vacuna,  medico,  exigimos,  vacuna,  hospital
pinche,  medico,  pendejo,  aparte,  revoltoso,  exigir,  vacuna,  riesgo,  matador,  nacion
joven,  estudiante,  derecho,  vacuna,  exigimos,  agilizar,  proceso,  regresar,  clase,  presencial,  vacuna
ano,  prometer,  sistema,  salud,  tipo,  dinamarca,  desacato,  medicamento,  vacuna,  prueba,  tamiz,  tratamiento,  cancer,  traer,  medico,  cuba,  desplazando,  mexicano,  excusa
gusto,  menor,  recuperar,  saber,  hospital,  acudir,  privado,  medico,  vacuna,  atendieron,  porque,  ver,  covid,  maestro,  capiche,  opinar,  ud,  vacunascovid
entender,  atacar,  venir,  medico,  cubano,  medicina,  aprender,  lograr,  erradicar,  trasmision,  madrehijotienen,  vacuna,  cancer,  pulmon,  medicina,  comunitario,  vacuna,  cordel,  intercambio,  valioso
humildad,  gesto,  vacuna,  medico,  huele,  revanchismo,  barato
requisito,  salir,  dosis,  vacuna,  covid,  reducir,  prospecto,  medico,  institucion,  publico,  maestro,  capiche,  mayor,  ano
pequeno,  aldea,  remoto,  centro,  africamente,  asia,  miembro,  vacuna,  pandemia,  terminar
lucha,  covid,  personal,  salud,  rendir,  continuar,  trabajar,  ayudano,  olvid,  acudir,  cita,  completar,  esquema,  vacuna,  cortar,  cadena,  transmision,  prevencion,  vacuna,  chicoloapan
mexico,  demostrar,  mundo,  personal,  medico,  riesgo,  enferma,  morir,  covid,  lamentablemente,  ocupamos,  mundo,  sector,  salud,  privado,  pese,  exigir,  vacuna,  acceso
minuto,  hospital,  regional,  tlalnepantla,  hospital,  otorgar,  vacuna,  personal,  senalar,  medico,  enfermera
bienvenidos,  caer,  union,  europeo,  calificar,  medico,  cubano,  esclavitud,  moderna
mil,  fallecido,  numero,  elevado,  personal,  salud,  fallecido,  mundo,  taza,  mortalidad,  alto,  nivel,  mundial,  vacuna,  poblacion,  furioso
terminar,  vacuna,  sector,  salud,  decir,  comun,  deber,  priorizar,  curar,  padecimiento
veracruz,  centralizado,  puesto,  vacuna,  maestro,  lugar,  obligar,  viajar,  necesitar,  pernoctar,  pie,  cabeza,  urge,  um,  cambio,  ir,  mexico,  ir,  veracruz
comprar,  pinche,  inepto,  mentiroso,  clinica,  poner,  dosis,  pasar,  personal,  basura,  gobierno,  escogieron
secretaria,  cerrar,  recibir,  demanda,  vacuna,  menor,  personal,  covid
xavier,  ineptitud,  venir,  presidente,  jefa,  gobierno,  secretaria,  salud,  como,  venir,  medico,  estrategia,  vacuna,  latinoamericano,  doctor,  mate,  mediocridad,  salud,  voto,  util,  junio
doctor,  hugo,  respeto,  reconocer,  equivocaron,  vacuna,  maestro,  deber,  concluir,  medico,  esperar,  dosis,  medico,  operacion,  chapultepec,  esperar
definitivamente,  querer,  escuela,  vacuna,  trabajador,  educacion,  estudiante
ojala,  poner,  enamore,  ie,  ie,  ie,  ir,  vacuna,  perrear,  sector,  salud
firma,  compartir,  considero,  personal,  sector,  salud,  prioridad,  vacuna,  covid
incorporar,  personal,  sector,  turistico,  vacuna,  proximidad,  periodo,  vacacional,  plantear,  gobernador,  pianista,  presidente,  crees,  presidente,  tomar,  peticion
deber,  dar,  verguenza,  oseo,  equipo,  minimo,  eh,  presidente,  dar,  equipo,  vacuna,  personal,  servicio,  medico,  distincion
tocar,  preocupamo,  salud,  vacuna,  persona,  capital,  coordinacion,  nivel,  gobierno,  agradecemos,  asistencia,  personal,  salud,  gracias,  confianza,  tocar,  cuidar
acudir,  manana,  centro,  salud,  imss,  servicio,  medicina,  preventivo,  solicitar,  vacuna
aislamiento,  pandemia,  pandemia,  vacuna,  clase,  virtual,  fase,  falta,  vacuna,  vacuna,  personal,  salud,  positivo,  fallecido
miercoles,  abril,  felix,  salvar,  luchar,  candidatura,  tajo,  incendio,  parque,  nacional,  tepozteco,  vacuna,  trabajador,  educacion,  morir,  choque,  armado,  chihuahua,  bien,  anunciar,  retiro,  afganistan,  teleformula,  noticia,  mediodia
presentar,  libro,  medico,  escribir,  libro,  medico,  odontologo,  doctor,  equipo,  profesional,  plan,  vacuna,  basado,  recomendacion,  perverso,  dolor
reconocer,  gobernador,  alcalde,  coordinacion,  instancia,  papas,  suegro,  vacuna,  aplaudir,  organizado,  demostrar,  equipo,  resultado,  positivo
show,  avisar,  ir,  vacuna,  dar,  ficha,  llegar,  edad,  determinado,  fue,  metodo,  imss,  centro,  salud,  ano
vacuna,  hospital,  privado,  simple,  revolucion,  indicar,  constitucion,  dictadura
centro,  salud,  nomas,  volteo,  dosis,  vacuna,  guardia,  nacional,  poner,  dedo,  gatillo
cole,  insistimo,  cansancio,  cargo,  publico,  violador,  agresor,  sexual
vacuna,  siervo,  nacion,  maestro,  parcialmente,  personal,  linea,  adulto,  mayor,  medico,  sector,  privado,  personal,  labora,  merecer,  vacuna,  crees,  paciente,  requerir,  hospital
estupido,  populista,  idea,  exponer,  vida,  desconocido,  doctor,  publico,  privado,  contagian,  morir,  derecho,  vacuna,  seguro,  ir,  issue
forma,  manana,  salgan,  decir,  vacuna,  regres,  manana,  enfermera,  descongelaron,  vacuna,  terminar,  descongelaron,  irresponsable,  burocracia
hospital,  privado,  hacer,  prueba,  salir,  vacuna,  vender,  vacuna,  caso,  constitucional,  esperar
asumo,  mezcla,  cuidado,  vacuna,  sistema,  inmune,  recomendacion,  dar,  tapabo,  hospital,  consulta,  medico,  seguir,  usar,  evito,  ascensor,  necesario,  tapabo
secretario,  salud,  jorge,  acoger,  martes,  comenzar,  vacuna,  maestro
condicion,  hospital,  persona,  medico,  pagar,  vacuna
perfil,  profesional,  abogado,  contar,  habilidad,  destreza,  aptitud,  permitir,  desarrollar,  labor,  alto,  dosis,  calidad,  eficiencia,  abogado,  jorge,  varga
mil,  centro,  vacuna,  pais,  solucionar,  tramite,  evitariamo,  monserga,  siervo
anunciar,  nacion,  unidas,  vacuna,  empezar,  vacuna,  maestro,  capiche,  terminar,  vacuna,  personal,  hospital,  publico,  privado,  nivel,  nacional,  encantar,  logico
estabilidad,  nino,  fernando,  emiliano,  fernandez,  rellano,  familia,  mundo,  padecer,  enfermedad,  hambre,  frio,  falta,  comida,  hospital,  covid,  dios,  mande,  salud,  vacuna,  covid,  llegar,  distincion
econ,  mexico,  regreso,  clase,  semaforo,  verde,  protocolo,  conoz,  enterate,  voluntario,  medida,  sanitario,  priorizar,  vacuna,  coronavirus,  tarea,  cuidar,  tu,  salud
dome,  seguir,  avanzar,  co,  plasta,  vacuna,  salud
adulto,  poner,  vacuna,  querer,  pensar,  pasar,  mes,  clase,  grito,  independencia,  caer,  sector,  salud,  mentado,  madre
rato,  auspiciado,  gobierno,  hospital,  saludando,  rapido,  gente,  vacuna,  correcto,  tipo,  evento,  masivo
esposa,  enfermera,  imss,  hospital,  seccion,  sindical,  vacuna,  incluido,  dentista
semana,  participando,  modulo,  atencion,  vacuna,  ponte,  pila,  salud,  vida,  magcontreraspresente,  pontepilaconnosotro,  ponte,  pila,  ponte,  pila,  casa,  protegete,  proteger,  saldremos,  salvar,  vida
paramedico,  mayoria,  ambulancia,  pertenecer,  cruz,  rojo,  erm,  vacuna,  fallecer,  conocido,  covid,  paramedico,  vacuna
deber,  cambio,  pfizer,  ip,  obligacion,  publico,  particular,  dinero,  privado,  fin,  lucro,  peligroso
dosis,  super,  limitada,  mexico,  situacion,  privilegiado,  dar,  cabida,  postor,  abrir,  puerta,  caos,  escasez,  desorden,  dar,  preferencia,  postor,  animal,  razon,  comportese
capitalino,  merecer,  seguridad,  medicamento,  vacuna,  servicio,  calidad,  alcaldia,  pedimo,  invertir,  tema,  clave,  ciudad,  accion,  bienestar
coagulo,  colar,  funcionario,  vacuna,  covid
retraso,  vacuna,  febrero,  llegar,  previo,  mes,  estimados,  vacuna,  empezar,  edad,  ir,  retrasar,  gente,  servicio,  medico,  operacion,  correcamino,  retraso,  ir,  acumular
personal,  sanitario,  negar,  vacuna
equivocar,  padre,  ver,  salud,  hija,  afortunadamente,  vacuna,  imaginate,  persona,  recurso,  comprar,  vacuna,  refieres,  tirar,  hate,  gobierno,  valer,  verga,  pensar
mentira,  vacuna,  personal,  privado,  olvidado,  traslado,  puro,  covid,  arriesgar,  vida,  diario
idea,  tema,  vacuna,  personal,  salud,  hospital,  privado,  unanse,  organicense,  ir,  paro,  gobierno,  reaccionar,  seguro,  junio,  recuerden,  gobierno,  morena,  decidir,  vacuna
dondeestanlasvacunas,  acabar,  primero,  etapa,  vacuna,  terminar,  vacuna,  personal,  salud,  publico,  privado
hacer,  desmadre,  medico,  privado,  respuesta,  cambiar,  vacuna,  suficiente,  vacuna,  sector,  salud,  traer,  sobrante,  terminar,  pasen,  grupo,  vacuna,  guardar
pensar,  area,  salud,  creer,  vacuna
actuar,  poner,  pistola,  vacuna,  respetar,  proceso,  personal,  eutanasia
dosis,  astrazeneca,  covid,  unidad,  congreso,  centro,  medico,  nacional,  siglo,  xxi
seguir,  entender,  personal,  ejercito,  armado,  custodiando,  centro,  vacuna,  alguien,  explicar,  favor,  vacuna,  vacuna,  vacunacioncovid
sumar,  esfuerzo,  salir,  kravmaga,  defensapersonal,  seguridad,  salud,  vacuna
mercado,  positivo,  noticia,  favorable,  vacuna,  disponibilidad,  eeuu,  adulto,  mayo,  prospecto,  estimulo,  fiscal,  debate,  senado,  atencion,  dato,  mi,  servicio,  ed,  beige,  book
covid,  vacuna,  refuerzo,  proceder,  vacuna,  personal,  salud,  educacion,  cuestion
delincuencia,  detener,  apapacho,  nino,  mayor,  cancer,  atender,  vacuna,  despulfarraron,  fundir,  salir
vida,  ano,  existencia,  intenso,  recuperacion,  medico,  ver,  secuela,  post,  covid,  paciente,  efecto,  adverso,  vacuna,  sentir,  afortunado,  terrible,  experiencia
negar,  vacuna,  sector,  privado
tercero,  informe,  sector,  salud,  millon,  mexicano,  excluido,  servicio,  salud,  muerte,  covid,  cuarto,  mundial,  dato,  seguir,  prueba,  alto,  nivel,  contagio,  regateando,  vacuna,  menor,  edad
operativo,  correcamino,  conjunto,  diverso,  institucion,  mexicano,  jornada,  vacuna,  combatir,  pandemia,  covid
formo,  refieres,  logro,  programa,  bienestar,  social,  adulto,  beca,  joven,  emprendedor,  madre,  soltero,  jefas,  familia,  ayuda,  damnificado,  sismo,  terminar,  hospital,  combatir,  corrupcion,  diverso,  area,  compra,  aplicacion,  vacuna
correr,  gallina,  cabeza,  entorpecer,  personal,  especializado,  estorbando,  acudir,  vacuna,  acudimo,  servicio,  especialidad,  siervo,  nacion,  estorban,  razon,  decir
victor,  manuel,  hornacina,  hervir,  vacuna,  astrazeneca,  calderon,  consultar,  medico,  dolor muscular,  paracetamol,  sigues,  dolor muscular,  consultaste,  medico,  amiguismo,  william
servicio,  medico,  reafirmacion,  genero,  realizar,  ajuste,  necesario,  buscar,  beneficio,  dosis,  disponible,  reestablece,  suministro,  forma,  regular,  llamado,  solidaridad,  participacion,  usuario
esquema,  viable,  estuviesemos,  escenario,  vacuna,  ilimitada,  problema,  sanidad,  publico,  pudiese,  vacuna,  problema,  escasez,  vacuna,  soluciona,  abrir,  vacuna,  empresa,  privado
grave,  vacuna,  ir,  vacaciones,  medico,  linea,  exponer,  diario,  proteccion,  adecuado,  agotadora,  jornada,  condicion,  deplorables,  contar,  vacuna
dome,  semaforo,  naranja,  acudir,  vacuna,  salud
limitacion,  prueba,  atencion,  hospital,  negacion,  cubrebocas,  grupo,  tecnico,  prevision,  vacuna,  poblacion,  despenadero
increible,  recurrir,  tipo,  medida,  vacuna,  servicio,  privado,  correr,  riesgo,  contagio,  sector,  publico,  inmune
urgen,  pasar,  pendiente,  dosis,  medico,  sector,  salud
terrible,  escena,  desesperacion,  angustia,  sistema,  salud,  colapsar,  trabajador,  sector,  agotado,  expuesto,  falta,  epa,  vacuna,  precaucion,  buscar,  cuidar,  exponiendo,  contagio,  terrible
expuesto,  maestro,  medico,  medico,  duda,  maestro,  vacuna,  obtener,  voto,  simple
dosis,  gracias,  presidente,  auxiliando,  personal,  medico,  militar,  seguridad,  esfuerzo
instruccion,  gobierno,  como,  secretaria,  salud,  federal,  urge,  transparento,  pasar,  personal,  medico,  vacuna,  llevar,  ano,  dar,  atencion,  exponiendo,  alejar,  familia,  gobierno,  dar
calle,  clinica,  imss,  empezar,  vacuna,  gente
zoe,  fisico,  denota,  cansancio,  lograr,  revertir,  desmantelamiento,  falta,  integracion,  sistema,  salud,  imss,  bienestar
poder,  llevar,  forma,  deber,  entrar,  hospital,  deber,  vacuna,  asegurado
agradecer,  personal,  medico,  existir,  vacuna,  covid,  vacante,  sigamos,  cuidando,  come,  vacuna,  prepa,  jose,  vasconcelos
vacuna,  personal,  linea,  privado,  publico,  empezar,  personal,  linea,  manipular,  tema,  medico,  privado,  oficialmente,  programado,  programo,  adulto,  mayor,  seguir,  orden,  respetar
medico,  regresar,  origen,  causa,  necesitar,  dosis
distribucion,  logisticar,  vacuna,  astrazeneca,  sinopharm,  llegada,  aeropuerto,  casablanca,  marrakech,  documento,  sec,  salud,  marroqui
sumar,  ambiente,  reconocer,  excelente,  organizacion,  logistica,  calidez,  humano,  amabilidad,  persona,  recibir,  emocione,  sentir,  privilegiado,  seguir,  cuidando,  persona,  acceder,  vacuna
lamentablemente,  desicion,  comprar,  vacuna,  sistema,  nacional,  vacuna,  cargo,  secretaria,  salud,  gobierno,  federal,  gobierno,  ciudad,  mexico,  desconocer,  vacuna,  sputnik
aplicacion,  tendera,  efecto,  secundario,  vacuna,  vigila,  reaccion,  pregunta,  medico,  conveniente,  aplicar,  sufrir,  presion,  alto
votar,  representar,  mayoria,  hacer,  medico,  miedo,  dedicar,  vender,  taco,  valer,  campo,  batalla,  trabajar,  andar,  lloriqueando,  vacuna
medico,  comprometer,  calidad,  consecuencia,  etico,  proceder,  poder,  omitir,  senalar,  incompetencia,  politizacion,  programa,  vacuna
internacional,  enfermeria,  conmemorar,  nacimiento,  florence,  nightingale,  pionero,  fundadora,  enfermeria,  moderna,  tema,  enfermeria,  voz,  liderar,  invertir,  enfermeria,  respectar,  derecho,  garantizar,  salud
siquiera,  lograr,  dosis,  mil,  vacuna,  preguntar,  vacuna,  doctor,  ejercer,  hospital,  clinica,  iniciativa,  privado
leer,  autor,  propuesta,  entender,  mercado,  global,  vacuna,  taco,  anotame,  lista,  seguro,  conoz,  dedico,  podria,  explicar,  porque,  sector,  publico,  comprador
vacuna,  hospital,  medico,  priva,  aviso
vacuna,  mexicofaltan,  trabajador,  salud,  muerte,  trabajador,  salud
senor,  recibir,  vacuna,  inter,  mujer,  vacunando,  usar,  persona,  venderla
jornada,  vacuna,  continuamoses,  brindando,  apoyo,  logistico,  trabajar,  equipo,  combatir
pais,  vacuna,  sector,  salud,  sector,  educacion,  escolar,  adulto,  mayor,  economia,  restablecido
millon,  persona,  covid,  recuperadas,  seguir,  fiesta,  seguir,  fumar,  quitar,  cubrebocas,  tiran,  via,  publico,  apoyo,  vacuna,  familia,  directo,  personal,  salud
rechazar,  vacuna,  personal,  salud,  publico,  privado,  atentando,  integridad,  vida,  servir,  poblacion,  prioridad,  tercero,  ola,  contagio,  venidera,  estupidez,  limite
existencia,  humano,  considerar,  ilegal,  asunto,  vacuna,  tema,  salud,  publico,  nivel,  mundial,  derecho,  individual,  prevalecer,  interes,  particular
comercializacion,  vacuna,  covid,  firma,  peticion,  via
conoci,  medico,  medico,  voto,  morena,  fiel,  seguidor,  lopez,  obrador,  pandemia,  vacuna,  tocar,  vacuna,  acabar,  fallecer,  covid,  voluntad,  votar,  morena
padre,  ano,  recibir,  dosis,  vacuna,  pedir,  mandar,  mensaje,  canciller,  gracias,  recibir,  sincero,  reconocimiento,  labor,  pandemia,  extensivo,  equipo,  destacar
aislamiento,  pandemia,  pandemia,  vacuna,  clase,  virtual,  fase,  falta,  vacuna,  vacuna,  personal,  salud,  positivo,  fallecido
google,  decena,  plataforma,  predicen,  clima,  preguntar,  aciago,  reproductor,  ni,  postear,  util,  gobernado,  balloveroy,  vacuna,  hablar,  incluyeron,  organizacion
usar,  calcular,  dosis,  kilo,  peso,  siquiera,  importar,  noche,  decir,  manejar,  paciente,  ambulatoriamente,  rey,  urgencia,  atender,  tomar,  ex
desgastante,  lleno,  incertidumbre,  llanto,  cansancio,  valer,  pena,  mejorar,  medico,  sorprendido,  diagnostico,  carga,  deber,  terapia,  intensivo,  juventud,  ayudar
recibir,  dosis,  tocar,  enfermera,  personal,  limpieza,  hospital,  prioridad,  ciudadano,  eleccion,  mes
inaudito,  personal,  salud,  recibir,  dosis
tod,  sintesis,  scan,  nido,  tr,  proteger,  interes,  extranjero,  gritar,  igualdad,  mercado,  muer,  viv,  votemo,  tod,  modest
perder,  vecino,  medico,  covid,  verguenza,  diputada,  decir,  medico,  privado,  derecho,  vacuna,  madre,  derecho,  apoyar,  lopez,  pais
benemerito,  escuela,  nacional,  maestro,  vacuna
vacuna,  medico,  preferir,  vacuna,  servidor,  politico,  funcionario,  morir,  medico,  frente,  batalla,  covid
permitir,  senor,  monopolizar,  vacuna,  hacer,  favor,  vacuna,  hospital,  privado,  reaccionen
garantizando,  derecho,  salud,  violentado,  derecho,  grupo,  vulnerable,  paciente,  ser,  trasplantado,  enfermedad,  cronica,  comorbilidad,  deber,  vacuna,  forma,  primordial,  llamaremo,  atendido,  gracias
entrevista,  platicamo,  presupuesto,  salud,  esfuerzo,  garantizar,  abasto,  medicamento,  importancia,  refuerzo,  esquema,  vacuna
aseguras,  vacuna,  ruso,  servir,  dejaras,  analisis,  publico,  dictamen,  avalado,  instancia,  internacional,  publicar,  sustentar
considerar,  precursor,  novela,  mexicano,  moderna,  vida,  desempenar,  docente,  politico,  iniciar,  actividad,  docente,  ano,  interesar,  creacion,  institucion,  educativas,  cultural,  cultura,  cultura,  tradicion
exigimos,  vacuna,  comunidad,  escolar
amigo,  alguien,  conocer,  alguien,  trabaje,  inai,  necesitar,  ayudaasesoramiento,  cuestion,  certificado,  vacuna,  urgente,  gracias
misterio,  mujer,  mexico,  apoyar,  gobierno,  turno,  hijo,  pequeno,  necesitar,  guarderia,  vacuna
terrible,  pandemia,  atendida,  puntual,  distinto,  momento,  realizacion,  masivo,  prueba,  oxigeno,  domicilio,  entrega,  medicamento,  seguimiento,  medico,  exitoso,  plan,  vacuna
sumo,  peticion,  personal,  centro,  salud,  sa,  andres,  tomar,  vacuna,  personal,  linea,  rt
empezar,  tronar,  hueso,  enferme,  sarampion,  vacuna,  vacuna,  nobis,  francamente,  volvi,  bolsa,  totopo,  medico
julio,  personal,  frente,  covid,  hospital,  privado,  derecho,  vacuna
triste,  leer,  politica,  relevante,  pais,  dar,  mensaje,  ambiguos,  falta,  vacuna,  vacuna,  mexicano,  teoricamente,  necesario,  impactar,  salud,  publico,  morbimortalidad,  perdido,  falta
japon,  implemento,  mejor,  operacion,  militar,  historia,  moderna,  ataque,  sopresa,  pearl,  harbor,  ejecutar,  inicio,  tomar,  totalmente,  descuidada,  flota,  norteamericano,  saber,  ir,  atacar
usar,  dinero,  recorte,  sector,  salud,  tratamiento,  nino,  cancer,  vacuna,  compraron,  medicamento,  mantenimiento,  metro,  numero,  recorte,  presupuestados,  auditar,  vigilar,  peso,  presupuesto
oir,  angel,  privado,  vacuna
video,  entrevistar,  medico,  cientifico,  norte,  pais,  senalar,  declaracion,  lopez,  gatell,  combinar,  vacuna,  irresponsable,  estudio,  mundo,  confirmar,  riesgo,  salud,  opinar,  doctora
inicio,  vacuna,  mejora,  panorama,  actual,  inminente,  colapso,  vivir,  hospital,  como,  aumento,  caso,  grave,  aliento,  personal,  salud,  soporte,  manejo,  paciente,  quedate,  casa
doctor,  dosis,  doctor,  sector,  privado,  millon,  vacuna
fer,  seccional,  region,  tierra,  caliente,  sur,  pie,  lucha,  exigimos,  gobierno,  federal,  vacuna,  estudiante
pretender,  medico,  indicar,  dosis,  diario,  dexametasona,  intramuscular,  paciente,  covid,  practicamente,  asintomatico,  semana,  persona,  relativamente,  cercano,  recibir,  tratamiento,  abrir
saber,  resolver,  atencion,  contar,  instalacion,  suficiente,  ridiculez,  autosuficiencia,  poner,  venganza,  salud,  nino,  cancer,  construyeron,  ejemplar,  sistema,  vacuna,  votar
fideicomiso,  empresa,  cervecera,  caso,  for,  cienfuego,  salir,  limpio,  asesor,  secretario,  ejercito,  resultar,  asi,  boquetes,  faltante,  gracias,  malversacion,  vacuna
desgraciado,  julio,  vacuna,  ano,  adulto,  mayor,  medico,  privado,  qe,  recibir,  dosis,  vacuna,  usar,  fin,  electoral,  hagas,  pendejo,  malo
nino,  nacer,  mexico,  gobernante,  proveian,  salud,  vacuna,  recien,  nacido,  nacer,  suerte,  acceso,  operacion,  costar,  vida,  padre,  fortuna,  acceder,  servicio,  medico,  calidad,  gt
personal,  vacuna,  congelado,  malo,  organizacion
bots,  estupido,  contratar,  oposicion,  presidente,  atender,  instituto,  nacional,  cardiologia,  vacuna,  sector,  salud,  uf,  bloquear
pensar,  vacuna,  area,  laboral
dinero,  hombre,  equivaler,  rehabilitar,  paciente,  recuperar,  covid,  valer,  pena,  vacuna,  servidor,  nacion
casual,  formado,  acabar,  vacuna,  responsable,  salir,  avisar,  ciento,  persona,  seguir,  formadas,  pendejo,  personal,  arena,  seguridad,  mandar,  cerrar,  puerta,  madre
segundo,  dosis,  personal,  salid,  importante,  vacuna,  atendemo,  paciente,  clase,  linea
derecho,  vacuna,  menor,  edad,  firma,  peticion,  via
ir,  vacuna,  jugar,  salud,  expone,  saca,  gobierno,  jugar,  responsable,  vida
mexico,  vacuna,  trabajador,  salud,  co
poder,  vacuna,  tu,  pais,  siquiera,  terminar,  vacuna,  medico,  trabajador,  sector,  salud,  necesitar,  cerebro,  completamente,  vacio,  escribir
registro,  pagina,  vacuna,  excelente,  medico,  duda,  hablar,  local
escuchar,  exigencia,  oposicion,  tomar,  accion,  reducir,  contagio,  aplicar,  prueba,  masivas,  morena,  rechazar,  propuesta,  vacuna,  personal,  farmaceutico,  medico,  privado,  esperar,  tomar
fijo,  posicion,  asunto,  particular,  eleccion,  preveer,  partido,  tendra,  afinidad,  futuro,  cancelacion,  nai,  aplaudo,  organizacion,  vacuna,  brigada,  correcamino,  seguir
ano,  direccion,  agradecido,  experiencia,  ambivalentes,  cansancio,  satisfaccion,  estres,  resultado,  nervio,  seguridad,  crecimiento,  personal,  red,  relacion,  ampliada
correcto,  vacuna,  importante,  imprudente,  valer,  madre,  salir,  calle,  centro,  comercial,  bail,  hacer,  madre,  exigir,  atencion,  enfermo
favor,  capacidad,  dar,  servicio,  salud,  digno,  fabricar,  vacuna,  condicionar
asisti,  sede,  mama,  problema,  solicitar,  nuevamente,  expediente,  vacuna,  completo,  lleno,  descargar,  pagina,  vacuna,  llegar,  personal,  apoyo,  llenaba,  mano,  retrasabamamrasa,  avance
requerimos,  eficiencia,  etica,  urge,  terminar,  vacuna,  personal,  linea,  urge,  busquenlo,  diccionario,  urgente
organizar,  medico,  adulto,  maestro,  profesion,  edad,  vacuna,  anticovid,  maestro,  como,  aplicar,  importar,  residencia,  via
vacuna,  desarrollo,  morir,  quimico,  educacion,  publico,  representado,  corrupto,  feliz,  nino,  igual,  definar,  hija,  estudio,  colegio,  particular,  becada,  extranjero,  incongruente
decada,  mejor,  programa,  vacuna,  nivel,  mundial,  gobierno,  servidor,  publico,  cobrar,  vacuna,  inclusive,  pandemia,  influencia,  gracias,  doctor,  mate,  mexico,  gozar,  red,  frio,  saludable,  malo,  loco
mujer,  estupido,  poner,  precio,  vida,  doctor,  hospital,  privado,  vacuna,  distribuir,  estupido,  doctor,  arriesgar,  vida,  imbecil
velocidad,  vacuna,  llamar,  correcamino,  resultar,  ironico,  creer,  doctor
ojala,  autoridad,  pronuncien,  hospital,  herrero,  viable,  vacuna,  favor,  ecatepec,  atizan,  cc
recibir,  vacuna,  pfizer,  machine,  pepsi,  center,  personal,  como,  militar,  cuidando,  tomar,  foto,  pseudo,  doctor,  promoviendo,  gratuidad,  medico,  gobierno,  medicina,  gratuidad
pongale,  vacuna,  personal,  salud,  distincion,  vacuna,  impuesto
hola,  alcaldesa,  disculpar,  medico,  dar,  consulta,  covid,  domicilio,  poder,  obtener,  vacuna,  ahorita,  medico,  institucion,  habemos,  ver,  paciente,  evitar,  llegar,  hospital
encantar,  colapsar,  privilegiado,  derecho,  comprar,  vacuna,  apoco,  derecho,  quitar,  vacuna,  alguien,  riesgo,  ir,  cochino,  dinero,  conseguirla
pedir,  vacuna,  personal,  medico,  estrategia,  politica,  otorgar
fan,  andar,  programa,  vacuna,  andar,  bici,  inaugurar,  obra,  publico,  entregando,  reconocimiento,  presidente,  bolivia,  mujer,  cabron,  canso,  cocina,  sala
malo,  leche,  venir,  doctora,  exagera,  especialidad,  respeto,  criterio,  medico,  seno,  defender,  indefendible,  acaso,  dolio,  contrainsulto,  vacuna,  perro,  xd
negativo,  vacuna,  nino,  perseguir,  delito,  leso,  humanidad,  negligencia,  medico,  inventar,  pretexto,  ahorrar,  dinero,  tocar,  funcionario,  salud
saber,  rumoraba,  gobierno,  mexicano,  aumentar,  brecha,  vacuna,  linea,  vacuna,  influyentismo,  corrupcion,  denunciar,  ana,  paolo,  costo,  harias,  ojo,  denuncia,  anonimo
vacuna,  refuerzo,  covid,  maestro,  personal,  salud,  llegar,  inicio,  lopez,  gatell
denunciar,  aplicacion,  vacuna,  anticovid,  personal,  sec,  bienestar,  medico,  ip,  vacuna,  operador,  politico,  pertenecer,  edad,  de,  circulo,  red
franelero,  cobrar,  peso,  estacionar,  familiar,  esperar,  adulto,  mayor,  vacuna,  argumentar,  dar,  policia,  pedir,  exigir,  ojala,  poder,  apoyar
premio,  alcalde,  sustentar,  resultado,  dato,  estadistico,  cuantitativos,  coyoacan,  como,  vacuna,  actualiza,  ine,  patetico,  importar,  salud,  padron,  electoral
hablar,  labor,  fabricacion,  vacuna,  covid,  revision,  farmaco,  investigacion,  quimioinformatica,  organocatalis,  destacado,  alumno,  participar,  simposio,  linea,  egresado,  mundo
pretender,  vacuna,  bombero,  policia,  barrenderossacmex,  lineo,  fuego
querer,  felicitar,  permitir,  empresa,  privado,  gobierno,  estatal,  adquieran,  vacuna,  covid
