hacer,  responsable,  hermano,  lelo,  lopez,  gatell,  lopez,  obrador,  muerte,  medico,  vacuna,  covid,  negativo,  vacuna
exigir,  regulacion,  ciberespacio,  miras,  joder,  twitter,  pendejo,  transparento,  relacionado,  vacuna,  incluir,  listado,  recibir,  vacuna
repeticion,  programa,  mildred,  avalar,  pepe,  platicaron,  omar,  validez,  salcido,  escuela,  certificacion,  uno,  unidad,  certificacion,  academico,  ver,  pierda
obradorismo,  rebasado,  linea,  rojo,  doctor,  muerte,  pedanteria,  caracterizar,  casual,  negar,  vacuna,  nino,  enormidad,  prohibido,  brian,  avance,  moral,  sociedad
personal,  salud,  necesitar,  reconocimiento,  necesitar,  vacuna,  mundial,  salud
alvaro,  oregon,  puesto,  vacuna,  vivir,  alcaldia,  dejar,  personal,  vivir,  escuela,  onda,  ataco,  querer,  esconder
completamente,  innecesario,  regresar,  terminar,  ciclo,  escolar,  justificar,  vacuna,  maestro,  traducir,  voto,  morena,  personal,  medico,  privado,  vacuna,  miserable
pandilla,  vivir,  lujo,  clinica,  viejitos,  silla,  rueda,  batallan,  subir,  bajar,  presupuesto,  reparar,  elevador,  vacuna,  papiloma,  tetanos,  medicina,  lujo,  presidente
lentes,  vacuna,  consulta,  medico,  servicio,  ofrecer,  brigada,  salud,  gracias,  equipo,  direccion,  bienestar,  social,  adulto,  mayor,  labor,  beneficio,  toluquenas
agradecer,  subsecretario,  conduccion,  panel,  encuentro,  desarrollo,  tecnologico,  vacuna,  cloco,  covid,  apoyo,  otorgar,  realizacion,  evento,  equipo
tocar,  dosis,  vacuna,  pfizer,  centro,  medico,  siglo,  xxi,  excelente,  coordinacion,  personal
neta,  deber,  pena,  chingo,  personal,  salud,  vacuna
deberia,  irte,  vuelta,  vida,  real,  platicar,  medico,  contar,  vacuna,  ineptitud,  presidente
riesgo,  salud,  comprar,  vacuna,  barato,  terminar,  protocolos,  salvar,  cara,  monton,  mentira
moco,  guajolote,  llame,  marquito,  tarado,  vacuna,  organizar,  gobierno,  federal,  inteligenteprimero,  sector,  saludadultos,  mayoressigue,  gente,  vulnerable,  gob,  estatal,  robar,  presupuestoque,  esperar,  manejar,  vital
al,  vacuna,  seguir,  eutanasia,  pesimo,  servicio
grato,  presumir,  termino,  responsabilidad,  padre,  conviccion,  atender,  indicacion,  autoridad,  sanitario,  mexico,  vac<UNK>nen,  vacuna,  salvar,  vida,  proximo,  semana
pronto,  inmediato,  vacuna,  sector,  salud,  pais,  vacuna,  medico
trabajador,  cita,  vacuna,  mayo,  respuesta,  recurso,  humanos,  descontaremo,  cambiar,  jamo
entregar,  labor,  personal,  participar,  proceso,  vacuna,  xonacatlan,  coordina,  apoyo,  logistica,  jornada,  masivo
servidor,  nacion,  conocimiento,  computacion,  dizque,  arreglando,  problema,  esperar,  siquiera,  aparecer,  lista,  aplicacion,  dosis,  contar,  pasar
mil,  muerte,  poder,  evitar,  manejo,  promedio,  pandemia,  oms,  negligencia,  ineptitud,  dolo,  pandemia,  agrego,  negativo,  vacuna,  medico,  enfermera,  privado,  comprar,  vacuna,  usar,  electoralmente,  genocidio,  describir,  perfecto
personaldesaludsinvacuna,  vacuna,  personal,  salud
recibir,  mil,  dosis,  esfuerzo,  venerar,  pensar,  avion,  venir,  repleto,  pentontada,  suertudo,  ejercito,  medico,  sumar,  millon
demandar,  atentar,  salud,  vacunando,  iniciar,  campana,  persona,  vacuna,  vacuna
universidad,  publico,  solicitar,  donacion,  continuar,  desarrollo,  vacuna
vacuna,  ixtapaluca,  personal,  atender,  adulto,  mayor,  organizador,  ayuntamiento,  mostrar,  calidad,  calidez,  vacuna
santo,  maria,  ratera,  derecho,  acceso,  universal,  vacuna
sistema,  educacion,  colapsado,  causa,  pandemia,  covid,  capiche,  abrir,  aula,  sistema,  salud,  pais,  colapsado,  respeto,  prioridad,  vacuna,  atender,  pandemia,  politica,  matar,  salud
repetir,  consultorio,  particular,  mexico,  vacuna,  covid,  covidioto,  mexico
banda,  conocimo,  hoja,  estampado,  coco,  pluma,  gel,  deber,  prioritario,  vacuna
captura,  manual,  eufemismo,  cuasitecnico,  lista,  mano,  cuadernito,  esperar,  hoja,  suelta,  seguridad,  controlar,  documenta,  base,  dato,  vacuna,  robar,  imagino,  terminar,  captura
recibir,  unido,  cansino,  profe,  uno,  gobierno,  entender,  salud,  educacion,  derecho,  negocio,  esperar,  volver,  aula,  cosa,  amar,  ensenar,  periodismo,  investigacion,  futuro,  reportero
unico,  cura,  covid,  vacuna,  camino,  medico,  curar,  medicina,  amplio
abrir,  plataforma,  gobierno,  mexico,  registro,  linea,  adulto,  mayor,  vacuna,  covid,  deber,  inscribir
vacuna,  medico,  diario,  ver,  ciudadano,  enfermo,  consultorio,  exponiendo,  vida,  familia,  justo
favor,  limite,  acceso,  espacio,  publico,  persona,  vacuna,  decision
terminar,  vacuna,  personal,  salud,  informacion,  arribo,  vacuna,  caso,  omiso,  medico,  vacuna
desprecio,  peepers,  prepotente,  enfermo,  dueno,  vacuna,  vividor,  nacion,  voto,  vacuna,  medico
subsecretario,  salud,  hugo,  lopez,  gatell,  vacuna,  personal,  medico,  sector,  privado,  publico,  firma,  peticion,  via
sector,  salud,  gobierno,  muerte,  dar,  empezar,  formar,  logistica,  censado,  ubicado,  edad,  llegaremo,  vacuna
inscribir,  padron,  menor,  conformidad,  presentar,  resumen,  medico,  unicamente,  inscripcion,  vacuna
medico,  sur,  aplicado,  vacuna,  personal,  linea
narco,  correteando,  ejercito,  sacar,  natalia,  cuartel,  central,  gn,  incendiando,  iztapalapa,  gobierno,  federal,  amenazando,  vacuna,  nino,  vacuna,  certificacion,  medico,  nino,  cancer,  seguir,  medicamento,  gt
medio,  miente,  falso,  vacuna,  montaje,  imss,  secretaria,  salud,  aceptar,  falso,  aplicacion,  responsable,  alguien,  formar,  personal,  barrar,  capaz,  man
senor,  ignorancia,  idea,  cagadero,  pensar,  personal,  salud,  lado,  tipo,  personascomo,  acabar,  vacuna,  pregunta,  medico,  ir,  pisotear,  porno,  correcto
medico,  iniciar,  administrativo,  directivo,  medico,  residente,  enfermera,  personal,  vacuna,  lista,  indiscriminad,  favoritismo,  compadrasgo,  morena
personal,  salud,  deber,  vacuna,  totalidad,  incluir,  sector,  privado
vacuna,  trabajador,  salud,  instituto,  nacional,  rehabilitacion,  pedir,  trato,  igualitario,  vacuna
mierda,  humano,  personal,  salud,  sector,  privado,  poner,  vida,  riesgo,  merecer,  vacuna
plan,  vacuna,  responder,  oms,  ops,  comite,  asesor,  llevar,  crisis,  salud,  publico,  moriremo,  vacuna
presidente,  preguntar,  vacuna,  clinica,  imss,  tratar,  covid
pasaporte,  verde,  covid,  europeo,  discriminar,  vacuna,  vulnerar,  dato,  personal
tu,  agarren,  onda,  aprobacion,  emergencia,  esperar,  luz,  vacuna,  decir,  consulten,  medico,  consejo,  apropiado
medico,  laboral,  forma,  particular,  vacuna,  covid,  atender,  enfermo,  covid,  considerar,  vacuna,  vacuna,  enfermeria,  odontologia,  medico,  farmacia,  cuidadores,  salud,  vacuna,  medico
lizzie,  gotto,  obra,  criminal,  negar,  vacuna,  medico,  hospital,  privado,  coraje,  salvaron,  vida,  despreciar
voluntad,  multiplicar,  sierra,  tener,  diria,  personal,  proteccion,  civil,  escatimo,  esfuerzo,  transportar,  persona,  adulto,  mayor,  puesto,  vacuna,  saldremos
vacuna,  medico,  seguir,  personal,  necesario,  actual,  pandemia,  mexico,  terminar,  seguir,  epoca,  postpandemia,  urgente,  vacuna,  seguir,  exponiendo,  vida
gracias,  personal,  distinto,  dependencia,  esmerar,  brindar,  atencion,  calida,  joven,  acudir,  vacuna,  metete,  casa
lamentable,  error,  garrafal,  gobierno,  etico,  personal,  familiar,  covid,  imss,  ecatepec,  vacuna,  dic,  vacuna,  fecha
pasar,  dichoso,  plan,  nacional,  vacuna,  querer,  quedar,  rey,  chocolate,  medico,  esperar,  turno,  edad,  maestro,  salten,  fila,  urge,  votar,  partido
como,  gente,  metro,  camion,  mil,  trabajador,  gente,  entiendes,  porq,  vacuna,  pff,  ciudad,  mundo,  prioridad,  obvio
vacuna,  corresponder,  gobierno,  federal,  modulo,  vacuna,  alguien,  gorra,  vestimenta,  denuncia,  electoral,  vacuna,  anonimo,  poder,  incluir,  foto
gente,  vacuna,  persona,  personal,  salud
discusion,  andres,  salud,  publico,  mexico,  pais,  cuadro,  basico,  vacuna,  infantil,  servicio,  vacuna,  elemental,  dinamarca,  pais,  nivel,  bolivia
vacuna,  nino,  ano,  comision,  salud,  hijo,  vacuna,  pais
dejar,  terminar,  proceso,  empezar,  molestaria,  cansancio,  politico
desgraciado,  campana,  voto,  morena,  junio,  argumento,  vacuna,  personal,  salud,  privado,  exponiendo,  enfermo,  contagio,  exponencial,  decision,  gobierno,  actual
decir,  momento,  cosa,  quejar,  seguridad,  derecho,  salud,  vacuna,  seguir,  morir,  atender,  tu,  entiendes
trabajador,  salud,  protegido,  garantizando,  capacidad,  hospitalario,  mexico,  vacuna
ciento,  poblacion,  nl,  recibir,  vacuna,  anticovid,  salud
esperar,  deporten,  respeto,  merecer,  culpa,  persona,  poder,  terminar,  pandemia,  vacuna,  jugar
chingo,  ponersela,  medico,  dejar,  pinche,  circo
gracias,  doctor,  humano,  eficiente,  capaz,  gente,  recibir,  vacuna,  atreve,  denigrar,  logro,  obtenido,  ignorar,  ser,  odiar,  pais,  felicidad
barbaridad,  enfermera,  merecer,  carcel,  decir,  mando,  fingir,  vacunada
ayudar,  negocio,  moral,  empresario,  sector,  privado,  alza,  mano,  ayudar,  vacuna,  covid
ande,  regalar,  dinero,  propagandista,  exijo,  medicina,  nino,  cancer,  vacuna,  personal,  salud,  miserable,  asesino
sentir,  culero,  tio,  puteado,  fisicamente,  sentir,  pinche,  orgulloso,  linea,  frente,  covid,  contagio,  vacuna,  atender,  familiar,  covid,  chingo
personal,  medico,  simplemente,  pieza,  importante,  lucha,  increible,  gobierno,  entregar,  minimo,  vacuna,  material,  proteccion,  denunciar,  empleado,  hospital,  infantil,  mexico
pandemia,  vacuna,  economia,  salud,  seguridad,  verda
oms,  organizacion,  mundial,  salud,  director,  advertir,  mundo,  cancelar,  celebracion,  omicron,  variante,  afectar,  vacuna,  recuperar,  advertir,  cancelar,  celebrar,  manana,  cancelaria,  vida
tocar,  vacuna,  abuela,  conmueve,  atencion,  carino,  grupo,  medico,  voluntario,  gracias,  gracias
medico,  arquitecto,  ano,  experiencia,  manejo,  obra,  precisamente,  calendario,  ejecucion,  obra,  aplicar,  vacuna,  ejecutar,  trabajo,  especifico,  cosa,  programa,  esto,  presentar,  gt
vacuna,  maestro,  vacunada,  poblacion,  riesgo,  regreso,  clase,  maestro,  mover,  influencia,  asegurar,  vacuna,  asii,  manejar,  salud,  publico,  favor,  grupo,  totalmente,  criminal
amigo,  color,  lagartija,  deber,  modulo,  vacuna,  entrada
continuar,  jornada,  vacuna,  covid,  personal,  medico,  ejercito,  mexicano,  coagulo
hora,  presidente,  confirmar,  subsecretario,  salud,  viajar,  argentino,  experiencia,  vacuna,  covid,  aplicar,  pais,  re
prueba,  vacuna,  lobby,  auditorio,  centro,  medico,  cero,  espacio,  circular,  genio
faltar,  medico,  vacuna,  exigimos,  salud,  preocupen,  ocupar,  vacuna,  medico
mil,  plano,  salud,  derecho,  humano,  garantizar,  programa,  vacuna,  accesible,  adaptable,  aceptable,  idoneo,  todo,  confundamo,  dadiva,  partidista
medico,  mayoria,  trabajador,  mexicano,  pagar,  impuesto,  venir,  compra,  vacuna,  senor,  lopez,  trabajar,  merecer,  vacuna,  doctor,  ho
alentar,  cerrar,  quimio,  pequeno,  cancer,  vacuna,  tipo,  personal,  salud,  atencion,  remuneracion,  adecuado,  medico,  cubano,  seguro,  popular,  totalmente,  restablecido
vacuna,  pfizer,  centro,  salud,  copa,  menor,  edad
vacuna,  calle,  lleno,  bache,  sector,  salud,  falta,  mil,  millon,  tirar,  consulta,  egolatra,  absurdo,  austero,  vivir,  palacio,  increible,  mananero
amiga,  area,  neonato,  vacuna,  hepatitis,  recien,  nacido,  hospital,  labora
vacuna,  refrigerador,  area,  lacteo,  justo,  anonimo
egoista,  lucrar,  vacuna,  mil,  persona,  atencion,  medico,  polarizar,  pais,  adiosmorena
persona,  supermercado,  cartero,  casero,  limpieza,  transporte,  publico,  trabajar,  pandemia,  proteccion,  suficiente,  ingreso,  miseria,  mayoria,  peso,  mensual,  vacuna,  edad,  nivel,  riesgo
pensar,  pensar,  medico,  robar,  pandemia,  vacuna
nota,  mes,  particular,  interesar,  rusia,  presumir,  vacuna,  efectivo,  covid,  figura,  nacion,  adelantada,  tarea,  vacuna,  poblacion,  feliz,  lunes,  sputnik
preferir,  morir,  cirrosis,  covid,  poner,  atencion,  beber,  confunda,  sintoma,  vacuna,  personal,  salud,  centro,  medico,  siglo,  xxi,  gracias
vacunadas,  poner,  provechosas,  realidad,  anticovid,  trato,  parejo,  cambiar,  gobierno,  bocon,  vacuna,  salud,  quedate,  casa
polarizar,  sector,  publico,  privado,  salud,  personal,  medico,  trabajar,  salvar,  vida,  terrible,  pandemia,  vacuna,  brevedad
felicitacion,  equipo,  sede,  vacuna,  campo,  marteestan,  excelente,  trabajotodo,  perfectamente,  organizado,  gracias,  excelente,  atencion
llamar,  acaparamiento,  pais,  llamar,  seguridad,  social,  comprar,  oportunamente,  vacuna,  garantizar,  salud,  publico,  poblacion
medico,  enfermera,  linea,  pandemia,  exigimos,  vacuna,  inmediato,  vacuna,  medico
sinceramente,  valer,  cacahuates,  malo,  vacuna,  senor,  negar,  utilizar,  cubrebocas,  pandemia,  andar,  gira,  abrazaramo,  hacer,  show,  circo,  vacuna,  medico,  privado,  forma,  malo
reactivando,  economia,  medico,  cansado,  uci,  crematorios,  saturados,  permitir,  evento,  marcha,  protesta,  vandalismo,  pais,  mano,  delincuente,  comun,  vacuna,  mano,  empresa,  privado,  eps
vacuna,  formar,  acceso,  salud,  universal,  referir,  articulo,  constitucional,  condicionar,  cambio,  consulta,  pedorro
jajajajaja,  voluntario,  estudiante,  enfermeria,  equivocaron,  carne,  canon,  probable,  vacuna,  aplicando,  huele,  falsedad,  proceso
insistir,  ciudad,  policia,  soldado,  cuidar,  vacuna,  matar,  moscas,  canonazo
completamente,  estimado,  doctor,  jonathan,  chavez,  experiencia,  preferir,  hierro,  polimaltisado,  parenteral,  economia,  paciente,  renego,  miligramo,  iv,  dosis,  peso
miserable,  querer,  controlar,  voto,  vacuna,  covid,  animal,  inmundo,  reverencia,  asquerosas,  practica,  electoral,  salud,  asco
mayor,  felicitacion,  equipo,  irme,  destacado,  operacion,  logistica,  gracias,  increible,  labor,  mexicano,  contar,  vacuna
titular,  bienestar,  dato,  servidor,  nacion,  vacuna,  covid
hable,  amiga,  brasil,  confirmar,  mayor,  ano,  vacuna,  incluir,  personal,  medico,  seguir,  padre,  brasil
trabajar,  sistema,  salud,  prianrd,  trizas,  lograr,  pais,  vacuna
pandemia,  crear,  multimillonario,  sector,  farmaceutico,  pfizer,  moderna,  embolsan,  mil,  dolar,  beneficio,  gracias,  monopolio,  vacuna,  covid,  desarrollo,  recibir,  mil,  millon,  dolar
suponer,  miembro,  brigada,  vacuna,  persona,  pais,  caso,  normal,  vacuna,  prioritaria,  diputado
senorito,  on,  the,  record,  participar,  protocolo,  investigacion,  voluntario,  perfectamente,  informar,  llamar,  consentimiento,  informar,  vacuna,  informar
imposible,  corregir,  dato,  certificado,  covid,  linea,  llamar,  aparecer,  vacuna
facil,  gobierno,  aplicar,  millon,  vacuna,  hospital,  abandonado,  mundial,  diabetes,  mal,  sumar,  estorbo,  oposicion,  rapaz,  gente,  respeto,  jornada,  vacuna,  mexico,  avanzar
solo,  serio,  delito,  electoral,  condicion,  aplicacion,  caso,  gravisimo,  vacuna,  suponer,  vida,  muerte,  crimen,  investigar,  lucrando,  salud,  mexicano,  seguir
pusieran,  dosis,  medico,  semana,  estrategia,  guerito,  ando,  disminuir,  consumo,  alcohol
querer,  cubrir,  incompetencia,  senor,  vivir,  palacio,  mundo,  vacuna,  medico,  sector,  publico,  privado,  pais,  cuervo,  nacion
lastimo,  solidario,  deber,  rechazar,  vacuna,  vacuna,  personal,  sanitario,  pais,  justo,  tipo,  interesar,  comprar,  voto,  ciudadano,  mantener,  interesamo
loco,  cabra,  informate,  millon,  vacuna,  llegar,  mexico,  aplicar,  mundo,  gracias,  descalificar,  intenso,  medico,  enfermera,  esfuerzo,  personal,  sector,  salud
diadelavacunacion,  hospital,  especialidad,  centro,  medico,  nacional,  siglo,  xxi,  imss
saludo,  expresar,  inquietud,  esperar,  tomado,  contemple,  trabajador,  domestico,  vacuna,  residencia,  poblado,  ine,  vivir,  casa,  empleador,  gracias
ver,  arzobispo,  exclusion,  aplicacion,  vacuna,  requerir,  aprobacion,  emergencia,  menor,  ano,  vacuna,  aprobado,  personal,  medico,  correcto
gobierno,  trapado,  mentira,  hagas,  alto,  vacuna,  abusar,  regresar,  cubrebocas,  irresponsable,  cobarde,  anunciar,  mitad,  creer,  destruyo,  sector,  salud,  medico,  injusto,  arbitrario
mil,  muerto,  seguir,  negar,  vacuna,  personal,  medico,  criminal,  gestion,  pandemia,  mexico
pasar,  llegar,  vacuna,  nino,  centro,  salud,  centroide,  salud,  doctor,  jose,  castro,  villagrana,  pasar
vacuna,  covid,  seguir,  usar,  cubrebocas,  medico,  paramedico,  enfermera,  paciente,  circuito,  diaz,  miron
informacion,  publicado,  erroneo,  centro,  salud,  vacuna
maestro,  vacuna,  voto,  presi,  medico,  vender,  voto,  persona,  resentido
regresaremos,  tocar,  exigir,  kit,  digno,  vacuna,  rehabilitacion,  sanitario,  prescolar,  jean,  paige,  regresoseguro
vacuna,  sip,  esperar,  siervo,  nacion,  cagada,  criterio
nuestro,  derecho,  derecho,  vacuna,  menor,  edad,  firma,  peticion,  via
manejo,  vacuna,  lvblvd,  esforzaron,  vacuna,  personal,  recompensar,  casino,  operar,  capacidad,  seguir,  operar,  restaurante,  capacidad,  infimo
heroe,  necesitar,  vacuna,  profesor,  casa,  cabeza,  gobierno
vacuna,  poner,  dosis,  sector,  salud,  votar,  voto
personal,  hospital,  jugar,  vida,  diario,  persona,  internan,  padecimiento,  riesgo,  covid,  saber,  identifican,  expuesto,  obvio,  merecer,  vacuna
falta,  ano,  demuestres,  tu,  dicho,  desacato,  medicamento,  enfermo,  cancer,  diabeticos,  hepaticos,  alergico,  obesidad,  vacuna,  aplicado,  terminar,  hospital,  equipado,  personal,  suficiente,  pandemia
terminen,  vacuna,  personal,  medico,  ir,  iztapalapa,  urge,  puro,  electoral,  vacuna
doctor,  enfermera,  camillero,  intendencia,  personal,  riesgo,  seguir,  vacuna,  verguenza,  morena
programa,  vacuna,  covid,  dentista,  nutriologos,  hospital,  vacuna,  doctor,  consulta,  privado,  covid,  sat,  quitar,  riguroso,  isr,  mirar,  programa,  chafa
pronunciar,  albano,  pregunta,  aparte,  vacuna,  profesor,  escuela,  particular
ver,  gente,  formar,  lacayos,  salir,  resguardo,  soldado,  vacuna,  benito,  juarez,  decentepero,  exigimos,  renuncia
vacuna,  rabia,  senora,  medico,  cubano,  poner
dosis,  llegar,  ciudad,  mexico,  monterrey,  continuar,  inmunizacion,  profesional,  salud,  atender,  paciente,  covid
mentira,  vacuna,  unicamente,  llegar,  privilegiado,  inventario,  estatal,  comprometer,  hospital,  distribuidores,  hacer,  trato,  directo,  farmaceutico,  dosis,  gobierno,  aparto,  gobierno,  cambiar
control,  centro,  salud,  galo,  soberano,  azcapotzalco,  vacuna
agrede,  mexico,  prestigio,  doctor,  epidemiologo,  informar,  diario,  pandemia,  colaborar,  acertadamente,  estrategia,  vacuna
querido,  rey,  mago,  querer,  pedir,  siguente,  salud,  ano,  alcanzar,  vacuna,  familia,  sano
vacuna,  personal,  salud,  sector,  publico,  privado,  firma,  peticion,  via
vacuna,  calosfrios,  dolor,  retro,  ocular,  espalda,  fatiga,  extremo,  mediodia,  tomar,  paracetamol,  desaparecio,  tomar,  medico
mio,  we,  acabar,  vacuna,  centro,  salud,  frente,  guardia,  presidencial,  previeron,  demanda
terminen,  vacuna,  anciano,  idiota,  echar,  perder,  vacuna,  mexico,  acorde,  gobierno,  atender,  problema,  necesidad,  neofito,  organizar
excelente,  noticia,  sobretodo,  vivir,  enorme,  logro,  ciencia,  alcanzar,  record,  vacuna,  covid,  contraponer,  cruda,  paradoja,  mercantilizacion,  salud
suceder,  razon,  atender,  grupo,  medico,  pais,  tecnologia,  medicamento,  enfermo,  covid,  treta,  victimizacion,  distraer,  atencion,  nulo,  compra,  vacuna,  idolo,  papel
poder,  vacuna,  problema,  fila,  espera,  amable,  senorito,  enfermera,  sentir,  decaido,  advertir,  vacuna,  influenza,  protegido
abrir,  iniciativa,  privado,  vacuna,  listo,  dejar,  vacuna,  fin,  politico,  amar,  formar,  beca,  callar
trabajador,  sector,  salud,  aplicar,  dosis,  vacuna,  pfizer,  biontech
excelente,  reflexion,  haber,  implementado,  politico,  publico,  mexico,  nivel,  promedio,  alcanzar,  muerte,  mill,  vacuna,  pie,  mil,  mill,  usd,  gracias
presidente,  decidir,  comprar,  vacuna,  joven,  ano,  analisis,  evidencia,  medico,  ocurrencia,  costar,  vida
unico,  carta,  personalizado,  medico,  venir,  padecimiento,  salud,  alergia,  recomendar,  particular,  pfizer,  astrazeneca,  estupendo,  vacuna,  aplicado,  refuerzo,  millon,  persona
dejar,  foto,  piquete,  frustracion,  instituto,  nacional,  vacuna,  suple,  fortuna,  gozamo,  poblacion
pq,  medico,  linea,  atencion,  covid,  vacuna,  albanil,  obrero,  corremo,  riesgo,  vacuna
entender,  febrero,  hacer,  censo,  vacuna,  medico,  ahorita,  gobierno,  institucion,  privado,  atencion,  covid,  desesperen,  llegar,  vacuna
dejar,  compartir,  revisar,  poner,  pretexto,  poder,  vacuna,  escuela,  naval,  militar,  dosis,  pedir,  acta,  cura,  ine,  vacuna,  pedir,  derecho,  salud
medico,  privado,  derecho,  vacuna,  esperar,  medico,  salvar,  numero,  vida,  injusticia,  niegue,  derecho,  vacuna,  colmo,  cinismo,  tabaquero
fui,  dosis,  vacuna,  expo,  santo,  fe,  personal,  involucrado,  extraordinario,  organizacion,  enfermera,  amable,  super,  empatico,  tocar,  esperar,  dosis,  dar,  prioridad,  salud
molestia,  injusticia,  aplicacion,  vacuna,  menor,  padecimiento,  cronico,  derecho,  vacuna,  abierto,  menor,  edad
malo,  vacuna,  empezar,  caso,  covid,  personal,  recibir,  dosis
senado,  republica,  mexicano,  vacuna,  prioritaria,  personal,  salud,  mexico,  sector,  publico,  privado,  firma,  peticion,  via
exigimos,  gobierno,  federal,  estatal,  insumo,  limpieza,  suficiente,  permanente,  vacuna,  comunidad,  escolar,  regreso,  clase,  seguro,  alfredo,  mazo,  maza
estrategia,  recuperacion,  espacio,  publico,  calle,  operacion,  transito,  ampliacion,  banqueta,  cruce,  seguro,  urbanismo,  tactico,  accion,  intervencion,  rapido,  centro,  vacuna
prioridad,  vacuna,  vacuna,  medico,  hospital,  particular
pagar,  establecer,  colaborar,  comprar,  aplicar,  deber,  darselo,  costo,  lucrando,  vacuna,  vender,  hospital,  particular,  cobren
coordinado,  personal,  voluntario,  seguir,  avanzar,  jornada,  recordar,  brindando,  atencion,  vacante,  miguel,  gutierrez,  gobierno,  chaleco
urge,  aplicar,  vacuna,  menor,  entrada,  problema,  preexistente,  salud,  permitir,  comercializacion,  querer,  invertir,  salud,  menor,  pagar
lucrando,  politicamente,  vacuna,  salud,  publico,  obligacion,  gobierno,  agradecer
reforma,  electrico,  envian,  magistrado,  eeuu,  jet,  privado,  vacuna,  entendieron
prima,  medico,  area,  covid,  seguir,  aplicar,  dosis,  terrible,  pasar,  gasto,  inutil,  vacuna
retraso,  educacion,  juventud,  mexicano,  necesitar,  regreso,  clase,  seguro,  vacuna,  regresaremos,  escuela,  sanitizada,  infraestructura,  adecuado
increible,  respuesta,  gente,  peticion,  justificada,  empatia,  deber,  decir,  vacuna,  simplemente,  deber,  empatico,  responsable,  acto,  lamento,  vivir,  situacion
ministro,  salud,  argentino,  pfizer,  porto,  rt,  exigir,  periodista,  medico,  difamaron,  sputnik,  disculpen,  publicamente,  argentino,  continente
regreso,  clase,  seguro,  requerir,  insumo,  necesario,  sanitizacion,  tunel,  sanitizante,  agua,  potable,  cubrir,  necesidad,  sanitario,  salud,  docente,  alumno,  vacuna,  padre,  familia,  alumno,  cedempueblo
totalmente,  docente,  politico,  vacuna,  grupo,  edad,  continuar,  vacuna,  dono,  vacuna,  personal,  medico,  vacuna,  favor,  bastar,  pelear,  rojo,  blanco,  verde
ordenado,  consciente,  trabajar,  forma,  exitosa,  vacuna,  chimalhuacan,  covid,  vacuna,  chimalhuacan
canciller,  iniciando,  dosis,  paciente,  indicacion,  personal,  salud,  vacuna,  pfizer,  reforzar,  venir,  temporada,  fuerte
criticar,  medico,  formar,  poner,  vacuna,  criticar,  administrado,  decir,  critique
manden,  vacuna,  hospital,  michoacan,  urgen,  doctor,  hugo,  favor
mes,  vacuna,  problema,  entrevista,  vacuna,  profesional,  informacion,  preguntale
ixrapaluca,  pedimo,  vacuna,  vacuna,  medico
sabado,  foro,  puebla,  ano,  impensable,  reunion,  publico,  morena,  gente,  hablara,  cansancio,  burocracia,  partidista,  ocurrir,  alguien,  rebasar,  presidente,  izquierda,  citar,  allende
regreso,  clase,  obligado,  maestro,  padre,  familia,  personal,  administrativo,  exigimos,  vacuna
negar,  derecho,  recibir,  vacuna,  covid,  permitir,  medico,  seguir,  tratamiento,  paciente,  med,  twitter,  mexico,  medicosnovacunados,  mexico
pete,  eleccion,  marcha,  pregunta,  tocar,  participar,  campana,  acceso,  vacuna,  anticovid,  derivado,  candidato,  contacto,  sociedad
mil,  mexicano,  debaten,  vida,  falta,  asistencia,  medico,  insumo,  medico,  medicamento,  vacuna,  anticovid,  malo,  retoza,  contagio,  opulencia,  palaciega,  mejor,  cuidado,  medico,  dejes,  embaucar,  chantaje,  presidencial
lastimar,  servidor,  salud,  considerar,  poner,  dosis
apoyo,  favor,  metro,  constitucion,  modulo,  vacuna,  colapsado,  personal,  vacuna,  aparecer,  policia,  conocimiento
mensaje,  confianza,  mama,  suegra,  negar,  vacuna,  uno,  mensaje,  confianza,  favor,  estrategia,  vacuna,  gracias,  maestro
