aparte,  ignorante,  chakra,  pendeja,  dinero,  medico,  publico,  privado,  cuestion,  genero,  vacuna
neta,  caga,  pregunten,  vacuna,  poner,  meten,  daninas,  cuerpo,  resultar,  oportunidad,  vacuna,  persona,  wey,  servicio,  salud,  colapsando,  parenle,  mame
candil,  calle,  oscuridad,  casa,  deber,  terminar,  vacuna,  pueblo,  ayudar,  necesitar
vacuna,  medico,  sector,  salud,  prioritario,  plan,  vacuna,  gobierno,  morenito,  ignorar,  personal,  linea,  batalla,  covid,  via,  plan,  vacuna
oir,  excluir,  persona,  entidad,  federativa,  subsecretario,  salud,  negar,  vacuna,  motivo
siervo,  nacion,  recibir,  peso,  mes,  vacuna,  mil,  doctor,  recibir,  vacunaprioridad,  pege
mil,  medico,  formado,  mendigar,  vacuna,  mil,  frente,  batalla,  vacuna,  pasar
placer,  amigo,  motivados,  promover,  salud,  digital
diacereina,  inhibir,  produccion,  liberacion,  enzimo,  degradan,  cartilago,  colagenasa,  estromelisinie,  mejora,  signo,  sintoma,  artrosis,  dolor,  funcion,  articular,  consulte,  medico,  farmaciasgenericosyenesyma,  farmacia,  viable
dispuesto,  persona,  esperar,  hs,  aplicar,  vacuna,  seguir,  personal,  salud,  lineo,  vacuna,  esperar
dosis,  desinfectar,  alberca,  tratamiento,  medico,  tipo,  sustancia,  grado,  pureza,  utilizar,  alimento,  farmacia,  impureza
duda,  historico,  felicitacion,  jefa,  unidad,  mujer,  recibir,  vacuna,  aplicacion,  intramuscular,  brazo,  izquierdo,  fail,  sigamos,  caminar
sigamos,  cuidando,  salud,  previniendo,  tocar,  vacuna,  tocar,  cuidar,  barrio,  cuidar,  barrio,  atrevete
hermana,  aprender,  nadar,  rio,  huehuetan,  lugar,  bello,  marginado,  olvidado,  vacuna,  covid,  paso,  identificar,  necesidad,  garantizar,  derecho,  salud
certificado,  vacuna,  emitir,  secretaria,  salud,  gobierno,  federal,  gobierno,  ciudad,  mexico,  ley,  expedir,  corregi,  modificar,  certificado
hola,  senor,  ricardo,  esperar,  encontrar,  vision,  empresario,  ayudar,  grupo,  fuerte,  agilizar,  proceso,  vacuna,  pais,  mano,  gracias
vergonzoso,  indignante,  escuchar,  gatell,  adquirir,  vacuna,  directamente,  contravenir,  estrategia,  nacional,  vacuna,  ofender,  comentario
medico,  delegado,  imss,  bono,  covid,  personal,  vacuna,  prioritario,  robar,  hospital,  publico,  masificacion,  plaza,  ena,  presidente,  hecho
obligar,  docente,  presentar,  fisicamente,  saber,  vacuna,  can,  aplicaron,  pasar,  efecto,  proteccion,  atentado,  salud,  publico
funcionario,  vacuna,  mandalas,  uber,  brad,  periodista,  experto,  transporte,  vacuna
fallido,  politicamente,  social,  desacato,  medicamento,  tratamiento,  cancer,  vacuna,  infancia,  bastar,  relevar,  responsable,  programa,  social,  centrado,  reparto,  dinero,  prometer,  hospital
dosis,  lista,  vacuna,  tu,  persona,  sonaron,  vacante,  sputnik,  xoxo,  unidad,  congreso,  centro,  medico,  nacional,  siglo,  xxi
mes,  comentario,  eh,  respuesta,  vacuna,  tetano,  apoyo,  vacuna,  llegar,  centro,  salud
vacuna,  tema,  personal,  afectar
jessicar,  valencia,  doctora,  doctor,  enfermera,  enfermero,  camillero,  personal,  labora,  limpieza,  deber,  vacuna,  gobierno,  importar,  salud,  sector,  salud,  sector,  privado
venta,  privado,  falta,  pasar,  riguroso,  metodo,  verificacion,  validez,  llegar,  fase,  evaluacion,  comercializar,  vacuna,  muestra,  emergente,  vendido,  gobierno,  mundial
imbecil,  hip,  vacuna,  medico,  privado,  absurdo,  enferman,  pisan,  imss
enviamo,  vacuna,  leon,  resto,  republica,  anciano,  avisar,  familiar,  sigues,  esperar,  apreciable,  dudoso,  siguele,  pista,  malo,  equipo,  sector,  salud,  marcelo,  claudia,  sheiunbeame,  saludo,  cordiales,  deseo,  exitoso
mierda,  gracias,  medico,  privado,  persona,  salvaron,  personal,  medico,  incluir,  privado,  deber,  vacuna,  reforma,  enojado,  mexico
capiche,  vacuna,  maestro,  medico,  mejora,  posicion,  electoral,  layla,  sensor
amiga,  subsecretario,  asunto,  multilateral,  shh,  reforzamo,  importante,  coordinacion,  materia,  vacuna,  actividad,  conjunto,  proximo,  dubai
lamentable,  seguir,  discriminando,  nino,  cancer,  nino,  ano,  dar,  medicamento,  vacuna,  coronavirus,  gastar,  fortuna,  promocion,  personal,  lamentable,  dinero,  ciudadano
tramite,  oficina,  agua,  pueblo,  imss,  como,  increible,  cantidad,  gente,  cubrebocas,  oficina,  empleado,  creer,  vacuna,  magico,  cuidado,  deber
feria,  virtual,  librote,  empleado,  trabajador,  virtual,  comercio,  abierto,  desfilemarchasjovenes,  vacuna,  in,  cerrado,  esperar,  decidir,  papa,  uno
mes,  aprender,  marcha,  ajuste,  habilitar,  centro,  produccion,  vacuna,  ojala,  esfuerzo,  llegar,  puerto
febrero,  marzo,  abril,  vacuna,  adulto,  mayor,  terminar,  sector,  salud,  unamentira,  kms,  lopez
maroma,  maroma,  pensar,  caso,  vere,  hospital,  privado,  olvidado,  plan,  vacuna
abuelo,  vacuna,  gracias,  estrategia,  atendieron,  gracias,  amor,  amor,  pagar
reconocimiento,  admiracion,  respeto,  companero,  rifan,  aplicando,  vacuna
personal,  organismo,  descentralizado,  dependencia,  gobierno,  municipal,  esmera,  brindar,  atencion,  calida,  proceso,  vacuna
pesimo,  atencion,  centro,  vacuna,  estadio,  universitario,  atender,  senorito,  negligente,  querer,  vacuna,  muchacho,  ayuda,  vivir,  casa,  ano,  suerte,  ocurrir,  acompanar,  su,  dimes,  dirige,  enojo,  pasar
pandillas,  vacuna,  pandillas,  sobretodo,  falta,  personal,  salud,  vacuna
instaurar,  investigacion,  profesional,  fallido,  estrategia,  covid,  pais,  sancionar,  responsable,  lamentable,  manejo,  dosis,  refuerzo,  adulto,  mayor,  camina,  gota,  instalar,  kiosko,  publico,  prueba
chale,  anduve,  atender,  vacuna,  pelan
companero,  unidad,  vacuna,  vacio,  enfermera,  quedar,  bastante,  unidad,  llegar,  gente,  vacuna,  querer,  vacuna,  hospital,  privado
medico,  creer,  oms,  aprueba,  vacuna,  derecha,  confundir,  ciencia,  ideologia,  mercado,  salud,  bienvenidos,  medico,  cubano,  mexico,  super,  bienvenida,  vacuna,  abrala,  ladren,  perro,  querer,  pelar
entender,  twit,  negar,  atencion,  medico,  poner,  vacuna,  fase,  investigacion
situacion,  vacuna,  situacion,  capaz,  evitar,  catastrofe,  situacion,  vergonzoso,  medico,  morir,  covid,  vacuna,  insumo,  situacion,  desastre
personal,  medico,  diverso,  institucion,  largo,  fila,  aplicar,  vacuna,  covid,  elemento,  guardia,  nacional,  resguardan,  hospital,  mexico,  sede,  habilitado,  aplicacion,  vacuna,  foto,  victor,  cruz
ir,  cotizando,  mercado,  negro,  labor,  monitoreo,  frente,  creativo,  corrupcion,  reto,  bastar,  vender,  vacuna,  de,  ver
compartir,  indignacion,  pedir,  lista,  linea,  imss,  registrado,  personal,  hospital,  privado,  sat,  medico,  independiente,  dato,  vacuna,  cuestion,  voluntad
sputnik,  recorrer,  bello,  voluminoso,  cuerpecito,  gracias,  esfuerzo,  realizar,  garantizar,  derecho,  salud,  lujo,  presidente,  quedar,  pobre,  honor,  luchar,  obrador
organizacion,  vacuna,  gobierno,  ciudad,  mexico,  secretaria,  ambiente,  policia,  cargo,  gobierno,  ciudad,  mexico,  caso,  pan
personal,  ejercito,  mexicano,  encontrar,  aplicando,  dosis,  refuerzo,  poblacion,  manana,  regresar,  ver,  cuidar,  salud,  ccielcorazdeinterloma,  servicioalacomunidadcci,  interroga
abusiva,  aplicaron,  dosis,  cumplir,  condicion,  administrar,  vacuna,  profesora,  medico,  adulta,  embarazado,  solicito,  atencion,  justo,  esperar,  turno
nl,  toma,  control,  vacuna,  covid,  estatal,  desorganizacion,  servidor,  nacion
gracias,  medico,  enfermera,  colaboraron,  atender,  centro,  vacuna,  adulto,  mayor,  vacuna,  ixtapaluca
totalmente,  pesado,  aplicaron,  vacuna,  covid,  profesor,  vacuna
ver,  pregunta,  patricia,  ganar,  vacuna,  maestro,  publico,  privado,  juro,  vuelta,  pregunta,  principal,  terminar,  entrevista,  contestar
caotico,  afuera,  organizacion,  agradecido,  vida,  aliviado,  haber,  poder,  vacuna,  pais,  salud,  derecho,  invertimo,  decena,  millon,  vacuna,  medicamento,  doctor,  infraestructura
coincido,  vacuna,  prioridad,  linea,  persona,  edad,  hermoso,  cagon,  pusiste,  personaje,  hospital,  epico,  radio,  respeto
gracias,  opcion,  pondria,  duda,  genuina,  ir,  elegir,  tipo,  vacuna,  coloquen,  poder,  financiar
vacuna,  escuela,  medico,  naval,  irlanda,  medico,  privado,  formado,  esperar,  vacuna,  afuera,  esc,  naval,  como,  fila,  inmenso
honor,  empresa,  innovadora,  moderna,  sano,  lider,  mundial,  sector,  farmaceutico,  considerar,  ventaja,  competitivo,  invertir
maria,  irene,  ramirez,  enfermera,  especialista,  recibir,  vacuna,  covid,  pfizer,  campana,  cobertura,  universal,  lanzado,  gobierno,  mexico
activacion,  trabajador,  felicitacion,  logistica,  impresionante,  centro,  vacuna
andaban,  vacunando,  diestra,  siniestra,  senora,  encontrar,  metro,  constitucion,  ofrecer,  vacuna,  querer,  salir,  gobierno,  sistema,  vacuna,  refuerzo
morena,  traicion,  patria,  nacion,  tratamiento,  nino,  cancer,  persona,  enfermedad,  cronica,  muerto,  vacuna,  covid,  ninato,  amnistia,  narco,  saludar,  directamente,  mama,  chapo,  pacto
senora,  cayo,  giro,  politico,  escudar,  argumento,  negar,  vacuna,  personal,  sanitario,  privado,  voto
calendario,  vacuna,  retraso,  seguir,  llevar,  ano,  terminar,  vacuna,  disc<UNK>lpe,  sor,  presidente,  suficiente,  garantizar,  derecho,  salud,  constitucion,  demanda,  ley
tarde,  poder,  acudir,  corrijan,  certificado,  vacuna,  mes,  actualicen,  base,  dato,  institucion,  ayudar,  agilizar,  tramite
imss,  desmentir,  reaccion,  grave,  trabajador,  recibir,  vacuna,  covid,  coagulo,  ojala,  aplicar,  vacuna,  pfizer,  arbol,  comer,  platano,  bonito
gasolina,  super,  cara,  vacuna,  medicamento,  recorte,  personal,  prensa,  contenta,  matar
felicitacion,  modulo,  vacuna,  coyoacan,  ub,  esc,  marina,  cal,  virgen,  atencionexcelente,  organizacion,  personal,  colaborador,  marina,  conde,  persona,  facilitar,  silla,  rueda
plan,  vacuna,  mate,  plan,  negocio,  redondo,  lucrar,  salud,  chispa,  mara,  vaa,  pobre
exijan,  regresen,  clase,  presencial,  personal,  sep,  vacuna,  comodo,  sueldo,  prestacion,  urgente,  nino,  regresen,  clase,  presencial
pentavalente,  vacuna,  polio,  iniciar,  aplicar,  sector,  usar,  hexavalente,  oral,  quitar,  bop,  protegia,  polio,  tipo,  vacuna,  hexavalente,  tipo
olvidar,  personal,  salud,  necesitar,  vacuna,  pandemia,  punto
personal,  medico,  enfrentar,  pandemia,  pais,  mes,  padeciendo,  falta,  equipo,  proteccion,  sufrir,  consecuencia,  lidiar,  pesimo,  aplicacion,  vacuna,  dosis,  llegar
tratar,  anti,  vacuna,  vacuna,  cuestion,  interes,  personal,  problema,  salud,  publico,  nivel,  mundial,  prevalecer,  interes,  particular,  entender
borla,  alias,  twitear,  miente,  toma,  llevalo,  hospital,  ficticio,  levantaste,  poder,  vacuna,  ojo,  serian,  vacuna,  agua,  gobierno
mejor,  vacuna,  paso,  agradecer,  gn,  medico,  enfermero,  enfermera,  ayudar
servicio,  salud,  vacuna,  big
exigir,  personal,  medico,  vacuna,  anticovid,  leon
persona,  decir,  recibir,  vacuna,  personal,  educativo,  edad,  vacuna,  mes
estimado,  decision,  vacuna,  personal,  informar,  vacuna,  personal,  libertad,  privacidad,  termino,  gente,  comprender,  correctamente,  actualidad,  manipula
afuera,  vista,  poder,  auxiliar,  cama,  herramienta,  vacuna,  infodemia,  acto,  criminal
crees,  medico,  particular,  tocar,  vacuna,  hospital,  buscar,  estupidez,  mensaje,  chingo,  madre,  enojar,  vacuna
lograr,  falta,  vacuna,  mil,  medico,  enfermera,  privado,  increible,  llegar,  amenaza,  bloqueo,  tomar,  sigamos,  exigir
cuiden,  nino,  esquema,  vacuna,  completo,  hepatitis,  agudo,  infantil,  gasto,  medico,  mayor,  salud
salud,  publico,  politica,  pandemia,  vacuna,  elector,  tristeza,  mexico,  lord,  zapato
vacuna,  madre,  explanada,  estadio,  ciudad,  universitario,  pumas,  organizacion,  trato,  paciente,  felicidad,  profesional,  gusto,  profesionalismo
observo,  vacuna,  listada,  venir,  farmaceutico,  privado,  correr,  riesgo,  inversion,  dejar,  pedir,  papa,  gobierno
necesitar,  asesoria,  medico,  necesitar,  vacuna,  varicela,  porfavor
aislamiento,  pandemia,  pandemia,  vacuna,  clase,  virtual,  fase,  falta,  vacuna,  vacuna,  personal,  salud,  positivo,  fallecido
lentitud,  pesimo,  planeacion,  organizacion,  vacuna,  mes
ano,  mexico,  cobrar,  vacuna,  dar,  generacion,  pregunta,  porque,  fin,  electoral,  partido,  personal,  venta,  nocturno
negacion,  realidad,  practicar,  comun,  sindicato,  autoridad,  actual,  crisis,  sanitario,  sinembargo,  comenzar,  vacuna,  trabajador,  especialidad,  protesta,  funciono
mediodia,  vacuna,  centro,  salud,  hora,  llegar,  nino,  esperar,  vacuna,  pasar
vacuna,  covid,  bendita,  sector,  educativo,  super,  lujo,  centro,  vacuna,  gobierno,  como,  alcaldia,  miguel,  hidalgo,  constar,  vacuna,  sector,  salud,  grupo,  edad
vacuna,  medicamento,  obra,  publico,  voto,  prianprdmovciud
juicio,  amparo,  convertir,  demanda,  exigir,  prestacion,  autoridad,  medicina,  vacuna,  pension,  parque,  agua,  potable,  camino,  cama,  hospital
esperar,  turno,  imss,  seguridad,  social,  publico,  mexicano,  toque,  turno,  vacuna
jornada,  salud,  bosques,  pedregal,  dar,  asesoria,  juridico,  informacion,  derecho,  humanos,  consulta,  vacuna,  neumococo,  revision,  dental,  ortopedia,  esperar,  alamo,  esquina,  bosques
vacuna,  principe,  covid,  centro,  salud,  portal,  in,  ciudad,  mexico,  distrito,  federal
plan,  medico,  personal,  directo,  linea,  deber,  vacuna,  horror
vivar,  vacuna,  vivo,  sector,  salud,  vivo,  ka,  vivo,  aduana,  vivar,  mexicano,  consciente,  vivo,  mexico
querido,  todo,  vender,  vacuna,  covid,  fraude,  delito,  gobierno,  personal,  salud,  babosas
vacuna,  pro,  pro,  dejar,  reconocer,  organizado,  dar,  servicio,  informacion,  coordinacion,  promocion,  logistica,  calificacion,  reprobatoria
celebrar,  bombo,  platillo,  creacion,  universidad,  bienestar,  animal,  extranar,  barbaridad,  cometido,  regimen,  asunto,  adquisicion,  aplicacion,  vacuna,  anticovid,  urge,  ciudadania,  reaccionar
medico,  debieran,  atender,  tu,  poder,  demostrar,  hecho,  medico,  sector,  privado,  lucran,  salud,  dar,  vacuna,  ganar,  salario,  minimo,  comentario,  miserable
excelente,  contar,  vacuna,  derecho,  humano,  salud
super,  importante,  atender,  llamado,  evitar,  contagio,  puebla,  tristemente,  hospital,  punto,  rebasar,  capacidad,  atencion,  vacuna,  significar,  bajemos,  guardia,  compartir
querer,  reconocimiento,  personal,  centro,  vacuna,  calzada,  iman,  delegacion,  conocer,  calidad,  trabajoso,  asistimo,  esposo,  constatamo,  organizacion,  trato,  cordial
prescripcion,  medico,  solicite,  dosis,  diario,  historia,  arte,  encantado
marina,  unico,  centro,  cuestion,  medico,  aplicar,  vacuna,  astrazeneca,  deber,  historial,  medico,  carta,  medico,  tratante
vacuna,  medico,  paramedico,  hospital,  clinica,  privado
doctora,  querer,  negar,  excluir,  padre,  familia,  recibimos,  dosis,  cansino,  registrar,  personal,  complementario,  brigada,  apoyo,  plante,  unidad,  salle,  personal,  exigir,  comprobante,  docente
estimar,  claudia,  cede,  preparatorio,  desorden,  rebasado,  equipo,  chaleco,  verde,  sumamente,  groseria,  jade,  fila,  persona,  amenazada,  alcanzar,  vacuna,  totalmente,  contro
estrategia,  vacuna,  terminar,  vacuna,  medico,  rematar,  comunidad,  muchisimo,  rechazo,  vacuna
programa,  nacional,  vacuna,  continuamoses,  vacuna,  personal,  educativo,  ciudad,  mexico,  mayo,  consulta,  hora,  sede,  cita,  impresa,  ir,  asociado
problema,  vacuna,  personal,  medico,  enfermeria,  aplicar,  dejar,  asistir,  clinica,  hospital,  laboral,  estar,  saturando,  hospital,  necesario,  personal,  regresar,  cubrir,  lugar
terminaran,  vacuna,  personal,  salud
faltar,  vacuna,  medico,  enfermera,  personal,  hospitalario,  sector,  privado
recuerden,  registrar,  constancia,  medico,  diagnostico,  diabetes,  vacuna,  paciente,  obesidad,  morbida,  enfermedad,  addison,  sindrome,  hipopituitario
distraigan,  telegrafo,  falta,  insumo,  medicamento,  vacuna,  sector,  salud,  publico,  privado,  corrupcion,  linea,  metro,  corrupcion,  votar,  botar,  sal,  votar,  voto
mexico,  doctor,  recibir,  muestra,  visitador,  medico,  diverso,  laboratorio,  dejar,  muestra,  medico,  llevar,  vacuna,  masivo,  ciudadano,  venir,  transformacion,  ta,  junio
mananero,  panorama,  plan,  nacional,  vacuna,  dosis,  aplicado,  febrero,  dosis,  aplicado,  persona,  completar,  esquema,  vacuna,  aplicado,  dosis,  personal,  salud,  capiche
queja,  permite,  poner,  vacuna,  exito,  contar,  suficiente,  personal,  orientara,  supervisara,  desarrollo,  actividad,  ma,  afuera,  deportivo,  informar,  asesoraba,  queja
medico,  recibimos,  vacuna,  covid,  incluir,  institucion,  sector,  privado,  apoyar,  causa,  compartir
proximo,  eleccion,  ine,  responsable,  responsable,  seguridad,  funcionario,  casilla,  proporcionar,  vacuna,  seguro,  medico,  percance,  consideraria,  seguridad,  nacional
negar,  vacuna,  imss,  extranjero,  cita,  asignar,  hacer,  fila,  numero,  vacuna,  empleado,  decidir,  derecho,  vacuna
gobernar,  publicitando,  freno,  recibimiento,  raquitico,  volumen,  vacuna,  covid,  sintoma,  inequivoco,  pericia,  mandatario,  gabinete,  propaganda,  clientelismo,  salvar,  poblacion,  covid,  urgen,  capacidad,  organizacion
acompane,  mama,  aplicacion,  dosis,  excelente,  servicio,  agil,  personal,  atento,  mama,  salir,  feliz,  gracias
disculpa,  ver,  mensaje,  hija,  alergicar,  huevo,  probable,  alergicar,  polietilenglicol,  polisorbato,  presente,  vacuna,  covid,  importante,  consulta,  previo,  historia,  clinica,  completo,  especialista,  alergia
repito,  dosis,  mexicano,  totalidad,  personal,  salud,  lamentable,  aplicacion,  ficticia,  planificado,  fin,  electoral,  salud,  derecho,  humano,  crimen
volvi,  ver,  roncho,  pensar,  caso,  personal,  salud,  tener,  acceso,  vacuna,  medico,  hombre,  gay,  sentir,  derivar,  resignar,  cualquiera,  tocar,  viruela,  simio
pandemia,  mentira,  dicho,  hecho,  gobierno,  vacuna,  guardadas,  transito,  sector,  vacuna,  explicacion,  aunque,  caso,  grave,  aplicar,  vacuna
mentira,  cuento,  justificar,  insuficiente,  cantidad,  vacuna,  usar,  operador,  electoral,  personal,  salud
justo,  personal,  llamado,  operacion,  chapultepec,  vacuna,  personal,  mes,  frente,  area,  covid
prohibir,  consumir,  alcohol,  recibir,  vacuna,  covid,  martes,  subsecretario,  prevencion,  promocion,  salud,  hugo,  lopez,  gatell,  prohibicion,  consumo,  alcohol,  recibir,  vacuna,  covid
formar,  brigada,  persona,  funcion,  logistica,  facilitadora,  enlace,  efectivamente,  aplicar,  plan,  vacuna,  repito,  vacuna,  miembro,  brigada,  vacuna
veras,  doctor,  vengo,  familia,  medicoscon,  mayusculaque,  servil,  ignoraron,  etica,  servir,  ignorante,  excelente,  medico,  consultar,  cascara,  corrupto,  vacuna,  covid,  estropear,  sistema,  inmune,  nino
vacuna,  anticovid,  salud,  ojo,  hermoso
vacuna,  docente,  depender,  estrategia,  salud,  seed
aislamiento,  pandemia,  pandemia,  vacuna,  clase,  virtual,  fase,  falta,  vacuna,  vacuna,  personal,  salud,  positivo,  fallecido
concluir,  vacuna,  personal,  salud
acuerdo,  estimado,  morir,  gente,  covid,  medico,  enfermera,  senor,  permitir,  poner,  lista,  vacuna,  correr,  director,  otro,  vacuna,  vista,  gordo
lleno,  emocion,  doler,  brazo,  sentir,  cansado,  sentir,  paz,  padre,  recibir,  dosis,  estr,  plantilla,  trabajador,  institucion
sobrina,  nacer,  junio,  super,  problema,  vacuna,  big,  tardar,  ano,  comprar,  hospital,  privado
vacuna,  sector,  productivo,  poblacion,  solucionar,  disminuir,  pedo,  agradecer,  abuelita,  acceder,  vacuna
vacuna,  esposo,  alegria,  gente,  trabajar,  enfermera,  asistente,  organizacion,  orgullo,  mexicano,  gobierno,  red
necesitar,  seguridad,  certificado,  vacuna,  servir,  viajar,  resetear,  certificado,  vacuna,  covid,  viajar,  emergencia,  firma,  peticion,  via
valgame,  suspenden,  vacuna,  festivo,  gente,  lista,  colar,  obtener,  vacuna,  servidor,  morena,  utilizar,  influyentismo,  vacuna,  personal,  medico,  honestos
rifo,  avion,  avion,  licitacion,  medicina,  farmacia,  sector,  salud,  vacio,  vacuna,  vacuna,  presidencia,  presidente
vacuna,  prioridad,  absoluto,  gobierno,  proceso,  sumamente,  lento,  inmunizar,  millon,  persona,  marzo,  prometer,  requerir,  avance,  rapido
medico,  caballito,  batalla,  imss,  decena,  acoste,  asesorartienen,  conocimiento,  experiencia,  pluma,  destruir,  ano,  trabajocomo,  estrategia,  exitosa,  vacuna,  universalexitolic
foto,  tome,  manana,  centro,  vacuna,  escuela,  jose,  maria,  velasco,  condicion,  precaria,  malo,  organizacion,  dosis,  jeringa,  desastre,  burla,  sector,  vulnerable,  sociedad,  adulto,  mayor
problema,  ciudad,  mexico,  depender,  vacuna,  otorgar,  secretaria,  salud,  gobierno,  federal,  realizar,  planeacion
sufrio,  covid,  mejoro,  semana,  intubacion,  perdido,  cubrebocas,  morir,  gente,  diario,  hospital,  material,  medicina,  medico,  reparten,  vacuna,  gente
servidor,  nacion,  vacuna,  importar
medico,  vacuna,  mexico,  pais,  personal,  medico,  fallecido,  mundo
solicitar,  agilizar,  vialidad,  punto,  vacuna,  unidad,  transito,  villa,  verdun
alerta,  viajero,  coagulo,  exigir,  certificado,  vacuna,  anti,  entrar,  restaurante,  comercio,  bar,  antro,  estadio,  deportivo,  tipo,  lugar,  advertir,  miguel,  angel,  riquelme
vacuna,  recien,  nacido,  medicamento,  cirugia,  atencion,  medico,  ciudadano,  contagiado,  atencion,  poblacion
caca,  gobierno,  garantizar,  principal,  funcion,  gobierno,  acceso,  salud,  despegamos,  dosis,  vacuna,  anticovid,  sihaydeotra
pera,  manzana,  como,  mil,  persona,  acabar,  vacuna,  gn,  vacuna,  doctor,  enfermera,  servidor,  portador
mes,  poner,  dosis,  conocido,  grave,  hospital,  familia,  politica,  reunir,  persona,  celebrar,  cumpleanos,  exagerada
personal,  enfermera,  bastar,  vacuna,  persona,  miron,  estorbo,  persona,  vacuna
gobierno,  apoyar,  uno,  politecnico,  vacuna,  hospital,  agilizar,  proceso,  eficiente,  mexico,  pais,  persona,  feliz,  ayudar,  problema,  dejar,  querer,  heroe
encomienda,  ojala,  logre,  vacuna,  nin,  faltar,  iniciar,  ciclo,  escolar,  logro,  frente,  secretaria,  maestro
vacuna,  insumo,  hospitalario,  apoyo,  microempresas
carcel,  funcionario,  abusivo,  llegada,  vacuna,  covid,  ocasiono,  funcionario,  publico,  utilizaran,  puesto,  brindar,  fila,  vacuna,  familia,  incluir,  abuso,  propuse,  carcel,  inmediato
pie,  servicio,  medico,  poblacion,  desempleo,  falta,  mantenimiento,  metro,  calle,  carretera,  violencia,  criminal,  aumento,  sacar,  presidiarios,  carcel,  vacuna,  medico,  medico,  clinica,  hospital
terminar,  vacuna,  personal,  medico
metropoli,  personal,  participacion,  ciudadano,  gobierno,  capitalismo,  pedir,  persona,  vacuna,  sano,  distancia,  personal,  marina,  re
finalizar,  jornada,  conferencia,  regional,  salud,  derecho,  humanos,  cuidado,  gay,  americar,  latino,  caribe,  como,  mexico,  panel,  itshepatitis,  virales,  ph,  vacuna,  prevencion,  atencion,  tratamiento
suponer,  gobierno,  ta,  evitar,  discriminacion,  dar,  pobre,  necesitar,  distribuir,  vacuna,  directivo,  doctor,  frente,  salvar,  vida
vacuna,  prioridad,  tema,  salud,  politico,  transformacion,  participativo,  vacuna
vacuna,  vulnerable,  contento,  ver,  video,  foto,  medico,  privado,  vacuna,  cc
vacuna,  medico,  exigimos,  vacuna,  medico,  salud
pedir,  aplicar,  vacuna,  covid,  personal,  neurologia
dosis,  az,  gracias,  pagar,  impuesto,  medico,  enfermera,  pie,  canon,  chavos,  organizacion,  tio,  slim,  padre,  esposa,  hijo,  cuidamos,  vacuna,  gracias
semana,  vacuna,  americo,  llamado,  picante,  trasplantado,  enfermedad,  cronica,  acercar,  centro,  salud,  completar,  esquema,  vacuna,  base,  medico,  tratante,  indicar
feliz,  companero,  neuropatologia,  instituto,  nacional,  neurologia,  oportunidad,  recibir,  vacuna,  anti,  covid
atendimos,  necesidad,  trabajador,  mercado,  moderna,  escuchamo,  propuesta,  revisamos,  diverso,  tema,  comercio,  proteccion,  civil,  demarcacion,  gobierno,  cercano,  atento,  necesidad,  familia,  tiro,  torre
acudir,  explicar,  motivo,  razon,  acudiste,  desicion,  encargado,  universidad,  unidas,  vacuna,  autorizar,  vacuna
entender,  mensaje,  anexando,  vacuna,  mexicano,  dinero,  ir,  centro,  salud,  pagar,  pediatra,  gratuidad,  distincion,  parejo,  pais,  mexico
proceder,  suspension,  omision,  vacuna,  medico,  sector,  privado,  virus,  sarscov,  aplicar,  vacuna,  refuerzo,  igualdad,  condicion,  personal,  salud,  sector,  publico,  sala
aplicar,  falta,  personal,  salud,  hospital,  privado,  millon,  recibir,  dosis,  dejar,  presumir,  llegar,  vacuna,  presumir,  aplicado,  millon,  llegar,  esperar,  logro
sentir,  persona,  eua,  reafirmando,  super,  privilegiadas,  esperar,  avance,  vacuna,  nacional,  volver,  suponer,  universal,  privilegio,  clase
continuo,  terminar,  licenciatura,  obtener,  derecho,  competir,  competencia,  nacional,  estudiante,  medicina,  antes,  pfizer,  academia,  nacional,  medicina,  premio,  ganar,  gracias,  excelente,  catedro,  cubano,  recibir,  ano,  social
