disminucion,  caso,  covid,  perfilar,  septimo,  semana,  baja,  persona,  recuperadas,  activo,  estimados,  caso,  estimados,  defunciones,  esquema,  vacuna
gusto,  paciente,  vacuna,  requerir,  seguimiento,  par,  sintoma,  leve,  seguir,  hospitalizado,  intubando,  paciente,  persista,  resistencia,  vacuna,  bajen,  guardia,  vacuna,  tu
marzo,  plan,  nacional,  vacuna,  alerta,  coronavirus,  mexico,  contagio,  muerte,  contagio,  muerte,  cuidense
opcion,  gusto,  presupuesto,  importante,  reducir,  consumo,  ropa,  moda,  rapido,  hecho,  material,  chafo,  durables,  esquema,  maquina,  esclavitud,  moderna
evidencia,  cientifico,  nino,  vacuna,  gustar,  verlo
estudiante,  protestar,  porcentaje,  vacuna,  aplicado,  exigimos,  gobierno,  agilizar,  vacuna,  poblacion,  regreso,  seguro,  clase
ano,  protesis,  utilizar,  sistema,  computarizadohoy,  robotintegramo,  hardware,  software,  lograr,  resultado,  perfecto,  emocionante,  historia,  ortopedicar,  modernatecnico,  mecanicanavegacionrobotdrjonathan,  hernandez,  molina
iniciativa,  privado,  poder,  comprar,  vacuna,  generar,  tranquilidad,  creer,  insistir,  gobierno,  idea,  logistica,  vacuna,  mienten,  situacion,  complicado
deber,  deber,  vacuna
alcohol,  indicacion,  tambo,  hacer,  vacuna
regreso,  clase,  crimen,  asegurar,  regreso,  clase,  estudiante,  vacuna
natalie,  pario,  cientifico,  vacuna,  covid
cultura,  japones,  resaltar,  valor,  moral,  material,  ano,  luz,  vacuna,  muerto,  indudable,  sabiduria,  manejo,  mistica,  cientifico,  confiar,  pais
vacuna,  joven,  vacuna,  participacion,  seguro,  jornada,  ejemplar,  vacante
carmelo,  creer,  numerologia,  astrologia,  runa,  ver,  conspiracion,  duda,  vacuna,  eh,  muerte,  jugar
tumbo,  vacuna,  astrazeneca,  amaneci,  frecuencia,  respiratorio,  elevado,  practicamente,  molestia,  datar,  whoop,  duda,  fascinante
oigan,  vacuna,  olvidar,  vacuna,  prevenir,  morir,  volver,  contagiar,  contagien,  decir
ojala,  poder,  vacuna,  faltamo,  joven,  riesgo,  morir,  enfermedad,  distinguir,  grado,  raza
diciembre,  plan,  nacional,  vacuna,  alerta,  coronavirus,  mexico,  contagio,  muerte,  contagio,  muerte,  cuidense
extranar,  escuela,  prestigio,  preparar,  ojete,  vida,  diario,  extrane,  vision,  moderna,  innovadora,  alejado,  mayoria
japon,  disminuir,  ritmo,  vacuna,  eleccion,  mexico,  maldito
aislamiento,  pandemia,  pandemia,  vacuna,  clase,  virtual,  fase,  cumpliremos,  ano,  nino,  clase,  positivo,  fallecido
jueves,  vacuna,  sputnik,  deber,  decir,  potente,  vacuna,  vacuna,  evitar,  enfermes,  covid,  efecto,  enfermedad,  drasticos,  vacuna,  ayudar,  crear,  anticuerpo,  bajemos,  guardia
personal,  esperar,  regreso,  sobrino,  leer,  conectar,  casa,  azul,  guille,  milkyway,  volveremosmasfuertes,  vacante,  usacubrebocas,  mexico,  by,  tomado,  web
pandemia,  inventada,  vacuna,  controlar,  pancho,  preso,  doble,  bien,  trump,  regresar,  cambio,  climatico,  putero,  fuente,  carmelo,  nous
desicion,  triste,  necesario,  vacuna,  terminarian,  lider,  militar,  subordinados,  venerar,  cuidar,  aman,  aplicarian,  pueblo
cuidar,  brandon,  infodemia,  cuidado,  noticia,  falso,  vacuna,  clave,  vacuna,  tu,  informate,  fuente,  oficial
regreso,  clase,  crimen,  regreso,  clase,  presencial,  afectar,  hijo,  vacuna
pandemia,  bicho,  covid,  cobrar,  vida,  persona,  tocar,  ir,  validas,  estrategia,  ir,  votar,  poder,  vacuna
poder,  ignorar,  caso,  ahorita,  poner,  abismal,  morir,  covid,  contagiaron,  vacuna,  vacuna,  experimental,  ideal,  ano,  vacuna,  olvidar
igualmente,  joven,  condicionar,  ine,  vacuna,  volver,  mentir,  respirar,  cool,  chayote
infante,  esconda,  hospitalizacion,  pediatrico,  momento,  dejar,  mezquino,  vacuna,  nino,  pais
laboratorio,  fabricaban,  medicamento,  cancer,  bajar,  produccion,  vacuna,  covid,  rentable
extinga,  covid,  mundo,  vacuna,  prevenir
justificar,  fuente,  empleo,  doc,  duraran,  duro,  vacuna
asumir,  falta,  conciencia,  vacuna,  nacional,  pretender,  generalizar
febrero,  plan,  nacional,  vacuna,  alerta,  coronavirus,  mexico,  contagio,  muerte,  contagio,  muerte,  cuidense
vacuna,  evitar,  llegar,  celtic,  temporada,  venir,  sabio,  cambiar,  opinion,  equipo
vacuna,  causaria,  problema,  salud,  asegurar,  experto,  bioquimica,  via
clase,  presencial,  pandemia,  pandemia,  vacuna,  fase,  positivo,  fallecido
afortunadamente,  vacuna,  transmision,  cutaneo
vacuna,  obesidad,  miopia,  sarro,  diente,  profundamente,  ignorante,  prefieres,  enfermar,  vacuna,  tu,  dar,  te,  arandano,  medicamento,  triste,  caso
vacuna,  ano,  clase,  presencial
super,  organizado,  ecatepec,  vacuna,  servir,  servir,  registro,  sano,  distancia,  esperar,  suceder,  naucalpan,  atizan,  tlalnepantla,  igual,  gobierno,  morena,  garantia,  ojala
marcharemo,  vacuna,  gobierno,  vacuna,  estudiante,  covid,  regreso,  seguro,  clase,  presencial
recordar,  vacuna,  previenen,  contagio,  muerte,  enfermedad,  grave,  ano,  hablar,  vacuna,  entender,  ayudar
alguien,  intencionalmente,  distraer,  atencion,  pandemiaprefiere,  pregunten,  vacaciones,  muerto,  enfermo,  vacuna
ver,  plan,  basura,  moderna,  hablas,  medida,  prevencion,  rompes,  pides,  quedar,  casa,  ir,  vacaciones,  quedar,  credibilidad,  renuncia
magnifico,  politica,  vacuna,  comparar,  circunstancia,  emergencia,  mundial,  unico,  siglo,  punto,  comparacion,  momento,  historico,  parecer
vacuna,  dome,  vacuna,  delo,  maestro,  nino,  regresar,  ala,  escuela,  sigamos,  cuidando,  bajemos,  guardia
comentar,  biologa,  conocido,  desarrollar,  vacuna,  ambivalentes,  proteina,  omicron,  llegar,  caso,  valer,  pena,  dar,  sugerir,  quedar,  cuarto,  valer,  pena,  entrar,  invierno,  nov
vacuna,  riesgo,  biologa,  epidemiologa,  agradecer,  tocar,  usar,  cubrebocas,  exponiendome
vacuna,  evitan,  contagio,  protegen,  enfermedad,  grave
hola,  doctora,  elaboracion,  vacuna,  porque,  elaboraron,  forma,  rapido,  machote,  desarrollar,  querer,  articulo,  mano,  gracias,  antemano
inglaterra,  poblacion,  mexico,  vacuna,  mexico,  semana,  nino,  hospitalizado,  imaginen,  llegar,  covid,  mexico,  ninez,  obesa,  mundo,  desastre
dejame,  adivinar,  censura,  cientifico,  peligro,  vacuna,  vacuna,  experimental,  censura,  mil,  loco,  encontrar,  seguro,  junkie,  teorio,  conspiradora
aislamiento,  pandemia,  pandemia,  vacuna,  clase,  virtual,  fase,  falta,  vacuna,  positivo,  fallecido
planeta,  protocolo,  vulnerable,  politizar,  vacuna,  gente,  enferma,  lleno,  odio,  ignorancia
pandemia,  emocional,  normal,  mucho,  sanar,  raiz,  colectivo,  ayuda,  sanar,  vacuna,  vida,  amorpropio,  saludmental,  vih,  sesion,  renacimiento,  sep,  jueves,  condeso
clase,  presencial,  pandemia,  pandemia,  vacuna,  fase,  positivo,  fallecido
clase,  presencial,  pandemia,  pandemia,  vacuna,  fase,  positivo,  fallecido
reverenda,  imbecilidad,  pensar,  vacuna,  caguama,  disponible,  pleno,  oferta,  entender,  palatino,  priorizo,  grupo,  riesgo,  fobia
spot,  recomendacion,  vacuna,  usacubrebocas,  distancia,  social,  ventilacion,  lugar,  cerrado,  continuar,  cruzado
obvio,  vacuna,  mecanismo,  elevar,  oportunidad,  llegar,  contagiar,  desarrollar,  cuadro,  grave,  garantizar,  contagiar,  seguir,  vehiculo,  trasladar,  particula,  infectado,  trasladen
vacuna,  efectividad,  medicamento,  absurdo,  asumir,  absurdo,  vacuna
nino,  aislamiento,  pandemia,  pandemia,  vacuna,  vacaciones,  verano,  fase,  positivo,  fallecido
ano,  enfermedad,  cronica,  vacuna,  chico,  definir,  prioridad,  epidemiologico
positivo,  covid,  servicio,  imss,  impecable,  prueba,  rapida,  medicamento,  instruccion,  oximetro,  llegar,  sentir,  temor,  mantener,  optimista,  vacuna,  infeccion,  querer,  dios,  salir,  victorioso
tipo,  vacuna,  antigeno,  sarscov,  activar,  celula,  vero,  dosis,  dosis,  intervalo,  dosis,  posterior,  dosis,  aprobacion,  sanitario,  pais,  incluido,  mexico
vacuna,  prevenir,  imposible,  dar,  vacuna,  entorno,  pandemia,  asintomatica,  contagia
catastrofe,  campana,  vacuna,  post,  electoral,  fila,  descomunal,  medida,  prevencion,  vendedor,  ambulante,  control,  distancia,  aforo,  usar,  huacales,  desastre
publicacion,  internacional,  calcular,  mortandad,  mil,  persona,  mexico,  genocida,  pavonea,  acusar,  vacuna,  avanzar,  transformacion,  fregada
nota,  deficiente,  basar,  diapositiva,  evidentemente,  indagar,  intervalo,  confianza,  sustento,  concluir,  diapositiva,  vacuna,  eficacia
escuela,  necesitar,  vacuna,  alumno,  padre,  familia,  maestro,  agua,  potable,  regreso,  seguro,  clase,  ceder,  pueblo
calor,  estorbo,  despensas,  sano,  distancia,  vacuna,  inmune
inmunidad,  vacuna,  menciona
presidente,  haber,  contagiar,  vacuna,  pedo,  gente,  creer,  vacuna,  inmunidad,  secreto,  vacuna,  evitar,  infeccion,  hacer,  grave
dejar,  fobia,  balbuceo,  entender,  cambiar,  vacuna,  farmaceutico,  reconocido,  charco,  similar,  laboratorio,  presencia,  mexico
riesgo,  mundo,  vacuna,  ventaja,  economico,  re,  activar,  obligar,  tercero,  mundo,  operar,  vacuna,  necesidad,  consumo
nino,  aislamiento,  pandemia,  pandemia,  vacuna,  vacaciones,  verano,  fase,  positivo,  fallecido
totalmente,  manejo,  pandemia,  negar,  tratamiento,  nino,  cancer,  quitar,  dinero,  fideicomiso,  enfermedad,  catastrofico,  proveer,  vacuna,  basico,  poblacion,  infantil,  abastecer,  medicamento,  seguridad,  social
toma,  accion,  investigar,  vacante
segregando,  poblacion,  vacuna,  discriminar,  confirmar,  sospechabamo,  corriente,  ambiente
regreso,  clase,  crimen,  maestro,  contagian,  vacuna
entender,  contexto,  humano,  derecho,  vacuna
caso,  exponer,  hijo,  entregar,  calificacion,  compruebo,  profesor,  vacuna,  profesor,  vacuna,  creer,  vacuna
vacuna,  campo,  fuerza,  impedir,  hospitalizacion,  muerte,  evitar,  contagio,  depender,  usemo,  cubrebocas,  mantener,  sano,  distancia
pandemia,  pedir,  cubrebocas,  poner,  vacuna,  influenza
informacion,  importante,  minuto,  eduardo,  clark,  explicar,  vacuna,  fundamental,  estrategia,  salud,  evitar,  caso,  grave,  enfermedad
sensibilidad,  como,  fila,  prueba,  caso,  nino,  valer,  pena,  accion,  posicionamiento,  gobierno,  vacuna,  hospitalizado
miguel,  carbonero,  debate,  abierto,  pais,  vacuna,  covid,  deber,  obligatorio,  mayor,  edad,  deber,  exigir,  trabajador,  empresa,  vacuna,  caso,  negativo,  poder,  despedir,  opinar
increible,  plan,  vacuna,  planeacion
suponer,  poner,  cantidad,  exacto,  jeringa,  ver,  presione,  osea,  vacuna,  ocupado,  jeringa,  cuidas,  covid,  enfermar,  cosa
alvaro,  oregon,  perder,  morena,  alcaldia,  contemplar,  vacuna,  contagio,  culpa
manejo,  pandemia,  vacuna,  suficiente,  necesitar,  insistir,  cubrebocas,  ventilar,  espacio,  lavado,  mano,  prueba,  evitar,  aglomeracion,  preparado,  hospitalariamente,  palabra,  prevencion
invitar,  desayunar,  galanazo,  hacer,  plan,  vacuna,  aproximar
persona,  morir,  empezar,  pandemia,  irresponsabilidad,  valio,  cuidaban,  consecuencia,  buscar,  culpable,  vacuna,  servir,  covid,  complicacion
cultura,  civilizacion,  medieval,  caracterizar,  geocentrico,  cultura,  civilizacion,  moderna,  antropocentrico,  civilizacion,  actual,  vivir,  caracterizar,  excentrica,  precario,  intelectualmente
nino,  prioridad,  vacuna,  salon,  clase,  positivo,  querer,  prueba,  asintomatico,  importar,  anden,  contagiando,  negar,  prueba,  descartar,  contagio,  covid
abuelita,  preocupado,  dispuesto,  pagar,  vacuna,  mayoria,  postura,  opinar
vacuna,  sociedad,  medicamento,  nino,  cancer
chicuelo,  cuandoelfuturonosalcance,  zaideberian,  concierto,  prueba,  servir,  vacuna,  llegar,  infectado,  conciertoseria,  ideal,  evento,  sonar,  the,  man,  killer
viejo,  canino,  mentiroso,  inmune,  venenoso,  seguro,  vacuna,  rufian,  miedo
agua,  horchata,  joven,  ano,  disparar,  forma,  brutal,  pandemia,  vacuna,  dar,  autorizacion,  compris,  doctor,  muerte,  joven
ano,  persona,  problema,  inmunologico,  varicela,  vacuna,  virus,  varicelazoster,  quedar,  latente,  reactivar,  producir,  sarpullidos,  doloroso,  culebrilla,  vacuna,  reducir,  riesgo
cartera,  diversificada,  vacuna,  reducir,  riesgo,  tecnologico,  suministro,  gobierno,  mexico,  cartera,  diversificada,  vacuna,  excelente
padre,  familia,  forma,  politica,  salud,  mexico,  exigimos,  salud,  nivel,  pedimo,  regreso,  seguro,  clase,  vacuna,  poblacion
mexico,  aprobar,  estudio,  publicado,  porfa,  explicam,  vacuna,  confiable,  aplicar,  problema,  porfa,  duda
crecimiento,  economia,  cimentadamente,  rumbas,  muerto,  covid,  delincuencia,  organizado,  vacuna,  suficiente
sone,  ir,  restaurante,  caro,  vacuna,  covid,  venir,  incluir
estrategia,  planteado,  perdida,  vida,  humano,  hora,  esquema,  vacuna,  actual,  pandemia,  criterio,  ciencia,  duro,  crimen,  leso,  humanidad,  llamar
febrero,  plan,  nacional,  vacuna,  alerta,  coronavirus,  mexico,  contagio,  muerte,  contagio,  muerte,  cuidense
hueva,  critica,  pendeja,  hueva,  fanatismo,  estupido,  neta,  aplaudo,  seguir,  cuidando,  cubrebocas,  vacuna,  vacuna,  vacuna
interesar,  checo,  metodo,  powers,  transicion,  hormonal,  ignorar,  path,  ciencia,  moderna,  nomas,  asomar,  dar,  sistema,  ocupar,  ahorita,  tantito,  anti,  tran
extraordinario,  exito,  vacuna,  covid,  cuba,  esperanza,  pais,  bajo,  ingreso
salgan,  huatulco,  vacaciones,  usen,  cubrebocas,  vuelo,  hotel,  vacuna
mensaje,  importante,  paciente,  cancer,  vacuna,  efectivo,  seguro,  paciente,  cancer,  comenten,  medico,  mayoria,  caso,  aplicacion,  vacante
exacto,  probabilidad,  inmunizado,  vacuna,  probar,  efectivo
cita,  falta,  conciencia,  gente,  creer,  vacuna,  virus,  entender,  seguir,  cuidando
infectologo,  hare,  hijo,  vacuna,  deber,  congruente,  ciencia,  comentario,  recibir,  brenda,  duda,  exponer,  politizacion,  ignorancia,  tema,  delicado,  vacuna,  infancia
reporta,  contagio,  contagio,  defunciones,  covid,  reconocer,  mil,  caso,  activo,  vacunarte,  cubrebocas,  informar,  vacuna
considerar,  vacuna,  cuidado,  saludo
desafortunadamente,  quedar,  secuela,  fibrosis,  pulmonar,  cansancio,  olvidar,  palabra,  costar,  concentrar,  tristemente,  lleve,  tratamiento,  posterior,  covid,  mes,  covid
suegra,  ano,  marcapaso,  problema,  epoca,  dudoso,  vacuna,  familia,  animamo,  registramo,  domingo,  desinformacion,  comenzar,  difundir,  grupo,  vecino,  ir,  empezar,  vacuna
facil,  juzgarpero,  mayoria,  gente,  opcion,  morir,  corona,  gob,  vacuna,  moral,  gastara,  vacuna,  estadio,  cosasatrapamil,  satrapo
consecuencia,  novak,  djokovic,  deportado,  australia,  vacuna,  juego,  complicado
vacuna,  proteccion,  humanidad
pfizer,  iniciar,  prueba,  pildora,  prevenir,  covid
ma,  dosis,  vacuna,  corazon,  coronavirus,  covid,  covid,  cuarentena,  sanadistancia,  quedateencasa,  oaxaquenopresumido
corrupcion,  vacuna,  politico,  militar,  vacunando,  imaginan,  vacuna,  cause,  muerte,  subito,  punto,  vivir,  mundo,  depurados,  bicho,  corrupto
experimento,  pfizer,  aprobacion,  completo,  tema,  vacuna,  reducir,  riesgo,  gobierno,  responsable,  proponer,  vacuna,  rodeado,  ignorancia,  ver,  conspiracion
mucho,  campana,  meme,  pandemia,  vacuna
marcharemo,  vacuna,  regreso,  clase,  presencial,  estudiante,  vacuna
imbecil,  cubrebocas,  servir,  servir,  servir,  servir,  obligatorio,  cubrebocas,  vacuna,  servir,  acoger,  cubrebocas,  gripita
carbon,  unido,  medida,  disminuir,  absorcion,  carbon,  multi,  dosis,  medida,  aumentar,  eliminacion
curioso,  invertir,  negocio,  vacuna,  invertir,  tratamiento,  farmacologico,  eficiente,  acabar,  covid
tarea,  cuidar,  tu,  ejercicio,  regulado,  comer,  sano,  ayuda,  fortalecer,  sistema,  inmune,  forma,  aconsejar,  preparar,  iniciado,  vacuna,  unido,  hacer,  tarea,  ante,  salud
vacuna,  funcionar,  virus,  flanqueando,  duramente
viaje,  joven,  vacuna,  importante,  independientemente,  implicar,  economicamente,  vida,  valioso,  pena,  pais,  estrategia,  vacuna,  desastroso,  abrazo,  carino
vacuna,  antecedente,  padecer,  covid,  previamente,  gt,  mes,  tendencia,  efecto,  adverso,  escalofrio,  cefaleo,  malestar,  alergio,  sulfa,  vacuna,  genero,  efecto,  adverso,  adicional
diez,  entidad,  registrar,  alza,  contagio,  covid,  regeneracion,  pena,  seguir,  desperdiciando,  vacuna,  anciano,  gente,  trabajador,  bastar,  estupidez
nino,  aislamiento,  pandemia,  pandemia,  vacuna,  vacaciones,  verano,  fase,  positivo,  fallecido
clase,  presencial,  pandemia,  pandemia,  vacuna,  fase,  positivo,  fallecido
dar,  positivo,  covid,  cuidado,  vacuna,  cuidense,  feo,  inquilino,  palacio,  dato
vulnerable,  vacuna,  fallecer,  esperar,  muerto,  contagio,  muerto,  justificar,  inaccion
insumo,  regreso,  clase,  maestro,  contar,  dosis,  vacuna
gobierno,  parecer,  mentira,  existir,  virus,  entender,  vacuna,  exime,  riesgo,  contaminar,  tu,  poder,  vacuna,  adulto,  mayor
aislamiento,  pandemia,  pandemia,  vacuna,  clase,  virtual,  fase,  falta,  vacuna,  positivo,  fallecido
sugestionar,  poner,  vacuna,  creer,  menor,  molestia,  aplicacion,  dolor,  aplicado,  gravedad,  muerte
vacuna,  sinovial,  provocar,  muerte,  anciano,  mexico,  denuncia,  familia,  via
comorbilidad,  depresion,  perfil,  seguridad,  interaccion,  resto,  medicamento,  iniciar,  dosis,  minimo,  ajustar,  funcion,  renal,  hepatica,  medicamento,  dormir,  vida,  paciente,  insomnio
excelente,  noticia,  vacuna,  chino,  servir,  generar,  suficiente,  anticuerpo,  mayor
crees,  vacuna,  recuperar,  dato,  duro,  pandemia,  logico,  sencillo
iztapalapa,  vacuna,  contagio
aurora,  caso,  circulo,  gracias,  vacuna,  infectaron,  saber,  persona,  contagiada,  obvio,  seguir,  cuidando
vacuna,  impedir,  koi,  caso,  ayuda,  llegue,  hospital,  mueras,  tb,  garantia
vacuna,  dueno,  cuerpo,  riesgo,  toma,  ley,  murphy,  probable,  minimo,  pasar,  riesgo,  efecto,  secundario,  alguien,  asegurar
contexto,  coloquial,  ensenar,  ideal,  vacuna,  dar,  inmunidad
ideal,  empezar,  transmision,  vacuna,  llegar,  cuentagotas,  normal,  alto,  demanda,  nivel,  mundial,  empezar,  zona,  alto,  contagio,  vacuna,  avanzaria,  necesario,  apagar,  incendio,  vaso
regreso,  clase,  homicidio,  directo,  matadero,  culpable,  regreso,  clase,  presencial,  estudiante,  vacuna
contar,  medida,  sanitario,  debida,  convivencia,  vacuna
enfrentar,  crisis,  sanitario,  cien,  ano,  segundo,  alguien,  morir,  covid,  realidad,  depender,  completo,  gigante,  farmaceutico,  campana,  vacuna,  unico,  interesar,  ganancia
saludo,  vacuna,  mexicano,  seguir,  cuidando,  caso,  detente
preocuparon,  papas,  puta,  pandemia,  ir,  fiesta,  fiesta,  anemia,  doctora,  cuidara,  papas,  fiesta,  vacuna,  excusa,  llamar,  inconsciente,  poner,  riesgo
deber,  incluir,  mejora,  capacidad,  comprension,  analisis,  informacion,  salto,  cuantico,  conclusion,  parcial,  info,  avalar,  vacuna,  seguro,  caso,  enfermedad,  grave,  vacuna
infraestructura,  educativo,  estudiante,  vacuna,  inmunidad,  colectivo,  entender,  regreso,  clase,  homicidio
desafortunados,  ignorante,  contagiado,  valio,  madre,  cubrebocas,  vacuna,  pfizer,  dejar,  cubrebocas,  cuidar,  dudo,  conozca,  charle,  darwin,  teoria,  seleccion,  natural,  explicar
febrero,  plan,  nacional,  vacuna,  alerta,  coronavirus,  mexico,  contagio,  muerte,  contagio,  muerte,  cuidense
socio,  buscar,  ampliar,  capacidad,  pais,  ingreso,  bajo,  mediano,  pibe,  producir,  vacuna,  covid,  ampliar,  fabricacion,  aumentar,  acceso,  mundial,  herramienta,  fundamental,  controlar,  pandemia
sigamos,  proteger,  vacuna
corrijo,  politica,  nacional,  vacuna,  virus,  sars,  cov
opino,  deber,  vacuna,  fiesta,  tv
pendejo,  organismo,  verifican,  informe,  laboratorio,  experimentan,  vacuna,  cabron,  duda,  alto,  grado,  eficacia,  pongase,  estudiar,  dejar,  pendejear,  gente,  ver,  ma
creer,  acabar,  par,  vacuna,  favor,  entiendan,  proceso,  inmunidad,  colectivo,  complejo,  tipo,  situacion
deber,  acelerar,  vacuna,  masivo,  quinto,  roo,  yucatan,  capiche,  veracruz,  baja,  california,  sinagoga,  disparar,  contagio
coincido,  twitter,  autocritica,  ano,  cifra,  record,  homicidio,  violento,  doloso,  feminicidios,  masacres,  ciudad,  peligroso,  mundo,  vacuna,  campana,  electoral,  autocritica
ministro,  britanico,  reconocer,  variante,  omicron,  capaz,  infectar,  vacuna,  pauta,  completo,  rt,  jajajaja,  ojala,  empezar,  europeo,  estadounidense,  mexicanito
ojala,  servir,  leccion,  sonar,  haber,  vacuna,  inmortal
vacuna,  causar,  variante,  unico,  variante,  loki,  opinando,  idiota,  replicar,  virus,  aumentar,  probabilidad,  mutar,  vacuna,  obstaculizar,  replique,  resistencia,  antibioticos
ojala,  pandemia,  vacuna,  cuauhtemoc,  conocer
mayoria,  senalar,  desafortunado,  tuit,  entender,  burla,  actitud,  despectiva,  vacuna,  cansino,  perfeccion,  error,  entero,  lector
nave,  robada,  exterminio,  mundial,  vacuna,  covid,  enfermedad,  aparecer,  enfermedad,  congenito,  ayahuasca,  servir,  quirofano,  ingiere,  toma,  aplicado
escuchaste,  tuberculosis,  pulmonar,  decir,  pulmon,  respiracion,  cancer,  salud,  estilodevida,  clima,  vipassana,  saludesvida,  cuidar,  salud,  saludybienestar,  viruscovid,  vacuna,  vacunacionanticovid
agua,  resultar,  seguro,  oms,  confirmar,  inmunidad,  vacuna,  covid,  duro,  mes,  noticiero,  televisa
creer,  mayoria,  vacuna,  contraer,  covid,  organizando,  fiesta,  contagio,  zocalo,  miercoles,  celebrar,  inflacion,  dolar,  buv,  bajar,  semana
jefe,  vacuna,  cubrebocas,  oficina,  pariente,  dato,  vacuna,  contagian
llueva,  truene,  relampaguee,  salir,  casa,  vacuna,  cubrebocas,  correctamente,  ajustado,  lugar,  cerrado,  sano,  distancia,  ventilacion,  cruzado,  continuo,  espacio,  cerrado,  preferencia,  medir,  vacuna,  tu,  inmunidad,  inmediato
aprender,  parecer,  basicas,  lavado,  mano,  metodo,  desinfeccion,  alimento,  virus,  vacuna,  elaboran
importancia,  vacuna,  irresponsable,  seguir,  antivacuna,  ola,  muerte
salir,  caro,  cubrebocas,  vacuna
europo,  cansino,  plan,  conversacion,  real
vacuna,  dome,  vacuna,  reforzado,  virus
posterior,  conferencia,  prensa,  presidente,  compartir,  vista,  apoyemo,  restaurante,  falta,  vacuna,  ayudar,  vencer,  de
idea,  conceptocontencion,  dano,  incidente,  aislado,  alguien,  mente,  querer,  sustraer,  dosis,  potencian,  volver,  complice,  comunicado,  error,  generar,  desconfianza,  poner,  charola,  plata,  inmundo
decir,  definitivamente,  vacuna,  unido,  posibilidad
favor,  informate,  cuba,  vacuna,  comparado,  poblacion,  mundo,  usar,  andara,  poblacion,  inclusive,  nino
importante,  vacuna,  seguir,  cuidando,  organismo,  igual,  irresponsable,  cuidar,  tu,  hij
voz,  doctor,  muerte,  vacuna,  sputnik,  deber,  utilizar,  dato,  clinico
senora,  dotacion,  altamente,  significativo,  vacuna,  xochimilco,  caos,  grave,  fila,  interminable,  avance
cirujano,  plastico,  tuit,  sensacionalista,  amarillista,  vacuna,  embarazado,  posterior,  sugerir,  asociacion,  obito,  vacuna,  plastico,  esperar,  entender
atencion,  favor,  caso,  grave,  muerte,  ver,  covid,  persona,  vacunadas,  senor,  vacuna,  salvar,  vida,  evitar,  enfermedad,  grave
problema,  gente,  apto,  pensamiento,  abstracto,  requerir,  vivir,  democracia,  moderna
gobierno,  mexico,  arduamente,  cumplir,  forma,  plan,  vacuna,  covid,  solidaridad,  respetando,  medida,  sanitario,  cubrebocas,  guardar,  sano,  distancia,  salir,  quedate,  casa
normalmente,  desarrollo,  vacuna,  ano,  decada,  historia,  caso,  vacuna,  covid,  inicio,  pandemia,  avanzar,  ritmo,  precedente
enoja,  recomendacion,  facil,  hacer,  caso,  nomas,  sorprendan,  mortal,  consecuencia,  decir,  cubrebocamente,  vacuna,  cuidate,  covid,  sano,  distancia
desicion,  nino,  alcanzar,  inmunidad,  rebano,  vacuna,  ganar,  eleccion,  costa,  caso,  vida,  consecuencia,  politico,  lamentable,  importar,  nino
publicado,  resultado,  cansino,  nota,  rumor,  significar,  oms,  avalar,  dicho,  vacuna
peticion,  vacuna,  nino,  ano,  mexico,  inicio,  clase,  escolar
corrupcion,  protagonismo,  vacuna,  poblacion,  hablar,  salud,  vision,  aprendizaje,  valor,  principio,  simplemente,  brincan
persona,  merecerian,  ocupar,  cama,  hospital,  ocupar,  bruta,  ojala,  enfermedad,  llevar,  vacuna
ensayo,  clinico,  vacuna,  nasal,  sputnik,  comenzar,  moscu,  vacuna,  especialmente,  eficaz,  variante,  omicron,  altamente,  transmisible,  termino,  proteccion,  infeccion,  prevenir,  transmision
jaja,  meter,  rabona,  ojo,  cerrado,  urgen,  vacuna,  volverte,  clase
comentario,  enfermedad,  gripa,  cuidado,  alarma,  necesidad,  vacuna,  perdon,  duda
considerar,  deporte,  dosis,  riesgo,  seguridad,  proteccion,  piloto,  atreveria,  conducir,  kmh,  pelo,  riesgo,  morir
olvidar,  deber,  obedecer,  autoridad,  gobernante,  puesto,  dios,  vacuna,  fe,  ciencia,  dios,  efectivamente,  vacuna,  acto,  amor,  bendiciones
regresar,  responsabilidad,  nino,  vacuna,  hijo,  negar,  estudien,  aprendan,  perder,  covid,  agradable,  preciado,  hijo
asistire,  espacio,  uniras,  vacuna,  omicron,  bioestadisticona
agreguen,  vacuna,  ventilacion
familia,  enfermado,  hermana,  ano,  economicamente,  pobre,  puntual,  vacuna,  covid,  vacuna,  influenza,  conclusion,  pandemia,  respetar,  sexo,  edad,  condicion,  vacuna
