vacuna,  medida,  proteccion,  sano,  distancia,  lugar,  ventilado,  cubrebocas,  mejor,  arma,  abrazo,  crack,  papa,  instante,  gracias,  compartirlo
opinar,  dejar,  viejito,  deber,  estres,  cansancio,  llevar,  solucion,  estupida,  problema,  pais,  asilo,  copito
estadounidense,  creer,  teoria,  conspiracion,  microchip,  vacuna,  covid,  consultora,  rt,  recordar,  droga,  afectos,  estadounidense,  provocar,  neurona,  afectar
exigencia,  justo,  recurso,  existente,  probado,  disposicion,  evidencia,  efectividad,  vacuna,  indiscutible,  poblacion,  obstinacion,  desdenar,  evadir,  irresponsabilidad,  poblacion,  exigir
garantizar,  seguridad,  funcionario,  casilla,  proximo,  eleccion,  promoviendo,  vacuna,  anti,  covid,  desercion,  funcionario
junio,  plan,  nacional,  vacuna,  alerta,  coronavirus,  mexico,  contagio,  muerte,  contagio,  muerte,  cuidense
alguien,  vacuna,  serio,  acoger,  preguntar,  deber,  evitar,  infectar,  agendo,  alto,  riesgo,  contagio
extraordinario,  hilo,  interesante,  debate,  endocrinologo,  pediatra,  querer,  aclarar,  vacuna,  covid,  acelero,  pubertad,  nina,  condicion,  pandemia,  aceleran,  pubertad
defiendo,  efecto,  cabal,  amparo,  vacuna,  decision,  tomado,  decision,  salud,  calculado,  densidad,  poblacional,  seguir,  millon,  nino,  embarazo,  adolescente
mito,  vacuna,  covid,  buscar,  info,  encontrar,  adecuado,  aclarar,  duda,  saludo
totalmente,  tratar,  covid,  tema,  fondo,  vacuna,  saludo
reitero,  libre,  voluntario,  validar,  comenta,  evidencio,  argumento,  valido,  punto,  vista,  mio,  persona,  tema,  punto,  vista,  saludo,  estimado
considerar,  refrigeracion,  vacuna,  riesgo,  apagon,  dar
papas,  llevar,  nino,  vacuna,  carajo,  obedecer,  indicacion,  tomar,  foto,  video,  menos
altura,  vida,  unico,  pides,  ruegas,  familia,  enferme,  covid,  aguanten,  vacuna
evidencia,  contagio,  gente,  vacunada,  suponer,  depender,  vacuna,  sistema,  inmune,  ataco,  virus,  dificil,  reproduzca,  suficiente,  contagiar
seguro,  vacuna,  consecuencia,  seguro
vacuna,  edomexvacuar,  indispensable,  seguir,  tomar,  precaucion,  tando,  sano,  distancia
decir,  suegrito,  pasar,  papel,  dar,  alto,  vacuna,  creer,  vacuna,  seguir,  insistir
fucking,  ano,  pandemia,  vacuna,  seguir,  non,  free,  covid,  hagale,  ganar,  dar,  gozar,  profesional,  restaurante,  lomo,  linda
entender,  cristo,  dificil,  contagiar,  imposible,  vacuna,  gente,  entender
permitir,  estudiante,  medicina,  anden,  proceso,  vacuna,  covid,  vacuna,  exponer,  facultad,  obligado,  contrario,  deber,  proteger,  alumno
defiendo,  importante,  vacuna,  matar,  hermano,  tocar,  riesgo,  millon
decir,  falacia,  autoridad,  morir,  gente,  reaccion,  vacuna,  realidad,  realidad,  querer
paciente,  vivir,  diabetes,  tipo,  vacuna,  covid,  tranquilizar
probabilidad,  aumentar,  numero,  caso,  vacuna,  movimiento,  rapido
regreso,  clase,  presencial,  discusion,  maestro,  entender,  desear,  favor,  expliquele,  inepto,  vacuna,  hijo,  hija,  mandamos,  falta,  gana
aislamiento,  pandemia,  pandemia,  vacuna,  clase,  virtual,  fase,  sabado,  gente,  calle,  cubrebocas,  gente,  necia,  pensar,  llegar
exacto,  hermano,  eeuu,  vacuna,  alto,  riesgo,  contagio,  edad,  esperar,  largamente,  patricio,  insensible
depender,  relajemos,  pais,  peor,  momento,  empezar,  vacuna,  gente,  deshonra
pena,  deber,  representante,  oms,  desperdiciar,  vacuna,  viejo,  borde,  foso,  utilizar,  gente,  joven,  productivo
regreso,  seguro,  clase,  venir,  exigir,  vacuna,  poblacion,  infraestructura,  escuela,  solucion,  mover
mercado,  retroceder,  debatiendo,  optimismo,  vacuna,  cautela,  variante,  coronavirus,  delta,  esperar,  reportar,  eeuu,  ust
pobre,  morro,  maestro,  capacidad,  analisis,  servir,  vacuna,  maestro,  nino,  infectan,  morir
enero,  plan,  nacional,  vacuna,  alerta,  coronavirus,  mexico,  contagio,  muerte,  contagio,  muerte,  cuidense,  cuidense
estrategia,  vacuna,  dome,  vacuna,  importante
jamon,  historia,  mundo,  vacuna,  caracteristica,  conocer,  manejo,  acertar,  riesgo,  producto,  dificil,  comprender
vacuna,  riesgo,  muerte,  disminuir
panda,  vacuna,  llamar,  pandemia
plano,  forma,  impedir,  usar,  poblacion,  vacuna,  riesgo,  potencial,  simplemente,  accion,  irreversible,  instancia,  nacional,  internacional,  acudir
noon,  escaso,  porcentaje,  poblacion,  vacunada,  seguro,  este,  vacuna,  poder,  portador,  asintomatico,  contagiar,  persona
super,  dar,  logico,  estrategia,  vacuna,  adulto,  mayor,  nino,  escaso,  conocimiento,  decir,  nino,  sistema,  inmune,  fuerte,  adulto,  aparte,  hechale,  andar,  actividad,  economico
dar,  positivo,  covid,  contagie,  vacuna,  contagie,  vacuna,  oh,  contagie,  vacuna,  contagie,  vacuna
secretaria,  seguridad,  publico,  proteccion,  ciudadano,  rosa,  cela,  rodriguez,  vacuna,  mananero,  asunto,  resolver,  matanza,  salvatierra,  guanajuato,  reino,  tamaulipo,  jiutepec,  modelo,  evitan,  muerte,  responsabilidad
pregunta,  orden,  clase,  presencial,  mes,  dar,  clase,  porque,  autorizoque,  protocolos,  profesor,  vacuna,  united
gracias,  vacuna,  cancer,  alto,  moreno
ignorancia,  existir,  vacuna,  protejen,  quedar,  experimental,  poder,  contagiar,  tu,  inmediatamente,  salir,  prueba,  covid
grandecitos,  twitter,  accesar,  informacion,  creer,  vacuna,  derecho,  sinceramente,  dejar,  influenciar
recuerden,  vacuna,  periodo,  efectividad,  optar,  marca,  oferta,  permitir,  politico,  eurocentrista,  tomar,  vacuna,  chino,  ruso
europo,  amenaza,  fabricante,  vacuna,  controlar,  exportacion,  via
efecto,  pandemia,  comparar,  numero,  vacuna,  creciente,  salino,  jajajajaja,  idolatria,  dano
abril,  plan,  nacional,  vacuna,  alerta,  coronavirus,  mexico,  contagio,  muerte,  contagio,  muerte,  cuidense
publicacion,  asunto,  repito,  necesario,  dialogar,  clasicismo,  publicacion,  universal,  ir,  vacuna,  eu,  conocido,  realidad,  socioeconomico
maldito,  necedad,  seguir,  confundir,  poblacion,  exponer,  forma,  criminal,  contagio,  usen,  millon,  vacuna,  almacenadas,  efectivo
alma,  habita,  logico,  corra,  proceso,  ver,  diferencia,  proceso,  vacuna,  eeuu,  mexico,  deberia,  analizar,  causa,  digas,  dosis,  rebajada,  poder,  especifico
evitar,  chiste,  covid,  traer,  vida,  gente,  morir,  importante,  vacuna,  jugar,  puritano,  conveniencia
vacuna,  nino,  medicamento,  cancer,  nino,  vacuna,  cuadro,  basico,  nino,  nino,  becarios,  claudia,  terrible,  corazon,  proyecto
semana,  calle,  ny,  traer,  cubrebocamente,  enorme,  mayoria,  vacuna,  metro,  espacio,  cerrado,  mundo,  traer,  cubrebocas
gente,  generacion,  tocar,  vecinito,  polio,  enfermedad,  practicamente,  erradicado,  vacuna,  dudar
mundo,  evidencia,  epidemia,  covid,  menor,  edad,  ojala,  informar,  gobierno,  pasar,  mundo,  pidanle,  difunda,  medida,  vacuna,  cubrebocas,  distancia,  social,  ventilacion
mes,  efectividad,  vacuna,  pfizer,  biontech,  baja,  prevenir,  infeccion,  sarscov,  altamente,  efectivo,  prevenir,  enfermedad,  grave,  muerte,  vacuna,  salvan,  vida,  vacunarte,  cubrebocas
evento,  pequeno,  paso,  hombre,  paso,  inmunidad,  dar,  terapia,  inmunidad,  denomina,  vacuna,  laboratorio,  carnet
sentir,  muerte,  colega,  triste,  culpa,  gobierno,  persona,  egoistas,  cuidar,  vacuna,  tratar,  paciente
aclarar,  duro,  eficacia,  vacuna,  covid,  ano,  mes,  mes,  mes
jose,  luis,  respeto,  informar,  vacuna,  evitar,  contagie,  evitar,  mueras,  pongo,  grave,  contagia,  forma,  voluntario,  confio,  pongo
vacuna,  fabricado,  distribuido,  argumento,  emergencia,  sanitario,  sonar,  hacer,  responsable,  argumento,  vender,  rato,  supuesto,  version,  mejorada
saber,  reaccion,  moderada,  fuerte,  imagino,  vacuna,  mostrar,  reaccionar,  enfermedad
vacuna,  coronavirus,  quitar,  riesgo,  contagio,  disminuir,  riesgo,  enfermedad,  grave,  mirar,  gente,  pendeja,  ver,  ano,  aumento,  mentalidad,  anti,  vacuna,  vacuna,  coronavirus,  servir
preparar,  documentacion,  argumento,  respaldar,  eficacia,  vacuna,  can,  optan,  silencio,  enemigo,  prensa
amigo,  vacunense,  vacuna,  supere,  fobia,  vacuna,  seguro,  vacuna,  regresaremos,  vida,  conociamo,  covid
ano,  poner,  dosis,  proteger,  maldito,  covid,  llevar,  dosis,  contagio,  confirmar,  contagio,  sospechoso,  principio,  pandemia,  seguir,  lucha,  esperar,  leen,  salud
delia,  trasladan,  enfermo,  covid,  grave,  paramedico,  camillero,  chofer,  asistente,  familia,  afectado,  falleciendo,  contagio,  opcion,  vacuna
heroe,  olvidar,  covid,  historia,  contado,  cientifico,  cuyo,  avance,  vacuna
desacreditar,  golpeteo,  politico,  deporte,  nacional,  borla,  honorable,  periodico,  cansino,  reconocido,  oms,  chino,  vacuna,  salir,  pandemia,  regresar,  normalidad,  economia,  crecer,  mundo
evidente,  pesimo,  manejo,  pandemia,  mayo,  domo,  aplano,  curva,  dirigente,  morena,  saltan,  fila,  vacuna,  presumen,  red,  pretender,  eliminar,  autonomia,  independencia,  organo,  regulador
ojo,  alerta,  retraso,  vacuna
preguntale,  mali,  civilizada,  africano,  invadida,  potencia,  mundial,  escuchar,  pais,  europeo,  mediano,  ver,  especie,  dios,  vacuna,  poder,  contagiar,  alguien,  vacuna
crear,  tose,  nina,  nino,  efecto,  terrible,  perder,  olfato,  corneto,  tener,  estropeado,  saque,  resolver,  jarabe,  imprudencia,  vacuna
toma,  fuerza,  evidente,  necesidad,  contar,  vacuna,  efectivo,  suficiente,  poblacion,  dejar,  preocupado,  ineficiente,  actividad,  gobierno,  federal,  eso,  suceder
deber,  disponible,  real,  dato,  abierto,  vacuna,  grupo,  edad,  localidad,  residencia,  entidad,  federativa,  sexo,  ocupacion,  principal
clase,  presencial,  pandemia,  pandemia,  vacuna,  fase,  positivo,  fallecido
vacuna,  servir,  experimento,  clinico,  escenario,  epidemiologico,  real,  necesitar,  dosis
moscu,  mes,  atras,  poblacion,  negada,  vacuna,  mascarilla,  distanciamiento,  gobierno,  intentar,  limitacion,  vacuna,  mayoria,  poblacion,  fracaso,  comercio,  rebelar
martha,  entender,  vergonzoso,  decision,  extraordinario,  gestion,  tema,  vacuna,  error,  garrafal,  tantisima,  gente,  obradorismo,  eligen,  troll,  quinto
serial,  alzheimer,  minuto,  escuchar,  doctor,  hablar,  tratamiento,  farmacologico,  enfermedad,  alzheimer,  pasen,  voz,  char,  experto,  vacuna,  tu
hola,  mes,  entrevista,  feria,  hacer,  vacuna,  nine,  dimension,  acostumbrada,  riesgo
campana,  costar,  volver,  vacuna,  evitar,  problema
mutacion,  conocido,  comun,  distinto,  region,  velocidad,  disminuir,  virus,  fundamental,  limitar,  capacidad,  transmision,  posibilidad,  mutacion,  dejar,  efecto,  vacuna
vacuna,  evitar,  lesion,  grave,  salvar,  poner,  tu,  fregadero,  disminuyes,  riesgo,  fractura,  querer
durisimo,  contagiado,  vacuna,  vacuna
marzo,  plan,  nacional,  vacuna,  alerta,  coronavirus,  mexico,  contagio,  muerte,  contagio,  muerte,  cuidense
sabes,  esquema,  nacional,  vacuna,  verificar,  hij,  completo,  ninosfelicesysanosyno,  pediatra,  sangre,  nino,  tipsdesalud,  vacuna,  pediatria,  sano,  distancia,  cubrebocas,  ventilacionadecuadamecuada,  lavadodemanos,  regreso,  clase
vacuna,  lento,  na,  situacion,  agandallar,  ir,  quedar,  tu,  correcto,  fuck,  the,  system,  ayuda
ojo,  gobierno,  pedir,  pasen,  mes,  indicacion,  laboratorio,  producir,  vacuna
problema,  radicar,  pensar,  entrecomillo,  efecto,  vacuna,  matar,  virus,  contagie,  leer,  informate,  dano,  quedar
pandemia,  fenomeno,  natural,  afectar,  salud,  detener,  tsunami,  afectar,  salud,  publico,  atender,  enfermo,  vacuna
gente,  querido,  padre,  primerizo,  idea,  vacuna,  bebe,  costar,  alguien,  orientar,  vacuna,  vacuna,  universal,  gratuito,  vacuna,  padre,  primerizos
venir,  semana,  santo,  ola,  coronavirus,  equipo,  vacuna,  personal,  medico,  malo,  apostar,  inmunidad,  rebano,  medir,  hacer,  pasar,  morir,  millon,  seguir,  tranquilo,  novedad
vacuna,  compraron,  llegar,  mes,  llegar,  millon,  millon,  vacuna,  marzo,  pandemia,  domo,  disminuir,  muerte,  contagio,  promesa
vacuna,  gobierno,  momento,  dificil,  situacion
loque,  preocupar,  info,  suficiente,  disponible,  simple,  mortal,  refuerzo,  conveniencia,  aplicar,  loque,  estudio,  info,  conveniente,  pez,  vacuna,  astrazeneca,  sentir,  derivar
exigimos,  agilizar,  proceso,  vacuna,  estudiante,  vacuna,  regreso,  regreso,  clase,  peligroso
irresponsable,  enganen,  prueba,  animal,  fase,  vacuna
estudiante,  protestar,  regresar,  clase,  presencial,  vacuna,  contrario,  contagiar,  traeria,  fallecimiento,  familiar
relajando,  razon,  presion,  politica,  ciudadania,  regresar,  normalidad,  existir,  riesgo,  rebote,  area,  baja,  vacuna
seguir,  expectativa,  vacuna,  covid,  nino,  adolescente
hablar,  carajo,  millon,  persona,  vacuna,  ritmo,  inmunizar,  poblacion
dome,  sigamos,  esperar,  vacuna,  bajemos,  guardia,  sigamos,  medida,  proteccion
ser,  querido,  llegar,  fallecer,  convivido,  causa,  vacuna,  factible,  transmitir,  virus,  seguir,  pensar
imagino,  anotan,  cartilla,  vacuna,  importante,  llevarla
juez,  conceder,  suspension,  vacuna,  menor,  ernesto,  varga,  contr
solucion,  adherencia,  toma,  diario,  dosis,  frecuente,  medicamento,  accion,  prolongado
nino,  querer,  vacuna
preparacion,  saber,  informacion,  pertinente,  vacuna,  suficiente,  ofrecer,  apoyo,  tecnico,  aprobacion
conecto,  hacer,  registro,  comenzamo,  escuchar,  participacion,  presidente,  clic,  carlo,  castro,  vacuna,  inoculacion,  proteccion,  link
gobierno,  europeo,  parecer,  acompanar,  maduro,  salir,  noticia,  abandono,  parcial,  vacuna
prueba,  suposicion,  entender,  liga,  intentar,  evitar,  discriminacion,  real,  tema,  salud,  implicar,  deportivo,  delicado,  vacuna
estudiante,  protestar,  vacuna,  estudiante,  infraestructura,  escolar,  adecuado,  condicion,  actual
donacion,  vacuna,  deber,  dosis,  afectar
sentir,  pasar,  enfermedad,  conocido,  violento,  vacuna,  imagino,  deber,  principio
vacuna,  transmitir,  infeccion,  agua,  nino,  pequeno,  deber,  cuidadosos
manejar,  precaucion,  respetando,  limite,  velocidad,  evitar,  accidente,  vacante,  cubrebocas
inscripcion,  promocion,  horizontal,  curso,  chafa,  registro,  vacuna,  vacuna,  anti,  covid,  declaracion,  patrimonial,  curso,  chafa,  nomas,  quedar,  regreso,  clase,  presencial,  estudiar,  examen,  maligno
apurense,  vacuna,  elaboracion,  prueba,  necesario,  querer,  manipular,  mundo
esperar,  revisen,  contenido,  libre,  salud,  deber,  especialista,  emitir,  comentario,  informacion,  solido,  afectar,  persona,  vulnerable,  vacaciones,  work,  vacuna,  tu,  cubrebocas
basicamente,  desarrollar,  medicamento,  salvan,  vida,  vacuna,  salvar,  vida,  empresa,  farmaceutico,  tratamiento,  importante,  mentalidad,  ojala,  necesites,  hospital
taco,  acabar,  confesar,  vacuna,  inyectan,  virus,  explico,  poner,  vacuna,  aplicaron,  nino,  insistir,  plan,  gobierno,  necedad,  acabar,  perder,  clientela
ensayo,  demostrar,  vacuna,  covid,  disminuir,  gravedad,  enfermedad,  mortalidad
vacuna,  inmunidad,  prevenir,  caso,  grave,  bajar,  tasa,  hospitalizacion,  morbilidad,  persona,  vacuna,  agravan,  caso,  introducen,  enfermedad,  erradicado,  sarampion
importar,  idiota,  medicamento,  oncologicos,  vacuna,  covid,  nino,  vacuna,  necesario,  recien,  nacido,  imbecil,  asesino,  sal,  tonteria,  aplaudir,  solovino,  conveniencia
triste,  pandemia,  tiro,  idolo,  sobretodo,  declarar,  abiertamente,  antivacuna
clase,  presencial,  pandemia,  pandemia,  vacuna,  fase,  positivo,  fallecido
tonto,  creer,  nino,  contagian,  creer,  vacuna,  duro,  eternidad,  concientes,  ignorante
dudes,  sumar,  bicho,  sano,  distancia,  lavado,  mano,  cubrevoca,  vacuna
clase,  presencial,  pandemia,  pandemia,  vacuna,  fase,  positivo,  fallecido
familiar,  funerario,  comentar,  mayoria,  muerto,  covid,  contaban,  vacuna,  vacuna,  inmune,  adquieres,  covid,  vacuna,  poder,  contagiar,  amigo
festejo,  miercoles,  contagiaron,  diciembre,  zocalo,  variante,  deber,  pensar,  dosis,  vacuna,  nino,  celebrar,  inflacion,  dolar,  peso,  decir
medicamento,  encontrar,  tipo,  vacuna
lamentable,  importar,  situacion,  escuchar,  servidor,  publico,  decir,  cubrebocas,  bozal,  denota,  aprender,  pandemia,  vacuna,  espacio,  cerrado,  gente,  cubrebocas
vacuna,  dome,  seguir,  aumentar,  vacuna,  prevenir,  enfermedad
entiendes,  prueba,  beneficio,  vacuna
amigo,  organizador,  promotor,  restriccion,  viajar,  pedir,  certificado,  vacuna,  prueba,  por,  depender,  caso,  regla,  pais,  cambiar,  minuto,  tomenlo,  logistica,  contratacion,  actor,  vuelo
gracias,  dato,  compruebo,  solito,  respondiste,  vacuna,  obligatorio
junio,  plan,  nacional,  vacuna,  alerta,  coronavirus,  mexico,  contagio,  muerte,  contagio,  muerte,  reportaron,  muerte,  minuto,  erroneo,  cuidense
iniciar,  covid,  andar,  francia,  entrar,  italia,  regresar,  supusimos,  sano,  grave,  logro,  salir,  ano,  volver,  vacuna,  puesto,  leve
ano,  responsabilidad,  manda,  llevar,  vacuna
decir,  vacuna,  volver,  inmune,  mision,  mitigar,  maximo,  efecto,  contagia
esconder,  responder,  solucion,  problema,  infraestructura,  escuela,  oriente,  vacuna,  poblacion,  regreso,  seguro,  clase
vacuna,  poblacion,  suceder,  enfermo,  acabar,  pandemia
mundo,  vacuna,  cubrebocas
criminal,  pedir,  poner,  vacuna,  ovalada,  oms,  cansino,  sputnik,  baja,  proteccion,  cansino,  problema,  calidad,  abasto,  sputnik,  igualmente,  ver,  criminal,  pedir,  abrir,  vacuna,  nino
viejo,  fragil,  vacuna,  morir,  parar,  matanza,  viejo,  investigar,  muerte,  anciano,  noruego,  vacuna,  covid
clase,  presencial,  pandemia,  pandemia,  vacuna,  fase,  positivo,  fallecido
doctor,  muerte,  aprobar,  fase,  deber,  aplicar,  vacuna,  compro,  andar,  cacareando,  puro,  perico
vacuna,  dome,  sumar,  importancia,  vacuna,  tu
poner,  vacuna,  ruso,  eficacia,  riesgo,  pedimo,  vacuna,  politico,  sobreviven,  pasar,  prueba
crecer,  numero,  muerto,  falta,  medicamento,  vacuna,  detencion,  salud,  negligencia,  gatell,  acoger
brote,  sarampion,  doc,  descuidaron,  decir,  enfermedad,  sistema,  vacuna,  ataque,  mejor
abril,  plan,  nacional,  vacuna,  alerta,  coronavirus,  mexico,  contagio,  muerte,  contagio,  muerte,  cuidense
mil,  muerte,  millon,  mil,  caso,  mil,  sospechoso,  letalidad,  tasa,  mortalidad,  mil,  hit,  indice,  positividad,  porcentaje,  vacuna,  malo,  vacaciones,  chingada
poner,  dosis,  ph,  todo,  deber,  colocar,  esquema,  completo,  vacuna,  ph,  et,  comun,  cuidemo
continuar,  manejo,  pandemia,  lopez,  regreso,  clase,  presencial,  problema,  contagio,  nino,  demostrar,  covid,  afectar,  persona,  mayor,  vacuna
repetir,  burro,  vacuna,  evitar,  positivo,  contagiar,  persona,  amen
vacuna,  golpean,  salud,  exponer,  poblacion,  gobernador,  antecedente,  guardar,  medicamento,  dejar,  caducar,  traidor,  patria
gracias,  persona,  gente,  vacuna,  estrategia,  vacuna,  dome
mexico,  aplicar,  nino,  falta,  llegar,  porcentaje,  vacuna,  esconder,  belleza,  natural
compromiso,  presidente,  vacuna,  poblacion,  vulnerable,  pais,  duda,  cuidado,  vacuna,  cumplir,  certificacion,  sanitario,  necesario
vacuna,  dome,  seguir,  fase,  vacuna,  bajar,  guardia,  cubrebocas,  gel,  antibacterial,  sano,  distancia
lopez,  espanol,  trajeron,  viruela,  siglo,  poder,  desarrollar,  vacuna,  ano,  desarrollar,  vacuna,  covid,  comparacion,  premio,  nobel,  ciencia,  senor
muerte,  empezar,  sultan,  sultana,  turco,  medicina,  terminaba,  enfermando,  matandote,  empezar,  dispersar,  mundo,  exterminio,  mundial,  vacuna,  asesina,  fuerza,  vacuna
verguenzapues,  cientifico,  enfermedad,  virales,  seguir,  brote,  vacuna,  gustar,  fodongue,  nino
anestesia,  dosis,  baja,  miligramo,  intubar,  usar,  midazolam,  repito,  recomendar,  cosa,  opioides,  posteriormente,  relajante
diferencia,  california,  pedir,  comprobante,  vacuna,  prueba,  negativo,  covid
aceleren,  vacuna,  esperar,  estudiante,  vacuna,  comienze,  regreso,  clase,  presencial
nino,  aislamiento,  pandemia,  pandemia,  vacuna,  clase,  virtual,  fase,  falta,  vacuna,  fecha,  dosis,  vacuna,  covid
entendiste,  vacuna,  volver,  contagiar,  contagiar,  tercero,  cuestion,  solidaridad
idea,  sonar,  volver,  esquema,  completo,  aplicado,  sinovial
leer,  noticia,  enterar,  problema,  vacuna
clase,  dome,  precaucion,  distancia,  vacuna,  nino
querer,  contagiar,  vete,  votar,  aglomeracion,  vacuna,  foco,  contagio,  malo,  organizacion
malo,  traer,  pandemia,  avance,  tecnologico,  vacuna,  simplemente,  impresionante
terminar,  reino,  suceder,  prueba,  covid,  tarjeta,  vacuna,  normalidad
marcelo,  mamushka,  porque,  caber,  posibilidad,  detener,  pandemia,  vacuna,  seguro
presentar,  importancia,  regulacion,  sanitario,  mexico,  latinoamerica,  desigualdad,  acceso,  vacuna,  pais,  contar,  entidad,  regulatoria
escuela,  antorchista,  seccional,  region,  tierra,  caliente,  sumar,  demanda,  mil,  estudiante,  exigir,  vacuna,  regreso,  clase
volver,  aula,  retraso,  educativo,  desercion,  mil,  joven,  evitar,  vacuna,  estudiante,  adecuan,  aula,  evitar,  contagio
desesperacion,  malo,  estrago,  real,  pandemia,  pachanga,  carga,  tema,  vacuna,  obligado,  buscar,  distractor,  santo,  lucir,  gobernador,  palacio,  nacional,  malo,  frunciendo
grave,  riesgo,  estudiante,  vacuna,  condicion,  regreso,  clase,  presencial,  politico,  realmente,  asegurar,  padre,  familia,  hijo,  contagiar
decir,  aislamiento,  sudafrico,  pais,  caso,  variante,  decir,  suspension,  patente,  gobierno,  persona,  poder,  recibir,  vacuna,  reducir,  posibilidad,  variante,  machine,  apartheid
estudio,  demostrar,  eficacia,  dicho,  vacuna
hiciste,  caso,  politico,  nino,  creer,  dejar,  analizar,  tu,  cuidate,  protegete,  esperar,  vacuna,  ir,  seguir,  despotricando,  adelante,  hacer,  vacuna,  rapido,  presidente,  cambiar
totalmente,  asco,  dejar,  nuble,  atencion,  verdaderamente,  importante,  seguir,  medicina,  quinto,  ola,  covid,  arrasando,  contagio,  inseguridad,  tope,  vacuna,  nino,  pauso,  capital
tomar,  coca,  bacara,  deber,  vacuna,  confirmar,  cc
contento,  vacuna,  masivo,  poblacion,  vacunada,  subir,  ritmo,  increible,  gracias,  calcular,  experto,  ano
idea,  cansino,  proteger
simplemente,  protegido,  tipo,  vacuna,  hecho,  dif,  manera,  arn,  virus,  inactivo,  aplicacion,  dosis,  vacuna,  completo,  proteccion,  caso,  reaccion,  secundario
comprar,  certificado,  vacuna,  covid,  imaginen,  grado,  ignorancia
ojo,  sinovial,  proteger,  variante,  delta,  indonesio,  problema,  vacuna
presidente,  buscaria,  contar,  cantidad,  dosis,  informar,  oms,  preguntar,  reducir,  dosis,  distribuir,  opcional,  onda,  aceptar,  bajar,  dosis
escuchar,  ola,  contagio,  bendito,  artralgio,  odinofagia,  intenso,  mayoria,  contagiar,  vacuna,  infeccion,  previo,  ayudo,  salir,  avante
prueba,  disponible,  spike,  medir,  nivel,  inmunizacion,  vacuna
gracias,  lately,  leer,  leer,  twitter,  preguntar,  antes,  querer,  preguntar,  tu,  acerca,  inmunidad,  postviruela,  mono,  vacuna,  volver,  generar,  anticuerpo,  respuesta,  inmune,  eficaz
realidad,  mundo,  virus,  matar,  gente,  derecho,  levantar,  mano,  recibir,  vacuna,  determinar,  tema,  debate,  complicado,  merecer
seguir,  vacuna,  salir,  pandemia
ch,  cale,  vacuna,  rapido,  vacuna,  vacuna,  chino,  ruso,  poder,  entrar,  us,  europo,  criticar,  falta,  accion,  traer,  vacuna,  probado,  servir,  principal,  socio,  comercial
consistir,  tecnologia,  vacuna,  mina,  ventaja,  desventaja,  vacuna,  universal,  tipo,  coronavirus,  tipo,  virus
efecto,  vacuna,  momento,  covid,  enfermes,  resista,  virus,  proteje,  seguir,  estudio,  naciendo,  variante
fantastica,  noticia,  pfizer,  opcion,  confiable,  avanzar,  investigacion
vacuna,  plan,  retorno,  seguro,  volver,  aula
hacer,  lograr,  importar,  caiga,  sociedad,  cansancio,  atrapado,  pensar,  podria,  antesala,  meta,  bornout,  hazte,  sano,  reintegrar,  tu,  dudes,  rendimiento,  resultado
disciplina,  respeto,  medida,  como,  obligacion,  restriccion,  empresa,  obligando,  empleado,  vacuna,  acceso,  sitio,  contar,  mundo,  cuidara
pensar,  vacuna,  funcionario,  casilla,  peligroso
vacuna,  regreso,  normalidad,  cosa,  paciencia
regreso,  clase,  crimen,  regreso,  clase,  vacuna
forma,  legal,  obligar,  tipo,  mostrar,  estudio,  certificacion,  correspondiente,  instancia,  salud,  mundial,  avalar,  vacuna,  ruso
anticuerpo,  covid,  duran,  mes,  aumentar,  vacuna,  estudio
dictadura,  cubrebocas,  jugar,  chocho,  quejar,  opresion,  cubrebocas,  rechazar,  vacuna,  provecho
echar,  gana,  ventilacion,  mascarilla,  distanciamiento,  fisico,  descuidar,  vacuna
clase,  presencial,  pandemia,  pandemia,  vacuna,  fase,  positivo,  fallecido
complicado,  entender,  suficiente,  vacuna,  pfizer
escribe,  vacuna,  dar,  servir,  comentario,  dejar,  validez,  demuestra,  ignorancia,  tema
enero,  plan,  nacional,  vacuna,  alerta,  coronavirus,  mexico,  contagio,  muerte,  contagio,  muerte,  cuidense
muerto,  pandemia,  feminicidios,  regreso,  huachicoleo,  vacunasnada,  importar,  importar,  presidente,  bostezado
gente,  escrupulo,  bes,  dentista,  derecha,  dejar,  criticar,  esquema,  vacuna,  argumento,  estupido
