mil,  persona,  conocer,  boca,  subir,  tren,  maya,  utilizar,  santo,  lucir,  poder,  haber,  salvar,  cubrebocas,  palacio,  correr,  abril,  invertir,  medicina,  vacuna
problema,  millon,  vacuna,  almacen,  logro,  aplicado,  seguir,  esperar,  dosis,  combatir,  pandemia,  disminuir,  contagio
eficacia,  efecto,  adverso,  grave,  the,  lance,  publicar,  dato,  ensayo,  fase,  vacuna,  ruso,  sputnik,  rt,  unico,  poder,  esperar,  pais,  poder,  lograr,  rusia,  hurra,  hurra,  hurra
culpable,  genocidio,  vacuna,  enfermedad,  sepa,  covid,  vivo,  venir,  vacuna,  mortal,  asesina,  dejar,  paralitico,  inflamado,  dejar,  punto,  negro,  pus
problema,  virus,  mutar,  vacuna,  generar,  variante,  suceder,  omicron,  volver,  empezar,  vacuna,  pegar,  tiro,  sien,  dejar,  vivir,  desear,  ostia
podcast,  reco,  salud,  comer,  efecto,  post,  preguntale,  doctor,  paco,  moreno,  vacuna,  variante
mundo,  vacuna,  mexico,  embarra,  vapor,  salvese,  increible,  gente,  aprobar,  medida,  pseudo,  doctor,  acoger,  esperar,  toque,  alivian,  vapor,  morena,  destruyendo,  mexico
deberian,  bloque,  vacuna,  empezar,  pandemia,  dejar,  laborar,  actividad,  esencial,  departamento,  limpien,  instancia,  laborando,  exceptuando,  vulnerable
clase,  presencial,  pandemia,  pandemia,  vacuna,  fase,  positivo,  fallecido
reaccion,  corto,  plazo,  probable,  reaccion,  peg,  contener,  mediano,  plazo,  sindrome,  autoinmunidad,  inflamatorio,  enfermedad,  gasificada,  anticuerpo,  vacuna,  virus,  atenuados
ciencia,  opinion,  decada,  vacuna,  lograr,  humanidad,  erradicar,  enfermedad,  virus,  bastar,  opinion,  base,  cientifico,  peso,  sociedad,  basado,  ciencia,  tecnologia
estenosis,  traqueal,  postcovid,  favorecer,  dano,  reparacion,  tisular,  tofu,  causar,  disneacansancio,  semana,  confundir,  sintoma,  covid,  diferencia,  estenosis,  causa,  estridor,  respiratorio
clase,  presencial,  pandemia,  pandemia,  vacuna,  fase,  positivo,  fallecido
senora,  alcaldesa,  herrero,  vidal,  acoger,  foco,  cintura,  col,  modelo,  salir,  agua,  drenaje,  menor,  gente,  edad,  evitemo,  enfermedad,  gracias,  presupuesto,  participativo
junio,  plan,  nacional,  vacuna,  alerta,  coronavirus,  mexico,  contagio,  muerte,  contagio,  muerte,  cuidense
necedad,  traer,  cubrebocas,  salvar,  contagio,  vacuna,  campo,  poner,  julio,  convivir,  harto,  gente,  fiesta,  ponganse,  cubrebocas
aplaudo,  leer,  hablar,  prueba,  vacuna
amparo,  cambiar,  estrategia,  nacional,  vacuna
apar,  tu,  ue,  control,  vacuna,  exportar,  cumplir,  europo
ver,  temia,  fifo,  vacuna,  tapa,  boca,  actuar,  perfecto,  exigir,  gente,  servicio,  cubrir,  mantener,  distancia
por,  occidente,  pasar,  alto,  vacuna,  ruso,  covid,  querer,  negocio,  rusia,  tener,  variar,  perdonar,  via
bebe,  creer,  vacuna,  covid,  creer,  hilo,  rojo,  frente,  hipo,  beba
gracias,  dato,  irrelevante,  seguir,  ritmo,  terminaremo,  vacuna,  ano
variante,  covid,  llamar,  omicron,  vacuna,  llevar,  nombre,  optimus,  prime
teoria,  gente,  comentar,  nota,  escuela,  pedir,  calendario,  vacuna,  completo,  anotar,  tu
duracion,  inmunidad,  vacuna,  vacuna,  ano,  responder,  pregunta,  importante,  saber,  atole,  dedo
presenta,  sintoma,  covid,  hazte,  prueba,  pandemia,  terminar,  recomendacion,  seguridad,  higiene,  covid,  prueba,  omicron,  pandemia,  coronavirus,  influenza,  virus,  invierno,  viruscovid,  vacuna,  vacunacionanticovid
practica,  servir,  vacuna,  ver,  ventaja,  haber,  vacuna
tema,  deber,  tratar,  brevedad,  discutir,  bomba,  atomico,  vacuna,  patria,  via
tasa,  mortandad,  vacuna,  aumentar,  promedio,  inicio,  campana,  persona,  descansar,  paz
colega,  periodista,  afan,  podologos,  cansino,  pronunciar,  aclarar,  interpretar,  tema,  reportera
chiste,  distraer,  importante,  pandemia,  vacuna,  economia
insumo,  regreso,  clase,  padre,  familia,  requerimos,  vacuna,  hijo
coronavirus,  covid,  pandemia,  sarscov,  presidente,  andres,  manuel,  lopez,  obrador,  bienvenido,  omicron,  matar,  ataranta,  cuidate,  vacuna,  tu,  fortalece,  poblacion,  mundial,  salud,  suerte,  bendiciones
bien,  fracaso,  vacuna,  poblacion,  llevar,  clamando,  salir,  pandemia,  ver,  diferencia,  hablar,  responsablemente,  populismo,  vacuna
lucir,  complicado,  dificil,  controlar,  entorno,  coache,  joven,  seguramente,  vacuna,  complicar,  protocolos
senor,  subsecretario,  educacion,  basico,  vacuna,  sumar,  importancia,  regreso,  seguro,  clase,  alumno,  padre,  familia,  maestro
producto,  asesinato,  poblacion,  matar,  vacuna,  asesina,  letal,  reducir,  poblacion,  querer,  reducir,  entiendan,  matar
jajaja,  estadistica,  mundial,  avance,  porcentaje,  per,  capita,  vacuna,  pais,  vacuna,  asshole,  ignorante
clase,  presencial,  pandemia,  pandemia,  vacuna,  fase,  positivo,  fallecido
totalmente,  pegar,  metro,  nino,  cancer,  pandemia,  manejo,  vacuna,  campana,  electoral,  semaforo,  verde,  exponiendo,  nino,  contagio,  inmunidad,  rebano,  especial,  prueba
conferencia,  conocer,  tema,  buscar,  inmunidad,  rol,  vacuna,  prueba,  anticuerpo
urge,  tomar,  reforzar,  vacuna
vacuna,  solucion,  parcial,  mediano,  plazo,  futuro,  abrazaremo,  riesgo
representacion,  participamo,  reunion,  periodico,  prender,  revisamos,  avance,  vacuna,  regreso,  gradual,  seguro,  clase
vacuna,  trampa,  cuidado,  vacuna,  confio,  caiste,  trampa,  mortal,  be,  careful
opinion,  experto,  basado,  conocimiento,  experiencia,  decision,  aplicar,  dosis,  evitar,  hospitalizacion,  paciente,  grave
efecto,  agresivo,  secundario,  vacuna
paciente,  hospitalizado,  vacuna
pensar,  registro,  vacuna,  aplicado,  integrado,  formato,  papel,  cargar,  plataforma,  increible,  sistema,  informatico,  certificado,  dais,  debi,  usen,  papel,  salir,  barato,  tablets
esquema,  basico,  vacuna,  menor,  tratamiento,  aspecto,  fundamental,  nacion
hola,  jonathan,  apilaban,  ajustar,  dosis,  miligramo,  erat,  recientemente,  publicar,  eficacia,  seguridad,  rivaroxaban,  miligramo,  paciente,  haber,  saludo
ayuda,  vacuna,  evitar,  contagio
yohimbina,  incrementar,  testosterona,  masa,  muscular,  motivo,  persona,  consumir,  provocar,  dolor cabeza,  incremento,  frecuencia,  cardiacam,  presion,  arterial,  fuente,  base,  fisiologica,  ejercicio,  necio,  eduardo,  bacan
vacuna,  preparado,  ayuda,  organismo,  generar,  inmunidad,  organismo,  persona,  trastorno,  inmunitario,  problema,  preparado,  ergo,  medicina,  unico,  absoluto,  muerte
faringitis,  polaina,  covid,  demostrar,  contrario,  menor,  vacuna
oigan,  atencion,  vacuna,  nino,  ano,  mexico,  atento,  pandemia,  terminar
fer,  seccional,  region,  tierra,  caliente,  sur,  manifestamo,  nuevamente,  postura,  gobierno,  federal,  regreso,  aula,  vacuna,  exigimos,  vacuna
argentino,  reporta,  caso,  efecto,  secundario,  vacuna,  sputnik,  caso,  leve
nolecreo,  prueba,  duda,  miente,  rifo,  avion,  fideicomiso,  nacer,  vacuna,  contagio,  covid,  saludo
cubrebocas,  obligatorio,  vacuna,  vacuna,  vacuna,  vacuna,  vacuna,  contagio
parecer,  encerraran,  gestion,  vacuna,  contrato,  secreto,  obligatoriedad,  facto,  poner,  falta,  debate,  cientifico,  estigmatizacion,  empezar,  clase,  oido
cansancio,  cambiar,  metodologia,  tercero,  informe,  chapoteo,  denuncia,  extranjero,  afectar,  interes,  pueblo,  inco,  extranjero,  protejen,  negocio
vacuna,  persona,  baja,  guardia,  argumento,  poder,  andar,  cubrebocas,  vacuna
doscientos,  cincuenta,  mil,  cuatrociento,  sesenta,  nueve,  fallecido,  mexico,  subregistro,  agosto,  gt,  aumentar,  caso,  gt,  vacuna,  perdida,  gt,  semaforo,  inservible,  gt,  verborrea,  gubernamental,  gt,  ano,  emergencia,  sanitario
punto,  afectar,  plan,  vacuna,  afectar,  salud,  mil,  persona,  chisme,  lavadero
pena,  gente,  dudar,  pensar,  correcto,  preguntar,  acaso,  prioridad,  vacuna,  nino,  necesitar,  votar,  cuestion,  prioridad,  definido
ver,  vacuna,  oms,  lograr,  inmunidad,  viejito,  terminar,  final,  marzo,  inmunidad,  crisis,  economico,  aprendan
evidente,  ola,  contagio,  covid,  secretaria,  turismo,  sector,  hotelero,  capital,  enviar,  mensaje,  evitar,  cierre,  actividad,  economico,  reforzar,  vacuna
cabeza,  manejar,  tema,  regreso,  clase,  normal,  nino,  esquema,  vacuna,  eh,  contagiar,  regresar,  casa,  actualizar,  tarea,  seguir,  zoom
menor,  adolescente,  enfermar,  gravedad,  vacuna,  covid,  ops,  vacuna,  menor
vacuna,  chafo,  grupo,  interes,  querer,  creer,  seguir,  fomentando,  clasismo
ver,  mexico,  manejado,  pesimo,  pico,  pandemia,  muerte,  vacuna,  vacuna,  dudoso,  efectividad,  siquiera,  aceptado,  oms,  vacuna,  nino
nieto,  acoger,  afectar,  sistema,  inmune,  cuarto,  ola,  efecto,  vacuna
caramba,  pensar,  numero,  muerto,  oficial,  de,  infimo,  cifra,  vacuna,  aire
pandemia,  deber,  evitar,  contacto,  fisico,  costa,  iniciar,  vacuna,  vacante,  riesgo,  contagiar,  seguridad,  seguridadprivada,  quedatenecasa,  tip,  tip,  salud,  familiaenmexico,  mexico,  como,  mexicocity,  happy,  follarme
modelo,  vacuna,  aplicado,  simio
dosis,  caray,  querer,  usar,  infraestructura,  vacuna,  existente,  caray
duda,  poder,  aclarar,  porque,  caso,  dar,  repudio,  nacional,  panini,  hombre,  infiel,  mencionar,  deber,  tambo,  recibir,  dosis,  dar,  repudio
same,  reasons,  get,  vaccinated,  now,  razon,  crear,  proteccion,  seguro,  enfermedad,  grave,  importante,  familia,  proteger,  vacunarte
lastimo,  vacuna,  hijo,  saber,  caso,  doctor,  muerte
imagen,  tetanos,  vacuna,  generacion,  horror,  tetanos,  viruela,  rabia,  polio,  difteria,  tosferino,  facilitar,  infeccion,  virus,  estupidez,  antivacuna,  morir,  vacuna
clase,  presencial,  pandemia,  pandemia,  vacuna,  fase,  positivo,  fallecido
vacuna,  advertir,  ano,  empezar,  repentinitis,  paro,  cardiacos,  cancer,  infarto,  cerebro,  vasculares,  gusto,  lamento,  miedo,  investigar,  prefirieron,  desacreditar
celula,  vacuna,  cedula,  entender
enfermera,  simulo,  suministrar,  vacuna,  cometer,  delito,  investigar,  averiguar,  tratar,  aislado,  red,  criminal,  leer,  crimen,  jeringa,  vacio
vacuna,  impedir,  contagio,  disminuir,  riesgo,  mortalidad,  caso,  contraer,  enfermedad
colmo,  queman,  restaurante,  zona,  residencial,  acapulco,  balacera,  vacuna,  covid,  infantil,  puebla
esperar,  pronto,  recuperacion,  saludo,  respeto,  vacuna,  ciento,  seguro,  animo,  mundial,  narrar
lopez,  pandilla,  grave,  mexicopero,  acto,  esconder,  vacuna,  puta,  eterno,  propaganda,  provocar,  muerte,  contagio,  crimen,  regla,  castigado
serial,  alzheimer,  minuto,  escuchar,  doctora,  sonia,  sanchez,  hablar,  cuadro,  clinico,  enfermedad,  alzheimer,  pasen,  voz,  char,  experto,  vacuna,  tu
entender,  retrograd,  cuenta,  vacuna,  demostrar,  efectivo,  tema,  politico,  obligar,  gente,  inyectar,  sustancia,  desear,  vacuna,  sientete,  protegido,  dejar,  juzgar
escuela,  maestro,  alumno,  enfermo,  gracias,  vacuna,  gravedad,  gripita,  gente,  pensar,  pensar,  dudar,  vacuna
contagiaron,  vacuna,  evitar,  contagio,  futuro
asunto,  cuidar,  extremadamente,  comun,  vida,  normal,  importante,  vacuna
tasa,  mortalidad,  vacuna
afortunadamente,  mayoria,  caso,  leve,  simple,  gripa,  conocido,  familiar,  saber,  vacuna,  servir
discurso,  odio,  cabida,  sociedad,  moderna,  objeto,  debate,  interlocutor,  serio,  persona,  ostentan,  poner,  debatir,  eugenesia,  nazismo,  valido,  permitamo,  ataque,  comunidad,  tran
tweet,  vacuna,  vacuna,  esconder,  doctor,  muerte
rogelio,  dinoco,  necesitar,  urgencia,  vacuna,  insumo,  nino,  adolescente,  padre,  madre,  familia,  tutor,  regreso,  clase,  seguro,  regresoseguro,  dome
necesitar,  dosis,  valer,  prevenir
aislamiento,  pandemia,  pandemia,  vacuna,  clase,  virtual,  fase,  falta,  vacuna,  positivo,  fallecido,  tremendo,  sismo
to,  mo,  contagiar,  desgracia,  variante,  detener,  avanzar,  proceso,  vacuna,  famoso,  inmunidad,  rebano
realidad,  chico,  enfermedad,  dificil,  padre,  solicitar,  vacuna,  corresponder,  opinar
vacuna,  poblacion,  agente,  interesado,  entraran,  proceso,  acelerar
vaca,  vacuna,  simularonvacunar,  simula,  vacuna,  mayor,  simula,  estrategia,  resultar,  esfuerzo,  traslado,  esperanza,  evitar,  contagio,  mortal,  logistica,  reducir,  piquete,  haber,  casa
exigir,  inmediato,  vacuna,  protocolos,  atencion,  integral,  real
juez,  ordenar,  vacuna,  menor,  covid,  lluevan,  amparo,  guardia,  abogado,  agrio,  covid,  vacuna
ad,  hoc,  creer,  vacuna,  ruso,  dioxido,  cloro
ano,  pondre,  vacuna,  cuidar,  constar,  eficiencia,  casa,  casa,  necesitar,  traer,  puerta,  dejare,  cuidar,  vacuna,  experimento,  exigido
enero,  diputada,  presidente,  comision,  salud,  vacuna,  nino,  nina,  deber,  necesario,  continuen,  clase,  presencial
heavy,  salir,  guerra,  mundial,  vacuna,  desear
bola,  cristal,  ola,  vacuna,  pasar,  mexico,  gobierno,  acelerar,  vacuna,  faltar,  incluir,  nino,  encarinado,  hijo,  pariente,  antivacuna
respeto,  renuentes,  egoistas,  nino,  vacuna,  cubrebocas,  sano,  distancia
reflexion,  pasar,  vacuna,  patria,  guardar,  variante,  esperar,  coincidamente,  tranza
decir,  tema,  renovar,  infraestructura,  proceso,  llevar,  ano,  cambiar,  estrategia,  aplaudo,  existir,  vacuna,  hacer,  llegar,  necesitar
aislamiento,  pandemia,  pandemia,  vacuna,  clase,  virtual,  falta,  vacuna,  positivo,  fallecido,  cumplo,  ano,  casado
madre,  vacuna,  covid,  relacionado,  aplicacion,  maravilloso,  calidad,  desafortunadamente,  encargada,  persona,  discapacidad,  relajo
tema,  deber,  abierto,  cerrado,  tema,  deber,  flexibilidad,  tomar,  variable,  padre,  vacuna,  padre,  trabajar,  maestro,  vacuna,  salon,  ventilado,  opcion,  abrir,  abrir,  irresponsable
circulo,  red,  social,  lista,  contraindicacion,  vacuna,  covid,  atribuir,  fake,  yew,  checo
antivacuna,  papas,  creer,  vacuna,  afortunadamente,  muerto
maldito,  necio,  covid,  pasar,  importante,  covid,  vacuna,  nino,  pasar
aislamiento,  pandemia,  pandemia,  vacuna,  clase,  virtual,  fase
papel,  jugar,  matematico,  elaboracion,  vacuna,  leer,  porcentaje,  eficacia,  vacuna
leche,  materna,  bondad,  transmitir,  anticuerpo,  bebe,  vacuna,  covid,  lactando,  super,  recomendable,  continu,  amamantando,  bebe,  forma,  cuidar
duran,  sintoma,  covid,  delta,  omicron,  spoiler,  vacuna,  clave,  covid,  mexico
nomas,  falta,  pequeno,  detalle,  existir,  vacuna,  aprobacion,  correspondiente
nino,  adolescente,  california,  deber,  vacuna,  asistir,  clase,  presencial,  lopez,  manda,  importar,  consecuencia
acceso,  alainformacion,  criterio,  tecnico,  anunciar,  comprarian,  vacuna,  informacion,  precario,  razonamiento,  escaso,  tema,  relevancia,  poblacion,  afectar,  brote
enor,  importancia,  sistema,  complejo,  fisico,  moderna,  ver,  pasmado,  fisico,  alto,  energia
exceso,  positivismo,  toxico,  importante,  pequeno,  dosis,  realidad
insistir,  vacuna,  nin,  amparo,  lograr
mexico,  preparado,  ola,  contagio,  variante,  delta,  vacuna,  alento,  castigo,  ciudadano,  votar,  transformacion,  ta,  usemo,  cubrir,  boca,  careta,  cepa,  contagiosa
caso,  semaforo,  verde,  seguro,  llegar,  desastre,  vacuna,  vacuna,  vacuna
variante,  covid,  yse,  deber,  pensar,  dosis,  vacuna,  nino,  festejo,  inflacion,  dolar,  peso,  buv,  informacion,  blindada
resultado,  mayoria,  feed,  limitar,  acceso,  espacio,  publico,  vacuna
ponganse,  vacuna,  poblacion,  incontrolable,  buscar,  solucion,  unico,  solucion,  asta,  aorta,  seguir,  aumentar,  numero,  cama,  buscar,  realidad,  solucion
vacuna,  dome,  persona,  vacuna,  olvidar,  seguir,  cuidando
enton,  deber,  ritmo,  vacuna,  parcialmente,  vacuna,  vacuna,  siquiera,  efectividad
gustar,  gente,  vacunada,  mes,  vacuna,  pais,  joven,  mayor,  alegrar,  vacuna,  significar,  vida,  re,  activacion,  economico
dano,  colateral,  eliminar,  tratamiento,  ignorantemente,  prohiben,  vacuna,  pequeno,  padre,  hijo,  fuerza,  canalizado
mil,  muerto,  mentirita,  ver,  tempestad,  hincan,  seguro,  gente,  vacuna,  hijo,  creer,  tonteria,  vacuna,  provocar,  autismo,  nino,  ayudar
agilizar,  proceso,  vacuna,  seguro,  regreso,  clase,  vacuna
oms,  aprobado,  vacuna,  chino,  sinovial,  trump,  cortar,  apoyo,  oms,  restablecio,  bien,  favor,  informar,  hablar
cifra,  vacuna,  noticia,  cepa,  covid,  gana,  hacer,  antivacuna
mexicano,  seguir,  leyendo,  libro,  ano,  creer,  cuarzo,  curan,  cancer,  vacuna,  chip,  bano,  sal,  quitar,  depresion,  sazone,  desigualdad,  seguir,  existir,  persona,  abusiva,  lopez
maldad,  perversion,  cinismo,  incapacidad,  gente,  inconmensurable,  clase,  vacuna,  robado,  prohibir,  test,  autoadministrados
omicron,  ver,  peligroso,  parecer,  principio,  doctor,  muerte,  escondido,  dar,  informacion,  efectividad,  vacuna,  perder,  responsabilidad
cuba,  regresar,  clase,  vacuna,  nino,  joven
vacuna,  menor,  ano,  secretaria,  educacion,  insistir,  clase,  presencial,  argumentar,  escuela,  sitio,  contagio,  realidad,  crisis,  educativo,  delfina
caso,  formalmente,  diagnostico,  dolor,  cansancio,  insomnio,  pensamiento,  catastrofico,  simulacion,  real,  afectar
leer,  reporte,  gente,  vacunada,  desarrollar,  comi,  malo,  vacuna,  dudo,  enfermo
covid,  prevenir,  vacante,  como,  orgullounisa,  somosunisa,  salud,  informate,  unico,  universidad,  salud
marco,  llevar,  turco,  presidente,  gobierno,  mexico,  seguido,  exactamente,  recomendacion,  oms,  mentir,  oms,  recomendar,  vacuna,  nino,  volver,  mentir,  unico,  ejercicio,  rutina,  presidente,  precisamente,  mentir
hiciste,  documentando,  vacuna,  covid,  crimen,  guerra,  nomas,  desmentir,  persona,  antivacuna
encantar,  preparado,  imagen,  ovalo,  listo,  para,  mostrar,  aprobacion,  emergencia,  saltar,  procedimiento,  burocratico,  vacuna,  pasar,  fase,  prueba
vivillo,  pasar,  doctor,  vacuna,  sorprendido,  presentar,  juez,  vivir,  pasar,  gente,  ejemplar,  andar,  libre,  guber,  convertir,  justicia,  chihuahua
antivacuna,  raro,  idea,  atreverse,  criticar,  absurdo,  entender,  responsabilidadirresponsabilidad,  vacuna,  importante
tratamiento,  inmunoterapia,  llevar,  ano,  vacuna,  sprays,  antihistaminicos,  pandemia,  cancelaban,  consulta,  poder,  retomar,  pandemia
importante,  gente,  vacuna,  desgraciadamente
aislamiento,  pandemia,  pandemia,  vacuna,  clase,  virtual,  fase
tarde,  podrian,  ayudar,  sacar,  certificado,  vacuna,  covid,  esque,  dar,  baja,  numero,  celular,  medi,  alto,  melo,  pedir
demostrar,  virulenta,  vacuna,  existente,  efectivo,  variante,  consiguiente,  autoridad,  encargada,  enfrentar,  pandemia,  deber,  llamar,  redoblar,  esfuerzo,  cuidado,  reves
contagio,  seguir,  mundano,  soberbio,  mexico,  diferencia,  vacuna,  sintoma,  consecuencia,  severo
vacuna,  amigo,  normal,  sentir,  reserva,  miedo,  acaso,  personal,  volver,  disparar,  contagio
mexicano,  gente,  buscar,  vacuna,  vacuna,  recien,  nacer,  proteger,  tuberculosis,  meningea,  papas,  buscar,  vacuna,  sarampion
alerta,  oms,  falso,  sensacion,  seguridad,  vacuna
importante,  medir,  nino,  elegir,  salir,  cuidar,  vacuna,  afios,  teoria,  aman,  cuidar
deber,  hacer,  firmar,  carta,  responsabilicen,  contagio,  muerte,  provoquen,  querer,  vacuna
seguio,  vacunarte,  gastaste,  viaje,  vacuna,  persona,  mexico,  cepillo,  inmunidad,  inmediato,  semana,  alcanzar,  agua,  vayas,  contagiar,  viaje
contagio,  variante,  omicron,  gratuito,  feria,  claudia,  invertir,  par,  boleto,  metro,  recuerden,  amigo,  variante,  estrago,  nino,  pequeno,  justo,  rango,  edad,  vacuna,  mexico
alumno,  regresar,  clase,  distancia,  informar,  asimismo,  profesor,  profesora,  considerar,  grupo,  riesgo,  vacuna,  prioritaria
semaforo,  rojo,  seguir,  cuidando,  vacuna
sexeniosel,  negocio,  farmaceutica,  vacuna,  gratuito,  cuidar,  aspero,  salir,  luchador
regresar,  semaforo,  epidemiologico,  naranja,  cerrar,  actividad,  economico,  reforzar,  plan,  vacuna,  proximo,  semana,  detalle,  mediodia
escuchar,  robert,  malone,  peligro,  vacuna,  nino,  hilado,  falta,  credibilidad,  autoridad,  materia
notando,  alza,  infeccion,  encargo,  vacuna,  chino,  ruso,  efectividad,  pastelito,  festejar
leo,  enojado,  gente,  vacunadoincluso,  culpando,  omicron,  preguntar,  gente,  menor,  ingreso,  acaso,  antivacuna,  ser,  nave,  ingreso,  academico,  culpa,  bando,  sociedad
econ,  mexico,  otro,  alfonso,  celda,  sala,  valorar,  esfuerzo,  maestro,  coronavirus,  mantener,  vigente,  programa,  aprender,  casa,  regreso,  clase,  dar,  previo,  vacuna,  magisterio,  mensaje
tema,  desacato,  medicamento,  crecer,  dela,  tragedia,  linea,  fallido,  programa,  vacuna,  deber,  hablar,  estupidez,  lopez,  aspiracionismo,  clase,  medio
bajar,  guardia,  ver,  quedate,  casa,  cubrebocas,  vacunarte
alg,  creer,  vacuna,  manejada,  control,  contagio
amiguitasrecuerdales,  obligatorio,  vacuna
rato,  anunciar,  llegada,  cantidad,  fuerte,  vacuna,  poner,  esperar,  muerto,  entender,  llegar,  deber,  poner,  suponer,  deber,  deber,  perder,  eficacia
gracias,  vacuna,  programa,  prevencion,  monkeypox,  como
centro,  control,  prevencion,  enfermedad,  anunciar,  prueba,  reforzar,  recomendacion,  mujer,  embarazado,  vacuna,  embarazado,  recibir,  vacuna,  arn,  riesgo,  bebe
tratamiento,  cancer,  vacuna,  coronavirus,  nino,  adolescente,  requerir,  estancia,  juridico,  cambiar,  sexo,  gratis,  come,  fruta,  verdura,  dulce,  quitar
gobierno,  dios,  enferme,  enfermar,  quiebre,  quebrar,  chino,  apostar,  contagio,  cero,  entrar,  ola,  inmunidad,  colectivo,  vacuna,  chino,  ironia
vacuna,  vacuna,  proteger,  contagio,  saber,  maestro,  trabajador,  educacion,  tocar,  refuerzo,  noviembre
pandemia,  terminar,  jornada,  nac,  vacuna,  avanzar,  exitosa,  contagio,  hospitalizacion,  aumentar,  relajamiento,  medida,  joven,  vacuna,  favor,  proteger,  cuiden,  familia
amigo,  coreano,  jungyup,  bang,  regalar,  cubrebocas,  of,  criticar,  ayudar,  comunidad,  korea,  residir,  etapa,  vacuna,  anticovid
vacuna,  garantia,  indio,  seguir,  medida,  nivel,  mundial
chupe,  vacuna,  israel,  urge,  tomar,  medida,  creer,  seguro,  vacuna,  rapido,  mexico,  feliz,  viernes
panal,  disminuira,  secuestro,  extorsion,  factible,  trasladar,  ferrocarril,  vacuna,  covid,  resultado,  caer,  accion,  tesla
alguien,  vacuna,  favor,  agarren,  putazo,  puno,  cerrado,  nino,  ver,  afectado,  desafortunadamente,  vacuna,  querer,  pensar,  nino
aceleren,  vacuna,  sepa,  exigir,  vacuna,  alumno,  regresar,  clase,  presencial
pesadilla,  desgracia,  traer,  muerte,  desolacion,  desesperanza,  quebranto,  emocional,  economico,  problema,  desigualdad,  pais,  vacuna,  surgir,  variante,  depender
densidad,  relativo,  zona,  rural,  juntan,  compartir,  transporte,  publico,  vacuna,  vulnerable,  detener,  rapido,  dispersion,  erradicar,  virus,  comunidad,  lograr,  cd
primero,  plano,  agosto,  chino,  imparable,  mortalidad,  disminuir,  ciento,  vacuna,  educacion,  universitario,  seguir,  linea,  crisis,  sanitario,  migrante,  fin,  despues,  mes
ojala,  convalecencia,  reflexione,  estrategia,  fallido,  pandemia,  jornada,  vacuna
priorizar,  vacuna,  covid,  joven,  enfermedad,  cronica,  insuficiencia,  renal,  inmunosupresion,  enfermedad,  cardiovascular,  haber,  esperes,  amparen,  enfermen,  hospitalicen,  morir,  vacuna,  joven
wo,  escuchar,  julio,  freno,  abrir,  escuela,  universidad,  abrir,  economia,  mantener,  cuidado,  virus,  vacuna,  vigilar
esto,  importante,  vacuna,  india,  coronavirus,  nivel,  efectividad,  espuma
sentir,  respuesta,  enfermedad,  medicamento,  disminuir,  efectividad,  vacuna
feliz,  ano,  desear,  oms,  oms,  advertir,  surgir,  variante,  covid,  totalmente,  resistente,  vacuna,  medida,  avanzar,  pandemia
ojo,  autoridad,  indicacion,  via,  amparo,  vacuna,  menor,  senalados
oculto,  informacion,  cienfuego,  compra,  vacuna,  ataque,  triste
sanitario,  agua,  aula,  silla,  padre,  respetar,  sano,  distancia,  comunidad,  rural,  pensar,  vacuna,  malo
vacuna,  viruela,  mono,  especificamente,  viruela,  humano,  inmunidad,  viruela,  problema,  producir,  masivamente
pfizer,  anunciar,  resultado,  pildora,  tratar,  virus,  sars,  cov,  indicar,  evitar,  hospitalizacion,  esperar,  pildora,  aprobado,  unido
estudio,  destacar,  importancia,  dosis,  adicional,  arn,  ampliar,  respuesta,  anticuerpo,  neutralizante,  variante,  altamente,  divergente,  sarscov,  nancy,  agradecimiento,  gracias,  doctor,  lopezgatel
sigamos,  egoistas,  usemo,  cubrebocas,  vacuna,  seguir,  cuidando
jajajaja,  imagino,  centro,  salud,  ponio,  vacuna,  ibas,  casa,  casa,  barrer,  imagino,  llevar,  control,  nino,  sano,  planificacion,  familiar,  censo,  nino,  comunidad,  vacuna
deshumaniza,  generalizar,  etiquetar,  deshumaniza,  discurso,  vacuna,  covid,  ir,  mutando,  seguro,  inmunizar,  protegen,  efecto,  secundario,  niegas,  conversacion,  sano
cubrebocas,  vacunarte
exigimos,  vacuna,  todo,  viruela,  simio,  virueladelmono
saber,  trafico,  ilegal,  arma,  droga,  vacuna,  prueba,  covid,  persona,  organo,  humanos,  dolar,  auto
medicina,  nino,  cancer,  vacuna,  red,  clase,  distancia,  sueldo,  trabajador,  gas,  bienestar,  chairs,  creer,  listo,  peor
vacuna,  criminal,  ver,  decir,  peligroso,  matar
aislamiento,  pandemia,  pandemia,  vacuna,  clase,  virtual,  fase
