excelente,  atencion,  personal,  centro,  vacuna,  pepsi,  center,  destaco,  atencion,  dio,  erick,  atento,  amable,  honor,  reconocer,  organizado,  vacuna
quedar,  evidencia,  pandemia,  incapacidad,  nacion,  considerar,  salud,  publico,  prioridad,  ciencia,  marchar,  alerta,  decision,  acerca,  libertad,  vacuna,  llenar,  espacio,  discusion
esperanza,  acabar,  covid,  radicar,  aplicacion,  generalizado,  vacuna,  nivel,  mundial,  mexico,  prioridad,  eleccion,  vida,  valer
advertir,  multa,  sancion,  alumno,  regreso,  clase,  obligatorio,  situacion,  pandemia,  numero,  persona,  faltar,  vacuna,  escuela,  publico,  escuela,  privado,  dificil,  situacion
afectado,  estrategia,  proceder,  reunir,  equipo,  poner,  adecue,  plan,  desquiten,  sueldo,  niegue,  vacuna,  derecho,  constitucional,  mexicano,  acceso
entregar,  nl,  vacuna,  almacenadas,  forma,  correcto
escuche,  gente,  molestar,  porque,  persona,  agradecen,  actual,  gobierno,  vacuna,  gobierno,  importar,  salud,  olvidar,  darte,  quimioterapia,  falso,  nino,  cancer
olvidar,  defender,  violador,  ine,  victima,  prefirio,  invertir,  millon,  estadio,  beisbol,  tratamiento,  nino,  cancer,  vacuna,  medico,  sector,  privado
guau,  consciencia,  esposa,  vacuna,  cansino,  gracia,  comentario,  pedir,  empatia,  ud,  paciente,  covid,  atender,  hospital,  visitar,  interes,  politico
recuerdo,  vacuna,  influenza,  poner,  plaza,  comercial,  brigada,  propagandista,  enfermera,  nop,  cobraban
aprender,  personal,  salud,  criterio,  gente,  criterio,  personal,  linea,  incluir,  personal,  practica,  privado,  vacuna,  joven,  residente,  personal,  medico
mil,  enfermera,  medico,  vacuna,  sortear,  pandemia,  importar,  empresa,  privado,  pasar,  mil,  egresado,  universidad,  publico,  privado,  especialidad,  medico
vacuna,  medico,  linea,  contagio,  hospital,  covid,  diferencia
pregunta,  exactamente,  duro,  inmunidad,  conveniente,  vacuna,  junio,  refuerzo,  enero,  medico,  especialidad,  otorrino,  menciono,  exposicion,  aerosol,  gracias
efecto,  vacuna,  permance,  faltar,  especificar,  doctor,  factor,  duro,  inmunidad,  post,  vacuna,  esperar,  fe,  medico,  sector,  privado,  vacuna,  tambie
vacuna,  salud,  jugar,  escribir
jack,  adopcion,  responsable,  mes,  desparasitar,  vacuna,  ir,  guadalajara,  lamentablemente,  situacion,  transporte,  politico,  linea,  autobus,  viajar,  familia,  informe
montar,  centro,  vacuna,  personal,  docente,  dejense,  venir
exigir,  mayoria,  personal,  salud,  linea,  vacuna,  abrazo,  doctora
vacuna,  sector,  salud
reconocer,  esfuerzo,  seguir,  indicacion,  esperar,  vacuna
dosis,  lista,  unidad,  congreso,  centro,  medico,  nacional,  siglo,  xxi
vayase,  clinica,  poner,  pueblo,  tienda,  doctor,  gatel,  justo,  vacuna
tema,  pandemia,  covid,  vacuna,  vacuna,  requerir,  interes,  ingenio,  organizacion,  voluntad,  politica,  plausible
calizar,  como,  vacuna,  covid,  centro,  medico
ciudadano,  preocupado,  situacion,  pandemia,  exijo,  aceptar,  propuesta,  sector,  empresarial,  aplicacion,  vacuna
inicio,  dome,  aplicacion,  mil,  vacuna,  hospital,  covid,  sector,  salud,  inmunizacion,  trabajador,  diverso,  institucion,  red,  frio,  ultrarefrigerado,  garantizar,  eficacia,  biologico
secretaria,  salud,  federal,  desarrollo,  vacuna,  externo,  convenio,  financiar,  estudio,  serio,  hecho,  antiviral,  especifico,  seguro
desconcertante,  declaracion,  senor,  deber,  agradecer,  falta,  servicio,  medico,  nivel,  vacuna,  prometer,  nivel,  crecimiento,  seguridad,  patada,  ahogado
senador,  nivel,  mundial,  dosis,  covid,  pais,  confirmar,  aceptar,  necesidad,  aplicacion,  mexico,  solicitar,  portar,  voz,  solicitante,  aplicar,  trabajador,  representar
terminar,  vacuna,  personal
increible,  suspenda,  vacuna,  como,  navidad,  importar,  pachanga,  salud,  jefe,  gobierno
personal,  salud,  reir,  astrazeneca,  dosis
epoca,  cuidar,  enfermo,  labor,  clase,  trabajadorasella,  decidir,  luchar,  cansancio,  aprender,  hospital,  llegar,  nombrada,  superintendente,  instituto,  cuidado,  senoro,  enferma
manden,  personal,  instalacion,  escuela,  naval,  dosis,  km,  fila,  chaleco,  verde,  revisar,  documento,  lento
obtuve,  dosis,  covid,  estadio,  universitario,  gracias,  persona,  personal,  universitario,  esperar,  mexicano,  poder,  vacuna,  salud,  derecho
necesitar,  asegurar,  cansanciopersonal,  salud,  linea,  vacuna
aclaro,  vacuna,  siervo,  nacion,  estorbo,  nacion,  servir,  proceso,  vacuna,  estorban
medico,  discrimine,  decir,  atender,  persona,  orientacion,  politica,  romper,  juramento,  hipocratico,  triste,  doctora,  quejar,  vacuna,  creer,  vacuna,  contrario,  recibir
iniciar,  vacuna,  masivo,  personal,  entrar,  contacto,  paciente,  vacuna,  covid
querido,  yuri,  espacio,  pedir,  exigir,  vacuna,  vacuna,  disponible,  medico,  hospital,  farmacia,  supieras,  manejo,  plan,  vacuna,  mexico,  riesgo,  implicar,  pis
increible,  esperar,  entender,  medico,  adulto,  mayor,  maestro,  vacuna,  padre,  familia,  nino,  escuela
personal,  salud,  expuesto,  tomar,  numero,  muestra,  pais,  epidemiologo,  huh,  pedir,  gobierno,  agilizar,  autorizacion,  compra,  vacuna,  viruela,  simio,  frenar,  epidemia
escuela,  nacional,  maestro,  campo,  marte,  vacuna,  dosis,  ano,  gente,  megafono,  dar,  bienvenida,  senalar,  deber,  agradecer,  malo,  sheinbaun,  practica,  comun
iniciativa,  esperar,  guber,  iniciar,  negociacion,  alto,  nivel,  traer,  vacuna,  leon,  manda,  mail,  atencion,  cliente
riesgo,  medico,  ver,  paciente,  covid,  hospital,  consultorio,  privado,  profesor,  vacunando,  medico,  priva,  razon,  vacuna,  medico,  pais
comprometido,  salud,  bienestar,  sociedad,  lanzar,  promocion,  permitir,  viajero,  vacuna,  forma,  gratuito,  aeropuerto,  lardo,  texas,  requerir,  previo,  cita,  boleto,  maleta,  documentado
aplicar,  dosis,  trabajador,  salud,  terminar,  esquema,  completo,  seguir,  prioritario
gente,  personal,  medico,  hospital,  linea,  riesgo,  contraer,  covid,  nosocomio,  querer,  vacuna,  andar,  desmadre,  preocupacion
derecho,  vacuna,  linea,  perdon,  ofenda,  esperar,  senor,  chapucero
politizando,  salud,  persona,  vacuna,  malo,  combinacion
edicion,  batalla,  medituiteros,  personal,  sanitario,  vacuna,  priva
casavalle,  propusimo,  foco,  equidad,  oportunidad,  brindando,  espacio,  emprendimiento,  barrio,  desarrollamo,  cocina,  comunitario,  moderna,  intendencia,  agradecido,  vida,  aportar
negar,  vacuna,  interes,  politico,  terquedad,  convivo,  diario,  oficina
tomo,  proceso,  vacuna,  proximo,  dosis,  mayo,  astrazeneca,  covid,  vacuna,  deber,  ayuda,  uno,  institucion,  privado,  proceso,  eficiente
secretaria,  salud,  gobierno,  federal,  encargada,  sistema,  nacional,  vacuna,  contempladomente
vacuna,  necesitar,  personal,  medico,  nl
pregunta,  vacuna,  persona,  lupus,  importante,  revisar,  medicamento,  recibir,  recibir,  inmunosupresores,  respuesta,  disminuido,  vacuna,  recomendacion,  vacuna,  seguir,  cuidando,  invitar,  doctor
vacuna,  medico,  farmacia,  consulta,  privado
vacuna,  prioritaria,  personal,  salud,  mexico,  sector,  publico,  privado,  firma,  peticion,  via
semana,  mes,  ka,  dosis,  medico,  quedar,  desprotegidos
querras,  ayudar,  voto,  fin,  anticonstitucional,  antidemocratico,  medico,  exigir,  vacuna,  crees,  sorpresa,  junio
pfizer,  permitir,  fabricante,  generico,  suministrar,  pildora,  experimental,  covid,  pais,  ingreso,  bajo,  medio,  licencia,  grupo,  internacional,  salud,  publico,  medicina,  patente,  pool,  app
aislamiento,  pandemia,  pandemia,  vacuna,  clase,  virtual,  fase,  falta,  vacuna,  vacuna,  personal,  salud,  positivo,  fallecido
nino,  aislamiento,  pandemia,  pandemia,  vacuna,  clase,  virtual,  fase,  falta,  vacuna,  vacuna,  personal,  salud,  positivo,  fallecido
evidencia,  eficacia,  dosis,  reducir,  vacuna,  astrazeneca,  ampliar,  recomendacion,  sem,  semana,  retomar,  aplicacion,  dosis,  pfizer,  comenzar,  primero,  personal,  salud
vacuna,  servicio,  emergenciaambulancia,  erm,  policia,  guardia,  seguridad,  personal,  limpieza,  empleado,  tienda,  centro,  comercial,  personal,  linea,  fuego,  expuesto,  saludo,  jefa,  claudia
dosis,  maestro,  negar,  salud,  maestro,  dosis,  vacuna,  canino
listo,  paramedico,  centro,  vacuna,  estadio,  ciudad,  universitario,  como
adoptar,  compartelo,  hermoso,  cachorrito,  macho,  mes,  talla,  chicamedianita,  protocolo,  medico,  completo,  entregar,  carnet,  vacuna,  contacto
serio,  expectativa,  urgencia,  necesidad,  desesperacion,  morir,  verdadero,  causa,  chiste,  desviar,  atencion,  pesimo,  plantacion,  vacuna,  pagina,  internet
felicidad,  organizacion,  vacuna,  funcionario,  chaleco,  verde,  super,  amable,  vacuna
mexicano,  vacuna,  covid,  salud
pregunta,  registrar,  vacuna,  refuerzo,  sector,  docente,  gracias
vacuna,  atencion,  vacuna,  irrevocable,  faltar
exacto,  centro,  medico,  siglo,  xxi,  vacuna,  dosis,  igualmente,  biblioteca,  vasconcelos,  lugar
prioridad,  medico,  juez,  magistrado,  ministro,  judicial,  laborar,  comprar,  posibilidad,  vacuna
millon,  vacuna,  terminamo,  vacuna,  personal,  medico
luchar,  lograr,  medico,  chimalhuacan,  agradecemos,  jesu,  valentino,  iso,  vacuna,  dirigente,  sigamos,  luchar
tibia,  solicitud,  deber,  promoviendo,  accion,  colectivo,  amparo,  omision,  vacuna,  personal,  salud
mensaje,  lider,  fer,  correcto,  llamado,  luchar,  vacuna,  estudiante,  equipamiento,  sanitario,  mantenimiento,  servicio,  escuela,  demanda,  exigir,  gobierno,  solucion
necesitar,  transparencia,  gobierno,  dependencia,  salud,  demostrar,  personal,  requerir,  vacuna
senor,  presidente,  hacer,  ejercicio,  humildad,  ordenar,  vacuna,  sector,  medico,  pueblo,  protegido
escuchaste,  hdtpm,  vacuna,  derecho,  campana,  electoral
recibir,  vacuna,  medico,  injusticia
laboratorio,  vender,  vacuna,  privado
prioridad,  trenecitoinutil,  vacuna,  salud,  seguridad,  prioridad,  gobierno,  tren,  prioridad,  visitar,  hospital,  victima,  linea,  vistas,  trenecito
encantar,  gente,  reclamar,  gobierno,  cayo,  sistema,  vacuna,  adulto,  mayor,  conectaban,  dispositivo,  logico,  nacional
walgreen,  uber,  technologies,  inc1,  informar,  martes,  asociaran,  proporcionar,  programa,  educativo,  transporte,  gratuito,  clinica,  vacuna,  covid,  unido,  comunidad,  desatendidas,  area,  rural
tocar,  febrero,  revisar,  edad,  edad,  palancas,  servir,  personal,  salud,  fila,  ir,  vacuna
valer,  aplaudir,  reconocer,  excelente,  servicio,  atencion,  centro,  vacuna,  normal,  organizacion,  exito
vacuna,  influenza,  imss,  servicio,  excelente
visita,  cuates,  um,  vacuna,  exito,  gracias,  enfermera,  consultorio,  matutino,  atencion,  nina,  que,  grito,  control,  emi,  vacuna
fecha,  vacuna,  hospital,  sigloxxi
besote,  volar,  personal,  medico,  encargado,  vacuna,  marcelo,  gatel,  pais,  mundo,  brote,  rebote,  toque,  quedar,  gracias,  planeado
vacuna,  medico,  privado
simpatizar,  hombre,  menosprecia,  atender,  hijo,  nino,  vacuna,  medicina
tantoespectaculo,  aplicacion,  vacuna,  centro,  salud,  clinica,  familiar
ejemplar,  gestion,  madre,  obtener,  vacuna,  hijo,  abonar,  vacuna,  nino,  presentar,  amparo,  triste,  gobierno,  continuar,  atencion,  pandemia,  ocurrencia,  desatino,  funcionario,  salud,  dejar
recibir,  atencion,  respuesta,  corregir,  certificado,  volver,  vacuna,  marca,  porque,  castigar,  ciudadano
profesor,  personal,  vacuna,  requisito,  ojala,  padre,  madre,  familia,  urge,  entren,  clase,  urge,  responsabilidad
articulo,  enfatiza,  red,  consular,  participar,  esfuerzo,  comunidad,  vacuna,  decisivo,  apoyo,  coordinacion
lider,  mundial,  provocar,  panico,  manipular,  ciudadania,  pais,  demostrar,  miedo,  muerte,  malo,  organizacion,  dome,  como,  cooperan,  panico,  adonde,  medico,  vinieron,  apoyar,  vacuna
centro,  vacuna,  enfermera,  inyecta,  evitaramo,  alcohol,  estudiante,  medicina,  semana
preguntar,  vacuna,  gente,  vacuna,  servir,  prueba,  video,  ponlo,  inyectan,  medico,  somo,  jeringa,  vacias,  llegar,  vacuna,  poner,  brazo,  incorrecto
madre,  pediste,  ayuda,  medico,  privado,  verdadero,  linea,  ir,  vacuna,  traidor,  huevo,  interesar,  politico,  mierda,  darte,  salino
mesa,  intersectorial,  estrategia,  vacuna,  personal,  salud,  continuar,  recibir,  administrando,  aplicando,  vacuna,  conforme,  llegada,  pandemia,  coordinado,  favor,  digamonos,  cuidando
senadora,  vacuna,  medico,  vida,  terrible,  morena
maestro,  solidarizamos,  alumno,  exigir,  gobierno,  federal,  vacuna,  comunidad,  estudiantil,  vasconcelos,  vacuna,  magistral
llego,  paciente,  urgencia,  llego,  probable,  covid,  hospital,  privado,  recibir,  dosis,  contemplado
bon,  ice,  cargo,  logistica,  vacuna,  vacuna,  luchar,  febrero,  diadeljabonchiquito
publican,  dato,  completo,  hospital,  vacuna,  poner,  caracteristica,  completo,  paciente,  informar,  compris,  inmediato
mame,  presidente,  vacuna,  dar,  vacuna,  medico,  andar,  vacunando,  a,  a,  aportar,  sociedad
opinion,  impensable,  regreso,  maestro,  requerir,  refuerzo,  vacuna,  escuela,  publico,  papel,  bano,  medida,  recurso,  colegio,  saqueado
gracias,  pagar,  impuesto,  gob,  aplicar,  vacuna,  excelente,  atencion,  salle
tocar,  vacuna,  tio,  personal,  atento,  rapido,  poner,  bailar,  inyectar,  esperanza,  gracias
favor,  cuestionen,  velocidad,  vacuna,  terminaremo,  ano,  ritmo,  brigada,  siervo,  nacion,  modulo,  medico
ojo,  vacuna,  cubano,  autorizada,  oms,  dar,  sabio,  huyas,  don,  porfis,  lopez,  pio,  pio,  cubano,  cuates,  ojo,  gorron,  historico,  ey,  apa,  salud,  jugar
contadas,  vacuna,  gente,  valer,  gorro,  llegar,  esperar,  aprovechar,  manifestar,  salud,  cuidado,  individuo,  gozan,  trato,  existente,  gratuito,  fallecido,  fallecer
vacuna,  covid,  centro,  medico,  nacional,  siglo,  xxi,  in,  cuauhtemoc,  distrito,  federal
seguro,  instalacion,  hecho,  aula,  ventilado,  bano,  agua,  etcetera,  esperar,  presidente,  importan,  nin,  mexican,  negar,  medicamento,  tratamiento,  diverso,  padecimiento,  negar,  vacuna
vacuna,  servicio,  comunitario,  hospitaleseso,  justificaria,  falta,  respeto,  medico
entro,  twitter,  leo,  aunado,  tema,  salud,  social,  vacuna,  decir,  yuki,  parar,  nota,  mental,  reflexionar,  ando
merecemos,  vacuna,  personal,  medico,  priorizar,  importar,  grado,  especialidad,  entre,  area,  covid,  atiendas,  paciente,  vacuna,  pie,  canon
vacuna,  mejor,  amiga,  medico,  hospital,  publico,  venir,  vacuna,  esperar,  ano
maximus,  primerpaseotaadopta,  apoyar,  adopcion,  tenencia,  responsable,  mascota,  gracias,  organizacion,  evento,  ayudar,  consciente,  abandono,  vacuna,  esterilizacion,  mascota
centro,  convencion,  personal,  como,  imss,  sereno,  encargar,  vacuna,  esperar,  par,  semana,  certificado,  coger,  decir,  correr,  pendiente
vacuna,  tema,  salud,  publico,  deber,  sujeto,  opinion,  impacta,  ciudadania
buscar,  adoptar,  gatita,  tipo,  figaro,  hermana,  rescatar,  calle,  mes,  restablecida,  salud,  peso,  vacuna,  esterilizad,  lista,  adopcion,  juguetona,  carinosa,  suavecita,  buscar,  hogar
personal,  medico,  vacuna,  persona,  trabaje,  sector,  salud,  publico,  privado
reservar,  info,  compra,  vacuna,  condicion,  seguridad,  infraestructura,  mandar,  medico,  zona,  marginada,  trago,  mantener,  cargo,  erario,  lopez,  exigir,  lor,  rinda,  cuenta,  deer,  park,  perdida,  millonario
vacuna,  acabar,  dinero,  columna,  atender,  pandemia,  mano,  invisible,  adam,  smith,  mercado,  encargar,  atender,  emergencia,  atendida,  permanente
invitar,  hablar,  doctor,  particular,  vacuna
texto,  vacuna,  personal,  linea,  hospital,  covid,  nivel,  publico,  privado,  informacion,  incorrecto,  corrijan,  personal,  linea,  publico,  privado
vacuna,  discrecional,  personal,  canal,  television
persona,  clasismo,  recibir,  vacuna,  practica,  seguro,  gratuito,  dejar,  tirar,  odio,  ojala,  vacuna
vacuna,  medico,  necesitar,  vacuna,  combatir,  contagio
vivir,  parodia,  costar,  chingadera,  tratamiento,  nino,  cancer,  vacuna,  equipamiento,  medico,  linea
ay,  aja,  dar,  ponle,  pilo,  vacuna,  medico,  estupidez,  vacuna,  maestro,  medico,  morir,  ver,  enfermo,  enfermedad,  asintomatica,  lineo
oferta,  suficiente,  vacuna,  mercado,  internacional,  pais,  personal,  medico,  poblacion,  vulnerable,  desprotegida,  gracias,  capricho,  malo,  mano,  gobierno,  incompetente
exigimos,  vacuna,  tomar,  bandera,  politica,  solucion,  demanda,  social,  on,  pop,  respeto,  cumplimiento,  derecho,  on,  pop
brigada,  correcamino,  utilizar,  mil,  vacuna,  personal,  medico,  saltaran,  fila,  mil,  persona,  sector,  salud,  recibir,  vacuna,  ocurrir
pais,  vacuna,  accesible,  walk,  in,  farmacia,  argumento,  balde
chale,  justo,  declaracion,  apoyo,  colega,  vacuna,  pasar
ama,  picho,  pie,  impuesto,  evadir,  eluden,  connotacion,  fiscal,  donacion,  dizque,  organizacion,  sociedad,  civil,  fundaciones,  empresa,  fantasma,  pelea,  pagar,  escuela,  clinica,  carretera,  vacuna
urge,  detener,  obra,  publico,  pendejas,  invertir,  dinero,  vacuna,  sector,  salud,  capricho,  pendejo,  jefe,  esperar,  gobierno,  inutil
vacuna,  acceso,  universal,  distincion,  set,  instrumento,  politico,  priorizar,  personal,  sanitario,  personal,  ambito,  seguridad,  policia,  marin,  soldado,  guardia,  nacional,  bombero
dinero,  vacuna,  escuela,  hospital,  tren,  refineria,  universidad,  beca,  crecimiento,  dejar,  avanzar,  priapismo,  votar,  priapismo
vacuna,  tomar,  agua,  seguir,  indicacion,  personal,  salud,  paracetamol,  caso,  necesario,  repito,  tomar,  agua,  natural,  electrolito,  agua,  sabor,  refresco,  agua,  poner,  brazo,  dejar,  cuerpo,  descansar
luis,  gerardo,  mendez,  lamentar,  fallecimiento,  padre,  seguir,  trabajar,  medico,  vacuna,  denuncia,  pesame,  sepa,  coronavirus,  urban,  pop,  vision,  entretenimiento
voto,  vacuna,  medico,  linea,  vacuna,  medico,  de
malo,  mundo,  persona,  parado,  sol,  acceso,  servicio,  salud,  esperar,  vacuna,  votar,  morena
ciento,  mil,  medico,  estudiante,  personal,  vacuna,  gracias,  joaquin,  dar,  voz
medicamento,  vacuna,  tratamiento,  cancer,  equipo,  medico
chimalhuacan,  necesitar,  vacuna,  insumosmedico,  combatir,  exigiremo,  bienestar
evusheld,  innovadora,  alternativa,  vacuna,  covid,  paciente,  inmunodeprimidos,  via
pesimo,  vacuna,  personal,  salud,  pesimo,  presurizado,  demostrar,  existencia,  cabildero,  usufructo,  notoriedad
unico,  vacuna,  tocar,  esposo,  privado
salud,  medicina,  vacuna,  educacion,  menospreciando,  universidad,  viniendo,  fosil
padre,  familia,  disposicion,  nino,  regresen,  clase,  preocupar,  salud,  pedir,  exigir,  vacuna,  regreso,  clase,  seguro
pais,  poderoso,  mundo,  lograr,  implementar,  plan,  vacuna,  perfecto,  francia,  millon,  vacuna,  mexico,  sufrir,  acaparamiento,  super,  potencia,  omitir,  inmenso,  esfuerzo,  salud
exigir,  vacuna,  atento,  derecho,  humanos,  valor,  primario,  libertad,  dignidad,  persona
trabajador,  salud,  otrosdato,  declaracion,  triunfal,  pandemia,  vacuna,  sanitario,  muerto,  simulacion,  improvisacion,  trabajador,  salud,  unido,  organizado
doctor,  morir,  atender,  paciente,  preferir,  vacuna,  alo,  promotor,  voto
hijole,  dona,  traer,  pan,  acabar,  pan,  compartir,  foto,  vacuna,  influenza,  chingue,  jode,  uniforme,  credencial,  mesa,  pinche,  dona,  ver,  medico,  sur
argumento,  valido,  seguir,  faltando,  personal,  labora,  institucion,  salud,  vacuna,  estrategia,  gobierno,  ocurrencia,  destacar,  incompetencia
politica,  empresa,  colaborador,  vacuna,  comunitario,  despido,  justificado,  correcto,  decidir,  acatar,  medida,  seguridad,  individual,  comunitario,  atentando,  salud
contact,  invitar,  participar,  fase,  clinica,  vacuna,  patria
juglar,  laguna,  expresar,  gratitud,  personal,  salud,  recibir,  vacuna,  labor,  oportuno,  demora,  tardanza,  restaura,  confianza,  humano,  condicion,  inyeccion,  dosis,  esperanza,  gracias,  correcamino
vacuna,  enfermedad,  endemico,  desacato,  medicamento,  vacuna,  medico,  usar,  recurso,  deuda,  contraido,  quemando,  combustoleo,  salamanco
organizacion,  incluir,  servidor,  nacion,  operador,  electoral,  cumplir,  campana,  vacuna,  limitante,  disponibilidad,  alertar,  curando,  salud
mananero,  distribuir,  dosis,  vacuna,  hospital,  entidad,  pais,  ruta,  terrestre,  ruta,  aereo,  titular
fila,  triton,  extenso,  avanzar,  rapidisimo,  dirigir,  proceso,  escribir,  sputnik,  dejenlo,  gritar,  personal,  salud
nacion,  xavier,  analista,  consultor,  politico,  salud,  senalar,  cumplir,  meta,  mexico,  vacuna,  mil,  persona,  diario,  re
unico,  cs,  atender,  covid,  vacuna,  oh,  im,  an,  alien,  im,  legal,  alien,  im,  pasante,  in,  centro,  salud,  rural
personal,  salud,  esperar,  vacuna
dato,  peso,  devaluar,  gasolinazo,  deuda,  reestructurado,  credito,  mejor,  condicion,  atender,  pandemia,  deuda,  vacuna,  poner,  orden,  sector,  salud,  guardia,  nacional,  formado,  argumento,  intriga
telefono,  asesoria,  corregir,  certificado,  vacuna,  contestanmuy,  malo,  atencion,  caray,  oficina,  hacer,  pagina,  atender,  llevar,  mes
agandalles,  malo,  morena,  esperar,  valer,  pena,  mencionar,  diverso,  colonia,  como,  organizando,  correr,  servidor,  nacion,  acompanen,  brigada,  vacuna,  abusivo,  advertencia
padre,  vacuna,  hospital,  inter,  vatos,  llevar,  chingo,  paciente,  pais
importar,  personal,  farmacia,  clinica,  hospital,  privado,  publico,  deber,  vacuna,  encontrar,  pandemia,  personal,  linea,  riesgo
esperar,  nino,  vacuna,  llegar,  vacuna,  centro,  salud,  esperar,  tomar,  dar,  solucion,  porfavor
reconocimiento,  agradecimiento,  infinito,  brindar,  padre,  oportunidad,  acceder,  vacuna,  covid,  gracias,  gobierno,  gracias,  tod,  persona,  atendieron,  amable,  paciente,  generoso,  felicidad,  logro,  gracias
mananero,  presidente,  recibir,  vacuna,  personal,  medico,  atender,  paciente,  covid,  adulto,  mayor,  llamado,  esperar,  turno,  vacuna,  saltar,  fila
amigo,  vacuna,  preguntar,  ale,  medico,  problema
siguiente,  lista,  docente,  eleccion,  upp,  acabar,  vacuna
terminar,  vacuna,  medico
centro,  medico,  nacional,  poner,  sputnik,  ver,  sovietico,  poner,  foto,  stalin
acabar,  escuchar,  anuncio,  morena,  salud,  derecho,  privilegio,  medicina,  cancer,  vacuna,  doctor,  hospital,  rebasado
excelente,  organizacion,  vacuna,  instituto,  nacional,  genomica,  gracias
minuto,  proceso,  vacuna,  venir,  gobierno,  institucion,  cara,  amargado,  normal,  cambio,  actitud,  diferencia,  amabilidad,  situacion,  agradecer,  vacuna
argentino,  ministro,  salud,  vacuna,  amigo,  mexico,  subsecretario,  salud,  positivo,  covid,  parejo,  venir,  partido,  copa,  mundial,  ineptitud
repito,  dosis,  mexicano,  totalidad,  personal,  salud,  lamentable,  aplicacion,  baja,  efectividad,  planificado,  fin,  electoral,  salud,  derecho,  humano,  crimen
saltar,  vacuna,  personal,  salud,  sector,  privado
seguir,  entender,  logistica,  coherencia,  aplicacion,  vacuna,  maestro,  vacuna,  pasar,  nino,  grupo,  portador,  contagiar,  resto,  grupo,  casa,  familia,  integrante,  seguir,  vacunando,  medico,  protestaron
llamar,  unir,  esfuerzo,  democratizar,  vacuna,  covid,  cloco,  urgente,  sector,  privado,  gobierno,  organismo,  internacional,  trabajar,  lograr,  acceso,  justo,  equitativo,  universal,  vacuna
aprobacion,  otorgado,  secretaria,  salud,  previo,  autorizacion,  presidencia
biblioteca,  jose,  vasconcelos,  excelente,  organizacion,  recibir,  atender,  joven,  aplicando,  dosis,  vacuna,  astrazeneca,  seneca,  civilidad,  responsabilidad,  social,  futuro,  nacion,  enhorabuena,  joven
historiador,  maestro,  logistica,  vacuna,  pandemia,  similar,  pandemia
jodido,  pinche,  doctor,  deber,  iniciativa,  privado,  derecho,  comprar,  vacuna,  poder,  pagar,  derecho,  pinche,  mugroso
felicidad,  pedro,  respetar,  turno,  proceso,  vacuna,  elegancia,  claridad,  atender,  campo,  marte,  autoridad,  sanitario,  diferencia,  usurpador
propongo,  campana,  masivo,  em,  pais,  aplicar,  vacuna,  terminen,  entrenado,  debidamente,  medico,  enfermera
matar,  nino,  dejar,  tratamiento,  cancer,  matar,  personal,  medico,  dejar,  equipo,  seguridad,  vacuna,  dejar,  mexicano,  medicamento,  perdon,  olvido
urgente,  parar,  abuso,  opcion,  huelga,  medico,  doctora,  denuncia,  vandalismo,  aplicacion,  vacuna,  covid,  renuncia,  imss,  video
traeran,  vacuna,  gente,  formado,  calle,  personal,  real,  traeran,  vacuna,  hora,  vacuna,  punto
senor,  herreria,  persona,  amable,  sencillo,  privilegio,  atender,  recabar,  dato,  vacuna,  miguel,  hidalgo,  saludo
medico,  trabajador,  sector,  salud,  recibir,  dosis,  vacuna,  acudan,  correo,  exijan
vacuna,  maestro,  artimano,  elector,  lopez,  millon,  maestro,  bolsa,  hora,  eleccion,  maestro,  preferir,  terminar,  vacuna,  medico
cronica,  chakra,  medico,  vacuna,  metro,  resolucion,  desacato,  medicamento,  lista,  infinito,  triste,  cuelguen,  vacuna,  junio,  vacuna,  pais
iniciar,  vacuna,  personal,  medico,  linea,  ms,  enhorabuena,  merecer,  residente,  enfermera,  tecnico,  personal,  salud
