variante,  delta,  vacuna,  tu
infrasecturcutra,  pagina,  internet,  pretender,  crear,  plataforma,  regular,  red,  social,  hablar,  conservar,  cadena,  frio,  vacuna,  tamo,  jodido
lineamientos,  vacuna,  refuerzo,  considerar,  certificado,  existir,  incluir
nino,  aislamiento,  pandemia,  pandemia,  vacuna,  vacaciones,  verano,  fase,  positivo,  fallecido
combate,  virus,  not,  vacuna,  tu,  vacuna,  salvar,  vida
util,  prueba,  cubrebocas,  vacuna,  adolescente,  decir
vacuna,  forma,  hablar,  gente,  pequeno,  conformar
vacuna,  recombinante,  basadas,  adenovirus,  replicacion,  deficiente,  rad,  candidata,  adecuado,  perfil,  producto,  objetivo,  oms,  proteccion,  plazo,  persona,  alto,  riesgo,  covid
chile,  complican,  restriccion,  avanzar,  vacuna,  retroceder,  cuarentena,  gt,  nota,  mexico,  continuar,  medida,  cubrebocas,  distanciasocial,  lavado,  mano
seguir,  cuidar,  llegar,  ninguno,  vacuna,  servir,  prevenir,  muerte,  covid,  vacuna,  vacuna
articulo,  ano,  articulo,  reciente,  referir,  directamente,  lacteo,  vacuna,  consumo,  humano
vacuna,  probada,  seguro,  aprender,  pandemia,  necesitar,  muerto,  pais,  asesino,  grande,  mundo,  seguir,  ser
desabastecimiento,  cuadro,  basico,  vacuna,  nino,  tamiz,  recien,  nacido,  vacuna,  influenza,  metro,  vacuna,  ph,  vivir,  senora
aferrar,  acto,  humanidad,  deber,  cuidar,  vacuna,  venir
vacuna,  seguro,  deber,  dejar,  infodemia,  vacuna
decir,  conocimiento,  causa,  trato,  congruente,  incongruente,  salgo,  descalificar,  odio,  huela,  socialismo,  trabaje,  fobias,  repito,  problema,  vacuna,  necedad,  caray
exigimos,  agilizar,  proceso,  vacuna,  estudiante,  regreso,  clase,  presencial,  regreso,  clase,  homicidio
dar,  razon,  madre,  servir,  enfermamo,  vacuna,  garantia
vacuna,  mijito,  ver,  agusto,  tuiteando,  plaza,  lorito,  infante,  pandemia
fluyendo,  variante,  delta,  caso,  pfizer,  leo
prueba,  vacuna,  servir,  enferma,  fuerte
sabremos,  efectivo,  vacuna,  riesgo,  vacuna
apoyar,  pais,  vacuna,  persona,  periferio,  pensamiento,  individualista,  entender,  percepcion
nino,  vacuna,  efecto,  miocarditis
resolver,  antiviral,  afortunadamente,  vacuna,  poder,  desarrollar,  estudio,  act,  salir,  preprint,  revision,  par,  error,  metodologia,  estadistico
dato,  real,  mil,  muerto,  covid,  nino,  cancer,  medicamento,  narcopresidente,  mil,  asesinato,  decrece,  economia,  millon,  pues,  cerrado,  perdido,  empleo,  corrupcion,  maximo,  vacuna,  feminicidios
ruben,  vacuna,  peligro,  mexico,  mundo,  infectando,  investigador,  queratina,  confirmar,  lopez,  obrador,  dosis,  infecto
vacuna,  genio,  dejar,  gente,  decidir,  morir,  seleccion,  natural,  basar,  organismo,  apto,  recurso,  sobreviven,  dejar,  recurso,  desear,  vivir
epidemia,  dificil,  vacuna,  desigualdad,  enfermedad,  letal,  ego,  soberbia,  ambicion,  politico,  desmedidas,  cepa,  dificil,  aceptar
doctor,  feo,  moreno,  sanchez,  pandemia,  terminar,  aprobar,  molnupiravir,  paxlovid,  mes,  existencia,  vacuna,  nino,  ano,  amparo,  mano,  prueba,  fallecido,  necesitar,  pq,  hacer,  caso
amsterdam,  comenzar,  vacuna,  viruela,  sismico
pfizer,  cumplir,  nivel,  mundial,  entrega,  dificil,  lograr,  compania
perdon,  entender,  vacuna,  ruso,  importante
renunciar,  acto,  criminal,  vacuna,  menor,  lento,  recomendar,  cubrebocas,  enfasis,  ventilacion,  mentir,  dato
tarde,  podrian,  ayudar,  sacar,  certificado,  vacuna,  covid,  esque,  dar,  baja,  numero,  celular,  medi,  alto
traer,  mascarilla,  obvio,  vacuna,  dar,  evitar,  fuerte,  cosa,  jorge,  traer,  mascarilla,  dizque,  abogada
semaforo,  verde,  vacuna,  anti,  covid,  regreso,  clase
entender,  tema,  tamaulipo,  texto,  imperdible,  profundo,  cabeza,  vacuna,  familia,  tamaulipeca
ano,  ir,  tardar,  vacuna,  poblacion,  mexico,  vacuna,  salvar,  vida
nino,  aislamiento,  pandemia,  pandemia,  vacuna,  vacaciones,  verano,  fase,  positivo,  fallecido
regreso,  aula,  necesario,  saludable,  plan,  proceso,  contemple,  atienda,  condicion,  vacuna,  nino,  ano,  reforzar,  dosis,  trabajador,  educacion,  vulnerable
sintoma,  principal,  infeccion,  covid,  variante,  omicron,  via,  superior,  dolor garganta,  dolor muscular,  articular,  sensacion,  pecho,  oprimido,  tos,  vigilar,  dato,  alarma,  fiebre,  gt,  oxigenacion,  lt,  vacunarte,  covid
primero,  plano,  junio,  remesa,  ascenso,  sumar,  moralista,  maestro,  bajar,  guardia,  repunte,  persona,  vacuna,  regreso,  clase,  voluntario,  caso,  contagio,  cuarentena,  todo
entender,  perfecto,  sistema,  inmunologico,  comprometer,  ruleta,  ruso,  vacuna,  riesgo,  alcanzar,  paciencia,  vacuna,  encontrare,  optimo
aceptar,  dudar,  vacuna,  covid,  enfermes,  gravedad,  escuchar,  vacuna,  simplemente,  espera,  enfermar,  vacuna,  dar,  sarampion,  leve,  dar,  tuberculosis,  leve,  perro,  dar,  rabia,  leve
pensar,  vacuna,  covid,  modificar,  estructura,  genetico,  deber,  ver,  oportunidad
gracias,  mantener,  informar,  pandemia,  informacion,  vacuna,  cansino
entender,  francia,  utilizar,  pasaporte,  vacuna,  actividad,  museos,  restaurante
entendamos,  vacuna,  contagiar,  seguir,  cubrebocas
deber,  promover,  vacuna,  menor
millon,  vacuna,  llevar,  mexico,  ojo,  europo,  andar,  pico,  italia,  cerrar,  escuela,  querer,  abrir,  capiche,  gente,  andar,  calle,  porcentaje,  cubrebocas
irresponsable,  gente,  vacuna,  salir,  lado,  medida,  higiene
marcharemo,  vacuna,  exigimos,  vacuna,  estudiante,  regreso,  seguro,  clase
registrar,  conteo,  anticuerpo,  especifico,  monitorear,  funcionamiento,  vacuna,  estudiar,  ultimamente,  verifica,  volver,  administrar,  dosis,  incrementar,  conteo
tema,  programador,  vacuna,  modifican,  adn,  entender,  asusta,  muevan,  codigo,  vacuna,  entender,  acceso,  packed,  tuit,  tremendamente,  estupido
replicar,  vacuna,  generar,  respuesta,  inmune,  millon,  vacuna,  tecnologia,  vacuna,  covid,  actual,  bie
dome,  gracias,  ala,  vacuna,  salir,  pandemia,  sigamos,  luchar
doctora,  caso,  covid,  diciembre,  enero,  leveasintomatico,  vacuna,  pfizer,  mayo,  vacuna,  pfizer,  junio,  covid,  julio,  agosto,  resfriado,  prolongado,  superman
republica,  dominicano,  rato,  medida,  sanitario,  estupida,  tasa,  vacuna,  menor,  seguir,  terror,  ciudad,  mexico
mayoria,  vacunada,  dosis,  caso
hombre,  ano,  de,  leve,  dic,  secuela,  semana,  vacuna,  sinovial,  abril,  presentar,  edema,  hematuria,  protucru,  gg,  crear,  mal,  nephrology,  kidneybiopsy,  kidneypath
bloquear,  senalar,  ineptitud,  cansancio,  capaz,  reconocer,  recomendacion,  brazo
aislamiento,  pandemia,  pandemia,  vacuna,  clase,  virtual,  fase,  falta,  vacuna,  positivo,  fallecido
porcentaje,  aplicacion,  vacuna,  estudiante,  protestar,  exigir,  vacuna,  par,  regreso,  seguro,  clase
crecer,  infeccion,  omicron,  parar,  vacuna,  cobro,  derecho,  piso,  co,  gente,  preferir,  perder,  cosecha,  negocio,  horror
afan,  especulador,  enriquecer,  infundiendo,  miedo,  temor,  omicron,  dejar,  cientifico,  cesar,  farmaceutico,  voraces,  moderna
entendiste,  post,  plan,  vacuna,  formal,  manda,  tip,  hoja
pausa,  laboral,  indicar,  caso,  cansancio,  extremo,  michi,  recomendar
iniciar,  vacuna,  influenza,  encontrar,  prueba,  creer,  baston,  toma,  mostrar,  nasal,  saludo
columna,  semanal,  opinion,  vacuna,  viruela,  mono,  exigencia,  poblacion,  contar,  biologico
aislamiento,  pandemia,  pandemia,  vacuna,  clase,  virtual,  fase,  iniciamos,  febrero,  esperar,  empezar,  bajar,  caso,  covid,  navidad,  gente,  entender
vacuna,  exime,  contagio,  funcion,  crear,  anticuerpo,  defiendan,  cuerpo,  contagio
celebro,  pete,  conversado,  exitosamente,  lider,  mundial,  manana,  conversar,  vladimir,  putin,  millon,  vacuna,  covid,  bajemos,  guardia,  sputnik,  fuerza,  presidente
falda,  seguridad,  vencer,  enemigo,  invisible,  vacuna,  ir,  recibir,  aplicado,  prevencion,  conciencia,  social,  solidaridad,  opcion
provoque,  ignorancia,  muerte,  vacuna,  historia,  fundamento
nop,  edad,  poblacion,  alto,  riesgo,  corresponder,  fase,  final,  principio,  caso,  informar,  plan,  vacuna,  llegada,  lote,  vacuna
urge,  vacuna,  masivo
rabia,  rabia,  mortal,  padecer,  sida,  lepro,  variante,  omicron,  funcionar,  vacuna,  natural,  buscar,  historia,  desaparecio,  inf,  espanol
avance,  tema,  vacuna,  seguir,  cuidando,  favor,  cubrebocas,  covid,  vacuna
dentista,  tratar,  desatar,  panico,  boicotear,  proceso,  vacuna,  muela
explicar,  pasar,  decir,  confirmar,  aplicar,  vacuna,  decir,  hacer,  prueba,  anticuerpo,  historia,  caramba
importante,  recordar,  esperar,  minimo,  vacuna,  anticuerpo,  protector,  caso,  astrazeneca,  completar,  esquema,  dosis,  cuidar,  vacunadasos
ojo,  responsabilidad,  acabar,  vacuna,  continuo,  persona,  conjunto,  vacunadas
proteger,  vacuna,  inmunidad,  rebano
enero,  plan,  nacional,  vacuna,  alerta,  coronavirus,  mexico,  contagio,  muerte,  contagio,  muerte,  cuidense
gusto,  escuchar,  cientifico,  reivindique,  epidemiologia,  explicar,  pais,  caso,  exito,  deber,  catastrofe,  apostar,  inmunidad,  rebano,  vacuna,  campechaneadamendo
nino,  exigir,  demanda,  gobierno,  genocida,  provea,  medicamento,  nino,  cancer,  provea,  vacuna,  recien,  nacidosque,  previo,  seguridad,  social,  padre,  nino,  sufrir,  enfermedad
empezar,  llegar,  ba,  cancan,  base,  dinamica,  europo,  probable,  ola,  semana,  vacuna,  infeccion,  previo,  fuerte,  duradero,  depender,  virus
criminal,  perder,  dignidad,  inicio,  pandemia,  someter,  deseo,  someter,  contradice,  vacuna,  autorizar,  vacuna,  publicacion,  resultado,  fase
vacuna,  pleno,  pandemia,  negligentes,  criminal
aprender,  vivir,  covid,  aire,  libre,  riesgo,  disminuir,  vacuna,  medida,  solucion
vacuna,  prevenir,  virus,  sistema,  respiratorio,  vacuna,  prevenir,  desarrolles,  enfermedad,  grave,  infectar,  tu,  enfermedad,  inicio,  decente,  informe
vacuna,  ayuda,  cubrebocas,  positivo,  gobierno,  vacuna,  negligentes,  cubrebocas,  sintoma,  leve
seguir,  tonteria,  querer,  controlar,  poblacion,  mundial,  vacuna,  olvidar,  controlar,  celular,  red,  vacuna,  seguir,  teorio,  conspiracion
aviso,  informar,  padre,  familia,  vacuna,  obligatorio,  inscripcion
recordar,  razon,  vacuna,  persona,  bomba
vacuna,  bajemos,  guardia,  sigamos,  proteger,  diseno,  cubrebocas,  triple,  capa,  lavable,  elaborado,  telar,  pedal,  covid,  cubrebocas,  ataco,  pandemia,  bajes,  guardia
cuidado,  comentario,  desafortunados,  vacuna,  servir,  fortalecer,  sistema,  inmunologico,  dar,  mantener,  cuidado,  cubrir,  boca,  cuidado,  respectivo,  cuestionar,  desinformar
nivel,  mundial,  vacuna,  desgarradora,  realidad,  nino,  regresar,  clase
creador,  vacuna,  anticovid,  oxfordastrazenecamas,  advertir,  covid,  terminar,  proximo,  pandemia,  letal,  mafioso,  industria,  farmaceutico,  motivo,  terminar,  pandemia
clase,  presencial,  pandemia,  pandemia,  vacuna,  fase,  positivo,  fallecido
satisfaccion,  vacuna,  ambos,  dosis,  permito,  reconocer,  clic,  manuel,  lopez,  obrador,  cumplimiento,  responsabilidad,  gestion,  proteccion,  sanitario,  labor,  ano,  mostrar,  mexicano,  excelente
senor,  canela,  vacuna,  nesesita,  hijo,  carisima,  asta,  porfavor,  vacuna,  salvara,  ami,  hijo,  enfermedad,  ayudara,  requerimos,  apollo,  dar,  terapia,  fisico,  evitar,  atrofia,  miento,  musculo
vacuna,  barrera,  morir,  enfermar,  gravedad,  factor,  importante,  chile,  pais,  latino,  vacuna,  enfrentar,  ola,  persona,  vacunadas,  enfermado,  relajar,  medida,  sanitario,  individuo
ec,  postura,  ideologico,  obtusas,  racismo,  negro,  contradictorio,  musico,  difundir,  blues,  mundo,  covid,  vacuna,  deber,  separar,  hombre,  obra
virus,  activado,  refieres,  vacuna,  replican,  imposible,  contagio
razon,  vacuna,  nino,  ano,  aumento,  caso,  hospitalizacion,  presencia,  covid,  nino,  nino,  joven,  dispersan,  virus,  vacuna,  seguro,  vacuna,  nino,  ninez,  vacunada,  vacuna,  nino,  mexicano
vacuna,  contagiar,  correr,  riesgo,  deber,  cuidar,  quitar,  cubrir,  boca
acerca,  muerte,  vacuna
importancia,  acelerar,  vacuna
doctora,  recomendable,  ta,  dosis,  vacuna,  covid,  variante,  omicron
cercano,  reloj,  dios,  prioridad,  acoger,  autorizar,  vacuna,  caduca,  batalla,  horario,  verano,  danar,  improvisacion,  administracion,  dato
formado,  indicar,  vacuna,  aclarar,  dicho,  situacion,  favor,  esto,  caos
inicio,  pandemia,  trascender,  trabajador,  esencial,  expuesto,  desprotegidos,  virus,  circular,  vacuna,  volver,  ignorado,  expresar,  inequidad
estupendo,  noticia,  aparato,  complemento,  perfecto,  vacuna,  inmunizar,  apartar,  infectado,  ojala,  escaner
nino,  maestro,  trabajar,  excelentemente,  clase,  tv,  complementado,  zoom,  jaleo,  regresen,  clase,  presencial,  interes,  economico,  nino,  maestro,  vacuna,  semaforo,  de
oigan,  vacuna,  evento,  riesgo,  eso,  gustar,  llegar
inicio,  vacuna,  quinto,  roo,  semaforo,  verde,  bajar,  guardia,  digamonos,  cuidando
suponer,  querer,  extremar,  precaucion,  prueba,  real,  vacuna,  pasar,  pasar,  chile,  leccion
proselitismo,  politico,  vacuna,  fase,  investigacion,  aprobado,  instancia,  comercializad,  aprobar,  emergencia,  esperar,  salir,  luz,  tomar,  medida,  necesario,  paciente
nino,  aislamiento,  pandemia,  pandemia,  vacuna,  vacaciones,  verano,  fase,  positivo,  fallecido
nino,  decidir,  adulto,  ignorante,  vacuna,  evitar,  contagio,  contagiar,  vacuna,  sintoma,  mortal,  persona,  contagian,  vacuna,  poder,  contagiar,  tu,  poder,  contagiar
llegar,  conclusion,  doctor,  ano,  llegar,  inmunidad,  rebano,  teoria,  vacuna,  joven
ento,  seguro,  contrariamente,  pensar,  creer,  malo,  inyecta,  paz,  confianza,  confio,  dar,  dosis,  abundancia,  vida,  fundamental,  vivir,  pedir,  disfrute,  maximo,  momento
mexico,  unico,  pais,  deber,  registrar,  poblacion,  vacuna
vacuna,  nino,  leve
necesitar,  carnet,  vacuna,  covid,  por,  negativo
aislamiento,  pandemia,  pandemia,  vacuna,  clase,  virtual,  fase,  fuerte,  familia,  perder,  familiar,  ocupacion,  hospitalario,  baja
recibir,  dosis,  astrazeneca,  prueba,  desarrolle,  inmunidad,  grado,  proteccion,  mejor,  momento,  prueba,  fase,  inicial,  seguimiento,  gracias,  respuesta
covid,  vacuna,  evitan,  enfermedad,  virus,  generar,  evitan,  contagio,  grip,  contagiar,  virus,  vacuna,  gripe
coronavirus,  covid,  pandemia,  sarscov,  deber,  proteger,  fortalecer,  vacuna,  salud,  suerte,  bendiciones
metanalisis,  efecto,  insulin,  glucosa,  grave,  riesgo,  hipoglucemia,  desp,  estrategia,  reducido,  dosis,  baja,  ui,  like,  eficaz,  menor,  riesgo,  hipoglucemia
vacuna,  significar,  contagie,  virus,  contagie
variante,  covid,  yse,  deber,  pensar,  dosis,  vacuna,  nino,  festejo,  inflacion,  dolar,  peso,  informacion,  blindada
necesario,  entender,  vacuna,  indispensable,  reducir,  riesgo,  morir,  virus,  reducir,  gravedad,  enfermedad,  cuidando,  tu
hablaran,  dinosaurios,  tenedor,  bronca,  efecto,  problema,  poner,  discurrir,  asunto,  importante,  vacuna,  informacion,  danar
vacuna,  repercusion,  muerte,  culpable,  putin,  ho,  dejar
decir,  vacuna,  elector,  casualmente,  semana,  eleccion,  empezar,  vacuna,  gente,  mujer,  embarazado
falta,  casa,  ya,  llegar,  vacuna,  terminar,  recomendacion,  cuidemo
ignoro,  entiendes,  pedir,  regresar,  vacuna,  vacuna,  seguro,  menor,  hijo,  asmatico,  covid,  morir,  mayoria,  nino,  mexico,  respetar,  sano,  distancia,  mascarilla
unido,  acaparo,  vacuna,  pregunta,  pandemia,  sacar
vacuna,  covid,  seguro,  efectivo,  embarazo,  vacuna,  salvan,  vida,  vacunarte
clase,  presencial,  pandemia,  pandemia,  vacuna,  fase,  positivo,  fallecido
vacuna,  dome,  sigamos,  medida,  sanitario,  vacuna,  rapido
encontrar,  responsable,  pinta,  vacunasayuda,  damnificado,  preguntar,  tachar,  cientifico
escasez,  vacuna,  exceso,  avivados
indirectamente,  vacuna,  generar,  coagulo,  proteina,  espigo,  clave,  noticia,  llegar,  medio,  comunicacion,  acabar,  vacuna,  sabeis
ojala,  meollo,  asunto,  gobierno,  tomar,  medida,  deber,  tomar,  pueblo,  quedar,  pinche,  casa,  consciente,  atravesar,  llevadero,  vacuna,  punto,  aparteclaro
salvemo,  mexico,  mayoria,  querer,  quitar,  ahorro,  amor,  continuar,  falta,  medicamento,  poblacion,  vulnerable,  querer,  mexico,  recuperar,  volver,  crecer,  economicamente,  seguridad,  medicina,  vacuna,  votar
descansando,  semana,  dosis,  preventivo,  enfermedad,  grave,  covid,  sonando,  bebe
astrazeneca,  dato,  obsoleto,  estudio,  vacuna,  eeuu,  instituto,  nacional,  enfermedad,  infecciosa,  rt
antivacuna,  amig,  cientifico,  ensenen,  eficacia,  efectividad,  vacuna,  bastar,  analicen,  dato,  pais,  aplicado
respetuoso,  exhorto,  invitacion,  seguir,  decir,  mamada,  prueba,  vacuna,  resultar,  pronostico,  muerte,  mexico,  covid,  salir,  madre
pandemia,  sufrido,  historia,  moderna,  crisis,  climaticar,  borde,  guerra,  mundial,  chino,  rusia,  occidente,  deber,  entender,  generacion,  vivir,  mundo,  relativo,  calidad,  vida,  reflexion,  millennials
perfecto,  inicio,  paso,  profundizar,  poder,  acceder,  estudiar,  modelo,  japones,  recomiendo,  pandemia,  vacunaslamentablemente,  panacea,  independientemente,  nulo,  gestion,  gobierno,  federal
aislamiento,  pandemia,  pandemia,  vacuna,  clase,  virtual,  fase,  mexicano,  adios,  familia,  realidad,  inimaginable,  perdida
caga,  gente,  aprovechar,  lugar,  publico,  evento,  vacuna
doctor,  gatel,  perder,  registrar,  vacuna,  impresion,  querer,  gastar,  vacuna,  importancia,  registro,  doctor,  perder,  gente,  morir,  dejar,  burocracia,  practico,  hacer,  caso,  favor
covid,  voluble,  vacuna,  organizacion,  excelente,  gratuito,  problema,  problema,  gente,  necia,  vacuna,  malo,  informacion,  gente,  deber,  informador,  gente,  ama,  humanidad
antivacuna,  decir,  cobertura,  presencia,  reptilianos,  bill,  gates,  seguir,  creer,  carisima,  medicina,  alternativa
queretaro,  dosis,  covid,  medio,  comunicacion,  guber,  urge,  llegar,  diario,  contacto,  muerte
macabro,  juego,  venir,  vacuna,  ruso,  compris,  autorizar,  practicamente,  agencia,  regulador,  mundo
urge,  nino,  esten,  vacuna
oh,  equinoccio,  primavera,  recargar,  energia,  piramid,  paso,  dosis,  sarscov,  holocausto,  cubrebocas,  manten,  distanciasocia
investigacion,  vacuna,  sumar
falso,  vacuna,  contagiar,  profesor,  contagiar,  nino
ignorancia,  mundo,  vacuna,  inmune,  lees,  comentario,  tweet,  corrigiendo,  vacuna,  servir,  mueras,  inmortal
emilio,  alvarez,  caza,  coincidir,  jefe,  jorge,  acoger,  titular,  vacuna,  anti,  covid,  llegar,  mexico,  persona,  vacunadas,  vacuna,  sobrar
enero,  plan,  nacional,  vacuna,  alerta,  coronavirus,  mexico,  contagio,  muerte,  contagio,  muerte,  ciento,  cincuenta,  mil,  muerte,  cuidense,  cuidense
dejar,  vacuna,  prueba
vacuna,  regreso,  estudiante,  adherido,  fer,  exigimos,  vacuna,  estudiante,  garantizando,  sano,  regreso,  clase,  presencial
herrero,  vidal,  acoger,  foco,  cintura,  salir,  agua,  negro,  alcantarilla,  herrero,  obra,  publico
aguerrido,  virus,  encontrar,  vacuna,  prueba,  error,  prueba,  error
queja,  superviso,  vacuna,  patria,  ofrecer,  ir,  seguro,  vacuna,  efectivo,  dosis,  variante,  sars,  covid,  doctor,  muerte
tonto,  miedo,  irracional,  vacuna,  servir,  sol,  creer,  vacuna,  ba,  proteger,  hecho,  andar,  sistema,  inmunologico,  finalmente
valer,  seguro,  unidad,  prueba,  ahorita,  vacuna,  nino
deber,  inyectar,  vacuna,  cantidad,  persona,  efecto,  adverso,  agenda,  ciudadano,  normal,  interesar,  saludo
pensar,  ano,  simple,  gripa,  paso,  coronavirus,  afortunadamente,  leve,  llevar,  reino,  cielo,  vacuna,  enfrentar,  secuela,  vivo,  afortunadamente
aislamiento,  pandemia,  pandemia,  vacuna,  clase,  virtual,  fase,  falta,  vacuna,  positivo,  fallecido
ineptitud,  chucho,  vero,  isla,  escondido,  closet,  sal,  afectar,  ver,  cantidad,  vacuna,  mundo,  seguro,  vacunadoscon,  entonte,  carga,  amar
investigacion,  pais,  india,  reducir,  considerablemente,  numero,  contagio,  consecuencia,  muerto,  enviar,  vacuna,  secreto,  creer
autoridad,  sanitario,  informacion,  mejorar,  vacuna,  empezar
olvidar,  mencionar,  persona,  linea,  combate,  virus,  vacuna,  seguramente,  inconciente
dejar,  politizar,  tema,  vacuna,  senora,  mercenario,  vacuna,  entender,  golpetea,  forma,  estupido
importante,  utilices,  producto,  especifico,  mantener,  piel,  contorno,  ojo,  saludable,  evitar,  temido,  pata,  gallo,  arrugo,  bolsa,  ojeras,  desmaquilla,  correctamente,  ojo,  utilizar,  mascarilla,  mitigar,  efecto,  cansancio
director,  ejecutivo,  pfizer,  albert,  borla,  judio,  sefardi,  tesalonica,  grecia,  ciudad,  cuyo,  poblacion,  judio,  desaparecio,  completo,  guerra,  mundial,  contar,  respuesta,  vista,  porque,  pfizer
acabar,  fallecer,  companero,  joven,  covid,  alcanzar,  vacuna,  malditos,  politico,  asilo,  gatell,  asesino,  desgraciado,  hp
aislamiento,  pandemia,  pandemia,  vacuna,  clase,  virtual,  fase,  falta,  vacuna,  positivo,  fallecido
razon,  preferir,  confiar,  artista,  desconocido,  facebook,  estudiar,  tema,  vacuna,  preferir,  creer,  teorio,  conspirano,  sentir,  alumno,  mediocres,  poseer,  conocimiento,  oculto
principio,  fundamental,  vacuna,  masivo,  infancia,  vacuna,  nino,  posible,  garantizar,  inmunidad,  rebano
clase,  presencial,  pandemia,  pandemia,  vacuna,  fase,  positivo,  fallecido
alivio,  vacuna,  doctor,  muerte
delegar,  campana,  vacuna,  salir
instruyo,  vacuna,  proceso,  investigacion,  cientifico
pensar,  vacuna,  contagiaron,  contagian,  ignorancia
vacuna,  salvan,  vida,  vacaciones,  work
contexto,  distinto,  tema,  normal,  vacuna,  reciente,  llevar,  ano,  persona,  querer,  vacuna,  pendejas,  educacion,  pagar,  terminar,  marcha,  neurona
comentar,  comorbilidad,  riesgo,  muerte,  aumentar,  vacuna,  exponer,  volar,  jefe,  esposa,  vacuna,  ambos,  abril,  acabar,  fallecer,  sintoma,  oxigeno,  hospital
derecho,  gente,  demandar,  gatell,  plan,  vacuna,  contingencia,  infectaron,  andar,  evento,  fiesta,  picos,  alto,  tontito,  madre,  cabron
pais,  invirtio,  investigacion,  vacuna,  derecho,  obligar,  agresivo,  violencia,  preparemo,  argumento,  convencer
califequemo,  vacuna,  murio,  vacuna,  morir,  tocar,  tocar,  merecemos,  respeto,  empatia,  compasion,  tiempo,  covid,  diego,  verdader,  vacuna,  antivacuna,  vacunarte
dio,  covid,  completo,  esquema,  vacuna,  vacuna,  influenza,  decir,  experiencia,  bajen,  guardia,  fuerte,  sigamos,  cuidando
detectar,  vacuna,  sobrante,  llevar,  control,  perfecto,  vacuna,  aire,  vacuna,  simulada,  enganaron,  padre,  porcentaje,  ordenar,  presidente,  simularan
teoria,  respuesta,  vacuna,  viruela,  humano,  creer,  prevenir,  mono,  punto,  confirmar
animal,  politico,  dato,  mil,  defunciones,  confirmado,  mil,  caso,  activo,  estimados,  mil,  esquema,  vacuna,  completo
cuarentena,  estricto,  lugar,  cubrebocas,  vacuna,  aplicado,  poblacion,  de,  fuga,  playa,  sorprenderia,  existir,  pico,  contagio,  semana,  ver
probar,  relacion,  directo,  vacuna,  trombosis,  comprobar,  proteccion,  enfermedad,  grave,  amarillista
feliz,  domingo,  sanitizamo,  sede,  vacuna,  cuidar,  salud,  joven,  visitar,  vacante,  defensa,  prevencion
llegar,  temporada,  gente,  pandemia,  ver,  abrazar,  abrazar,  iman,  evitar,  vacuna,  regreso
dar,  seguir,  antivacuna,  creer,  tuit,  broma,  entre,  perfil,  campana,  vacuna,  creer,  gente,  circulo
identifico,  aparte,  ignorancia,  indomita,  persona,  contagien,  mutacion,  vacuna,  volver,  eficiente
llamar,  discriminacion,  violar,  derecho,  gente,  vacuna,  problema,  vacuna,  afectar
favor,  alguien,  rienda,  esto,  absurdo,  regresar,  vacuna,  ola
eso,  responsablesino,  multitud,  tragedia,  suscitar,  ultimamente,  distinto,  rubro,  nino,  cancer,  medicamento,  incendio,  forestal,  prevencion,  damnificado,  inundacion,  apoyo,  falta,  vacuna,  cuadro,  basico
marzo,  plan,  nacional,  vacuna,  alerta,  coronavirus,  mexico,  contagio,  muerte,  contagio,  muerte,  cuidense
volver,  aula,  apoyo,  lucha,  fer,  vacuna,  estudiante,  regreso,  clase,  nino,  joven,  contagiado,  fallezcan,  sufrir,  consecuencia,  grave
estudio,  chileno,  dosis,  sinovial,  eficacia,  haber,  tu,  vacuna,  preocupar
muerto,  vacuna,  ayuda,  alguien,  querer,  responsabilidad,  individuo,  atrasado,  programa,  vacuna,  esquema,  completo,  obligar
clase,  vacuna
urge,  vacuna,  programaron,  salio,  control,  dato
sabias,  infeccion,  rotavirus,  considerar,  principal,  causa,  morbilidad,  mortalidad,  nino,  menor,  ano,  semana,  vacuna,  laboratorio,  importancia,  vacuna,  pequeno
vacuna,  covid,  persona,  sindrome,  down,  persona,  riesgo,  firma,  peticion,  via
ovarios,  decir,  presidente,  completamente,  loco,  lambiscon,  triste,  realidad,  nino,  necesitar,  vacuna,  regreso,  clase
cuidemo,  aplicacion,  vacuna,  hechar,  andar,  economia,  saldremos,  medida,  necesario
dejar,  capaz,  volver,  generar,  anticuerpo,  caso,  necesario,  eficiente,  capacidad,  cuerpo,  generar,  memoria,  accion,  vacuna,  estudio
regentar,  decidir,  aplicar,  sputnik,  habitante,  iztapalapa,  zona,  cero,  pandemia,  laboratorio,  muerte
dile,  vacuna,  covid,  tendencia,  siguiente,  semana,  guarden,  tuit
