cluster,lat,lon
persona necesitar terapia reemplazo hormonal rato cuerpo adapte menor nivel estrogeno dolor muscular articular mama mandar seguro sufrir dolor ano ,19.2970107,-99.2058092
contento vacuna mama ,19.2970107,-99.2058092
acostumbrando dificil perseverar cumplir meta esforzar valer pena desvelo enojo estres cansancio ,19.2846922,-99.140238
base dato virus actualizada shar tuneado entrar conversacion astrazeneca ojala papi ver poquito tranquilo decir covid gracias profesional salud ,19.424142929905656,-99.19609813581408
cogerte duro cansancio sabrosa ricuro ,19.0763934,-99.7825792
dona raquel madrecita vacunada vacuna oxfordastrazenecamas cuerpo amar corazon ama ,19.3998346,-99.1843501
creer ano falta toque vacuna ,19.357102,-99.1919955
ponganse solas draft punk bailar esperar poner vacuna hijo puta madre ,19.4043522,-99.128294
henry jajajaja problema jajaja ,19.3668621,-99.067766
sentimiento encontrado indescriptible abuelita abuelito felicidad emocion alegria recibir dosis vacuna covid dios grande dar oportunidad vivir momento ,19.2156239,-99.6470277
nadie preguntale saludo increible padre escuchar junto padre doble dosis semana beso ,19.444937,-99.180678
pagina vacuna saturada pedo empezar aparecer quedar ,19.198192,-99.0693801
cansancio navidad ano ,19.375769,-99.137171
decir sentir inmune vacuna ,19.2970107,-99.2058092
nacer ver registrar amiguis vacuna ,19.198192,-99.0693801
dormir manana tocar vacuna ,19.3059713,-99.4041647
venir vacuna termine movimiento lateral ,19.444937,-99.180678
amiga hermoso escorpion dar fuerza reponerte cansancio ,19.2970107,-99.2058092
bastar reves aventura poseidon entiendan referencia libro entender esperar vacuna ,19.3998346,-99.1843501
mil vacuna hijo puta madre chingado tren maya refineria pedo ,19.2846922,-99.140238
venir arreglado vacuna acaso hombre bonito ,19.152878,-99.1600234
exactamente ano tercero fiebre provocado covid intentar seguir trabajar cuarto dolor muscular rm cuerpo insoportable ,19.3863707,-99.259495
enfermero hija duro reaccion vacuna ,19.2970107,-99.2058092
cansancio nivel meme ,19.232228,-99.324375
vida colonia vacuna regresar plaza ,19.3998346,-99.1843501
sentir feliz mejor amiga doctora nefrologia arriesga vida area covid recibir vacuna alegria ,19.2846922,-99.140238
traigo alprazolam rescate mochilo servicio tomar miligramo dosis rescate miligramo seguro victimizado ,19.357102,-99.1919955
nomas vacuna dar franks manana querer ,19.357102,-99.1919955
analogia base dato musculoejercicio gustar vacuna entrenamiento entreno maraton cruzo meta experiencia entreno ,19.087511,-99.315748
mexico deber toque quedar sabado quedar papis domingo tocar vacuna covid poder dormir vecino fiesta musica vivo invitado ,19.3863707,-99.259495
calor ritmo salir dosis puesta ,19.232228,-99.324375
pregunta serio vacuna poder bebida alcohol monito vacuna poder crees ,19.2846922,-99.140238
oyendo luna aire chingo vacuna doler jajaja querido top santo sabina uf chicle azul morado ,19.4043522,-99.128294
dios bendecido semejante tecnologia internet gratis vida dosis podras compartir senal dispositivo genial ,19.087511,-99.315748
caer dosis empatia dona delfin recetar ,19.0763934,-99.7825792
sputnik contagiar mama novio decir negativo sentir tranquilo ,19.2846922,-99.140238
estresa demasia vacuna familiar papa vacuna hola cago ,19.2970107,-99.2058092
levantar mano poner vacuna paracetamol doler cabeza ,19.357102,-99.1919955
onda cansancio extremo ,19.357102,-99.1919955
mando grupo familiar nota viernes empezar vacuna gam abuelo inmediatamente ,19.444937,-99.180678
querer tinto decir militar vacuna levantar cejo musiquita famoso ayudar ubicar recuerdo ojo azul ,19.4043522,-99.128294
super mama tocar mediodia vacuna ,19.232228,-99.324375
vacuna ojala servir ano encierro jeje ,19.049016,-99.364536
quedate casa acaso vacuna andar paseando semaforo rojo decir papa predicar ,19.2970107,-99.2058092
terrible triste respuesta sabina ladina prepotente perfecto omitir contexto literalidad pensamiento entender querer llamado vacuna dresseritis agudo ,19.3998346,-99.1843501
sentir viejo registrar vacuna ,19.3863707,-99.259495
unico sostenido vida padre eterno roca cristo vacuna super medicamento ,19.456367,-99.221136
dosis astrazeneca libre sintoma preparar noche largo ,19.087511,-99.315748
querer apostar vacuna mexicano patria efectivo seguir apostar energia viejo ir restaurante cumplir querer cantar mananito pedo gracias gracias ,19.3998346,-99.1843501
nivel cansancio termine domingo llegar arrastrar ,19.232228,-99.324375
ando querer cocinar querer tono querer musica querer nadasolo manita vacuna madrina acomodo hormona ,19.232228,-99.324375
vivir cansancio hahaha ,19.232228,-99.324375
invitaron dj set cede vacuna millennialz sentir ,19.2846922,-99.140238
saludo abrazo amistad vacuna semana padeciendo estrago animo vibras ,19.3998346,-99.1843501
gente esperar sol jodido vacuna eficiente chinguen vivo bola pendejo ,19.51799,-99.330259
amigo alguien desear adoptar gatito hermano mes vacuna desear adoptar dar amor conocer alguien sepa ayudar compartir ,19.444937,-99.180678
unico efecto secundario vacuna tremendo antojo cenar pizzo ,19.2970107,-99.2058092
quedate ame nivel cansancio manana ,19.444937,-99.180678
andar inyectar heroina vacuna ,19.456367,-99.221136
efecto secundario dosis sputnik sueno infinito cuerpo cortar dolor brazo sueno fine fine ,19.3998346,-99.1843501
ah logro espanol vacuna atleta maravilla noticion vivo rey ,19.4043522,-99.128294
poder saber raro eleccion lograr millon vacuna ir semaforo verde salir cifra muerto faltar mil actualizar baja vacuna ,19.498594,-99.2481811
felicidad organizacion gobierno de poner vacuna abuela atendida extraordinariamente ,18.3671046,-100.613313
esperar pasar cansancio mejorar animo abrazo ,19.3863707,-99.259495
asistir vacuna venir lunes ver gusto paso informacion ,19.087511,-99.315748
cansancio estar caer gente al ,19.3998346,-99.1843501
entender jugar vivo condicion medico entrar ansiedad dosis vacuna ,19.206011,-99.4974926
companera leer pasaje biblia acercar atreverse comentar promesa animaba familiar casa enfermo venir cumplir deber traer preocupacion cansancio acumulado ,19.2156239,-99.6470277
salida morgana protocolo completo vacuna mes muero amor ,19.410995949990557,-99.16973115123326
gusto corrigieran error deveras sentir grabado ver pasar senor saber vacuna ,19.3863707,-99.259495
jajaja exacto recibir confesion loco amor gastador gorda closet preparatorio gustar guapo escuela amigo descubrieron burlaron cansancio fulanito salvar honor novia kilogramo ,19.3863707,-99.259495
martes entrene muero cansancio tocar stefania clase azul mediodia esperar clase pole ,19.3863707,-99.259495
espectacular organizacion joven coyoacan vacuna prepa feliz viaje sur ciudad vacaciones gracias alegria madre ,19.2970107,-99.2058092
jajajajaja izquierdista mejicano inmenso colo vacuna ,19.4043522,-99.128294
mame nadamas vacuna champichairo ,19.285882,-98.954037
exactamente hoja ka hiciste vacuna ,19.3998346,-99.1843501
perro oso millennials centennials morir vacuna boomers salir bailar quedar ,19.087511,-99.315748
comprala oir robar andas mendigando vacuna po ca madre ,19.456367,-99.221136
excelente atencion centro medico sexi agil medio hora vacuna bail solas jea dance rutina ejercicio disminuir dolor brazo ,19.407790687425482,-99.1540610099632
mentado madre cansancio imbecil palacio dejar silla presidencial ,19.498594,-99.2481811
persona harto inteligente analiza esquema vacuna mundo termin propon esquema proporcionar justo igualitario equidad queja critica chingo ,19.357102,-99.1919955
sensacion cansancio sentir cansancio presion estabilizo dolor brazo minimo duden vacuna sputnik vacuna tu vacunada vacuna vacuna salvan vida feliz domingo ,19.2970107,-99.2058092
vacuna embarazar mes dar vuelta quedo pensar alguien pensar cojo jajaja ,19.158446,-98.967727
generacion cuarentona mama fallecido diciembre acompanado vacuna huevo ,19.444937,-99.180678
vacuna diario ver dificil ,18.3671046,-100.613313
ver bonito feliz pesado imperfecto risa sacrificio cambio lagrimo felicidad cansancio ,19.4264172,-99.1976427
querer regalen cumplir perrito pestana spo diseno cejo gym pastel leche cheesecake flor vacuna covid ,19.3998346,-99.1843501
poner preferir esperar hipocrita jurar vocalista intocable correcto hora correcto alcanzar vacuna sobrar poder volver congelar ,19.087511,-99.315748
totalmente torneo corto venir jornada doble cuerpo jugador preparar cansancio evidente mantener ejercitado entrenado mentalmente ,19.0763934,-99.7825792
terreno desconocido uto pensar miedo vacuna ,19.357102,-99.1919955
rendir intento fallido registro vacuna persona edad concierto banda favorita musica agropecuario quedar pegado computadora comprar boleto tontito madre paciencia ,18.3671046,-100.613313
gracias llegar vacuna chisme ,19.375099,-98.940638
sal positivo covid poder vacuna ,19.444937,-99.180678
ande insomnio meter pagina vacuna ahorita funcionar acabar registrar persona ,19.087511,-99.315748
dosis perfecto sanar soledad amigo ,19.3863707,-99.259495
gatell manana medias tropical dosis senderismo ,19.3998346,-99.1843501
hermosura consejo fila vacuna acercar chavo decir bonito tinte traer traumada porque poder retoque ame ver lindo alguien diganle talvez cambiar buenavibra ,19.087511,-99.315748
man banda compatible vacuna llevame diosito ,19.3863707,-99.259495
senor presidente vacuna refuerzo sali positivo comer complicacion leve gripe ,19.444937,-99.180678
llorar diego verdader vacuna decidir suerte ,19.357102,-99.1919955
oigan alguien ligo fila vacuna ,19.4043522,-99.128294
pendejo escuchar utilizo cubrebocas vacuna pinche estupido ,19.4043522,-99.128294
colosal saluden axel renta torre vacuna enfermo covid invite quince ano hija pospusieron indefinidamente ,19.4043522,-99.128294
requisito tipo oh nombre umberto tapia chavez hospital zona carlo mcgregor gabriel manera esquina sa borda col valle como contacto aranzazu tapia cel whatsapp donador vacuna reciente ,19.087511,-99.315748
decencia subir mamada subir foto hacer contagiosa aclarar explicar muerto vacuna querer ver muerto dios ,19.444937,-99.180678
ecatepec centro cultural regresando mundo version registro codigo ir chingo madre ecatepec vacuna ,19.484399,-99.118665
sone texas vacuna caer razon entender entrar visa pasaporte estresaba ir creer pedir entrar neta pedir papal ,19.444937,-99.180678
gente creer comer taco calle agarrar defensa vacuna ,19.357102,-99.1919955
derechazos olvidar vacuna moquillo parvovirus desparasitar anual optativa ,19.357102,-99.1919955
racista seleccionar vacuna hijo puta decidir mame ,19.357102,-99.1919955
vacuna puse cel brazo pegar chip jajaja ,19.357102,-99.1919955
vivid tia muchacha adelante vacuna puro circo salir caldero rato nacho inocente ,19.3998346,-99.1843501
manana abuela recibir vacuna covid emotivamente sentir feliz agradecido formar plan nacional vacuna ciudad mexico excelente planeacion comunicacion estrategico ,19.309899472452273,-99.17719229086067
cambiar queretaro ano parecer enorme rancho tranquilo limitabo centro historico dinamica impresionante moderna ,19.444937,-99.180678
alimento afrontar efecto secundario vacuna ,19.357102,-99.1919955
viernes consentir noche neelix virus permitir salir querer sencillito amor cuidar tu cuidar quedate casa cubrebocas vacunarte feliz viernes ,19.350361,-99.186597
estimado javier ambiguo razon manifestar diputada pasear hablar ninez falta vacuna quimio ,19.444937,-99.180678
volver diario matar cansancio piecitos ,19.232313,-99.364536
astrazeneca viento juarez coman tomar agua beso sufrir ahorita ,19.357102,-99.1919955
dosis vacuna dar mil efecto doler vivir ,19.51799,-99.330259
raro hijo puta madre seguir recibir vacuna pinche mamada ,19.357102,-99.1919955
camara vacuna abuelo vacuna papas empiezo saludar beso boca ,19.2156239,-99.6470277
costo lloro cansancio cronico crisis existencial ,19.375099,-98.940638
premio evento francamente dudo aforo completo vacuna ojala equivoque cambio llanto botas ,19.357102,-99.1919955
doler vacuna cosa ensayar por vacuna ,19.3863707,-99.259495
poner vacuna moquillo tia ,19.2846922,-99.140238
tio ofendio preguntar yerno texas vacuna reunion formalicemo preguntar status vacuna ,19.3998346,-99.1843501
ir presumir vacuna sobrar presumir dones sangre mami desmaye dona sangre ,19.3998346,-99.1843501
amigo avisando registro vacuna pensar necesitar registrar preferir pertenecer club ,19.412031,-99.413769
efecto vacuna dar efecto ,19.3059713,-99.4041647
jamas juego hermano amigo neta jugar quince minuto morir cansancio jajajaja poder aprovechar app rapido smart tv ,19.0763934,-99.7825792
facil papa dejar vacuna miercoles mama martes acudan miercoles ,19.3863707,-99.259495
poner tuit vacuna controlar adn pus twitter mando xd ,19.158446,-98.967727
vida dificil canso sufrimiento cansancio dolor diferencia date valer toma coraje salir nesecito abrazo ,19.3668621,-99.067766
pregunta serio poner vacuna astrazeneca dolor cabeza alguien secuela parecido ,19.2846922,-99.140238
wow fila alcanzar pasar vacuna ,19.495237331789866,-99.23988775624458
bonito paseo moto ciudad guia increible amigo comida riquisima arte urbano noticia proximo vacuna ,19.3863707,-99.259495
moria gana subir cansancio quedar mimada mimir autodromo rodillo ,19.357102,-99.1919955
vodka mano sufrir dosis jajajajaja ,19.3863707,-99.259495
manana vacuna mama persona feliz mundo ,19.3668621,-99.067766
jajaja odiar efecto refuerzo vacuna ,19.3668621,-99.067766
dosis unico campo sintoma tipo resfriado nochebooster pfizer cansancio manana ,19.412031,-99.413769
saludo sintonizando casa auto pasar estrago vacuna astrazeneca covid entender aki excelente ,19.232228,-99.324375
bajar video perjudicar esque sorprender esperar impedir apoyar cansancio ,19.213113,-99.322812
tocar velar achaques novio dosis hell yeah chiquita ,19.456367,-99.221136
cuidate amigo aki esperar vacuna excelente semana ,19.0763934,-99.7825792
viernes dosis mandar exelente semana ,19.444937,-99.180678
presente ida semifinal pumas uno atlas ,19.331979863760115,-99.19221715772866
querer llegar vacuna ir aeropuerto recibir seguir recorrido toque aplicartela llevar mariachi ,19.087511,-99.315748
vecino buen alguien vacuna poner semana ,19.375769,-99.137171
vacuna seguridad nacional vacuna jefe mexico horrible salir mentira ,19.484399,-99.118665
dolor cabeza vacuna actitud salir ,19.2846922,-99.140238
platica pinguino random house desesper obviamente compadre autorizar ,19.421871442895988,-99.15695509895555
gana vida valer diputado federal local cola vacuna ,19.232228,-99.324375
che cansancio culero gym ,19.375099,-98.940638
placer deber cumplir muerto cansancio camita ,19.2970107,-99.2058092
nino llegar vacuna doctor javier darte ,19.484399,-99.118665
estupido escribir articulo poner imaginacion subir twitter esperar vacuna oportunidad malo leche periodista poner cubrebocas ,19.2846922,-99.140238
ese tocar final enero hospital rotando covid vere necesitar vacuna esperar trastorno ansiedad consumar ,19.412031,-99.413769
enganaron propuesta vendran casa vacuna saber engano vacuna domicilio mover amigo ayudaran llevar centro vacuna enganaron ,19.357102,-99.1919955
a ver dosis retoque linda ,19.357102,-99.1919955
verga espantan suficiente estres miedo cansancio ,19.357102,-99.1919955
convocar obviamente hacios romper chiva ,19.456367,-99.221136
sueno lista determinado persona querer pasear miedo vacuna exponemo covid ,19.3998346,-99.1843501
impactante imagen vacuna inyectando aire permitir paso acompanar adulto sentir seguro vacuna pariente mayor cosa ,19.444937,-99.180678
colico intenso periodo durar volvi menstruar sentir cansancio flujo abundante habitual ,19.498594,-99.2481811
dosis novia pao hermoso ,19.444937,-99.180678
apoyo protestar paris vacuna derecho medida obligatoriedad cuerpo autoritarismo dictar papa ,19.3998346,-99.1843501
cansancio pasar recuerdo permanecer guadalajara ,19.2218831,-99.5720087
dejar poner bailar vacuna manchen dios llevame ,19.0763934,-99.7825792
dosis cafeteria alvaro oregon quitar enchufes dueno querer gente poder quedar vil godinez ,19.2970107,-99.2058092
ora festejar abras chaparro vacuna cero coronavirioso sacar brillo piso tejon ,19.348252522531368,-99.30251636688911
gaga molestar moderna jazz dejenla feliz carrera bad romance just dance entretangan ,19.3998346,-99.1843501
cuidar enorme gusto vacuna ,19.357102,-99.1919955
jodan cervecito manana vacuna cirugia plantate realidad ,19.2970107,-99.2058092
video mostrar jeringa vacias liquido vacuna agua mentiroso confiar vida ,19.232228,-99.324375
tocar vacuna cumpleanos cancela festejaron ,19.444937,-99.180678
querer creer hacer vacuna ,19.412031,-99.413769
pensar vacuna hijo ver prepa trunca ,19.065226,-98.828815
manana abajo firmante vacuna chocolate perder visita malo aeropuerto felipe angel ,19.375769,-99.137171
linda manana dejar aplicar vacuna salir cuidar salud cuidar salud desear familia pensar saludo pasenla bonito ,19.484399,-99.118665
familia moderna escuchar pastel leche esto ,19.444937,-99.180678
tardar contestartodo llamado pedir informe vacuna familiar pasar serio ,19.444937,-99.180678
mama quejando vacuna cansino querer ofrezco voluntario ,19.375099,-98.940638
personita cercano vacuna dosis enorme paz faltar preciosa novia ,19.456367,-99.221136
pensar restringe vacuna habito sueno cambiar vida pasamo vida dormir imaginate pasar cuerpo dormimo ,19.357102,-99.1919955
dolor garganta congestion tos dolor muscular dolor espalda omicron cruda ,19.51799,-99.330259
dosis doler poquito brazo piquete leve dolor cabeza traigo sueno noche feliz semana ,19.3998346,-99.1843501
ano cachito abrace padre chisme rato botaremo celebramo mes vacuna menso hermano raul omar ir felicidad ,19.3863707,-99.259495
gracias vacuna llegar mediodia salir mediodia contratiempo sentir perfectamente agradecido esperanza vida ,19.51799,-99.330259
ver dosis oir ,19.0763934,-99.7825792
semana dosis doble sertralino duermo ,19.232313,-99.364536
echeverria ir vacuna cu ,19.2156239,-99.6470277
sentir viaje astrazeneca ,19.3863707,-99.259495
atolondrado pedir vacuna ocurrido efecto secundario responsable ,19.3998346,-99.1843501
ay querido juro sentir emocion nervio esperanza deseo amor poder vacuna solucion enfermar paso ,19.357102,-99.1919955
serial alzheimer minuto escuchar doctor alberto mienta hablar epidemiologia enfermedad alzheimer pasen voz char experto vacuna tu ,19.087511,-99.315748
feliz ever vacuna mama amp papa ,19.2970107,-99.2058092
esperar apagon truco raro llegar vacuna necesitar refrigeracion especial luz salir ma ,19.484399,-99.118665
razon hija doctora recibir bebes neonatologia mamas corona virus vacuna particular corona virus gracias dios libro pequeno ano tambie ,19.3998346,-99.1843501
estupido cura vacuna ,19.2846922,-99.140238
logre tontito fiebre cansancio muscular salir amante necesitar pin jajaja ,19.3998346,-99.1843501
anda noticia razon salir donaban vacuna ver millon llevar vacuna laboral ocupar estacionamiento entrar pinche pagina servir ocupar gente int ,19.2970107,-99.2058092
pensar librado sintoma sputnik temblar torcido jajaja llevame vladimir ,19.2970107,-99.2058092
salir hora poner vacuna atleta alto rendimiento cuarentenas chingon ,19.087511,-99.315748
ir rumbo gimnasio pasar centro vacuna poner remanente vacuna querer vacuna excelente servicio ,19.407790687425482,-99.1540610099632
guapo carla vacuna dosis jajajaja tiempo voz lleno recuerdo gracias ,19.484399,-99.118665
vacuna funcionar caer terreno fe sugestion eleccion administrar cantar ,19.3998346,-99.1843501
cuidar descansar vacuna hacer ,19.357102,-99.1919955
pendejo fifo meter chingo alcohol poder droga querer inyectar vacuna ruso ,19.3998346,-99.1843501
doler brazo vacuna esperar pasar ,19.357102,-99.1919955
burlaron papas quejaron efecto vacuna andar burlaron compartir red vacuna quedar acuerdan ,19.357102,-99.1919955
seguro mama formar vacuna ,19.498594,-99.2481811
sinceramente esperar conferencia subsecretario gatell decir ocurrir desayuno tamal dulce mano estrategia vacuna ,19.357102,-99.1919955
tocar vacuna chino sinovial valer sentir tranquilo papas tocar sputnik ahorita ,19.375769,-99.137171
poner vacuna parando pito garganta seco mach ,19.444937,-99.180678
tocar dosis novia noche mama mandar mensaje preguntar sentir ,19.456367,-99.221136
papas necios sintomatologia leve dolor cabeza cansancio gripa perdida gusto olfato saque onda reganar andar buscar internet hacer prueba ganar ,19.198192,-99.0693801
vacuna proceso minuto llegar mediodia sali ,19.357102,-99.1919955
cansino mayoria conocido aplicaron fiebre nomas dio sueno subir temperatura llegar fiebre volar ,19.152878,-99.1600234
malo organizacion acompanar mama vacuna prepa gel antibacterial entrar trayecto area aplicar vacuna sano distancia ,19.087511,-99.315748
tio rich pendejo punto ,19.444937,-99.180678
jajaja pata gallo version moderna jaja horror ,19.232228,-99.324375
cansancio pedos cubrir perfectamente pedro aquino hazme re chingado favor decir jugador equipo brillo gio brillo rato seleccion ,19.2970107,-99.2058092
emocionado pensar seguir vacuna basando imagen resultar seguir esperar ,19.0763934,-99.7825792
falta vacuna certificado correccion papeleta registrado llama claro informa sentir acudo ingresen vacuna aparecer certificado ,19.444937,-99.180678
vacuna sentir tranquilo covid ,19.049016,-99.364536
hacer caso cuerpo provoque cansancio extremo ,19.198192,-99.0693801
ver semana viernes tapizado tlaxcal dosis sabado puebla sandunguita marte proyecto acabar centro miercoles salsa bachata tackestudio parejisimo ,19.38661184,-99.10893785
atrasado compadre amigo feliz cumpleanos ,19.4043522,-99.128294
pendejo creer vacuna lobotomizado corazon rinon higado trasplantado vampiros clavar estacar corazon sacar sol resurreccion ,19.375099,-98.940638
ir desvelar trabajar asegurado covid vacuna asegurado tuum querer mandar poliza casa auto mano duda levanto manana ,19.357102,-99.1919955
hijo dio fiebre ano cuerpo dolorido pfizer cuerpo dolorido ano ,19.498594,-99.2481811
bonito cosa mexico faltamo persona vacuna eh ele olvidar candiles calle oscuridad casa ,19.2846922,-99.140238
senor padre vacuna tranquilidad indescriptible ,19.3998346,-99.1843501
amiga viajar hija vacuna miedo ver quedar sentir responsable estereotipado supuesto superioridad moral ,19.087511,-99.315748
amigo calor guess vacuna efecto ma body ,19.232228,-99.324375
jajajajaja servir asesor nuevamente llamar presuncion inocencia cansancio presidente establecer pum acusar prueba ,19.357102,-99.1919955
personal pasar afortunadamente papas informar situacion reir gente pensar covid falso jaja mama solito registrar padre vacuna ayudar ,19.498594,-99.2481811
cagan minimizan covid vacuna sano come actitud ubico ,19.2156239,-99.6470277
eduardo vacuna trump primo terapia conversion verastegui ,19.357102,-99.1919955
falso decir vacuna doler temperatura gracias ,19.2846922,-99.140238
sabots vacuna ponganme metal atascado celebrar controldedano ,19.3668621,-99.067766
sputnik falta paps abrazo ,19.232228,-99.324375
clic feliz ano comprar hospital angel lote vacuna covid urge licuo fuerte abrazo ,19.484399,-99.118665
ver gente antivacuna cuento recibir inyeccion convertimo cyborg transhumano preguntar acelerar transformacion vacuna formo inmediatamente ,19.357102,-99.1919955
vacuna mama saquen fiesta ,18.3671046,-100.613313
perra calor out cuerpo vacuna ,19.456367,-99.221136
doctor hija padecer sindrome neurotico querer vacuna doctor recomendar hacer hija ano gracias respuesta feliz ano ,19.232228,-99.324375
hoygantz problema registrar servir registrar vacuna ,19.3863707,-99.259495
gracias tema vacuna poder recibir previo competencia sintoma dosis vacuna sputnik leve dolor brazo listo jueves seguir preparar copa mundo ,19.398955320898928,-99.08892886246893
justo querer mandar hijo escuela papas vacuna obligacion tapabo continuo ver tapabo cero distancia socio ,19.232228,-99.324375
quedar vacuna jajajaja ,19.357102,-99.1919955
unico rentable nombraste vega jugar ei hacios acabados paso costar ,19.232228,-99.324375
mamen vacuna viejitos tianguis ,18.3671046,-100.613313
comisario brote sarampion decir vacuna mirar ayas coqueteamos pasamo jajajajaja ,19.444937,-99.180678
lleve mama vacuna ,19.354814,-98.940043
literalmente muerto cansancio ,19.4170226,-99.091915
intranquila persona seguir contacto asegurar poder dormir preocupar vacuna cortina subir popularidad dormir bie ,19.357102,-99.1919955
ay nanita recuerden vacuna cubrebocas lugar ventilado asistir evento concurrido sano distancia ,19.375099,-98.940638
miedo encontrar hermano fila vacuna platicar ,19.3863707,-99.259495
don cha vida moderna acopla venir alma viejo viejiiiisima ,19.2846922,-99.140238
papas vacuna feliz ,19.484399,-99.118665
orgullosamente prepa foto recuerdo vacuna duda afortunado acceso poder papa esperar llego vacuna oportunidad ,19.444937,-99.180678
tocar vacuna abuelita hermoso ,19.2970107,-99.2058092
cita operacion cita trauma ortopedia surtida condon vacuna tetanos gracias mamada ,19.498594,-99.2481811
persona mayor feliz finalmente poder registrar vacuna realidad dato vacuna rato voto ,19.3863707,-99.259495
hijo responsabilidad ando poner momento caliente perro tocar vacuna doler pata pedir chiva medio gato llegar miercoles preparar planta queque bano jabon potasico plaga ,19.3998346,-99.1843501
caga pensamiento boomers millennium trayendo nuestro boomer vacuna ,19.408979124828086,-99.18155231104673
pierda noticia joaquin munoz insistir juan gabriel vivir vacuna covid amor juan gabriel tocar pobre ,19.375769,-99.137171
terriblemente irresponsable tema perder efecto dosis ,19.3998346,-99.1843501
tanda red social genial dar vacuna querer publicar jajaja ,19.2156239,-99.6470277
corazon esperar vacuna ,19.3863707,-99.259495
hola amigo saludo colonia moderna alcaldia benito juarez como excelente trasmision emocion saludo cordiales ,19.357102,-99.1919955
