cluster,lat,lon
punto rating pasamo vacuna escuchar divagacion ,19.3863707,-99.259495
terminator pedir vacuna poder tocar ,19.3863707,-99.259495
resaca vacuna verga doler brazo insoportable pasar noche horrible temperatura decir ayuda isus ,19.232313,-99.364536
banderazo inicial vacuna venusiano arrancar ambiente alegria esperanza vivir sentir vibras capital tv ,19.37128665,-99.17473631
hablar dosis perder preguntar ,19.444937,-99.180678
creer muero lentamente cansancio wednesday goodvibes goodluck mexico city mexico ,19.4326,-99.1332
vacuna pedo vacuna pedo fila chase vacuna ,19.51799,-99.330259
mismo tocar esperar dar dosis exacto rumor estirar dosis ,19.087511,-99.315748
falta canita ojala querer vacuna ,19.456367,-99.221136
ami obvio sentir vacuna virus atenuado mucho mame vacuna ,19.232228,-99.324375
chica dano pregunte poder vacuna quiereme ,19.357102,-99.1919955
llevar intento capitulo stranger things dormido cansancio rueguen logre ,19.2970107,-99.2058092
perro gato vacuna desparasitados ,19.456367,-99.221136
poder soportar dolor brazo cansancio dolor cabeza ,19.232228,-99.324375
modulo vacuna conejo enfermedad hemorragica forma gratuito ver vacuna gratis mediodia mediodia ,19.548843,-99.0385106
vacuna bendecidos enfermamo pasar bie ,19.498594,-99.2481811
dosis nomas dolio chingo ,19.412031,-99.413769
liga escocesa tropiezo cansancio cabron ,19.357102,-99.1919955
subi foto poner vacuna quitar camisa ponermela mostrar carnes respeto ,19.498594,-99.2481811
gatito buscar hogar atencion carino nombre chicle grunona vacuna desparasitados echenme mano rt ,19.152878,-99.1600234
semana estres cansancio laboral ver reinicio vida ,19.484399,-99.118665
vengo manejando cara cansancio biblioteca traquilo ,19.4519951,-99.1987237
guarden dosis imaginar poner manden semana canijo pasar dosis perder efecto dosis ,19.2970107,-99.2058092
pretendere nope universo cloverfir ld alimentar abras abandonar ,19.213113,-99.322812
enfadado tema vacuna falta poner tu vacuna encantar digas tlatuani destila desesperacion superalo presidente excepcional oir disimula llanto nota cotorrea ,19.3998346,-99.1843501
maldito vacuna tiro ,19.3998346,-99.1843501
pfizer odiar sargento envenenar resto mundo noy ruso chino seguro cargo efecto colateral vacunasmiralo putin singing cagando risa ,19.232228,-99.324375
porno helado serie historia moderna ,19.3998346,-99.1843501
excelente organizacion ambiente emocion esperanza macro sitio vacuna cu coyoacan esperar bendicion mama emocion ,19.309899472452273,-99.17719229086067
acompanar papa recibir dosis vacuna fav vivo ,19.2156239,-99.6470277
gente cansar cansancio cambiar sentimiento persona ,19.232228,-99.324375
topado online historia chamaco chamaca vacuna escondidas deseo madre padre antivacuna epoca fumaba mota escondidas caray ,19.357102,-99.1919955
ay sh ,19.3998346,-99.1843501
viernes vacuna manden vibras salir vacuna ,19.087511,-99.315748
jajaja cosa decir vacuna ig pensar referir vacuna covid realidad rabia ,19.2970107,-99.2058092
hola ey mirar dosis reaccion refuerzo contagiaron omicron gracias vacuna leve unicamente garganta dio lata dic puse grave covid ,19.232228,-99.324375
a vacuna suegro monterrey llegar querer vacuna papas ,19.357102,-99.1919955
vacuna chingo italiano tuneado amiga gustar ,19.543845,-98.929305
gracias senor presidente vocacion humano votare morena amor amor pagar semana vacuna mama tia mes abuelita senor cuidar rancho ,19.3863707,-99.259495
cancela ansiedad gente vacuna ,19.4043522,-99.128294
desinformacion influir pensamiento conspirano pensar vacuna experimental convertir zombie pasar ,19.357102,-99.1919955
mil gracias trato profesionalismo asustada tranquilo nina tipo reaccion alergicar vacuna afortunadamente atender excelentemente ,19.31838927241306,-99.11683073263325
aficion especial chiva duro hacias ano idolatran paquete omar bravo rafa marque lugo maman ,19.3998346,-99.1843501
cm vacuna tetanos desacato ano acabar llegar vacuna ph hija tocar rpm menor alguien vino medicina sufrir desacato ,19.2970107,-99.2058092
sumergi aleatorio musica sublime linea bukowski subrayar descubri mediodia lunes tocar dosis cafe ,19.049016,-99.364536
senora desatada conocer tarugo vengo llegar texas aglomeracion cepa importar constar querer vacuna opinion estupida ,19.444937,-99.180678
efecto vacuna leer poner doler cuerpo ,19.3998346,-99.1843501
oigan pensar friamente parecido llegar turno vacuna ,19.357102,-99.1919955
jajaja simon leer aerolinea pedir prueba abordar imagino pedo mayoria mexico sputnik perder varo dejar entrar mexicano ,19.3863707,-99.259495
hablar master ir pagar vacuna ,19.51799,-99.330259
abuelito vacuna dosis cantar victoria paso ,19.357102,-99.1919955
encantar determinacion esperar junio vacuna eh entrar tenganme paciencia confianza ,19.498594,-99.2481811
nivel supervivencia covid diciembre vacuna astrazeneca julio mamon pinche vacuna peor cruda sentir astrazeneca ,19.357102,-99.1919955
chido minuto vacuna sala observacion joya ,19.357102,-99.1919955
normal sputnik tumbado doler brazo jaja ,19.2846922,-99.140238
rato mesa revision papel vacuna senora ayudar avento chiste simplon simplon alto calidad soltamo reir solamente highlight semana ,19.357102,-99.1919955
llegar tijuano parte traducir eh eh balearon cansancio yamatrinar leccion vida ,19.3998346,-99.1843501
fiambrera conocer quedar dar gusto europo mari esperado cargamento vacuna adverso mendigo fmi grieta ,19.0763934,-99.7825792
novio decir venir vacuna como ,19.484399,-99.118665
alguien gustar reguero gustar alguien gay gay alguien comer comida mayoria gustar incidir aplicacion vacuna demostrar separar ,19.232228,-99.324375
decir belleza vacuna hacer reaccion ,19.2846922,-99.140238
venida vacuna esperanza enfermen facil mente abuelito vacuna dome ,19.51799,-99.330259
nena excelente noticia contraindicado beber vacuna recomendar vida sano ,19.087511,-99.315748
mago rastro version moderna individual rosca rey rellena carlo nutella dulce leche pedir gordo ,19.3863707,-99.259495
bonito registrar papas vacuna tuit ,19.3863707,-99.259495
italia pedir certificado vacuna viajar transporte publico subes canada poder entrar comprar marihuano alcohol vacuna mexico llevar mes esperar certificado ,19.087511,-99.315748
hola vacuna corresponder salgo viaje noche tocar ,19.2846922,-99.140238
gusto gente recibir vacuna ,18.3671046,-100.613313
viejito punk papa vacuna ,19.357102,-99.1919955
esperar vacuna familiar amigo renunciar favor ,19.4043522,-99.128294
pan muerto calavera amamanto plato poder faltar celebracion diademuertos ,19.349654227833366,-99.16234276388137
neta super poderoso vacuna cansino defraudar esperar seguir ,19.456367,-99.221136
jaja ahorita dificil vacuna cubrir seguir saludo ,19.484399,-99.118665
torpe salir ,19.3863707,-99.259495
exacto estrategia poderoso familia vacuna pagar inmunizacion pagar cuestion capacidad creatividad administrativo razon presidente paquidermo dormir ,19.2970107,-99.2058092
focas amaestrada venir maximo neta risa criterio pensar pensara papa ,19.2846922,-99.140238
esperar poder vacuna sigo cuidando ,19.3863707,-99.259495
sentir entre camara gas cerrar entrada centro vacuna palacio deporte adentro ,19.375769,-99.137171
emocionado convocatoria vacuna ano desafortunadamente ando vacuna ,19.2156239,-99.6470277
cuernavaca tepoztlan paloma paz falta vacuna modulo sedoso ,19.232228,-99.324375
persona preguntar claramente pq querer pfizer tu ,19.232228,-99.324375
abrazo fuerte fuerte vivir momento desesperacion cansancio amor ,19.444937,-99.180678
denme tip aprender vacuna cien querer acordar ,19.2156239,-99.6470277
felicidad amiga falta vacuna ,19.375769,-99.137171
querer cantar victoria vacuna pegar puse talvez hacer reaccion madrugada querer cantar victoria ,19.3668621,-99.067766
necesito registrar dosis ,19.444937,-99.180678
querer dosis carga ,19.3998346,-99.1843501
vacuna ny tarde minuto registro vacuna regalaron metro card gana pretexto ,19.232228,-99.324375
aplicaron vacuna ma pa viejo familia quedar dosis ,19.357102,-99.1919955
mame ponganme vacuna carnal ponedora agua viajar ,19.3998346,-99.1843501
mero curiosidad cuarentones azcapotzalco vacuna poli zacatenco gam vivo gam afectar nomas curiosidad ,19.444937,-99.180678
encierro terminar ver ilusion hija decir abuelo esperar poner vacuna ver coraje imagen andar vacacionando cuidado ,19.444937,-99.180678
grupo whats amiga vacuna tocar ,19.444937,-99.180678
negociazo vida acabar arruinar imaginan hinojo oh oderbech hildebrando my bribriesco importando vacuna ,19.484399,-99.118665
querer santo claus ano querer pedir familia poder vacuna covid paz entendimiento amistad armenia azerbaiyan regalo jp caro gracias ,19.357102,-99.1919955
papas vacuna adios estupido pandemia ,19.3998346,-99.1843501
haber go pedir cartilla vacuna cabron jajajaja mamen razon mejorar hueva mandar informacion saber fallar aplicacion afectado ,19.198192,-99.0693801
duro lucha cansancio hueva lograr rodar satisfaccion precio ,19.357102,-99.1919955
tocar vacuna sobrevivo pasar excelente cumpleanos xd ,19.375099,-98.940638
experimentar cansancio semana descanso seguir disfrutar gustar afrontar dolor fisico jajaja send consejo andar meter nariz ,19.3998346,-99.1843501
poner vacuna covid doler brazo sentir afortunado agradecido seguro familia temor contagiar extra saber prohibir beber alcohol ,19.456367,-99.221136
madre deseo raza vacuna pinche odio reaccion ,19.232228,-99.324375
jajajaja andar coordinando vacuna ,19.412031,-99.413769
desvelado despeinado hambre dosis ir campo marte miguel hidalgo de ,19.42385214,-99.19679495
uto dolio brazo inyectar vacuna ,19.2156239,-99.6470277
chakra vacuna esperar toque ,19.087511,-99.315748
cu acercar morro ofrecer ficha vacuna pensar revendedor cu decir madre oficial ,19.331979863760115,-99.19221715772866
puse pensar hacias mes gritar gol ,19.4043522,-99.128294
ver termino cansado ver ojito cansancio ,19.498594,-99.2481811
infladisimo hacios entrar juego amarillo wey suponer jugar posicion defensa correteando medio pumas chiva chivasvspumas ,19.456367,-99.221136
propongo investigar hijastro transar corruptela cara muneco ventrilocuoque esposa dosis toloache entiendo pijo ,19.4043522,-99.128294
preocupar ir sentir enter llevar decada condicionando inscripcion bebe nina nino guarderia escuela vacuna completo ,19.357102,-99.1919955
jajajajaja confirmar exigo vacuna piedad piedad ,19.2970107,-99.2058092
vacuna sintoma hora esperar pasen um ,19.50293888,-99.18357542
actitud chingona tambo ayuda cuenta vacuna pasar seguir consejo relajar mejoraras cuerpo animo ,19.0714677,-99.9024488
orgulloso hacer pasear perder terminar vacuna importante senor ,19.232228,-99.324375
ver sto centro vacuna echar porros adulto mayor vacuna puse llorar ,19.2846922,-99.140238
reaccion vacuna astrazeneca esperar dolor cabeza pasar ,19.412031,-99.413769
actualizacion sentir patada sentir fuerte astrazeneca sputnik ,19.3863707,-99.259495
puse primero astrazeneca cosquilla booster sputnik batazo nuca quedar booster astrazeneca pegar sentir depender organismo ,19.3059713,-99.4041647
modest terminado na pista aeropuerto fa llegar vuelo en vacuna proximamente jonron en casa lleno nov entrada corran voz xorfvorpropuesta tod ,19.2970107,-99.2058092
venir venir llamado atencion pensar corazon cerebro acerca tema vacuna masivo ,19.3863707,-99.259495
ufo mirar definitivo cansancio sueno oler combatir insomnio gente poner flor almohada secar arrancar flor oler proposito peligro senora planta ,19.357102,-99.1919955
correcto tocar vacuna abuelito quedate casa ,19.357102,-99.1919955
jueves saludo carino esperar saludable ojala vacuna punto ser michi amer jajaja kami oliendo flor mandar mama ,19.357102,-99.1919955
mucho pensamo condicion alguien correr prisa pensar ahorrara vacuna ciudadano faltar vacuna ,19.2846922,-99.140238
pobrecito loco robar cansancio ,19.357102,-99.1919955
co vida social hola doctora gripita pedir dios mantener pertenecer poblacion vacuna ver jaja sonar power missy elliot ,19.232228,-99.324375
conocer gente aplicado dosis dolor aplicaron vacuna decaimiento pesadez ,19.357102,-99.1919955
tocar papas dosis sintoma fuerte comparacion dosis literal papa jake ,19.2846922,-99.140238
semana sentimiento encontrado alegria papa abuelo vacuna angustia falta mama tristeza persona partir esperar vacuna vacuna ,19.357102,-99.1919955
manana azul vacuna putita ,19.357102,-99.1919955
estampo chingo vacuna subir guardia porlosqueyanoestan zocalocdmx fotodeldia fotografosmexicano fotografia subelaguardia covid porlosqueyanoestan torrelatinoamericana correlativo ,19.43269735,-99.13309605
covid libramo dichosa eh leer caso neta gloria vacuna negar salud libre chingo madre ,19.087511,-99.315748
tranquilo luz ensayo venir reforma vacuna apocalipsis ,19.444937,-99.180678
cansancio madurez resignacion querer discutir ,19.357102,-99.1919955
no bb manana vacuna poder destruir ,19.0763934,-99.7825792
confiemo autoridad companera vacuna gratis abrazo estimar ,19.357102,-99.1919955
querer volver vacuna cumplir cabello daniel romo ,19.498594,-99.2481811
vacuna querer tocar sentir alivio ,19.3668621,-99.067766
vacuna empiezo escalofrio dolor muscular claudia castana fiebre venir ,19.232313,-99.364536
mercado cocine caldo verdura pollo asado salsa chile arbol barri trapee sacudi andado cuidando recien vacuna dosis merezco vinito ,19.444937,-99.180678
participe fase cansino mes tocar vacuna placebo fiebre dolor articulacion nausea ceder paracetamol querer morir recomendable ,19.3863707,-99.259495
especialista serio beber alcohol recibir vacuna estimado ,19.232228,-99.324375
llevar ano quejando gobierno pandemia sorprender sepa vacuna really bitch ,19.087511,-99.315748
astrazeneca susto curado maracuya barbacoa ,19.357102,-99.1919955
dosissegundamendo reaccion sentir fregada ,19.3998346,-99.1843501
conocer historia condenar repetir vacuna tu ,19.087511,-99.315748
miercoles moderna tambo pasar fatal seguir dolor brazo ,19.2156239,-99.6470277
desperte malo medicamento pendeja maree eh ahorita sentir tomo dosis ,19.357102,-99.1919955
pedir morena dato haber vacunacionque madre lucrando saludar pasar ,19.3863707,-99.259495
seguro volver cerrar ahorrar chavos pasar mama chavo secundario creer vacuna ,19.3998346,-99.1843501
chingon lista gente vacuna gusto reencontrar ,19.3863707,-99.259495
jajajaja quedar guardado ,19.444937,-99.180678
regreso oficialmente oficina comentario privilegio tire ovni creer ver cansancio ,19.3863707,-99.259495
caray poder dormir preocupacion aprovechar vacuna quite inventan ,19.484399,-99.118665
feliz feliz feliz vacuna laguito tapo boca ,19.484399,-99.118665
hola agregar tu manana ir vacuna cine quedar ,19.3863707,-99.259495
mes poner cansino reaccion horrible tocar moderna esperar reaccion gacha mayo dar actitud positivo seguir usar cubrebocas lavado mano sano distancia seguir encerrado casa ,19.3998346,-99.1843501
ver repeticion cafe noticia cumplo diciembre registro vacuna gracias ,19.456367,-99.221136
duda juego dolor muscular inconforme dar minuto opinar ,19.3863707,-99.259495
payasada dosis llegar chamba calentura policia dizque leer temperatura platica platica pelado ,19.3998346,-99.1843501
tocar vacuna semana preguntar miercoles vacuna ir terapia ,19.357102,-99.1919955
kendrick dosis sabbathina queja porno banda sonoro ,19.4043522,-99.128294
pinche mamada fakenews tocar vacuna mero hora real pobre dones emocionado neta empeora odio ,19.2846922,-99.140238
sip fase cansino terminando ches macartysta formacion critica minimo oms fase resultado sputnik resultado gente penitente berry ,19.2970107,-99.2058092
hora empiezo oir putin cabeza sputnik ,19.2970107,-99.2058092
daban gana molestar paladin repetimo dosis pasen mes arrojarme ,19.2970107,-99.2058092
mandar fila vacuna anahuac carretera forma bloquear salir casa ,19.3059713,-99.4041647
esforzare dosis extra empatia cole diane rey ,19.0763934,-99.7825792
citar humano cepillo origen persona feliz perder hiciste robar vacuna referencia cita persona miserable infeliz ,19.357102,-99.1919955
mantener numerosa familia abuela hermano poder trabajo exigir fisico caso hambre cansancio bisabuela culpa pagar malo pasar ,19.498594,-99.2481811
calentura pedazote dar vacuna tumbo jajaja ,19.375769,-99.137171
felicidad vacuna hermosura mexico abrazo beso bendiciones vos familia deseo pasen feliz martes ,19.2970107,-99.2058092
vacuna ver participacion gente comprar pozole noche grito ,19.3863707,-99.259495
esperar dolorosa vacuna doler reaccion dosis tamano ,19.51799,-99.330259
seguiras triste salir vacuna diabetes corran ponersela ,19.232228,-99.324375
amiga sincronizado poner vacuna valio caca ,19.412031,-99.413769
exacto problema queja fiesta mil vacuna llegar mil tomar foto ,19.3998346,-99.1843501
funcionar vacuna cuerpazo reaccionando descansa abrigate dio frio flojero leve abrazo solidario dulzura ,19.2970107,-99.2058092
drenado energia maldito vacuna ,19.357102,-99.1919955
querer hacer efecto vacuna salir salir ,19.3998346,-99.1843501
pego horrible vacuna sentir fallecer ,19.357102,-99.1919955
perder amado perder viajar deseo abandonar chiqui beber tocar vacuna lauro sad ,19.444937,-99.180678
cajero automatico ubicado super mercado doriana hiper vigo colonia moderna semana funcionar ,19.375769,-99.137171
vacuna intentar hacer tu sentir malo persona ver vacuna amenace relacion familiar companero amigo ver vacuna usado amenazar medio vida escuela ver ,19.444937,-99.180678
neta pobre chava opinar hijo grande juicio nino vacuna formar ,19.4043522,-99.128294
obvio dar lastimo alguien familia quedar tratamiento cancer vacuna seguro social querer sigues alabando ,19.357102,-99.1919955
sputnik gana invadir kiev ,19.579588071458847,-99.02088849410924
cien viejo camiseta caiman mama vacuna semana ,19.444937,-99.180678
preguntar vacuna decir postracion ,19.3998346,-99.1843501
ojala cuidar cartilla vacuna crios cuidar una corra ,19.2846922,-99.140238
idiota usar sentir cabron protegido vacuna mierda ,19.3998346,-99.1843501
necesario nalguear novia dejar apurate vacuna neta querer teveolento necesitar correte unanalgadita ,19.357102,-99.1919955
tocar vacuna papa acabar actitud felicidad ver emociona chingo caray paso lento seguro falta madrecita chula ,19.375769,-99.137171
pasar ano mezcla miedo cansancio ,19.3863707,-99.259495
entender juguito rodilla chip vacuna proximo vida interesar clase biologia esperar util ,19.484399,-99.118665
puse ahorita cuarto pfizer ojala vacuna ,19.372724349504644,-99.17080920070553
hablar vacuna hablas eh coger ver interes cojan amigo libre coger querer dejar cojo querer epoca deber reprimirte ,19.357102,-99.1919955
pagina vacuna error ,19.3998346,-99.1843501
viejito reir enfermo senor vacuna vacuna ,19.456367,-99.221136
vacuna tio contenta falta suegra papa esperar ,19.3998346,-99.1843501
ideal empezar vacuna peru llegar invierno querer imaginar pasar llegar invierno llegar vacuna capacidad hospitalario peru vacuna ,19.412031,-99.413769
hora llego dosis listo esperar reaccion dosis tarea acabar alucine sarscov fes dragon uno ,19.47517492,-99.04505755
apagon organizo malo jajajaja codificacion vacuna reiniciar cerebro apagon levantaban gente jajajajaja dios pata navidad jajajaja jajaja ,19.3668621,-99.067766
recomendar suero ayudar efecto secundario vacuna suero ,19.2970107,-99.2058092
tipo cansancio requerir descanso requerir paz ,19.232228,-99.324375
tumbo dosis temperatura dolor cuerpo todito dolia todito obvio chille poquito chi ando ,19.3998346,-99.1843501
quedar vacuna domingo pandemia descansa ,19.357102,-99.1919955
inventar poner dosis astrazeneca hora noche sentir boa morir doler horrible cuerpo cabeza ,19.4043522,-99.128294
hermana llevar vacuna hijo testigo enfermero aplicando vacuna comer chuparon dedo limpiaron dedo mantel mesa poner vacuna seguir vacunando ,19.3863707,-99.259495
pata navidad querido chavos chavoruco vayanse vacuna recuperar pata tweet ,19.3668621,-99.067766
querer muerto vacuna ,19.3059713,-99.4041647
pasar efecto secundario vacuna deseo pronto recuperacion ,19.3998346,-99.1843501
patrana cara vacuna cuarto decir abuela ,19.232313,-99.364536
felicidad querer vacuna suegro minimo ,19.3998346,-99.1843501
neta regresar clase mes salir vacaciones vacuna discurso reencontrar reafirmar conocimiento mamada ,19.484399,-99.118665
aeropuerto consumiste manjar ten viaje vacuna ,19.213113,-99.322812
diseno entrar disenar concierto vacuna esperanza inmunidad tocar ,19.4043522,-99.128294
querer registrar vacuna ano pagina saturada echenle peso banda ancho servidor porfa ,19.198192,-99.0693801
deseo papas pronto vacuna logre vacuna seguir luchar faltar saludo ,19.51799,-99.330259
encontrar tuiteo lindo vacuna super chiquito bonito ,19.3863707,-99.259495
vacuna pandemia chingo madre ,19.357102,-99.1919955
mama mijo sientese vacuna madre problema orden minuto hermana sentir cuelgue orita pasar normal ,19.357102,-99.1919955
vacuna esperar salir madre ,19.375769,-99.137171
agradecer noticia dar vacuna enviar fascismo vacuna enfermo notificador optimismo feliz preocupemo ,19.3998346,-99.1843501
banda disfrazar morir vacuna ,19.456367,-99.221136
ir vacuna inserte voz tia punto reganar sobrino toma ,19.357102,-99.1919955
hola regresar aplicacion vacuna organizado atencionbien dejar tenso gente ,19.232313,-99.364536
banda estadio vacuna aforo controlar querer saludar cepillan vid ,19.3863707,-99.259495
traigo arrastrar cansancio vivir enorme ,19.3998346,-99.1843501
sigamos dejar cansancio vencer increible cancion motivar flu away dimah qudaibergen ,19.375099,-98.940638
jajajaja mesio empezar echar madre ine aja vacuna pequeno manga usar ,19.375769,-99.137171
nazaret hechando pasion viejito vacuna tramando paro hacia ,19.456367,-99.221136
cansancio gripe covid sentir ,19.2970107,-99.2058092
sentir mentalmente agotado superar cansancio fisico ,19.3863707,-99.259495
manana partido entrenamiento reaccion vacuna permitir ,19.375769,-99.137171
cancion favorita principe vampiros dosis murphy nadar ojo ,19.3863707,-99.259495
querer ultra pancho cola vacuna valle divertir ,19.357102,-99.1919955
cansancio cumplir twittear ,19.232313,-99.364536
poder sacar cita vacuna papa ,18.3671046,-100.613313
amigo toque vacuna pedir cortar papeleta taco corten papeleta saliva ,19.2846922,-99.140238
guau noticion vacuna viejito polilla chillon noticia internacional ,19.375769,-99.137171
acabar caer vacuna hacer pandemia ,19.357102,-99.1919955
abrimo jabon novia olor bebe poder oler efecto vacuna ahorita pff muero amor oler bebe feliz mundo querer jabones natural querer jabon bebe gracias ,19.3998346,-99.1843501
papa recibir dosis manana tio turno conocer caso gente mexico familia argentino abuela turno febrero avisar hijo nieto ,19.3863707,-99.259495
enterar ver excusa vacuna decidir vacuna decidir querer acercar llamar libertad ,19.456367,-99.221136
despierto carnada noticia registro vacuna decir pendejo oposicion vacuna ir lento pensar tocar mamada ,19.3998346,-99.1843501
triste vida duro acepto humildemente tocar pfizer selecto jovial suertudo grupo astrazeneca envidia ,19.3863707,-99.259495
porno lento rogando dosis morro hacer feo tv ,19.2846922,-99.140238
ver tirando pagina registro vacuna ,19.3998346,-99.1843501
apapacho post vacuna ,19.357102,-99.1919955
hola mexico gustar preguntar tu abuelita presentar reaccion vacuna mil gracias compartir foto ,19.357102,-99.1919955
marcar celular papa vacuna fallecer covid mama fortuna recibirla ,19.375769,-99.137171
estupido cansancio ecatepec modelo ,19.5661,-99.0451
problema pinche envidioso seguramente vacuna ,19.3863707,-99.259495
vacuna poner placebo foto cansar mentir ,19.232228,-99.324375
sentir cansancio canso rapido camino duelen hombro espalda aparecer fiebre dolor cuerpo ,19.444937,-99.180678
entender video sinagoga veracruz ra fila vacuna ,19.087511,-99.315748
tocar vacuna martes justo recuperar pp ,19.2970107,-99.2058092
pinche borla gustar quedar idiota subir foto poner vacuna aprovechar trabajar rabia ,19.444937,-99.180678
querer vacuna jefe comi ,19.2970107,-99.2058092
ayuda paso peatonal seguro arreglar banqueta gente vacuna ,19.392880391979613,-99.17297190765002
dar par pagina colapse sigamos vacuna colo ,19.456367,-99.221136
dosis vacuna poner chingo cargue caja tarimo termine muerto tocar dosis aplicaron pinche gente manchada ,19.2970107,-99.2058092
vacuna alguien ver registrar falacia mitomano palacio ,19.3998346,-99.1843501
entender relacion gozo placer dolor deporte entrenar gustar madrugar disfrutar someter masaje descarga muscular tortura why ,19.357102,-99.1919955
venir hacer examen vistapues sientiendo cansancio visual resultado graduacion cambiar ano deterioro exponencial pasar frente pantalla edad brutal ,19.2970107,-99.2058092
recibir exceso dosis traicionera ver amor fracasar participe infidelidad numero ,19.3668621,-99.067766
llevar poderoso playera cruz azul vacuna ,19.498594,-99.2481811
puesto vacuna can sintoma leo seguir dolor brazo pierna izquierda ,19.3998346,-99.1843501
victoria bill mafia saints ayudar entrar ritmo enderezar camino rival inferior inyectan dosis confianza pasar chefs kingdom raider nation go bus ano ,19.087511,-99.315748
formacion ayuda estilo juego hacias clavado tener estatico tapo alexis vega movilidad cordoba ,19.357102,-99.1919955
imaginar sentir papa vacuna ojala vacuna nino completamente feliz ,19.213113,-99.322812
justo sintoma covid fila vacuna ,19.3998346,-99.1843501
medicamente recomendable pasen perder efecto vacuna poder confundir palido efecto secundario vacuna ,19.444937,-99.180678
hola jorge papa suegro tarde par intentar cansancio ,19.087511,-99.315748
ordenado irno vacuna votar votar inteligente libre ,19.2970107,-99.2058092
hola afortunada situacion calle ayudar mes vacuna desparasitar esterilizar talla chica mediano limpio carinosa convivo gato perro nino escribir adopcioneslunaytamara ,19.357102,-99.1919955
cansancio nota don antonio ,19.2156239,-99.6470277
miercoles terapia vacuna ultrasonido mamario ver acabar ,19.3998346,-99.1843501
