cluster,lat,lon
ridiculo adelantar comprar vacuna decir papa round sombra ,19.3998346,-99.1843501
mama reaccion aplicacion vacuna cansancio dolor cabeza pedir caldito pollo agarra home office casa mama ,19.498594,-99.2481811
vacuna ching ando ,19.3998346,-99.1843501
seguir adolorido fiebre quitar pasar esperar dosis cambiar viktor drum ,19.456367,-99.221136
dio reaccion vacuna astrazeneca sentir reaccion ,19.357102,-99.1919955
gracias cesar llevar dosis taco ojo ,19.2970107,-99.2058092
ver historia amigo pasar covid pego vacuna tiro ,18.3671046,-100.613313
poder cansancio dormir hora ,19.444937,-99.180678
decir cu avisar abstinencia vacuna informar poner anda miedo exito ,19.232228,-99.324375
tremendo alivio papas vacuna gracias dios ,19.2970107,-99.2058092
gracias gusto haber dosis ,19.2846922,-99.140238
hermana companera poner vacuna dolia cabeza morir infarto ,19.232313,-99.364536
jajaja deber sentir orgulloso pais insuficiencia vacuna ver logro este ardido voto voto ,19.3863707,-99.259495
mano janssen curiosamente ma frente poner fox ayudita ,19.444937,-99.180678
maldito vacuna ando rojo cara ,19.285882,-98.954037
dolio brazo vacuna pfizer amaneci cansado ejercicio musculo sensible querer mover ,19.357102,-99.1919955
gracias resfriado cansancio minuto temblor quedar sumamente dormido escuche sentir movimiento mama dormir andar tirante amigo actividad sismico activo comun ,19.2846922,-99.140238
admirar gente sufrir efecto astrazeneca seneca anoche arrepenti pecado codera debi houston booster pfizer super benevolente senora decada ,19.357102,-99.1919955
dirios jefe ir vacuna unido ,19.3998346,-99.1843501
efecto secundario vacuna vacuna biologia hacer ,19.232228,-99.324375
poner dosis semana calculo deber vacuna semana onda ,19.232228,-99.324375
opino carlo estrategia vacuna querer ,19.232228,-99.324375
ay molestar recabar vacuna regalar lastimar gustar jaja ,19.2156239,-99.6470277
sufrimiento pequeno dosis fuerte inmortal ,19.2970107,-99.2058092
dios pinche pete pinche vacuna ver infeliz ,19.232228,-99.324375
ah caray ver ver fila aplicar vacuna desconformes vil cara infodemia lor brazo ,19.444937,-99.180678
querer esperar vacuna ,19.232228,-99.324375
noche contacto salubridad vacuna madre suegra quedar venir mover ,19.232313,-99.364536
llegar arrastrar cansado pensar madrugar llevar decision cansancio fisico necesitar desgaste emocional extra dar paz gracias bye ,19.3059713,-99.4041647
stephen smith would say is bad ma ,19.3863707,-99.259495
normalicen llorar recibir vacuna memoria gente oportunidad llore festejaron vacuna tu vacuna vacuna obligatorio vacuna ,19.425040206309205,-99.19772386550903
noche salchiamigo marcha llevar candi juntar cirugia juntamo peso euro moderna colombiano ,19.087511,-99.315748
FELIZ DIA de LAS MADRES diste vida amor espacio cargaste vientre dolor cansancio diadelasmadres felizdiamamo mama mama madre ,19.444937,-99.180678
espere vacuna dosis esperar seguir cuidando emocionado expresar sentimiento bonito ,19.3998346,-99.1843501
amigo amiga listo registro vacuna covid ano ,19.198192,-99.0693801
cita endocrinologo clinica condeso feliz cuerpo aceptar super mes try aumentar dosis contenta habemus inyeccion magia tran is beautiful ,19.3863707,-99.259495
hola amiga mujer hermoso cuerpo diosa mujer isabel mujer hermoso voz ganar cruz azul vacuna pumas perder ck adios hermoso ,19.2846922,-99.140238
querer desayunar tia shefali reirno imitacion aquaman shefali volver abrir tia salir recibir vacuna docente economia aguantar plan fuck comi ,19.0763934,-99.7825792
animo mega nervioso sentir vacuna ,19.3998346,-99.1843501
sentir puteado vacuna inyectar pinche gobierno sentir ir inyectar agua fail mejicomajico ,19.357102,-99.1919955
cara cansancio feliz ,19.456367,-99.221136
pepillorigel vacuna alcaldia miami caro pedir amigo prestir comprobante domicilio ecatepec iztacalco ver ,19.3863707,-99.259495
vacuna astrazeneca sentir verga ,19.2156239,-99.6470277
manden vibras bonita vacuna lema bonito ,19.2218831,-99.5720087
marido salir correr escuchar megafono anunciar vacuna rabia desparasitacion vacuna ,19.087511,-99.315748
sueno cansancio estres agotamiento hartazgo gana seguir vivir ,19.3632521,-99.1796393
seguro vacuna burro acariciabo pollo canallo tatin ja ja ,19.2846922,-99.140238
jajajaja miercoles manana poner vacuna lalo festejar cafe pan dulce guardar aron ,19.3059713,-99.4041647
animo hermana temor meter fatal pintan vacuna bb ,19.2846922,-99.140238
malo despertar logro seguir lidiando condenar cansancio extremo ,19.456367,-99.221136
fila persona sentadas brazo descubrir esperar vacuna paisaje lindo ver tiempo vacuna coyoaca ,19.309899472452273,-99.17719229086067
cita salir mediodia tema hora exactamente hora aplicando vacuna manana cu ,19.232228,-99.324375
aguantar alcohol dosis ,19.0763934,-99.7825792
cargo sentir recordar deber volver sueno anhelo querer sentir vida acabar preguntar tome dosis ,19.3863707,-99.259495
vete burlar eche mama querer gobierno seguro vacuna servir lamer ,19.3998346,-99.1843501
paso aparecio virus vacuna habian muerto quedar sintoma paso afortunadamente ,19.357102,-99.1919955
imbecil hablador formado fila dosis vitacilina ,19.357102,-99.1919955
tranquilidad mama papa vacuna ,19.3863707,-99.259495
ando broma volvi retomar dosis diario prosti olvidar hare serotonino vamonos ,19.3998346,-99.1843501
rufian ruiz ruiz rulo rocco amp scuccimarra sabado amp brecha sabine Sahagun saintexupery sankaracarya santo ana saramago saramago ir schafer cheree garcia sepsis seminario historia mentalidad seminario historia moderna ,19.357102,-99.1919955
falta papa mama dosis ,19.357102,-99.1919955
danny historia vacuna ando ahorita ,19.2846922,-99.140238
mandar poner vacuna influenza manana super random vacuna ,19.357102,-99.1919955
amigo familiar vacuna eu ,19.357102,-99.1919955
hola marioneta ejercicio vacuna doler brazo calma dolor ten lindo semana ,19.232228,-99.324375
justo querer volver vacuna tocar cansino sentir protegida querer volver covid ,19.3863707,-99.259495
refuerzo tocar sputnik caer pesado dolor cabeza fatiga protegida dejar vacuna merecemos hacer humanidad entero amigo familia poder sobrevivir ,19.357102,-99.1919955
doler miedo dormir poner vacuna covid doler mover sueno ,19.087511,-99.315748
uyo hijo duro jaja asegurar pediatra dentista vacuna escuela ropa panal leche clase pintura deporte club vacaciones ,19.3863707,-99.259495
felicidad proceso vacuna maravilla tarde minuto entrar salir mundo saber amable ,19.152878,-99.1600234
vacuna papa xd poner chip pase senal woe xd ,19.4043522,-99.128294
curioso logistica desplegado cita folio companero llegar poner vacuna covid decir alcanzar mexico vacuna electoral ,18.3671046,-100.613313
ano casa venir semana vacuna ultra trail intamoment instapic ultratrail tolucalabella tocar familia ,19.289341,-99.655794
harto dosis coffeand metal vivo doble carga ,19.3998346,-99.1843501
llegar cafe doble cafe adulterado vacuna ,19.375769,-99.137171
osea enojo decir gritar culero vecino escucharon ,19.456367,-99.221136
vacuna amigo conocido familia morir esperar vacuna ,19.3998346,-99.1843501
jajaja jajaja gracias trabajar chingo horda granja trollsbot emplead borla oposicion miserable desesperadamente prianrd compinches periodismo basura vacaciones vacuna ,19.2970107,-99.2058092
disfruto red twitter imaganen gracias entero registrar vacuna gracias ,18.3671046,-100.613313
ke ke vacuna ke seguir cuidando ,19.375099,-98.940638
vengo tratar concierto astrazeneca ,19.404140625621277,-99.09989177728549
puta madre sputnik pego ensayo aguantar pie ,19.4043522,-99.128294
cansado poner dosis vacuna dolio garganta ,19.285882,-98.954037
mama feliz vacuna ,19.456367,-99.221136
creer papa volviendo casa dosis vacuna llegar fumar ,19.285882,-98.954037
leyendo analizando malestar vacuna reto ,19.3998346,-99.1843501
poder premier vacuna minuto juego ,19.232228,-99.324375
cruda desvelada cansancio ,19.498594,-99.2481811
relato vacuna alcanzar dejar pasar ,19.444937,-99.180678
programa vacuna implicaba registrar sitio web ano porquerio echar andar decir saber vacuna ir lista ocurrido plan semana ,19.087511,-99.315748
moderna vacuna compania lleno juventud idea vacuna covid comparado panza ,19.3863707,-99.259495
maestro personalmente emociona perspectiva recibir dosis cansino gobierno senal haber enterar necesidad evacuacion ,19.357102,-99.1919955
tocar vacuna papas ,19.232228,-99.324375
gracias informacion hija poner feliz tocar vacuna ,19.3668621,-99.067766
efecto secundario vacuna covid inglaterra quedar chiquito cara asustar barrio poner vacuna efecto ver madrugada bar aledano ,19.2970107,-99.2058092
demonio pensar vacuna ala persona dosis astrazeneca penca ver echar calabaza radio formula gente pinche viejito cabron sal moda ,19.2970107,-99.2058092
falta vacuna gusto cita ,19.232313,-99.364536
fuerte deseo vacuna papas viejo ,19.3863707,-99.259495
gusto yeah podras gastar pagar vacuna farmacia canal autoservicio preferencia feliz sentir ,19.3863707,-99.259495
nino volver escuela divinomuchos poder estilo vida encerradosque quedar tanto divino procesoque vacuna volver normalizar socializar ,19.357102,-99.1919955
primo querer morir venir vacuna tocar ,19.332369186343012,-99.19114635399846
jefe cobrar pension recibes vacuna pone peda pilon expropiar empresa chal ,19.087511,-99.315748
oportunidad vacuna dejar registrar ,19.51799,-99.330259
seguro quedar tu facil decir descansabas trabajaba estudiabo trabajar siguieras tranquilo ataco vacuna ,19.357102,-99.1919955
oigan llevar mama compruebe vivir vacuna ,19.412031,-99.413769
paciente querer vacuna ,19.198192,-99.0693801
vacuna madre ver six flap acerquense gusto tomamo foto firmo disco ,19.295318734383834,-99.21082870507433
amigo postvacuna covid unico efecto adverso dolor brazo cansancio ,19.3998346,-99.1843501
guerradevecinos llegar julio vecino complicado divertido preparate recibir dosis risa serie original neelix guerradevecinos pierda ,19.375769,-99.137171
hacios regresar europo jugadora ir superar hugo sanchez espana ,19.357102,-99.1919955
mierda humano quedar ir formado vacuna oposicion moralmente derrotado ,19.2846922,-99.140238
festejando bono falta registro vacuna vacuna vacuna vacuna porno sed malo ,19.2846922,-99.140238
doler vacuna sputnik efectividad anthony faci comentar fauna vivir epoca guerra frio ,19.2846922,-99.140238
asumo edad cansancio inevitable ,19.2156239,-99.6470277
eclectico corto vivir latino michi bodega mega vacuna covid le eclectico corto ,19.372499,-98.989059
gracias juan pablo traigo dosis astrazeneca ir llorar saludo alumna carino ,19.357102,-99.1919955
cunado desmayaba aguja vacuna hermana nervioso valio madre miedo papas hijo ,19.444937,-99.180678
aplicacion sputnik vacunaderefuerzo malestar gana irrefrenable invadir ucrania movilizar tropa soberanamente frente frontera minimo tocar vecino marcha sovietica guerra volumen ,19.331979863760115,-99.19221715772866
tocar vacuna sabado ir alguien vacuna jajajaja ,19.2970107,-99.2058092
miedo vacuna peste malo arsenal ,19.357102,-99.1919955
hola forma fila entrar estacionamiento costco vacuna persona carro pasar fila llenar formato dar cura recomiendo llegar suerte ,19.498594,-99.2481811
puro mentira vacuna ahorita bie borracho vacaciones ,19.0763934,-99.7825792
pasar hermana agendar vacuna ,19.444937,-99.180678
querer diario novio depilo ceja registramo vacuna ,19.498594,-99.2481811
jefe redactor sa juan disculpen sa juano bautista sa juan apostol avisar hacer espectaculo traducir vacuna patron ruso vacuna traer mierda virus ,19.484399,-99.118665
alguien infiltra meter vacuna asesina letal hisopo meterte nariz boca producir problema estomago doler raspan garganta terminando infectando ,19.412031,-99.413769
hacer competencia pagina vacuna falta ortografia incendio plano ,19.456367,-99.221136
diciembre empezar antidepresivo mierda piel pelo metabolismo sueno dejar bajar dosis cambiar psico recuperar salud regreso never aga ,19.232228,-99.324375
cicloviar generar caos estacionan vehiculo doble fila trolebus sufrir rebasar agrego jornada vacuna tantito feliz lunes azcapotzalco ,19.456367,-99.221136
pensar ver borroso vacuna ,19.444937,-99.180678
vacuna poner musica bailo cuarentones fauna extremista ver jodido vital rapido saber acusarian rociaria cylon gracias kurt robar favor recibir ,19.497886667010466,-99.17521476745604
pensar causaria sintoma salir ,19.3998346,-99.1843501
tocar vacuna sabado palacio deporte amigo ,19.4043522,-99.128294
vacuna poder regresar dirigir podcasts taquito pastor ,19.357102,-99.1919955
ambiente vivir palacio deporte sputnik conejito dar volo cabeza septiembre ,19.404140625621277,-99.09989177728549
socio vacuna elevar semana chida decir martes termino cuatro dar comision efecto esperar lunes examen ,19.444937,-99.180678
perdonar man vacuna cubrebocas forma corazon querer dar entrevista tele ,19.3998346,-99.1843501
frustracion cansancio semana ,19.232228,-99.324375
pensar broma hijo prodigo volver casa ,19.2970107,-99.2058092
covid fiebre dolor muscular tos nulo llemo oliendo gusto intacto energia animo fatiga seguir herbolaria antibiotico ,19.3998346,-99.1843501
dar comer alimento balanceado vacuna desparasitar poner placa identificacion cuiden atropellar necesario meter nomina prestacion ,19.375769,-99.137171
deber vacuna enfermaron poder pendejo ,19.3998346,-99.1843501
cansancio quel mental ,19.0763934,-99.7825792
puse vacuna doler cabeza camita unico recurso lloviendo frio saludo amigo ,19.4043522,-99.128294
camara claudia vacuna amigo ,19.4043522,-99.128294
servir vacuna jaja ,19.3998346,-99.1843501
significar equipo estres cansancio desgaste emocionado trabajar jugar ganar ,19.453698166986783,-99.19982573999654
tocar dosis sabado marino poner anales trillon pal sabado ,19.2970107,-99.2058092
esperar salgan papas vacuna ,19.087511,-99.315748
hola querer contar aplicaron dosis vacuna unico malestar dolor cabeza viernes directo aviso tomar agita seguir cuidando ,19.087511,-99.315748
jajajaja neta palacio nacional microfono mano salir pinche pregunta litero cuestionar vacuna resto feto gobierno inutil ,19.3998346,-99.1843501
pinche edward jenner naciste inventar vacuna mexica enfermaron murieran chihuahua ,19.3998346,-99.1843501
dejar vacuna ir casa minuto vacuna twin ,19.444937,-99.180678
duda saber vacuna poner ,19.498594,-99.2481811
sabio guardar cuarentena cubrebocas lavar mano llegar vacuna solicitar dudo funcione sistema simplemente volver solido confianza doler jugar expectativa gente ,19.3998346,-99.1843501
actualizacion vacuna astrazeneca madrugada escalofrio dolor cabeza febricula amaneci chida dolor brazo ,19.087511,-99.315748
acabar soul llegar mensaje hermano doctor avisando vacuna covid vida ,19.3863707,-99.259495
fabuloso dinamo podio streaming radio personalizar skins ai querer vacuna ,19.2970107,-99.2058092
amigo alemania dispuesto vacuna decir poner dosis ,19.3998346,-99.1843501
felicidad querer hacer celebrar ,19.357102,-99.1919955
sentir culpable ir reunion premiere peli trabaje vacuna cansancio lluvia cuerpo socializar ,19.3998346,-99.1843501
madre pinche morenito gente pobre ignorante poner vacuna ruso perdon vocabulario encuentro dios ver ,19.357102,-99.1919955
pedir compren libro digital pedir vacuna cuiden cubrebocas gel antibacterial sano distancia querer ,19.2970107,-99.2058092
dolor muscular hueso moderado escalofrio perdida apetito ,19.3059713,-99.4041647
representar aficionadas encontrar manana disfrutar delicioso chilesennogad ingrediente favorito celebracion amor recibir dosis carino vibrar quedar delicioso ,19.2156239,-99.6470277
necesito arenero camita plato comida agua sesion juego minuto adicional vacuna triple felino antirrabica desparasitacion esterilizacion ,19.3998346,-99.1843501
traer vacuna bendiciones biblioteca vasconcelos llegar mediodia formado esperar hijo fila llegar torre bandera pesimo organizacion ,19.3998346,-99.1843501
vacuna recien xpreguntaronesta cuerdo vacunarsersiud trasladarsersile llamaran hora poner vacuna gobierno vacuna llegar todo ,19.087511,-99.315748
saldras negativo vacuna animo querer atole dedo creer bendito documentado ondeante compra vacuna sputnik astrazeneca cansino vacuna ,19.3998346,-99.1843501
hablar conocido serie leyenda vacuna dosis pegar fuerte covid pegar comer dosis sentir efecto servir pfizer fuerte ,19.357102,-99.1919955
ah cabron estrategia vacuna ,19.357102,-99.1919955
wey mamas esperar hijo salgan vacuna esperar ,19.3998346,-99.1843501
jajaja jajaja jajaja arrastrado vino dios tocar siquiera completar esquema recomiendo des gracias impuesto pagar vacuna ,19.3863707,-99.259495
chinguen madre aparte beber ir verga vacuna ,19.2846922,-99.140238
residente asqueado cansancio extremo gana levantar manana habilidad emocional sentimiento insatisfaccion caso burn out ,19.3863707,-99.259495
deseo cumpleanos padre recibieran vacuna covid tio abuelo iguala recibir dosis poquito poquito ,19.357102,-99.1919955
cansancio mental fisico ,19.3863707,-99.259495
tio ver vacuna covid gente super organizado tod amable felicitacion tod vacuna vacuna como sectorsalud ,19.4973825,-99.17462221
mundo producir alimento millon persona habemos millon produccion sorprender millon morir hambre acceso alimento pasar vacuna covid feliz viernes ,19.412031,-99.413769
hacer prueba sali negativo gracias vacuna super leve moraleja vacuna confiar vacuna ,19.3998346,-99.1843501
vacuna dosis cuento pegar astrazeneca literal tardar minuto salir vac<UNK>nen vacuna ,19.357102,-99.1919955
razon einstein oscar wilde decir mujer casan curiosidad hombre cansancio sufrir desengano ,19.0763934,-99.7825792
iztapalapa ir agua tener vacuna esperar recompensadamensensad tocar vacuna sputnik ,19.2846922,-99.140238
quedar dormido dune muerto cansancio ,19.3863707,-99.259495
obvio obvio obvio joto pasar decir covid vacuna pasea oficina cubrebocas reir gritar salir positivo ,19.3998346,-99.1843501
funcionario ine ver reaccion poblacion foto tomar ir vacuna reaccion informemo ,19.357102,-99.1919955
ridiculo ver video wey ver pusiste vacuna estupidez nombre apellido ,19.456367,-99.221136
esperar vacuna hambre vacuna ,19.407304382632155,-99.09140110015869
novio convencer tematica lucha libre servir dar necesitar vacaciones cara cansancio cargar hahaha ,19.198192,-99.0693801
amigo vacuna abuela entender felicidad ,19.232228,-99.324375
mando vacuna cerebro ,19.2846922,-99.140238
ah mirar antojo genero vacuna ,19.3998346,-99.1843501
asistir deber presentar comprobante vacuna defecto comprobante negativo covid abusados ir confiar mero dejar pasar repito ganar mexico ,19.206011,-99.4974926
pregunten padre vacunadosahora pelas kono ,19.232228,-99.324375
poner alto traficante dolor hacerdejar pasar abuso oxigeno acta defuncion panteones vacuna bastar ,19.0763934,-99.7825792
jajajajaja hotmail pedir vacuna jajajaja ,19.4043522,-99.128294
felicidad querer amigo vacuna aplicaron zocalo amable eficiente saludo afectuoso ,19.357102,-99.1919955
oficialmente dosis vacuna muerto salir superpoder pd enceraron poner vacuna ,19.498594,-99.2481811
estilista pendeja atora patrulla acabar beber queque vacuna vivir ,19.357102,-99.1919955
vacuna papas feliz universo ,19.2970107,-99.2058092
gruesecita costar buscar matiz noticia cansancio buscate tema abuses paciencia ,19.3668621,-99.067766
entre centro vacuna mediodia sali vacuna mediodia super ordenar tranquilo excelente ,19.444937,-99.180678
seguro prueba referencia red bull embarazo eh vacuna miedo red bull idea medicamento prohibido lactancia embarazo ,19.357102,-99.1919955
entender escribe vivir dar testimonio querer vacuna razon hacer esquema completo pfizer dios gracias salir omicron gripa pasar casa ,19.51799,-99.330259
dosis rayo gamma sentir david banner hombre increible ,19.4104602,-99.1767677
doctora psiquiatra subir dosis again preparar twits sad sorry poner cambio dosis deseenme suerte km ,19.3998346,-99.1843501
permiso familiar vivir prestar comprobante domicilio sede alquilaban negocio zona vacuna vendio cafe internet hacer nombre ,19.444937,-99.180678
comentario tweet falso ojo senalar realidad infraccion termino condicion deberia preocupar tu querer sputnik defenderla ,19.3863707,-99.259495
vacuna astrazeneca doler fiebre desastre inmediaciones cenais marina adentro organizado dejar pensar tamano negocio vacunaciones dato grande cripta ,19.2970107,-99.2058092
cansancio tanto ejercicio hacer ravioles cenar llenisima sentir culpable vomitare ,19.3863707,-99.259495
ah novio poner sputnik sintoma querer hahahaha ,19.232228,-99.324375
amigo necesitar ayuda mama asistir concierto coldplay meter certificado vacuna aparecer registro dosis hoja sellar vacuna presentar ,19.152878,-99.1600234
macha reaccion vacuna vertigo mareos constante doler brazo feliz vacuna yes ,19.444937,-99.180678
termine marido cansancio ,19.456367,-99.221136
mama papa vacuna ,19.365037,-99.179868
sentir falta pre entreno pinche cansancio dejar clase manana ,19.2156239,-99.6470277
dormir reaccion vacuna pegar fuerte preferir virus ,19.3998346,-99.1843501
jajaja wow acabar dosis iniciar acabar docente chiste dar embarrada vacuna levantar preferencia nah ,19.498594,-99.2481811
compraron vacuna poquita causar efecto grave brincan fila vacuna hombro derecho recibir jugar ,19.357102,-99.1919955
triste ver dar tipo noticia recibir dosis contagiar hora recibir perder batalla mil persona dudando vacuna responsable ,19.2970107,-99.2058092
chingando cansancio vivia malo preguntense carajo vivir cocoo familia fecal ,19.4043522,-99.128294
aguantar gana vacuna recrear coreografia video viernes bailo medio ,19.332316,-98.994694
lleve flor mama llevar vacuna dosis gracias vida ,19.2970107,-99.2058092
compartir experiencia negativo hacer periodismo padre vacuna pasar entrevistada vacuna milpa alto ,19.049016,-99.163354
ridiculo anduviste vacuna hashtage quedate casa ,19.484399,-99.118665
vacuna dormir ,19.3998346,-99.1843501
alcanzo dimensional cansancio fisico emocional regresar clase presencial ,19.0763934,-99.7825792
experiencia rodar pista alfa volver repetir a a valio pena esfuerzo llegar regresar rodar inclemente sol intenso trafico polvareda cansancio santo lucir ,19.382802,-99.154199
berrinche ena preguntar embarazo cervical dosis metotrexato rarisisisisimo consulta ver uso utero reloj arena ,19.444937,-99.180678
pedo vacuna desde ,19.357102,-99.1919955
lleve ine impresion registroexpediente vacuna preguntar hora ,19.357102,-99.1919955
sincero primero dosis pier efecto sentir dosis astrazeneca sentir dolor cabeza temperatura dolor ojo ver borroso dormir querer vomitar perdon critique exageraba ,19.115033,-99.7351564
vacuna rani metete banar ayuda paracetamol ambos vario pego efecto secundario ,19.2970107,-99.2058092
pasar vacuna cuarto dosis regreso agarra aguacero rato bonito noche feliz descanso ,19.232228,-99.324375
llegar vacuna pasar soldado aplaudieron llevar rato esperar pabellon paciencia paciencia pfizer ,19.375769,-99.137171
cancer vejiga recurrente tratamiento pembrolizumab dosis diciembre hospitalizado deshidratacion izquierda tacto derecha ver llegar saturando febril inconsciente ,19.357102,-99.1919955
janssen jugar figura pase anotar amonestan misterio jugar paisbajeno entender ,19.3998346,-99.1843501
feliz haber vacuna querer cantar rola pusieran shakiro astrazeneca lose postracion shakiro ,19.3998346,-99.1843501
ir instagram resolver duda vacuna covid paciente vivir vih ig drjezerlezama ,19.357102,-99.1919955
salir hijo comer animo mesero comensal sol mesa banqueta sensacion verbena llegar primavera vacuna empresario cerrar levantaran perder recuperara ,19.28034994910654,-99.16058998797756
recibas dosis felicidad hermoso noche siento amor dios corazon noche ,19.3668621,-99.067766
pesame oir pregunta vacuna vacuna morbilidad ,19.3998346,-99.1843501
duda vacuna gabinete andar paseando privilegio ,19.412031,-99.413769
hablar querer put ,19.375769,-99.137171
demostrar ineficiencia desinteres gente decepcion ver urna vacuna iztapalapa ,19.2846922,-99.140238
subir foto vacuna ver esperanza duda logro cientifico festejar mostrar mundo entero ,19.087511,-99.315748
mierda deme maldito vacuna volver zanganos ,19.498594,-99.2481811
principio andas lamiendo pata gente alguien tira mierda cansancio risa ,19.2970107,-99.2058092
declarar pandemia sospecha fe covid sentir realmente hacer prueba esperar ue vacuna hacer simple catarro pensar ir invicto decir ,19.444937,-99.180678
noticia recibir dosis vacuna feliz calor insoportable efecto secundario ,19.3863707,-99.259495
esquema completo foto pandemia favor dime botar vaca llamar vacuna jajajajaja ,19.3863707,-99.259495
re bonito monton shot vacuna mayoria paz ,19.3863707,-99.259495
alguien dar brazo torcer gt vacuna gratis camiseta decir ,18.3671046,-100.613313
sentir presion social vacuna ,19.049016,-99.364536
ponte vacuna decir joven fuerte decir pasar decir ,19.3998346,-99.1843501
raro centro vacuna acabar tocar prender foco rojo madre piensenlo contar historia anti ,19.3998346,-99.1843501
dejar manipular miedo tranquilo requerir vacuna ,19.357102,-99.1919955
na mexico raro gente extranar hablar hablas gente fila vacuna taco tianguis generalmente molestar ciudad amigable ,19.456367,-99.221136
cc houston jose ramon lopez entrar casa gris casa gris houston esperar gasolina falta medicamento tratamiento vacuna a a ,19.3863707,-99.259495
ando adolorida nalgas extranaba feeling dolor muscular ,19.3863707,-99.259495
salir error raro plataforma registro vacuna ,19.3998346,-99.1843501
dosis realidad ver ver ,19.375769,-99.137171
solicito dosis apapacho ,19.456367,-99.221136
dosis sentir valido jajajajaja ,19.087511,-99.315748
feliz porque ver novia sad porque vacuna ,19.2970107,-99.2058092
razon sintoma vacuna chivo pegar jajajaja shava ,19.3998346,-99.1843501
huixquilucan vivo cuadras universidad anahuac decir porque vehiculo vacuna pie vacuna pie rumbo super vacuna aplicar ,19.412031,-99.413769
