id,url,date,content,likeCount,retweetCount,replyCount,coordinates,place,latitud,longitud,radio,tweet_tokenizado,palabra_clave
1419057342725951491,https://twitter.com/TROLELLO/status/1419057342725951491,2021-07-24 22:10:09+00:00,@mDamn6 @carlos_COGC @GobCDMX @pfizer @moderna_tx @AstraZeneca Hoy en la mañana. Te recuerdo que está semana que pasó se permitió para que se vacunar a todos los resagados y que no tenía ninguna vacuna mayores de 30 años. Pero ya regresamos al sistema de que solo se vacunan en la alcaldía que resides.,0,0,0,"{'longitude': -99.180678, 'latitude': 19.444937}","{'fullName': 'Gustavo A. Madero, Distrito Federal', 'name': 'Gustavo A. Madero', 'type': 'city', 'country': 'Mexico', 'countryCode': 'MX'}",19.309917325231165,-99.12243737329996,31.28km,"['manana', 'recuerdo', 'semana', 'pasar', 'permitir', 'vacuna', 'rezagados', 'vacuna', 'mayor', 'ano', 'regresamo', 'sistema', 'vacuna', 'alcaldia', 'resides']",vacuna moderna
1419005611451326465,https://twitter.com/AnhuiL8/status/1419005611451326465,2021-07-24 18:44:36+00:00,"Ustedes que todo lo saben ¿debería de vacunarme con la #pfizer ? Ya tengo la AZ.
Una dosis de la vacuna de Pfizer o de Moderna después de una dosis de AztraZeneca provee altos niveles de anticuerpos neutralizantes (más altos que dos dosis de AztraZeneca),",0,0,1,"{'longitude': -99.324375, 'latitude': 19.232228}","{'fullName': 'Álvaro Obregón, Distrito Federal', 'name': 'Álvaro Obregón', 'type': 'city', 'country': 'Mexico', 'countryCode': 'MX'}",19.309917325231165,-99.12243737329996,31.28km,"['deber', 'vacuna', 'pfizer', 'az', 'dosis', 'vacuna', 'pfizer', 'moderna', 'dosis', 'astrazeneca', 'provee', 'alto', 'nivel', 'anticuerpo', 'neutralizante', 'alto', 'dosis', 'astrazeneca']",vacuna moderna
1416840427429376005,https://twitter.com/AlmaRoColibri/status/1416840427429376005,2021-07-18 19:20:56+00:00,La Vacuna de Moderna 💉 contra el Covid19 😷 https://t.co/uT2rzAIAgo,1,0,0,"{'longitude': -99.067766, 'latitude': 19.3668621}","{'fullName': 'Nezahualcóyotl, México', 'name': 'Nezahualcóyotl', 'type': 'city', 'country': 'Mexico', 'countryCode': 'MX'}",19.309917325231165,-99.12243737329996,31.28km,"['vacuna', 'moderna', 'covid']",vacuna moderna
1412833253644328960,https://twitter.com/Padawanmx/status/1412833253644328960,2021-07-07 17:57:51+00:00,"@doctormacias Estimado Doctor, buenas tardes. Si me permite importunarlo, me gustaría saber, por favor, si en mi caso en particular, q fui vacunado con Sputnik (solo 1a dosis), podré vacunarme con otro tipo de vacuna, cómo lPfizer o Moderna, después de completar mi esquema. Muchas gracias.",0,0,1,"{'longitude': -99.259495, 'latitude': 19.3863707}","{'fullName': 'Miguel Hidalgo, Distrito Federal', 'name': 'Miguel Hidalgo', 'type': 'city', 'country': 'Mexico', 'countryCode': 'MX'}",19.309917325231165,-99.12243737329996,31.28km,"['estimado', 'doctor', 'tarde', 'permitir', 'importunar', 'gustar', 'favor', 'caso', 'particular', 'vacuna', 'sputnik', 'dosis', 'poder', 'vacuna', 'tipo', 'vacuna', 'pfizer', 'moderna', 'completar', 'esquema', 'gracias']",vacuna moderna
1409742201458941952,https://twitter.com/GabaMaiden/status/1409742201458941952,2021-06-29 05:15:07+00:00,"La científica Sarah Gilbert 👩‍🔬🧪 recibió por la vacuna AstraZeneca 💉 el Premio Princesa de Asturias de Investigación y Técnica 2021, 🥇al igual que otros seis científicos, 👨‍🔬que desarrollaron las variantes 🧪 de Pfizer/BioNTech y Moderna. 💉 https://t.co/2DQlqWtKyB",0,0,0,"{'longitude': -99.1843501, 'latitude': 19.3998346}","{'fullName': 'Cuauhtémoc, Distrito Federal', 'name': 'Cuauhtémoc', 'type': 'city', 'country': 'Mexico', 'countryCode': 'MX'}",19.309917325231165,-99.12243737329996,31.28km,"['cientifico', 'sarah', 'gilbert', 'recibir', 'vacuna', 'astrazeneca', 'premio', 'princesa', 'astucias', 'investigacion', 'tecnica', 'cientifico', 'desarrollaron', 'variante', 'pfizerbiontech', 'moderna']",vacuna moderna
1409671306816090118,https://twitter.com/JezMex/status/1409671306816090118,2021-06-29 00:33:24+00:00,"Por lo tanto la vacuna: 
-No mata tus células 
-No modifica tu DNA
- la proteína spike que se produce por la vacuna de Pfizer o Moderna, es diferente a la que tiene el SARS COV-2 

LAS VACUNAS SON SEGURAS 3/",7,2,1,"{'longitude': -99.1843501, 'latitude': 19.3998346}","{'fullName': 'Cuauhtémoc, Distrito Federal', 'name': 'Cuauhtémoc', 'type': 'city', 'country': 'Mexico', 'countryCode': 'MX'}",19.309917325231165,-99.12243737329996,31.28km,"['vacuna', 'matar', 'celula', 'modifica', 'dna', 'proteina', 'spike', 'producir', 'vacuna', 'pfizer', 'moderna', 'sars', 'cov', 'vacuna', 'seguro']",vacuna moderna
1407418054976458754,https://twitter.com/edersio/status/1407418054976458754,2021-06-22 19:19:47+00:00,Mi fantasía sería que me pusieran la vacuna Moderna así como yo. 💅🏻 aysi La Moderna ni llegó a México ☹️,4,0,2,"{'longitude': -99.259495, 'latitude': 19.3863707}","{'fullName': 'Miguel Hidalgo, Distrito Federal', 'name': 'Miguel Hidalgo', 'type': 'city', 'country': 'Mexico', 'countryCode': 'MX'}",19.309917325231165,-99.12243737329996,31.28km,"['fantasia', 'pusieran', 'vacuna', 'moderna', 'asi', 'moderna', 'mexico']",vacuna moderna
1395382033703178241,https://twitter.com/CruzieFer/status/1395382033703178241,2021-05-20 14:12:56+00:00,"El requisito es tener la vacuna de Pfizer, Moderna, AstraZeneca o Johnson &amp; Johnson.
Las vacunas CanSino y Sputnik aún no están aprobadas por la EMA, entonces los turistas que hayan recibido estas dosis deben esperar —a menos que alguno de los 27 países europeos decida incluirlas https://t.co/08WUnSXfAb",1,0,0,"{'longitude': -99.180678, 'latitude': 19.444937}","{'fullName': 'Gustavo A. Madero, Distrito Federal', 'name': 'Gustavo A. Madero', 'type': 'city', 'country': 'Mexico', 'countryCode': 'MX'}",19.309917325231165,-99.12243737329996,31.28km,"['requisito', 'vacuna', 'pfizer', 'moderna', 'astrazeneca', 'amp', 'vacuna', 'cansino', 'sputnik', 'aprobado', 'eme', 'turista', 'recibir', 'dosis', 'esperar', 'pais', 'europeo', 'decidir', 'incluir']",vacuna moderna
1372979948609269771,https://twitter.com/kutziquetzal/status/1372979948609269771,2021-03-19 18:35:03+00:00,"A mi papá le pusieron su primera dosis de la vacuna ""Moderna"" y pues estoy muy feliz ❤️",3,0,0,"{'longitude': -99.259495, 'latitude': 19.3863707}","{'fullName': 'Miguel Hidalgo, Distrito Federal', 'name': 'Miguel Hidalgo', 'type': 'city', 'country': 'Mexico', 'countryCode': 'MX'}",19.309917325231165,-99.12243737329996,31.28km,"['papa', 'poner', 'dosis', 'vacuna', 'moderna', 'feliz']",vacuna moderna
1371864099387289600,https://twitter.com/LuzMari40455582/status/1371864099387289600,2021-03-16 16:41:03+00:00,"Moderna inicia las pruebas de su vacuna en niños y bebés desde los 6 meses de edad - RT
Solo los padres ignorantes y que no quieren a sus hijos van a permitir esta aberración https://t.co/B1uExO7g8h",0,0,0,"{'longitude': -99.2058092, 'latitude': 19.2970107}","{'fullName': 'Coyoacán, Distrito Federal', 'name': 'Coyoacán', 'type': 'city', 'country': 'Mexico', 'countryCode': 'MX'}",19.309917325231165,-99.12243737329996,31.28km,"['moderna', 'iniciar', 'prueba', 'vacuna', 'nino', 'bebe', 'mes', 'edad', 'rt', 'padre', 'ignorante', 'querer', 'hijo', 'permitir', 'aberracion']",vacuna moderna
1364411858145349633,https://twitter.com/renealonso05/status/1364411858145349633,2021-02-24 03:08:31+00:00,Achis apoco moderna hizo una vacuna contra el COVID 🤔 Pensé que nomas hacían pastas y sopas,3,0,1,"{'longitude': -99.6470277, 'latitude': 19.2156239}","{'fullName': 'Metepec, México', 'name': 'Metepec', 'type': 'city', 'country': 'Mexico', 'countryCode': 'MX'}",19.309917325231165,-99.12243737329996,31.28km,"['chis', 'apoco', 'moderna', 'vacuna', 'covid', 'pensar', 'nomo', 'hacer', 'pasto', 'sopa']",vacuna moderna
1362101993632849922,https://twitter.com/IngManuelMunozG/status/1362101993632849922,2021-02-17 18:09:56+00:00,La UE se va por la mejor vacuna y compra 300 millones de Moderna .,2,1,0,"{'longitude': -99.259495, 'latitude': 19.3863707}","{'fullName': 'Miguel Hidalgo, Distrito Federal', 'name': 'Miguel Hidalgo', 'type': 'city', 'country': 'Mexico', 'countryCode': 'MX'}",19.309917325231165,-99.12243737329996,31.28km,"['ue', 'vacuna', 'compra', 'millon', 'moderna']",vacuna moderna
1358860324959621120,https://twitter.com/IngManuelMunozG/status/1358860324959621120,2021-02-08 19:28:42+00:00,"@IngManuelMunozG  Moderna la mejor vacuna , una compañía llena de juventud e ideas la vacuna de COVID 19 es nada comparado a lo que tiene en la panza .",2,0,0,"{'longitude': -99.259495, 'latitude': 19.3863707}","{'fullName': 'Miguel Hidalgo, Distrito Federal', 'name': 'Miguel Hidalgo', 'type': 'city', 'country': 'Mexico', 'countryCode': 'MX'}",19.309917325231165,-99.12243737329996,31.28km,"['moderna', 'vacuna', 'compania', 'lleno', 'juventud', 'idea', 'vacuna', 'covid', 'comparado', 'panza']",vacuna moderna
1354812294417420288,https://twitter.com/DrHectorHdez/status/1354812294417420288,2021-01-28 15:23:16+00:00,"@doctormosqueda Doc, en caso de negarse a la aplicación de una vacuna, se tendría otra oportunidad en caso de haber de otro laboratorio?P. ej. Negarse a pfizer y preferir moderna?",0,0,0,"{'longitude': -99.315748, 'latitude': 19.087511}","{'fullName': 'Tlalpan, Distrito Federal', 'name': 'Tlalpan', 'type': 'city', 'country': 'Mexico', 'countryCode': 'MX'}",19.309917325231165,-99.12243737329996,31.28km,"['doc', 'caso', 'negar', 'aplicacion', 'vacuna', 'oportunidad', 'caso', 'laboratorio', 'ej', 'negar', 'pfizer', 'preferir', 'moderna']",vacuna moderna
1354594317671792642,https://twitter.com/SofiaSrivera/status/1354594317671792642,2021-01-28 00:57:07+00:00,"@JoseCardenas1 buenas tardes, el gobierno extinguió fideicomisos para obtener recursos para la salud, si deben tener dinero para comprar la vacuna de moderna.",0,0,0,"{'longitude': -99.128294, 'latitude': 19.4043522}","{'fullName': 'Venustiano Carranza, Distrito Federal', 'name': 'Venustiano Carranza', 'type': 'city', 'country': 'Mexico', 'countryCode': 'MX'}",19.309917325231165,-99.12243737329996,31.28km,"['tarde', 'gobierno', 'extinguio', 'fideicomiso', 'obtener', 'recurso', 'salud', 'dinero', 'comprar', 'vacuna', 'moderna']",vacuna moderna
1342655927569297408,https://twitter.com/DrJorgeLara/status/1342655927569297408,2020-12-26 02:18:13+00:00,@CarlitoS_lim @virdman6 @EKikin2101 Moderna es laboratorio en USA. El al Dr Fauci se le aplicó esa vacuna.,0,0,0,"{'longitude': -99.413769, 'latitude': 19.412031}","{'fullName': 'Naucalpan de Juárez, México', 'name': 'Naucalpan de Juárez', 'type': 'city', 'country': 'Mexico', 'countryCode': 'MX'}",19.309917325231165,-99.12243737329996,31.28km,"['moderna', 'laboratorio', 'doctor', 'faci', 'aplicar', 'vacuna']",vacuna moderna
