id,url,date,content,likeCount,retweetCount,replyCount,coordinates,place,latitud,longitud,radio,tweet_tokenizado,palabra_clave
1.54474E+18,https://twitter.com/Felipecardolo/status/1544740658199543808,2022-07-06 17:50:47+00:00,"@MarcelaSaebL @SSalud_mx No cometan el gran error de vacunar a las niñas y niños ¡No es NO! 
Ya lo dijo el propio Secretario de Salud federal: ""Yo no vacunaría a mis nietos, porque los menores tienen un excelente sistema inmunológico..""",0,0,0,"{'longitude': -99.128294, 'latitude': 19.4043522}","{'fullName': 'Venustiano Carranza, Distrito Federal', 'name': 'Venustiano Carranza', 'type': 'city', 'country': 'Mexico', 'countryCode': 'MX'}",19.30991733,-99.12243737,31.28km,"['cometan', 'error', 'vacuna', 'nina', 'nino', 'secretario', 'salud', 'federal', 'vacuna', 'nieto', 'menor', 'excelente', 'sistema', 'inmunologico']",vacunaria
1.48248E+18,https://twitter.com/Elhij0deltrueno/status/1482484461853892613,2022-01-15 22:46:53+00:00,@rafasanchezbal @MissRavenPliss @Faitelson_ESPN ¿Y por qué alguien que cree en las vacunas no se vacunaria? 🤦🏽‍♂️🤯 Neta usen la lógica. Bye ya me hartó este sin sentido,5,0,4,"{'longitude': -99.221136, 'latitude': 19.456367}","{'fullName': 'Azcapotzalco, Distrito Federal', 'name': 'Azcapotzalco', 'type': 'city', 'country': 'Mexico', 'countryCode': 'MX'}",19.30991733,-99.12243737,31.28km,"['alguien', 'creer', 'vacuna', 'vacuna', 'neta', 'usen', 'logico', 'bye', 'harto']",vacunaria
1.45971E+18,https://twitter.com/clautr77/status/1459710913888595968,2021-11-14 02:32:56+00:00,"@pratelly El presidente no usa cubrebocas ""porque no hay evidencia científica de su utilidad""😶Solo en USA se lo puso.  Y este señor no quiere vacunar de 12  a 17 porque ""tampoco hay evidencia científica"" hasta el secretario de salud declaró  ""Yo no vacunaría a mis nietos"" Son palurdos.",1,0,0,"{'longitude': -99.2058092, 'latitude': 19.2970107}","{'fullName': 'Coyoacán, Distrito Federal', 'name': 'Coyoacán', 'type': 'city', 'country': 'Mexico', 'countryCode': 'MX'}",19.30991733,-99.12243737,31.28km,"['presidente', 'cubrebocas', 'evidencia', 'cientifico', 'utilidadsolo', 'poner', 'senor', 'vacuna', 'evidencia', 'cientifico', 'secretario', 'salud', 'declarar', 'vacuna', 'nieto', 'palurdo']",vacunaria
1.42906E+18,https://twitter.com/IriarteFernando/status/1429057363605180417,2021-08-21 12:26:40+00:00,Veo un chingo de publicaciones diciendo vacúnate y Me vacunaría si estuvieran vacunando a los de mi edad en Ecatepec 🙄🙄🙄🙄 https://t.co/XJ5ARzSf0V,0,0,0,"{'longitude': -99.1843501, 'latitude': 19.3998346}","{'fullName': 'Cuauhtémoc, Distrito Federal', 'name': 'Cuauhtémoc', 'type': 'city', 'country': 'Mexico', 'countryCode': 'MX'}",19.30991733,-99.12243737,31.28km,"['ver', 'chingo', 'publicacion', 'decir', 'vacante', 'vacuna', 'vacunando', 'edad', 'ecatepec']",vacunaria
1.41736E+18,https://twitter.com/Feroz73/status/1417362770853457927,2021-07-20 05:56:32+00:00,"@SinEmbargoMX Si con los datos de febrero yo me vacunaría en 153 años Hoy estoy esperando la 2da dosis, no debería funcionar un gobierno a periodicazos pero ni modo hoy así lo es..",0,1,0,"{'longitude': -100.613313, 'latitude': 18.3671046}","{'fullName': 'Mexico', 'name': 'Mexico', 'type': 'admin', 'country': 'Mexico', 'countryCode': 'MX'}",19.30991733,-99.12243737,31.28km,"['dato', 'febrero', 'vacuna', 'ano', 'esperar', 'dosis', 'deber', 'funcionar', 'gobierno', 'periodico']",vacunaria
1.41641E+18,https://twitter.com/AngelLo21936473/status/1416410705444720642,2021-07-17 14:53:22+00:00,"@lizsanchez200 Solo cuidate nena, yo no me e vacunado, se me paso lo fe ha pero ps hay que intentar o cuidarde lo mejor posible.. Y ps por otro lado yo te vacunaria bizcocho..",0,0,0,"{'longitude': -98.91272, 'latitude': 19.550567}","{'fullName': 'Chiconcuac, México', 'name': 'Chiconcuac', 'type': 'city', 'country': 'Mexico', 'countryCode': 'MX'}",19.30991733,-99.12243737,31.28km,"['cuidate', 'nena', 'vacuna', 'paso', 'fe', 'cuidar', 'tu', 'vacuna', 'bizcocho']",vacunaria
1.40122E+18,https://twitter.com/el_Barto__/status/1401220037160189952,2021-06-05 16:51:04+00:00,"@garciabanchs Un amigo mío me dijo que no se vacunaría porque leyó a don García.

Ya de murió...",0,0,0,"{'longitude': -99.1919955, 'latitude': 19.357102}","{'fullName': 'Benito Juárez, Distrito Federal', 'name': 'Benito Juárez', 'type': 'city', 'country': 'Mexico', 'countryCode': 'MX'}",19.30991733,-99.12243737,31.28km,"['amigo', 'vacuna', 'leer', 'don', 'garcia', 'morir']",vacunaria
1.39588E+18,https://twitter.com/calatabolinaga/status/1395875022162509825,2021-05-21 22:51:54+00:00,"@AlmaZep76582501 @abrahamendieta @EskilVieyra Sí, decían que hasta el 2134 se vacunaria a toda la población y en septiembre y octubre empiezan con los de 18 años. Es decir, con los últimos de la fila. Ahora, si nos estás satisfecha vete a EEUU a vacunar y quédate por allá.",8,0,1,"{'longitude': -99.330259, 'latitude': 19.51799}","{'fullName': 'Atizapán de Zaragoza, México', 'name': 'Atizapán de Zaragoza', 'type': 'city', 'country': 'Mexico', 'countryCode': 'MX'}",19.30991733,-99.12243737,31.28km,"['decir', 'vacuna', 'poblacion', 'septiembre', 'octubre', 'empezar', 'ano', 'fila', 'satisfecho', 'vete', 'eeuu', 'vacuna', 'quedate']",vacunaria
1.39523E+18,https://twitter.com/itsamadorvega/status/1395230017316065280,2021-05-20 04:08:52+00:00,"Me preguntaron que si en mi próximo viaje a Las Vegas me vacunaría. Mi respuesta fue un rotundo no, esperare mi turno aquí en mi país. 

Por congruencia y por confianza y respaldo a nuestro gobierno 😎❤️",1,0,0,"{'longitude': -99.1843501, 'latitude': 19.3998346}","{'fullName': 'Cuauhtémoc, Distrito Federal', 'name': 'Cuauhtémoc', 'type': 'city', 'country': 'Mexico', 'countryCode': 'MX'}",19.30991733,-99.12243737,31.28km,"['preguntar', 'viaje', 'vegas', 'vacuna', 'respuesta', 'rotundo', 'esperare', 'turno', 'pais', 'congruencia', 'confianza', 'respaldo', 'gobierno']",vacunaria
1.37947E+18,https://twitter.com/JesusLujanoHer1/status/1379470086155685888,2021-04-06 16:24:32+00:00,"@Pajaropolitico @lopezobrador_ Se ve que o eres sordo o no sabes leer, AMLO dijo que se vacunaria más adelante porque tenía muchos anticuerpos. Nunca dijo que no lo haría, eso inventaron los neoliberales y chayoteros",0,0,0,"{'longitude': -99.128294, 'latitude': 19.4043522}","{'fullName': 'Venustiano Carranza, Distrito Federal', 'name': 'Venustiano Carranza', 'type': 'city', 'country': 'Mexico', 'countryCode': 'MX'}",19.30991733,-99.12243737,31.28km,"['ver', 'sordo', 'leer', 'malo', 'vacuna', 'anticuerpo', 'hacer', 'inventar', 'neoliberales', 'chayote']",vacunaria
1.37885E+18,https://twitter.com/gordodx/status/1378847339440435201,2021-04-04 23:09:58+00:00,"Yo lo escribí hace días, en un vídeo claramente una señora le decía a la mujer que la vacunaría que la geringa estaba vacía.
Hoy se confirma (desgraciadamente)",2,0,1,"{'longitude': -99.259495, 'latitude': 19.3863707}","{'fullName': 'Miguel Hidalgo, Distrito Federal', 'name': 'Miguel Hidalgo', 'type': 'city', 'country': 'Mexico', 'countryCode': 'MX'}",19.30991733,-99.12243737,31.28km,"['escribir', 'video', 'claramente', 'senora', 'decir', 'mujer', 'vacuna', 'jeringa', 'vacio', 'confirmar', 'desgraciadamente']",vacunaria
1.37489E+18,https://twitter.com/LuzMari40455582/status/1374885027834642433,2021-03-25 00:45:09+00:00,"https://t.co/wGjydTAgIB
Qué bueno que rectificó, esta farsa ya no se sostiene, si en verdad el bicho fuese tan letal, las vacunas no se desperdiciarian en ancianos, se vacunaria a todo la sociedad sin restricción alguna",0,0,0,"{'longitude': -99.2058092, 'latitude': 19.2970107}","{'fullName': 'Coyoacán, Distrito Federal', 'name': 'Coyoacán', 'type': 'city', 'country': 'Mexico', 'countryCode': 'MX'}",19.30991733,-99.12243737,31.28km,"['rectificar', 'farsa', 'sostener', 'bicho', 'letal', 'vacuna', 'desperdiciaran', 'anciano', 'vacuna', 'sociedad', 'restriccion']",vacunaria
1.37379E+18,https://twitter.com/betitoKochiloko/status/1373787487949176836,2021-03-22 00:03:55+00:00,"@Milenio Si Yo tuviera oportunidad de ir a USA también me vacunaria, aquí en México se preocupan más por un aeropuerto y por un tren, nuestro gobierno está de la chingada¡¡¡",11,0,3,"{'longitude': -99.259495, 'latitude': 19.3863707}","{'fullName': 'Miguel Hidalgo, Distrito Federal', 'name': 'Miguel Hidalgo', 'type': 'city', 'country': 'Mexico', 'countryCode': 'MX'}",19.30991733,-99.12243737,31.28km,"['oportunidad', 'vacuna', 'mexico', 'preocupar', 'aeropuerto', 'tren', 'gobierno', 'chingada']",vacunaria
1.36372E+18,https://twitter.com/LaRocko/status/1363720797794271233,2021-02-22 05:22:29+00:00,@eleconomista Qué no #AMLO dijo que vacunaría a todos antes que a los mexicanos?,0,0,0,"{'longitude': -99.259495, 'latitude': 19.3863707}","{'fullName': 'Miguel Hidalgo, Distrito Federal', 'name': 'Miguel Hidalgo', 'type': 'city', 'country': 'Mexico', 'countryCode': 'MX'}",19.30991733,-99.12243737,31.28km,"['vacuna', 'mexicano']",vacunaria
1.36278E+18,https://twitter.com/chefyogui/status/1362782819399966723,2021-02-19 15:15:18+00:00,"Un chupe 🍹 por una vacuna contra #COVID19 en #Israel  
Urge que @Corona_MX o @Heineken_MX o  @CervezaSol tomen las mismas medidas aquí ¿no creen? seguro se vacunaría más rápido a todo México 😉🍻 #FelizViernes 

https://t.co/xuXNFcuAuE",1,0,0,"{'longitude': -99.1919955, 'latitude': 19.357102}","{'fullName': 'Benito Juárez, Distrito Federal', 'name': 'Benito Juárez', 'type': 'city', 'country': 'Mexico', 'countryCode': 'MX'}",19.30991733,-99.12243737,31.28km,"['chupe', 'vacuna', 'israel', 'urge', 'tomar', 'medida', 'creer', 'seguro', 'vacuna', 'rapido', 'mexico', 'feliz', 'viernes']",vacunaria
1.36153E+18,https://twitter.com/IvanButi/status/1361533180172505088,2021-02-16 04:29:40+00:00,Pensé que se vacunaria en EEUU. asi no hacia filas https://t.co/zIno2E75l8,0,0,0,"{'longitude': -99.324375, 'latitude': 19.232228}","{'fullName': 'Álvaro Obregón, Distrito Federal', 'name': 'Álvaro Obregón', 'type': 'city', 'country': 'Mexico', 'countryCode': 'MX'}",19.30991733,-99.12243737,31.28km,"['pensar', 'vacuna', 'eeuu', 'fila']",vacunaria
1.36107E+18,https://twitter.com/IvanButi/status/1361073800008380416,2021-02-14 22:04:16+00:00,Por un momento pensé que usted era de los que se vacunaria en los Estados Unidos https://t.co/xY8lHqG1Tn,0,0,0,"{'longitude': -99.324375, 'latitude': 19.232228}","{'fullName': 'Álvaro Obregón, Distrito Federal', 'name': 'Álvaro Obregón', 'type': 'city', 'country': 'Mexico', 'countryCode': 'MX'}",19.30991733,-99.12243737,31.28km,"['pensar', 'vacuna', 'unido']",vacunaria
1.35758E+18,https://twitter.com/CESARRULFO/status/1357576212097470464,2021-02-05 06:26:06+00:00,"@irmoralesl Pinche Lechuguita mentiroso ,eres una mierda inventando esta mentira ,demuestra que Putin dijo que no  se vacunaria pir qye no sirve para mayores de 60.",0,0,0,"{'longitude': -99.0693801, 'latitude': 19.198192}","{'fullName': 'Tláhuac, Distrito Federal', 'name': 'Tláhuac', 'type': 'city', 'country': 'Mexico', 'countryCode': 'MX'}",19.30991733,-99.12243737,31.28km,"['pinche', 'lechuguita', 'mentiroso', 'mierda', 'inventando', 'mentira', 'demostrar', 'putin', 'vacuna', 'por', 'qye', 'servir', 'mayor']",vacunaria
1.35737E+18,https://twitter.com/FRANCISCOGARC82/status/1357366642540486657,2021-02-04 16:33:20+00:00,"En Francia , Alemania y Estados Unidos un cuarto de la población no se vacunaria contra el Covid según encuesta , debido a desconfianza en sus gobernantes y se agudiza en los jóvenes : y en México cómo andamos ? Vía @guardian https://t.co/YxkxbBMJwD",2,1,1,"{'longitude': -99.140238, 'latitude': 19.2846922}","{'fullName': 'Iztapalapa, Distrito Federal', 'name': 'Iztapalapa', 'type': 'city', 'country': 'Mexico', 'countryCode': 'MX'}",19.30991733,-99.12243737,31.28km,"['francia', 'alemania', 'unido', 'cuarto', 'poblacion', 'vacuna', 'covid', 'encuesta', 'desconfianza', 'gobernante', 'agudiza', 'joven', 'mexico', 'andamos', 'via']",vacunaria
1.35596E+18,https://twitter.com/twitta0/status/1355961445477875713,2021-01-31 19:29:35+00:00,"@jorgezepedap A mi me hablaron para preguntar si sí me vacunaría y si yo podría acudir al módulo...
Y que ellos me hablarían. Yo confío en que así lo harán.",4,0,1,"{'longitude': -99.2058092, 'latitude': 19.2970107}","{'fullName': 'Coyoacán, Distrito Federal', 'name': 'Coyoacán', 'type': 'city', 'country': 'Mexico', 'countryCode': 'MX'}",19.30991733,-99.12243737,31.28km,"['hablar', 'preguntar', 'vacuna', 'acudir', 'modulo', 'hablarian', 'confiar', 'hacer']",vacunaria
1.35528E+18,https://twitter.com/cancerbero_real/status/1355281753699659790,2021-01-29 22:28:44+00:00,Vacunación covid-19. Nuevo León vacunaría a 3.8 millones https://t.co/J6XnrAadPL,0,0,0,"{'longitude': -99.2058092, 'latitude': 19.2970107}","{'fullName': 'Coyoacán, Distrito Federal', 'name': 'Coyoacán', 'type': 'city', 'country': 'Mexico', 'countryCode': 'MX'}",19.30991733,-99.12243737,31.28km,"['vacuna', 'covid', 'leon', 'vacuna', 'millon']",vacunaria
1.35513E+18,https://twitter.com/GabrielMesaMed1/status/1355130959969005569,2021-01-29 12:29:32+00:00,"Ahí andaba pregonando su deshonestidad y hasta echando culpas a México, cuando se dijo claramente cómo se vacunaría en prioridades de riesgo de contagiarse y hasta perder la vida y él no estaba en la primera línea, ya que no es médico y cuidando enfermos por COVID-19. https://t.co/wnN5yiPpOv",0,0,0,"{'longitude': -99.137171, 'latitude': 19.375769}","{'fullName': 'Iztacalco, Distrito Federal', 'name': 'Iztacalco', 'type': 'city', 'country': 'Mexico', 'countryCode': 'MX'}",19.30991733,-99.12243737,31.28km,"['andar', 'pregonar', 'deshonestidad', 'echar', 'culpa', 'mexico', 'claramente', 'vacuna', 'prioridad', 'riesgo', 'contagiar', 'perder', 'vida', 'linea', 'medico', 'cuidando', 'enfermo', 'covid']",vacunaria
1.355E+18,https://twitter.com/RaquelVill18/status/1354997313488347138,2021-01-29 03:38:28+00:00,@marthadebayle Si me vacunaria y esperaré  mi turno porque si viajo no vaya a ser que me quiten la visa me multen y ya no me quieran vacunar después jajaja 😜🥴🤣,0,0,0,"{'longitude': -99.140238, 'latitude': 19.2846922}","{'fullName': 'Iztapalapa, Distrito Federal', 'name': 'Iztapalapa', 'type': 'city', 'country': 'Mexico', 'countryCode': 'MX'}",19.30991733,-99.12243737,31.28km,"['vacuna', 'esperare', 'turno', 'viajo', 'quitar', 'visa', 'multen', 'querer', 'vacuna', 'jajaja']",vacunaria
1.35491E+18,https://twitter.com/supermarco68/status/1354905532352618498,2021-01-28 21:33:46+00:00,"@marthadebayle Obvio me vacunaría ... eso no queda en duda .. si fuera tan fácil viajaría ... pero no es así, así que ni modo hast que me toque ... si y perdimos un año que más da otros meses.. agobio !! ninguno ... la pandemia es lo que me agobia",0,0,0,"{'longitude': -99.324375, 'latitude': 19.232228}","{'fullName': 'Álvaro Obregón, Distrito Federal', 'name': 'Álvaro Obregón', 'type': 'city', 'country': 'Mexico', 'countryCode': 'MX'}",19.30991733,-99.12243737,31.28km,"['obvio', 'vacuna', 'quedar', 'duda', 'facil', 'viajaria', 'hast', 'toque', 'perder', 'ano', 'mes', 'agobio', 'pandemia', 'agobiar']",vacunaria
1.35462E+18,https://twitter.com/Moisesperam75/status/1354616572984369152,2021-01-28 02:25:33+00:00,@ArturoErdely ☝️☝️ laboro en INSalud y no han vacunado a todo el personal clínico y no me vacunaría hasta saber que ya todos los clínicos han sido vacunados y también tengo familia y mi madre de 70 años cuida a mi hija por trabájanos todos los días durante la pandemia. Soy #AdministrativoSalud,5,1,0,"{'longitude': -99.315748, 'latitude': 19.087511}","{'fullName': 'Tlalpan, Distrito Federal', 'name': 'Tlalpan', 'type': 'city', 'country': 'Mexico', 'countryCode': 'MX'}",19.30991733,-99.12243737,31.28km,"['labor', 'isalud', 'vacuna', 'personal', 'clinico', 'vacuna', 'clinico', 'vacuna', 'familia', 'madre', 'ano', 'cuidar', 'hija', 'trabajar', 'pandemia', 'administrativo', 'salud']",vacunaria
1.3517E+18,https://twitter.com/twitta0/status/1351703884637499398,2021-01-20 01:31:34+00:00,"Hoy me hablaron del programa “Bienestar” de la Cdmx para preguntarme que si me vacunaría contra Covid y que si podría asistir al módulo. Dije que si. Me dijo que me volverían a llamar. Vaya, Vaya...soy del grupo vulnerable...",1,0,0,"{'longitude': -99.2058092, 'latitude': 19.2970107}","{'fullName': 'Coyoacán, Distrito Federal', 'name': 'Coyoacán', 'type': 'city', 'country': 'Mexico', 'countryCode': 'MX'}",19.30991733,-99.12243737,31.28km,"['hablar', 'programa', 'bienestar', 'como', 'preguntar', 'vacuna', 'covid', 'asistir', 'modulo', 'decir', 'volverian', 'llamar', 'vayas', 'grupo', 'vulnerable']",vacunaria
1.34912E+18,https://twitter.com/cecicaceresfox/status/1349118162076241921,2021-01-12 22:16:49+00:00,Acabo de escuchar un comercial en la radio que decía que el partido Morena iba a destinar fondos a la compra de vacunas y daba a entender que gracias a ellos se vacunaría a más gente. No que no se iba a politizar la vacunación? Son un asco! #MorenaFuera #MorenaLaPandemiaDeMexico,1,1,0,"{'longitude': -99.1919955, 'latitude': 19.357102}","{'fullName': 'Benito Juárez, Distrito Federal', 'name': 'Benito Juárez', 'type': 'city', 'country': 'Mexico', 'countryCode': 'MX'}",19.30991733,-99.12243737,31.28km,"['acabar', 'escuchar', 'comercial', 'radio', 'decir', 'partido', 'morena', 'ir', 'destinar', 'fondo', 'compra', 'vacuna', 'dar', 'entender', 'gracias', 'vacuna', 'gente', 'ir', 'politizar', 'vacuna', 'asco', 'morena', 'morena', 'pandemia', 'mexico']",vacunaria
1.34778E+18,https://twitter.com/ChibyNavy/status/1347779634012672000,2021-01-09 05:37:59+00:00,"@HectorYunes La ignorancia es atrevida,se vacunan pocos porque hasta ahora han llegado 55.000 luego llegarán lotes de muchos miles más. Lástima que Javier Duarte esté en la cárcel, porque el si vacunaria rápido a todo el país,con agua pero sería rápido. https://t.co/tw3hg1Uwd9",0,0,0,"{'longitude': -99.221136, 'latitude': 19.456367}","{'fullName': 'Azcapotzalco, Distrito Federal', 'name': 'Azcapotzalco', 'type': 'city', 'country': 'Mexico', 'countryCode': 'MX'}",19.30991733,-99.12243737,31.28km,"['ignorancia', 'atrevida', 'vacuna', 'llegar', 'llegar', 'lote', 'mil', 'lastimo', 'javier', 'darte', 'carcel', 'vacuna', 'rapido', 'pasion', 'agua', 'rapido']",vacunaria
1.3466E+18,https://twitter.com/ricramt2010/status/1346595666315915264,2021-01-05 23:13:20+00:00,"@Viri_Rios No dijo eso Amlo, comentó que se vacunaría en ciudades y que a los que no concurrieran los irían a buscar a sus casas aunque fuera difícil de acceder",0,0,0,"{'longitude': -99.324375, 'latitude': 19.232228}","{'fullName': 'Álvaro Obregón, Distrito Federal', 'name': 'Álvaro Obregón', 'type': 'city', 'country': 'Mexico', 'countryCode': 'MX'}",19.30991733,-99.12243737,31.28km,"['malo', 'vacuna', 'ciudad', 'ocurrieran', 'irian', 'buscar', 'casa', 'dificil', 'acceder']",vacunaria
1.34447E+18,https://twitter.com/ZeroAlva/status/1344473815884079104,2020-12-31 02:41:51+00:00,@DrNetas @mario_delgado Con que done su presupuesto de maquillaje y operaciones estéticas se vacunaria a dos o tres alcaldias,0,0,0,"{'longitude': -99.0693801, 'latitude': 19.198192}","{'fullName': 'Tláhuac, Distrito Federal', 'name': 'Tláhuac', 'type': 'city', 'country': 'Mexico', 'countryCode': 'MX'}",19.30991733,-99.12243737,31.28km,"['done', 'presupuesto', 'maquillaje', 'operacion', 'estetica', 'vacuna', 'alcaldia']",vacunaria
