id,url,date,content,likeCount,retweetCount,replyCount,coordinates,place,latitud,longitud,radio,tweet_tokenizado,palabra_clave
1556481035805892609,https://twitter.com/TROLELLO/status/1556481035805892609,2022-08-08 03:22:51+00:00,"@HuertaVertiz @SSaludCdMx No 

Cansino equivale a 2 dosis de Astra Sputnik o Pfaizer.
Más moderna ya tiene su vacuna más su dosis de refuerzo.

Una segundo Refuerzo solamente para mayores de 60 años, y de 18 a 59 años demostrando que tienen una enfermedad cormobil. https://t.co/fjSSNIg6TL",2,0,1,"{'longitude': -99.180678, 'latitude': 19.444937}","{'fullName': 'Gustavo A. Madero, Distrito Federal', 'name': 'Gustavo A. Madero', 'type': 'city', 'country': 'Mexico', 'countryCode': 'MX'}",19.309917325231165,-99.12243737329996,31.28km,"['cansino', 'equivaler', 'dosis', 'astrazeneca', 'sputnik', 'pfizer', 'moderna', 'vacuna', 'dosis', 'refuerzo', 'refuerzo', 'mayor', 'ano', 'ano', 'demostrar', 'enfermedad', 'cormobil']",vacuna moderna
1551374677578321921,https://twitter.com/TROLELLO/status/1551374677578321921,2022-07-25 01:12:00+00:00,"@FreshmDexia @SSaludCdMx Lamentablemente la respuesta es NO. Pfaizer por ser la única vacuna autorizada para menores de 18 años, se reservo única y exclusivamente para ellos.y no hay Moderna no J&amp;J.",0,0,0,"{'longitude': -99.128294, 'latitude': 19.4043522}","{'fullName': 'Venustiano Carranza, Distrito Federal', 'name': 'Venustiano Carranza', 'type': 'city', 'country': 'Mexico', 'countryCode': 'MX'}",19.309917325231165,-99.12243737329996,31.28km,"['lamentablemente', 'respuesta', 'pfizer', 'unico', 'vacuna', 'autorizado', 'menor', 'ano', 'reservo', 'unico', 'exclusivamente', 'moderna', 'campo']",vacuna moderna
1549840342224175104,https://twitter.com/TROLELLO/status/1549840342224175104,2022-07-20 19:35:06+00:00,"@Margari37719601 @SSaludCdMx No por que ya tienen vacuna y refuerzo. Cansino equivale a dos dosis de Sputnik, Pfaizer y/o Astra, y moderna fue la dosis es refuerzo, por o que ya tienes el equivalente a 3 dosis.",0,0,0,"{'longitude': -99.259495, 'latitude': 19.3863707}","{'fullName': 'Miguel Hidalgo, Distrito Federal', 'name': 'Miguel Hidalgo', 'type': 'city', 'country': 'Mexico', 'countryCode': 'MX'}",19.309917325231165,-99.12243737329996,31.28km,"['vacuna', 'refuerzo', 'cansino', 'equivaler', 'dosis', 'sputnik', 'pfizer', 'astrazeneca', 'moderna', 'dosis', 'refuerzo', 'equivalente', 'dosis']",vacuna moderna
1548813109896196097,https://twitter.com/TROLELLO/status/1548813109896196097,2022-07-17 23:33:15+00:00,"@Aviito @SSaludCdMx Así que te conviene vacunarte con Cansino, que a diferencia de Pfaizer, Astra, y Sputnik es de una sola dosis, así ya tienes vacuna y moderna como refuerzo.",0,0,0,"{'longitude': -99.324375, 'latitude': 19.232228}","{'fullName': 'Álvaro Obregón, Distrito Federal', 'name': 'Álvaro Obregón', 'type': 'city', 'country': 'Mexico', 'countryCode': 'MX'}",19.309917325231165,-99.12243737329996,31.28km,"['convenir', 'vacuna', 'tu', 'cansino', 'diferencia', 'pfizer', 'astrazeneca', 'sputnik', 'dosis', 'vacuna', 'moderna', 'refuerzo']",vacuna moderna
1548802132299612160,https://twitter.com/TROLELLO/status/1548802132299612160,2022-07-17 22:49:38+00:00,"@KarlaGyG @SSaludCdMx Ya tienes vacuna y refuerzo. Es decir Pfaizer, Astra, Sputnik, la vacuna se divide en dos dosis, Casino en una. Por lo que + moderna ya tienes vacuna y refuerzo.",2,0,1,"{'longitude': -99.4974926, 'latitude': 19.206011}","{'fullName': 'Ocoyoacac, México', 'name': 'Ocoyoacac', 'type': 'city', 'country': 'Mexico', 'countryCode': 'MX'}",19.309917325231165,-99.12243737329996,31.28km,"['vacuna', 'refuerzo', 'pfizer', 'astrazeneca', 'sputnik', 'vacuna', 'dividir', 'dosis', 'casino', 'moderna', 'vacuna', 'refuerzo']",vacuna moderna
1546860854179778560,https://twitter.com/el_moizz/status/1546860854179778560,2022-07-12 14:15:41+00:00,@Titoch_69 Lo importante de la vacuna es que evite los síntomas o que estos sean muy leves; a mi me ha ido muy bien con Moderna. Que le sea leve a Karlita y se recupere pronto!,0,0,1,"{'longitude': -99.128294, 'latitude': 19.4043522}","{'fullName': 'Venustiano Carranza, Distrito Federal', 'name': 'Venustiano Carranza', 'type': 'city', 'country': 'Mexico', 'countryCode': 'MX'}",19.309917325231165,-99.12243737329996,31.28km,"['importante', 'vacuna', 'evitar', 'sintoma', 'leve', 'ir', 'moderna', 'leve', 'varita', 'recuperar']",vacuna moderna
1539126259556442113,https://twitter.com/TROLELLO/status/1539126259556442113,2022-06-21 06:01:10+00:00,"@Elizabe06099249 @SSaludCdMx Cansino, a diferencia de Astra, Sputnik y Pfaizer, es unidosis, es decir que con una dosis tiene la misma efectividad que las dos dosis de las otras. Por lo que con Moderna ya tienes vacuna y refuerzo. El equivalente a las tres dosis de las otras. https://t.co/kY5i3k2Cif",1,0,0,"{'longitude': -99.180678, 'latitude': 19.444937}","{'fullName': 'Gustavo A. Madero, Distrito Federal', 'name': 'Gustavo A. Madero', 'type': 'city', 'country': 'Mexico', 'countryCode': 'MX'}",19.309917325231165,-99.12243737329996,31.28km,"['cansino', 'diferencia', 'astrazeneca', 'sputnik', 'pfizer', 'unido', 'dosis', 'efectividad', 'dosis', 'moderna', 'vacuna', 'refuerzo', 'equivalente', 'dosis']",vacuna moderna
1532746810560749568,https://twitter.com/Sintratar/status/1532746810560749568,2022-06-03 15:31:31+00:00,"Sigo sin enfermarme de COVID_19 y mi mayor protección fue la vacuna de CanSino y el super refuerzo de Moderna, eso si cuando salgo de mi casa no me quito para nada el cubrebocas",1,0,0,"{'longitude': -99.1843501, 'latitude': 19.3998346}","{'fullName': 'Cuauhtémoc, Distrito Federal', 'name': 'Cuauhtémoc', 'type': 'city', 'country': 'Mexico', 'countryCode': 'MX'}",19.309917325231165,-99.12243737329996,31.28km,"['seguir', 'enfermar', 'covid', 'proteccion', 'vacuna', 'cansino', 'super', 'refuerzo', 'moderna', 'salgo', 'casa', 'quito', 'cubrebocas']",vacuna moderna
1529948757856509956,https://twitter.com/Rolo92769328/status/1529948757856509956,2022-05-26 22:13:03+00:00,"""LA PLANDEMIA HA CREADO 40 NUEVOS MULTIMILLONARIOS EN EL SECTOR FARMACÉUTICO. PFIZER Y MODERNA ""SE EMBOLSAN MIL DOLARES EN BENEFICIOS CADA SEGUNDO GRACIAS A SU MONOPOLIO SOBRE LA VACUNA CONTRA EL COVID-19, A PESAR DE QUE PARA SU DESARROLLO RECIBIERON MILES DE MILLONES DE DÓLARES",0,1,1,"{'longitude': -99.118665, 'latitude': 19.484399}","{'fullName': 'Ecatepec de Morelos, México', 'name': 'Ecatepec de Morelos', 'type': 'city', 'country': 'Mexico', 'countryCode': 'MX'}",19.309917325231165,-99.12243737329996,31.28km,"['pandemia', 'crear', 'multimillonario', 'sector', 'farmaceutico', 'pfizer', 'moderna', 'embolsan', 'mil', 'dolar', 'beneficio', 'gracias', 'monopolio', 'vacuna', 'covid', 'desarrollo', 'recibir', 'mil', 'millon', 'dolar']",vacuna moderna
1513930360064778244,https://twitter.com/TROLELLO/status/1513930360064778244,2022-04-12 17:21:39+00:00,"@GuillerminaUga4 @GobCDMX México no tenía, ni tiene, contrato con Moderna. Las únicas que llegaron fueron donadas por el Gobierno de los Estados Unidos. Así que tiene que acudir y en la mesa de casos especiales preguntar que vacuna le pueden aplicar.",0,0,0,"{'longitude': -99.259495, 'latitude': 19.3863707}","{'fullName': 'Miguel Hidalgo, Distrito Federal', 'name': 'Miguel Hidalgo', 'type': 'city', 'country': 'Mexico', 'countryCode': 'MX'}",19.309917325231165,-99.12243737329996,31.28km,"['mexico', 'contrato', 'moderna', 'unico', 'llegar', 'donadas', 'gobierno', 'unido', 'acudir', 'mesa', 'caso', 'especial', 'preguntar', 'vacuna', 'aplicar']",vacuna moderna
1501573228376080384,https://twitter.com/YessicastilloR/status/1501573228376080384,2022-03-09 14:58:50+00:00,¿Si es cierto que con la vacuna moderna NO SE DEBE tomar alcohol en 15 días?,2,0,6,"{'longitude': -99.1919955, 'latitude': 19.357102}","{'fullName': 'Benito Juárez, Distrito Federal', 'name': 'Benito Juárez', 'type': 'city', 'country': 'Mexico', 'countryCode': 'MX'}",19.309917325231165,-99.12243737329996,31.28km,"['vacuna', 'moderna', 'alcohol']",vacuna moderna
1498885128038371329,https://twitter.com/Dr_Verduzco/status/1498885128038371329,2022-03-02 04:57:17+00:00,"YA PÓNGANME MI VACUNA mRNA de gen CAT7 !!!!

...por favor y gracias. 🙂

@PeterDiamandis @pfizer @BioNTech_Group @moderna_tx",0,0,0,"{'longitude': -99.259495, 'latitude': 19.3863707}","{'fullName': 'Miguel Hidalgo, Distrito Federal', 'name': 'Miguel Hidalgo', 'type': 'city', 'country': 'Mexico', 'countryCode': 'MX'}",19.309917325231165,-99.12243737329996,31.28km,"['ponganme', 'vacuna', 'mina', 'gen', 'cat', 'favor', 'gracias']",vacuna moderna
1494815313858285574,https://twitter.com/NimitzCNV68/status/1494815313858285574,2022-02-18 23:25:17+00:00,"@leonard99402936 @YasItalian @BrendaCrabtreeR Ni siquiera hay que asistir a los consulados, la vacuna se aplica incluso en los aeropuertos, sin complicaciones

Uno elige si quiere Pfizer, Moderna o Johnson",5,2,0,"{'longitude': -99.315748, 'latitude': 19.087511}","{'fullName': 'Tlalpan, Distrito Federal', 'name': 'Tlalpan', 'type': 'city', 'country': 'Mexico', 'countryCode': 'MX'}",19.309917325231165,-99.12243737329996,31.28km,"['siquiera', 'asistir', 'consulado', 'vacuna', 'aplicar', 'aeropuerto', 'complicacion', 'elegir', 'pfizer', 'moderna']",vacuna moderna
1491375908082823173,https://twitter.com/TROLELLO/status/1491375908082823173,2022-02-09 11:38:19+00:00,"@DALACA666 @GobCDMX Pfizer al ser la única vacuna autorizada para menores de 18 años, se reservo para ese grupo. Y moderna está agotada, ya que no hay contrato con esa Farmacéutica, las únicas que había fueron donadas por el gobierno de los Estados Unidos. Esas son las razones.",0,0,0,"{'longitude': -99.180678, 'latitude': 19.444937}","{'fullName': 'Gustavo A. Madero, Distrito Federal', 'name': 'Gustavo A. Madero', 'type': 'city', 'country': 'Mexico', 'countryCode': 'MX'}",19.309917325231165,-99.12243737329996,31.28km,"['pfizer', 'unico', 'vacuna', 'autorizado', 'menor', 'ano', 'reservo', 'grupo', 'moderna', 'agotado', 'contrato', 'farmaceutico', 'unico', 'donadas', 'gobierno', 'unido', 'razon']",vacuna moderna
1489030988919447555,https://twitter.com/TomasAl29086216/status/1489030988919447555,2022-02-03 00:20:27+00:00,@SSaludCdMx hola buena tarde si mi esposa trabaja en una esc.particular q vacuna le toca del 3er refuerzo trabaja en la escuela moderna americana aquí en Coyoacán gracias,0,1,0,"{'longitude': -99.2058092, 'latitude': 19.2970107}","{'fullName': 'Coyoacán, Distrito Federal', 'name': 'Coyoacán', 'type': 'city', 'country': 'Mexico', 'countryCode': 'MX'}",19.309917325231165,-99.12243737329996,31.28km,"['hola', 'esposa', 'escparticular', 'vacuna', 'tocar', 'tercero', 'refuerzo', 'escuela', 'moderna', 'americana', 'coyoacan', 'gracias']",vacuna moderna
1488346499335569415,https://twitter.com/gabynajeraa/status/1488346499335569415,2022-02-01 03:00:32+00:00,"Que ilusa creyendo en mi gobierno, esperando Moderna y salen con su rusa. Mejor sin vacuna.",0,0,0,"{'longitude': -99.1843501, 'latitude': 19.3998346}","{'fullName': 'Cuauhtémoc, Distrito Federal', 'name': 'Cuauhtémoc', 'type': 'city', 'country': 'Mexico', 'countryCode': 'MX'}",19.309917325231165,-99.12243737329996,31.28km,"['ilusa', 'creer', 'gobierno', 'esperar', 'moderna', 'salir', 'ruso', 'vacuna']",vacuna moderna
1487250571837034499,https://twitter.com/cancerbero1/status/1487250571837034499,2022-01-29 02:25:42+00:00,"@LaModernaMx Desde Septiembre mi hijo se ganó (a según) un premio por haberse puesto vacuna Moderna. Es la fecha y aún no le llega su premio (ni le llegará...) Como ves, @morenazadmialma?",0,0,1,"{'longitude': -99.330259, 'latitude': 19.51799}","{'fullName': 'Atizapán de Zaragoza, México', 'name': 'Atizapán de Zaragoza', 'type': 'city', 'country': 'Mexico', 'countryCode': 'MX'}",19.309917325231165,-99.12243737329996,31.28km,"['septiembre', 'hijo', 'ganar', 'premio', 'haber', 'puesto', 'vacuna', 'moderna', 'fecha', 'llegar', 'premio', 'llegar', 'ver']",vacuna moderna
1486767656908767232,https://twitter.com/danielaobregons/status/1486767656908767232,2022-01-27 18:26:46+00:00,La farmaceútica Moderna empieza los ensayos clínicos en humanos de la vacuna de VIH,11,0,0,"{'longitude': -99.315748, 'latitude': 19.087511}","{'fullName': 'Tlalpan, Distrito Federal', 'name': 'Tlalpan', 'type': 'city', 'country': 'Mexico', 'countryCode': 'MX'}",19.309917325231165,-99.12243737329996,31.28km,"['farmaceuticam', 'moderna', 'empezar', 'ensayo', 'clinico', 'humanos', 'vacuna', 'vih']",vacuna moderna
1486410722380849166,https://twitter.com/darcag/status/1486410722380849166,2022-01-26 18:48:27+00:00,"@locatel_mx Ayer aplicaron vacuna""Moderna"", en Vocacional 7, no AstraZeneca, que pasó?, reacciones con molestia en extremidades, dolor y ligero ardor, lengua levemente como escaldada, sin aumento de temperatura.",0,0,1,"{'longitude': -99.140238, 'latitude': 19.2846922}","{'fullName': 'Iztapalapa, Distrito Federal', 'name': 'Iztapalapa', 'type': 'city', 'country': 'Mexico', 'countryCode': 'MX'}",19.309917325231165,-99.12243737329996,31.28km,"['aplicaron', 'vacunamoderna', 'vocacional', 'astrazeneca', 'pasar', 'reaccion', 'molestia', 'extremidad', 'dolor', 'ligero', 'ardor', 'lengua', 'levemente', 'escaldada', 'aumento', 'temperatura']",vacuna moderna
1486342471164600331,https://twitter.com/gnajjjj/status/1486342471164600331,2022-01-26 14:17:14+00:00,Mi situación después de que me pusieron el refuerzo de la vacuna Moderna. https://t.co/ZTNIBIQ4nI,5,2,1,"{'longitude': -99.180678, 'latitude': 19.444937}","{'fullName': 'Gustavo A. Madero, Distrito Federal', 'name': 'Gustavo A. Madero', 'type': 'city', 'country': 'Mexico', 'countryCode': 'MX'}",19.309917325231165,-99.12243737329996,31.28km,"['situacion', 'poner', 'refuerzo', 'vacuna', 'moderna']",vacuna moderna
1485103920460574726,https://twitter.com/Jorge_Reyes_/status/1485103920460574726,2022-01-23 04:15:41+00:00,El dolor del brazo izquierdo (consecuencia de la vacuna Moderna) bloquea el dolor que se padecía en la pierna derecha por una lesión debido al ejercicio. Interesante 🤨,0,0,1,"{'longitude': -99.7825792, 'latitude': 19.0763934}","{'fullName': 'Toluca, México', 'name': 'Toluca', 'type': 'city', 'country': 'Mexico', 'countryCode': 'MX'}",19.309917325231165,-99.12243737329996,31.28km,"['dolor brazo', 'izquierdo', 'consecuencia', 'vacuna', 'moderna', 'bloquear', 'dolor', 'padecer', 'pierna', 'derecha', 'lesion', 'ejercicio', 'interesante']",vacuna moderna
1485006529984139264,https://twitter.com/anapauTPichardo/status/1485006529984139264,2022-01-22 21:48:41+00:00,"@angiemagneto Tienes omicron?!  Ni moderna recomienda mezclar CANSINO con su vacuna 💉, pero ya está, aún así ya no me pongo otra",0,0,1,"{'longitude': -99.6470277, 'latitude': 19.2156239}","{'fullName': 'Metepec, México', 'name': 'Metepec', 'type': 'city', 'country': 'Mexico', 'countryCode': 'MX'}",19.309917325231165,-99.12243737329996,31.28km,"['omicron', 'moderna', 'recomendar', 'mezclar', 'cansino', 'vacuna', 'poner']",vacuna moderna
1484357810771017730,https://twitter.com/iris_charo/status/1484357810771017730,2022-01-21 02:50:54+00:00,"Supongo que este ya es el reporte final de mi experiencia con la vacuna de Moderna. Después de la aplicación, tuve dolor en el brazo el día de ayer, mismo que perduró hasta el día de hoy, pero se alivianó con paracetamol. Y ya, eso fue todo lo que me pasó. P.D. Soy un robot.",6,0,0,"{'longitude': -99.118665, 'latitude': 19.484399}","{'fullName': 'Ecatepec de Morelos, México', 'name': 'Ecatepec de Morelos', 'type': 'city', 'country': 'Mexico', 'countryCode': 'MX'}",19.309917325231165,-99.12243737329996,31.28km,"['suponer', 'reportar', 'experiencia', 'vacuna', 'moderna', 'aplicacion', 'dolor brazo', 'perduro', 'alivian', 'paracetamol', 'pasar', 'pd', 'robot']",vacuna moderna
1483570486390968320,https://twitter.com/lindocanario/status/1483570486390968320,2022-01-18 22:42:22+00:00,"Hola, Dr. Frisbie. Espero que me ayude a resolver una duda. Me aplicaron la vacuna Moderna, en ka ciudad de México, el viernes 14 de enero . Tuve dolor de brazo unos días, pero desde ayer por la tarde empecé a tener escalofríos y como mareo leve.",0,0,1,"{'longitude': -99.2058092, 'latitude': 19.2970107}","{'fullName': 'Coyoacán, Distrito Federal', 'name': 'Coyoacán', 'type': 'city', 'country': 'Mexico', 'countryCode': 'MX'}",19.309917325231165,-99.12243737329996,31.28km,"['hola', 'doctor', 'frisbie', 'esperar', 'ayudar', 'resolver', 'duda', 'aplicaron', 'vacuna', 'moderna', 'ka', 'ciudad', 'mexico', 'viernes', 'enero', 'dolor brazo', 'empezar', 'escalofrio', 'mareo', 'leve']",vacuna moderna
1483144736621871108,https://twitter.com/LaMayaFlores/status/1483144736621871108,2022-01-17 18:30:35+00:00,Apenas hoy me repuse de la #vacunamodeRNA. Me vacunaron el miércoles 🥴🥴,2,0,2,"{'longitude': -99.1919955, 'latitude': 19.357102}","{'fullName': 'Benito Juárez, Distrito Federal', 'name': 'Benito Juárez', 'type': 'city', 'country': 'Mexico', 'countryCode': 'MX'}",19.309917325231165,-99.12243737329996,31.28km,"['repuse', 'vacuna', 'vacuna', 'miercoles']",vacuna moderna
1482468161920380929,https://twitter.com/patybetaza/status/1482468161920380929,2022-01-15 21:42:07+00:00,Información muy importante sobre la eficacia de la vacuna de Moderna vs Covid que se aplica a los maestros del país. @SEP_mx @delfinagomeza 👇 https://t.co/AkX1wfWpxJ,3,0,0,"{'longitude': -99.1919955, 'latitude': 19.357102}","{'fullName': 'Benito Juárez, Distrito Federal', 'name': 'Benito Juárez', 'type': 'city', 'country': 'Mexico', 'countryCode': 'MX'}",19.309917325231165,-99.12243737329996,31.28km,"['informacion', 'importante', 'eficacia', 'vacuna', 'moderna', 'covid', 'aplicar', 'maestro', 'pais']",vacuna moderna
1482065799909191680,https://twitter.com/reneleyvatw/status/1482065799909191680,2022-01-14 19:03:16+00:00,Tenemos vacuna de @moderna_tx refuerzo contra #Covid19 #ThankyouUSA @USAmbMex,1,0,0,"{'longitude': -99.259495, 'latitude': 19.3863707}","{'fullName': 'Miguel Hidalgo, Distrito Federal', 'name': 'Miguel Hidalgo', 'type': 'city', 'country': 'Mexico', 'countryCode': 'MX'}",19.309917325231165,-99.12243737329996,31.28km,"['vacuna', 'refuerzo', 'covid', 'thankyou']",vacuna moderna
1482027910315876353,https://twitter.com/kattGonzalezG/status/1482027910315876353,2022-01-14 16:32:43+00:00,"Refuerzo de vacuna cansino en mayo, ahora fue Moderna.
😷 en Ciudad de Mexico CDMX https://t.co/SE7aY7TVTN",0,0,0,"{'longitude': -99.15506, 'latitude': 19.37632}","{'fullName': 'Benito Juárez, Distrito Federal', 'name': 'Benito Juárez', 'type': 'city', 'country': 'Mexico', 'countryCode': 'MX'}",19.309917325231165,-99.12243737329996,31.28km,"['refuerzo', 'vacuna', 'cansino', 'mayo', 'moderna', 'ciudad', 'mexico', 'como']",vacuna moderna
1481890011251417090,https://twitter.com/Fridachacon/status/1481890011251417090,2022-01-14 07:24:45+00:00,"No me extraña que la vacuna  #Moderna sea TT.
Si te hace visitar a San Pedro.
🤯😭",0,0,0,"{'longitude': -99.221136, 'latitude': 19.456367}","{'fullName': 'Azcapotzalco, Distrito Federal', 'name': 'Azcapotzalco', 'type': 'city', 'country': 'Mexico', 'countryCode': 'MX'}",19.309917325231165,-99.12243737329996,31.28km,"['extranar', 'vacuna', 'moderna', 'tt', 'visitar', 'sa', 'pedro']",vacuna moderna
1481776023918288902,https://twitter.com/adris180380/status/1481776023918288902,2022-01-13 23:51:48+00:00,Vacuna moderna aplicada...#soymaestra #Covid_19,2,0,0,"{'longitude': -98.954037, 'latitude': 19.285882}","{'fullName': 'Ixtapaluca, México', 'name': 'Ixtapaluca', 'type': 'city', 'country': 'Mexico', 'countryCode': 'MX'}",19.309917325231165,-99.12243737329996,31.28km,"['vacuna', 'moderna', 'aplicadasoymaestra', 'covid']",vacuna moderna
1481742444479795201,https://twitter.com/geeoovs/status/1481742444479795201,2022-01-13 21:38:22+00:00,@Claudiashein Aún llevando comprobante de vacuna y certificado no la quieren aplicar por favor necesitamos una respuesta porque otra dosis diferente tampoco la ponen porque corresponde Moderna a los que recibimos CanSino,0,0,0,"{'longitude': -99.259495, 'latitude': 19.3863707}","{'fullName': 'Miguel Hidalgo, Distrito Federal', 'name': 'Miguel Hidalgo', 'type': 'city', 'country': 'Mexico', 'countryCode': 'MX'}",19.309917325231165,-99.12243737329996,31.28km,"['llevar', 'comprobante', 'vacuna', 'certificado', 'querer', 'aplicar', 'favor', 'necesitar', 'respuesta', 'dosis', 'poner', 'corresponder', 'moderna', 'recibimos', 'cansino']",vacuna moderna
1481677315230818304,https://twitter.com/silviarrgarces/status/1481677315230818304,2022-01-13 17:19:34+00:00,¡Listo mi refuerzo #moderna ! Agradecida por tener una vacuna que mucha gente que se nos adelantó no pudo acceder a ella 🙏 #Pinchecovid en TECNOLOGICO DE ESTUDIOS SUPERIORES DE ECATEPEC. TESE https://t.co/mFlqqBLIXy,0,0,1,"{'longitude': -99.04131544, 'latitude': 19.51133461}","{'fullName': 'Ecatepec de Morelos, México', 'name': 'Ecatepec de Morelos', 'type': 'city', 'country': 'Mexico', 'countryCode': 'MX'}",19.309917325231165,-99.12243737329996,31.28km,"['listo', 'refuerzo', 'moderna', 'agradecido', 'vacuna', 'gente', 'adelantar', 'acceder', 'pinchecovid', 'tecnologico', 'estudio', 'superior', 'ecatepec', 'ese']",vacuna moderna
1479097179574841348,https://twitter.com/vhjm1967/status/1479097179574841348,2022-01-06 14:27:02+00:00,@warkentin que me puedes compartir de ka vacuna Moderna es confiable? Saludos Gaby,0,0,1,"{'longitude': -99.324375, 'latitude': 19.232228}","{'fullName': 'Álvaro Obregón, Distrito Federal', 'name': 'Álvaro Obregón', 'type': 'city', 'country': 'Mexico', 'countryCode': 'MX'}",19.309917325231165,-99.12243737329996,31.28km,"['poder', 'compartir', 'ka', 'vacuna', 'moderna', 'confiable', 'saludo', 'gaby']",vacuna moderna
1478803049569259523,https://twitter.com/betoupg/status/1478803049569259523,2022-01-05 18:58:16+00:00,"Échale el ojo @Tezcatlijota 
Aplicarán vacuna Moderna a personal educativo a partir del 8 de enero https://t.co/txdwg2vpmg",1,0,1,"{'longitude': -99.2058092, 'latitude': 19.2970107}","{'fullName': 'Coyoacán, Distrito Federal', 'name': 'Coyoacán', 'type': 'city', 'country': 'Mexico', 'countryCode': 'MX'}",19.309917325231165,-99.12243737329996,31.28km,"['echale', 'ojo', 'aplicar', 'vacuna', 'moderna', 'personal', 'educativo', 'enero']",vacuna moderna
1478466534037090306,https://twitter.com/tonatiuhmira/status/1478466534037090306,2022-01-04 20:41:04+00:00,"No se pierdan la explicación en TikTok de @Lakishimishi sobre el refuerzo de #vacuna💉 con #moderna que nos van a poner a docentes que recibimos #cancino:
 💯
https://t.co/SFtte2oLj9",2,0,0,"{'longitude': -99.180678, 'latitude': 19.444937}","{'fullName': 'Gustavo A. Madero, Distrito Federal', 'name': 'Gustavo A. Madero', 'type': 'city', 'country': 'Mexico', 'countryCode': 'MX'}",19.309917325231165,-99.12243737329996,31.28km,"['perder', 'explicacion', 'tinto', 'refuerzo', 'vacuna', 'moderna', 'docente', 'recibimos', 'canino']",vacuna moderna
1478409267480834054,https://twitter.com/reneleyvatw/status/1478409267480834054,2022-01-04 16:53:31+00:00,Muchas gracias por la donación de la vacuna #Moderna para maestros de México. Una gentileza del pueblo norteamericano. @USAmbMex @USEmbassyMEX,0,0,0,"{'longitude': -99.259495, 'latitude': 19.3863707}","{'fullName': 'Miguel Hidalgo, Distrito Federal', 'name': 'Miguel Hidalgo', 'type': 'city', 'country': 'Mexico', 'countryCode': 'MX'}",19.309917325231165,-99.12243737329996,31.28km,"['gracias', 'donacion', 'vacuna', 'moderna', 'maestro', 'mexico', 'gentileza', 'pueblo', 'norteamericano']",vacuna moderna
1476867543121993758,https://twitter.com/LockeChilango/status/1476867543121993758,2021-12-31 10:47:15+00:00,"@Lordjocamo Eso es falso, Pfizer, Moderna y otras ya recibieron, desde hace meses la aprobación definitiva.
La vacuna Abdala no ha entregado ni la documentación provisional. Ni siquiera ha podido dar un cronograma de cuando la va a dar...obviamente no la tiene aún.",14,3,1,"{'longitude': -99.1919955, 'latitude': 19.357102}","{'fullName': 'Benito Juárez, Distrito Federal', 'name': 'Benito Juárez', 'type': 'city', 'country': 'Mexico', 'countryCode': 'MX'}",19.309917325231165,-99.12243737329996,31.28km,"['falso', 'pfizer', 'moderna', 'recibir', 'mes', 'aprobacion', 'definitivo', 'vacuna', 'abrala', 'entregar', 'documentacion', 'provisional', 'siquiera', 'poder', 'cronograma', 'darobviamente']",vacuna moderna
1476474777082773504,https://twitter.com/LockeChilango/status/1476474777082773504,2021-12-30 08:46:33+00:00,"@MarcelaSaebL @BUHO2701 @SSalud_mx @HLGatell Estamos por debajo del nivel de vacunación de ¡Venezuela!
Sigan aplaudiendo al #DoctorMuerte chairos.
Ahora van a querer usar acá la vacuna cubana que no está siquiera en proceso de aprobación por la OMS y que seguro pagaremos mucho más caras que las de Pfizer o Moderna",3,2,0,"{'longitude': -99.1919955, 'latitude': 19.357102}","{'fullName': 'Benito Juárez, Distrito Federal', 'name': 'Benito Juárez', 'type': 'city', 'country': 'Mexico', 'countryCode': 'MX'}",19.309917325231165,-99.12243737329996,31.28km,"['nivel', 'vacuna', 'venezuela', 'seguir', 'aplaudiendo', 'doctor', 'muerte', 'chairs', 'vacuna', 'cubano', 'siquiera', 'proceso', 'aprobacion', 'oms', 'seguro', 'pagar', 'cara', 'pfizer', 'moderna']",vacuna moderna
1476410360504758274,https://twitter.com/rickimsa/status/1476410360504758274,2021-12-30 04:30:34+00:00,"@Milenio Vas @yeidckol , vacuna a todos los changos de tu familia con esa vacuna. 

Nada de pedir Pfizer, ni ir a EU a vacunarlos con Moderna..  

A ti y a los tuyos les toca Abdala",0,0,0,"{'longitude': -100.613313, 'latitude': 18.3671046}","{'fullName': 'Mexico', 'name': 'Mexico', 'type': 'admin', 'country': 'Mexico', 'countryCode': 'MX'}",19.309917325231165,-99.12243737329996,31.28km,"['ir', 'vacuna', 'changos', 'familia', 'vacuna', 'pedir', 'pfizer', 'eu', 'vacuna', 'moderna', 'tocar', 'abrala']",vacuna moderna
