id,url,date,content,likeCount,retweetCount,replyCount,coordinates,place,latitud,longitud,radio,tweet_tokenizado
1407520798823354375,https://twitter.com/marctronico/status/1407520798823354375,2021-06-23 02:08:03+00:00,"Ya quiero que haga efecto la vacuna para salir!
Yo saliendo :
 https://t.co/fCRcdrWTSD",5,0,1,"{'longitude': -99.1843501, 'latitude': 19.3998346}","{'fullName': 'Cuauhtémoc, Distrito Federal', 'name': 'Cuauhtémoc', 'type': 'city', 'country': 'Mexico', 'countryCode': 'MX'}",19.309917325231165,-99.12243737329996,31.28km,"['querer', 'hacer', 'efecto', 'vacuno', 'salir', 'salir']"
1407329664645861376,https://twitter.com/ElPincheCiclist/status/1407329664645861376,2021-06-22 13:28:33+00:00,"@OsoEnCuarentena @oxidodecromo Pero tienes que compartirla en el feis y/otras redes sociales, si no no tiene efecto la vacuna",2,0,0,"{'longitude': -99.259495, 'latitude': 19.3863707}","{'fullName': 'Miguel Hidalgo, Distrito Federal', 'name': 'Miguel Hidalgo', 'type': 'city', 'country': 'Mexico', 'countryCode': 'MX'}",19.309917325231165,-99.12243737329996,31.28km,"['compartir', 'seis', 'red', 'social', 'si', 'efecto', 'vacuna']"
1401539813438902273,https://twitter.com/carlostomasini/status/1401539813438902273,2021-06-06 14:01:45+00:00,@FernandoDelRio 🤣 ...es el efecto de la vacuna...,3,0,0,"{'longitude': -99.2058092, 'latitude': 19.2970107}","{'fullName': 'Coyoacán, Distrito Federal', 'name': 'Coyoacán', 'type': 'city', 'country': 'Mexico', 'countryCode': 'MX'}",19.309917325231165,-99.12243737329996,31.28km,"['efecto', 'vacuna']"
1398627396497121284,https://twitter.com/huevotekinder/status/1398627396497121284,2021-05-29 13:08:51+00:00,"@sergioaguayo @LaJornada La vacuna hizo su efecto,",0,0,0,"{'longitude': -99.1843501, 'latitude': 19.3998346}","{'fullName': 'Cuauhtémoc, Distrito Federal', 'name': 'Cuauhtémoc', 'type': 'city', 'country': 'Mexico', 'countryCode': 'MX'}",19.309917325231165,-99.12243737329996,31.28km,"['vacuna', 'hacer', 'efecto']"
1395919034277838855,https://twitter.com/anapauTPichardo/status/1395919034277838855,2021-05-22 01:46:47+00:00,"@PaolaSaeb Dolor leve en brazo lis dos días siguientes a la vacuna . 
Ese día dolor de cabeza y náusea leve 
Dormí 13 horas seguidas día días ...pero duermo demasiado siempre así q no puedo determinar si fue efecto o mi hueva natural",1,0,0,"{'longitude': -99.6470277, 'latitude': 19.2156239}","{'fullName': 'Metepec, México', 'name': 'Metepec', 'type': 'city', 'country': 'Mexico', 'countryCode': 'MX'}",19.309917325231165,-99.12243737329996,31.28km,"['dolor', 'leve', 'brazo', 'lis', 'dos', 'dia', 'siguiente', 'vacuna', 'dia', 'dolor', 'cabeza', 'nausear', 'leve', 'dormi', 'hora', 'seguido', 'dia', 'dia', 'duermo', 'demasiado', 'siempre', 'asi', 'poder', 'determinar', 'si', 'efecto', 'huir', 'natura']"
1395558438202191874,https://twitter.com/WenJarquin/status/1395558438202191874,2021-05-21 01:53:54+00:00,El único efecto secundario q he tenido hasta ahora de la vacuna ha sido un tremendo antojo de cenar pizza 😖,28,0,2,"{'longitude': -99.2058092, 'latitude': 19.2970107}","{'fullName': 'Coyoacán, Distrito Federal', 'name': 'Coyoacán', 'type': 'city', 'country': 'Mexico', 'countryCode': 'MX'}",19.309917325231165,-99.12243737329996,31.28km,"['unico', 'efecto', 'secundario', 'ahora', 'vacuno', 'ser', 'tremendo', 'antojo', 'cenar', 'pizza']"
1395482368564252673,https://twitter.com/auromanes/status/1395482368564252673,2021-05-20 20:51:38+00:00,Creo que ya me hizo efecto la vacuna jaja. https://t.co/BemQtOS4DP,0,0,0,"{'longitude': -99.259495, 'latitude': 19.3863707}","{'fullName': 'Miguel Hidalgo, Distrito Federal', 'name': 'Miguel Hidalgo', 'type': 'city', 'country': 'Mexico', 'countryCode': 'MX'}",19.309917325231165,-99.12243737329996,31.28km,"['creer', 'hacer', 'efecto', 'vacuna', 'jaja']"
1395207552670048261,https://twitter.com/ferelgar/status/1395207552670048261,2021-05-20 02:39:36+00:00,"Pues después de casi doce horas de que me pusieron la vacuna puedo reportar que no he sentido ningún efecto secundario, excepto por un cansancio extraño e intermitente

Sé que no es igual para todas las personas pero, a la gente que tiene miedo a la vacuna, no teman y vacúnense",14,1,2,"{'longitude': -99.1919955, 'latitude': 19.357102}","{'fullName': 'Benito Juárez, Distrito Federal', 'name': 'Benito Juárez', 'type': 'city', 'country': 'Mexico', 'countryCode': 'MX'}",19.309917325231165,-99.12243737329996,31.28km,"['pues', 'despues', 'casi', 'doce', 'hora', 'poner', 'vacuna', 'poder', 'reportar', 'ningun', 'efecto', 'secundario', 'excepto', 'cansancio', 'extrano', 'intermitente', 'el', 'igual', 'todo', 'persona', 'gente', 'miedo', 'vacuno', 'temar', 'vacunar']"
1395092547488436230,https://twitter.com/Quiimo1/status/1395092547488436230,2021-05-19 19:02:37+00:00,"Detesto a los neoliberales por el efecto de la vacuna
No es cierto ya los detestaba por Corruptos y ladrones https://t.co/8176mp9fJs",0,0,0,"{'longitude': -99.137171, 'latitude': 19.375769}","{'fullName': 'Iztacalco, Distrito Federal', 'name': 'Iztacalco', 'type': 'city', 'country': 'Mexico', 'countryCode': 'MX'}",19.309917325231165,-99.12243737329996,31.28km,"['detesto', 'neoliberal', 'efecto', 'vacuno', 'cierto', 'detestar', 'corrupto', 'ladron']"
1390409211348197382,https://twitter.com/sari0311/status/1390409211348197382,2021-05-06 20:52:43+00:00,"@wamlucerna @lopezobrador_ Así es doctora a seguirnos cuidando.
Doctora, le comento que la enfermera que me vacunó me dijo que la vacuna sólo tiene efecto 6 meses, es cierto?",3,0,1,"{'longitude': -99.067766, 'latitude': 19.3668621}","{'fullName': 'Nezahualcóyotl, México', 'name': 'Nezahualcóyotl', 'type': 'city', 'country': 'Mexico', 'countryCode': 'MX'}",19.309917325231165,-99.12243737329996,31.28km,"['asi', 'doctora', 'seguirno', 'cuidar', 'doctoro', 'comento', 'enfermera', 'vacuno', 'decir', 'vacuna', 'solo', 'efecto', 'meses', 'cierto']"
1387512165591044096,https://twitter.com/MagdaTlalpan/status/1387512165591044096,2021-04-28 21:00:53+00:00,"@Pajaropolitico @lopezobrador_ Lo que no tiene JUSTIFICACIÓN. Es el desempleo,falta de medicamentos y por CIERTO LA VACUNA QUE YA PERDIÓ EFECTO, en Alcaldía TLALPAN  pr ADULTOS MAYORES.",0,0,0,"{'longitude': -99.315748, 'latitude': 19.087511}","{'fullName': 'Tlalpan, Distrito Federal', 'name': 'Tlalpan', 'type': 'city', 'country': 'Mexico', 'countryCode': 'MX'}",19.309917325231165,-99.12243737329996,31.28km,"['justificacion', 'desempleo', 'faltar', 'medicamento', 'cierto', 'vacuna', 'perdio', 'efecto', 'alcaldia', 'tapar', 'pr', 'adulto', 'mayor']"
1385634503721324551,https://twitter.com/secc11cdmx/status/1385634503721324551,2021-04-23 16:39:44+00:00,"#LaTareaEsCuidarte 🧑‍💻📝

Si estás próximo a recibir la vacuna contra #COVID19 🦠 o recientemente fuiste inoculado con la primera o segunda dosis del #coronavirus ☣️ expertos sugieren no consumir alcohol por cierto tiempo 🍷🗓️ y aconsejan hacer ejercicio 🏃 para un mejor efecto✔️ https://t.co/SizonyST4U",6,6,0,"{'longitude': -99.1843501, 'latitude': 19.3998346}","{'fullName': 'Cuauhtémoc, Distrito Federal', 'name': 'Cuauhtémoc', 'type': 'city', 'country': 'Mexico', 'countryCode': 'MX'}",19.309917325231165,-99.12243737329996,31.28km,"['tarea', 'cuidartir', 'si', 'proximo', 'recibir', 'vacuna', 'recientemente', 'inoculado', 'primero', 'segundo', 'dosis', 'coronaviru', 'experto', 'sugerir', 'consumir', 'alcohol', 'cierto', 'tiempo', 'aconsejar', 'hacer', 'ejercicio', 'mejor', 'efecto']"
1383100191197122562,https://twitter.com/Cristina_Coach/status/1383100191197122562,2021-04-16 16:49:16+00:00,Mi marido haciendo planes con sus amigos para reunirse cuando tengan el efecto completo de la vacuna https://t.co/OHPNbQts0z,6,1,0,"{'longitude': -99.1843501, 'latitude': 19.3998346}","{'fullName': 'Cuauhtémoc, Distrito Federal', 'name': 'Cuauhtémoc', 'type': 'city', 'country': 'Mexico', 'countryCode': 'MX'}",19.309917325231165,-99.12243737329996,31.28km,"['marido', 'hacer', 'plan', 'amigo', 'reunir', 'efecto', 'completo', 'vacuna']"
1380621690112200709,https://twitter.com/gordodx/status/1380621690112200709,2021-04-09 20:40:36+00:00,"Les tengo una mala, el efecto de la vacuna contra covid 19 solo dura 6 meses,. Hay que hacer el mismo circo 2 veces al año! Espero se estén juntando recursos para comprar las que vienen @lopezobrador_ @GobiernoMX @CarlosLoret",1,0,1,"{'longitude': -99.324375, 'latitude': 19.232228}","{'fullName': 'Álvaro Obregón, Distrito Federal', 'name': 'Álvaro Obregón', 'type': 'city', 'country': 'Mexico', 'countryCode': 'MX'}",19.309917325231165,-99.12243737329996,31.28km,"['malo', 'efecto', 'vacuna', 'covid', 'solo', 'durar', 'mes', 'hacer', 'mismo', 'circo', 'vez', 'ano', 'esperar', 'juntar', 'recurso', 'comprar', 'venir']"
1379983584983941120,https://twitter.com/FERNAND61266857/status/1379983584983941120,2021-04-08 02:25:00+00:00,"@HLGatell @EMA_News @WHO No señor, no es así, sino el efecto que puede causar en la población de México. Reconocieron que la trombosis sí es causada por la vacuna, el ciudadano está en SU DERECHO A NEGARSE. Nadie lo puede obligar a ponérsela por su salud.
No por comprarla se debe usar a fuerzas. https://t.co/azFhyQet8Q",0,0,0,"{'longitude': -99.140238, 'latitude': 19.2846922}","{'fullName': 'Iztapalapa, Distrito Federal', 'name': 'Iztapalapa', 'type': 'city', 'country': 'Mexico', 'countryCode': 'MX'}",19.309917325231165,-99.12243737329996,31.28km,"['senor', 'asi', 'sino', 'efecto', 'poder', 'causar', 'poblacion', 'mexico', 'reconocer', 'trombosis', 'causado', 'vacuna', 'ciudadano', 'derecho', 'negar', 'nadie', 'poder', 'obligar', 'ponersela', 'salud', 'comprar', 'deber', 'usar', 'fuerza']"
1379547558524096524,https://twitter.com/lilithserena/status/1379547558524096524,2021-04-06 21:32:23+00:00,"Mis padres cuando les pusieron la vacuna:
Papi: todo muy bien pero haciendo sus ridiculeces de dinámicas mientras esperamos para el efecto 😡
Mami: muy bien organizado y nos entretuvieron.😌

Ahora saben de dónde saque mi mezcla perfecta entre el bien y el mal😂",8,0,0,"{'longitude': -99.180678, 'latitude': 19.444937}","{'fullName': 'Gustavo A. Madero, Distrito Federal', 'name': 'Gustavo A. Madero', 'type': 'city', 'country': 'Mexico', 'countryCode': 'MX'}",19.309917325231165,-99.12243737329996,31.28km,"['padre', 'poner', 'vacuna', 'papi', 'bien', 'hacer', 'ridiculez', 'dinamica', 'mientras', 'esperar', 'efecto', 'mami', 'bien', 'organizado', 'entretener', 'ahora', 'saber', 'donde', 'saque', 'mezclar', 'perfecto', 'bien', 'mal']"
1377827731597975552,https://twitter.com/Gob_Tlalne/status/1377827731597975552,2021-04-02 03:38:24+00:00,"@VikoMLA @Patascencio @adrianiitha_a2 @CgspOficial @C4Tlalnepantla Gracias por escribir, recomendamos que maneje una persona que no recibirá la vacuna por si el paciente reacciona a algún efecto secundario.",1,0,1,"{'longitude': -99.2481811, 'latitude': 19.498594}","{'fullName': 'Tlalnepantla de Baz, México', 'name': 'Tlalnepantla de Baz', 'type': 'city', 'country': 'Mexico', 'countryCode': 'MX'}",19.309917325231165,-99.12243737329996,31.28km,"['gracias', 'escribir', 'recomendar', 'maneje', 'persona', 'recibirar', 'vacuno', 'si', 'paciente', 'reacciona', 'algun', 'efecto', 'secundario']"
1368682203182469124,https://twitter.com/DR_CHACEK/status/1368682203182469124,2021-03-07 21:57:20+00:00,"@DrPacoMoreno1 Siempre y cuando el efecto de la vacuna sea permante Le faltó especificar  eso Dr. Factor del cual  hoy día no sabemos cuánto dura la inmunidad post vacuna 
Esperemos y tengamos Fe de que algún día a los médicos del sector privado nos vacunen tambien",1,1,0,"{'longitude': -99.1843501, 'latitude': 19.3998346}","{'fullName': 'Cuauhtémoc, Distrito Federal', 'name': 'Cuauhtémoc', 'type': 'city', 'country': 'Mexico', 'countryCode': 'MX'}",19.309917325231165,-99.12243737329996,31.28km,"['siempre', 'efecto', 'vacuna', 'permance', 'falto', 'especificar', 'doctor', 'factor', 'hoy', 'dio', 'saber', 'cuanto', 'duro', 'inmunidad', 'post', 'vacuno', 'esperar', 'fe', 'algun', 'dia', 'medico', 'sector', 'privado', 'vacunir', 'tambie']"
1364693856877445121,https://twitter.com/agnes_velasco/status/1364693856877445121,2021-02-24 21:49:04+00:00,@urbanearte Después de la aplicación tenderá algún efecto secundario como cualquier vacuna. Solo vigila la reacción y pregunta a su médico si es conveniente que se la aplique si no sufre de presión alta.,1,0,0,"{'longitude': -99.315748, 'latitude': 19.087511}","{'fullName': 'Tlalpan, Distrito Federal', 'name': 'Tlalpan', 'type': 'city', 'country': 'Mexico', 'countryCode': 'MX'}",19.309917325231165,-99.12243737329996,31.28km,"['despues', 'aplicacion', 'tendera', 'algun', 'efecto', 'secundario', 'cualquiera', 'vacuna', 'solo', 'vigilo', 'reaccion', 'preguntar', 'medico', 'si', 'conveniente', 'aplicar', 'si', 'sufrir', 'presion', 'alta']"
1357778480964984832,https://twitter.com/clazeto/status/1357778480964984832,2021-02-05 19:49:50+00:00,"Ya me apliqué la primera dosis de la Vacuna y no siento ningún efecto secundario. Tendré que aplicarme una segunda dosis.
Hasta aquí mi reporte... ¡¡Seguiré informando!! 😉 https://t.co/1Ot2la1lhn",163,35,15,"{'longitude': -99.15869671847675, 'latitude': 19.42786482671103}","{'fullName': 'Plaza Washington', 'name': 'Plaza Washington', 'type': 'poi', 'country': 'Mexico', 'countryCode': 'MX'}",19.309917325231165,-99.12243737329996,31.28km,"['aplicar', 'primero', 'dosis', 'vacuna', 'siento', 'ningun', 'efecto', 'secundario', 'aplicarmar', 'segundo', 'dosis', 'aqui', 'reportar', 'seguire', 'informar']"
1343424618284150785,https://twitter.com/annieevencess/status/1343424618284150785,2020-12-28 05:12:43+00:00,"@SSalud_mx ""Las personas que tenemos fibromialgia saben que efecto tiene la vacuna ??? Llevan un monitoreo de las personas que tenemos alguna enfermedad rara ?? @HLGatell  agradecería que se pusieran en contacto conmigo""",0,0,0,"{'longitude': -99.6470277, 'latitude': 19.2156239}","{'fullName': 'Metepec, México', 'name': 'Metepec', 'type': 'city', 'country': 'Mexico', 'countryCode': 'MX'}",19.309917325231165,-99.12243737329996,31.28km,"['persona', 'fibromialgio', 'saber', 'efecto', 'vacuna', 'llevar', 'monitoreo', 'persona', 'alguno', 'enfermedad', 'raro', 'agradecerio', 'poner', 'contacto', 'yo']"
1343354322445344770,https://twitter.com/Simondor1959/status/1343354322445344770,2020-12-28 00:33:23+00:00,"@bichiswichis @patOCarranza Hasta hoy van 23 mutaciones conocidas, 17 son comunes, pero seis son distintas en cada región. La velocidad de disminuir al virus es fundamental limitando su capacidad de transmisión. Si existe la posibilidad de que alguna mutación deje sin efecto a la vacuna. Habría otro 2020",0,0,2,"{'longitude': -99.1919955, 'latitude': 19.357102}","{'fullName': 'Benito Juárez, Distrito Federal', 'name': 'Benito Juárez', 'type': 'city', 'country': 'Mexico', 'countryCode': 'MX'}",19.309917325231165,-99.12243737329996,31.28km,"['hoy', 'ir', 'mutacion', 'conocido', 'comun', 'seis', 'distinta', 'cada', 'region', 'velocidad', 'disminuir', 'virus', 'fundamental', 'limitar', 'capacidad', 'transmision', 'si', 'existir', 'posibilidad', 'alguno', 'mutacion', 'deje', 'efecto', 'vacuna']"
1342289286721392642,https://twitter.com/carlostomasini/status/1342289286721392642,2020-12-25 02:01:19+00:00,"...la protección de la vacuna tarda unos 15 días en tener efecto, explica @HLGatell... https://t.co/7RMhEuyurQ",5,1,3,"{'longitude': -99.2058092, 'latitude': 19.2970107}","{'fullName': 'Coyoacán, Distrito Federal', 'name': 'Coyoacán', 'type': 'city', 'country': 'Mexico', 'countryCode': 'MX'}",19.309917325231165,-99.12243737329996,31.28km,"['proteccion', 'vacuno', 'tardo', 'dia', 'tener', 'efecto', 'explicar']"
